company,sector,headline,snippet,pub_date,url,quarter
Ford Motor Company,Automotive,Ford Reports Quarterly Loss but Says Sales Grew,Ford Motor attributed the loss in the fourth quarter to charges related to pension plans and a restructuring of overseas operations.,2024-02-06T21:53:42+0000,https://www.nytimes.com/2024/02/06/business/economy/ford-fourth-quarter-earnings.html,2024-01-01 to 2024-03-31
Ford Motor Company,Automotive,"Confronted With Child Labor in the U.S., Companies Move to Crack Down","McDonald’s, Costco and other major brands say they are stepping up efforts to keep minors from the grueling, often dangerous work that goes into their products.",2024-02-07T10:02:44+0000,https://www.nytimes.com/2024/02/07/us/child-labor-us-companies.html,2024-01-01 to 2024-03-31
Ford Motor Company,Automotive,"How Ford’s F-150 Lightning, Once in Hot Demand, Lost Its Luster","Some buyers said the electric Lightning did not meet expectations, and Ford has slashed its production plans for the pickup because sales are lagging.",2024-02-07T10:02:53+0000,https://www.nytimes.com/2024/02/07/business/fords-f150-lightning-electric-pickup-trucks.html,2024-01-01 to 2024-03-31
Ford Motor Company,Automotive,Automakers Are Sharing Consumers’ Driving Behavior With Insurance Companies,"LexisNexis, which generates consumer risk profiles for the insurers, knew about every trip G.M. drivers had taken in their cars, including when they sped, braked too hard or accelerated rapidly.",2024-03-11T09:00:51+0000,https://www.nytimes.com/2024/03/11/technology/carmakers-driver-tracking-insurance.html,2024-01-01 to 2024-03-31
Ford Motor Company,Automotive,China’s Electric Vehicles Are Going to Hit Detroit Like a Wrecking Ball,"Do we really want America to become a backwater of bloated, expensive, gas-guzzling cars?",2024-02-27T10:03:31+0000,https://www.nytimes.com/2024/02/27/opinion/gm-ford-electric-vehicles.html,2024-01-01 to 2024-03-31
Ford Motor Company,Automotive,Hybrid Cars Enjoy a Renaissance as All-Electric Sales Slow,"Automakers like Ford, Kia and Toyota are offering more hybrid options to appeal to buyers who aren’t ready for fully electric vehicles.",2024-01-17T15:26:48+0000,https://www.nytimes.com/2024/01/17/business/hybrid-cars-electric-vehicles.html,2024-01-01 to 2024-03-31
Ford Motor Company,Automotive,Toyota’s Hybrid-First Strategy Is Delivering Big Profits,"Toyota, the world’s largest automaker, has been criticized for selling few electric vehicles, but its decision to focus on hybrids is paying off financially.",2024-03-09T10:02:31+0000,https://www.nytimes.com/2024/03/09/business/toyotas-hybrid-electric-vehicles.html,2024-01-01 to 2024-03-31
Ford Motor Company,Automotive,Auto Sales Are Expected to Slow After a Strong 2023,"Automakers sold more cars in 2023 than a year ago as supply chain chaos ended, but sales are now under pressure from higher interest rates.",2024-01-03T16:31:58+0000,https://www.nytimes.com/2024/01/03/business/economy/auto-sales-general-motors.html,2024-01-01 to 2024-03-31
Ford Motor Company,Automotive,Tesla Sales Rebound After Steep Price Cuts,The leading U.S. electric-vehicle maker also drew buyers eager to take advantage of government incentives that will be harder to get in 2024.,2024-01-02T13:51:40+0000,https://www.nytimes.com/2024/01/02/business/tesla-fourth-quarter-sales.html,2024-01-01 to 2024-03-31
Ford Motor Company,Automotive,"For Michigan’s Economy, Electric Vehicles Are Promising and Scary","In a presidential battleground state, electric vehicles have emerged as a contested piece of the economic future — a job-killer or a job-creator.",2024-02-19T18:00:25+0000,https://www.nytimes.com/2024/02/19/business/economy/michigan-economy-2024-election.html,2024-01-01 to 2024-03-31
Ford Motor Company,Automotive,Volkswagen Leans on Electric Vehicles and Nostalgia to Grow in U.S.,It and other foreign automakers are trying to exploit upheaval caused by new technology to gain market share from their dominant rivals.,2024-02-20T21:15:19+0000,https://www.nytimes.com/2024/02/20/business/vw-electric-vehicles-us.html,2024-01-01 to 2024-03-31
Ford Motor Company,Automotive,G.M. Profits Hurt by Electric Car Business and Strike,"The automaker has placed a bet on electric vehicles, but it has struggled to produce and sell the vehicles in large numbers.",2024-01-30T11:30:07+0000,https://www.nytimes.com/2024/01/30/business/general-motors-fourth-quarter-earnings.html,2024-01-01 to 2024-03-31
Ford Motor Company,Automotive,Federal Regulator Questions Carmakers About Unwanted Tracking via Their Apps,The Federal Communications Commission is concerned about abusive partners using connected car apps to harass and track their victims.,2024-01-11T17:33:22+0000,https://www.nytimes.com/2024/01/11/technology/fcc-car-apps-stalking.html,2024-01-01 to 2024-03-31
Ford Motor Company,Automotive,"Donald Wildmon, Early Crusader in Conservative Culture Wars, Dies at 85","The American Family Association, which he founded, became a juggernaut in the Christian right’s campaign against sex and gay themes in art, television and pop culture.",2024-01-03T23:45:31+0000,https://www.nytimes.com/2024/01/03/us/politics/donald-wildmon-dead.html,2024-01-01 to 2024-03-31
Ford Motor Company,Automotive,"In State of the Union, Biden Will Cheer the Economy and Draw a Contrast With Trump",Allies are pushing the president to do more to sell skeptical voters on his economic record and to attack his likely Republican rival on tax policy.,2024-03-07T10:04:04+0000,https://www.nytimes.com/2024/03/07/us/politics/sotu-biden-economy.html,2024-01-01 to 2024-03-31
Ford Motor Company,Automotive,How Apple Used its Car Project to Drive Wider Innovation,"The tech giant has dropped its plans to develop an electric vehicle, but some of the development at the heart of the effort has helped power other products and services.",2024-02-28T13:06:19+0000,https://www.nytimes.com/2024/02/28/business/dealbook/apple-car-project-to-drive-wider-innovation.html,2024-01-01 to 2024-03-31
Ford Motor Company,Automotive,Tesla Recalls 1.6 Million Cars in China to Fix Self-Driving Systems,The recall follows a similar move by the company in the United States to upgrade the cars’ Autopilot feature.,2024-01-05T16:34:44+0000,https://www.nytimes.com/2024/01/05/business/tesla-china-recall.html,2024-01-01 to 2024-03-31
Ford Motor Company,Automotive,China Auto Giant BYD Sells More Electric Vehicles Than Ever,"Sales by BYD, the country’s dominant automaker, topped 3 million last year, including 1.6 million fully battery-powered cars. It’s a sign of China’s rapid growth in EVs.",2024-01-01T12:43:30+0000,https://www.nytimes.com/2024/01/01/business/byd-2023-sales.html,2024-01-01 to 2024-03-31
Ford Motor Company,Automotive,Rivian Will Delay Construction of a $5 Billion Factory in Georgia,"The money-losing electric vehicle company, which makes vans, trucks and S.U.V.s, is trying to preserve cash as it works to produce and sell more affordable vehicles.",2024-03-07T22:15:45+0000,https://www.nytimes.com/2024/03/07/business/economy/rivian-georgia-factory.html,2024-01-01 to 2024-03-31
Ford Motor Company,Automotive,Tesla Profit From Car Sales Falls as Price Cuts Hurt,"A tax benefit boosted quarterly earnings, but that masked a decline in earnings from carmaking caused by intensifying competition.",2024-01-24T21:21:45+0000,https://www.nytimes.com/2024/01/24/business/teslas-electric-vehicles-profit-price-cuts.html,2024-01-01 to 2024-03-31
Ford Motor Company,Automotive,VW Workers Seek Union Vote at Tennessee Plant for Third Time,"The United Automobile Workers said a “supermajority” of the 4,000 eligible workers at a Volkswagen factory had signed cards backing the union.",2024-03-18T14:00:06+0000,https://www.nytimes.com/2024/03/18/business/volkswagen-uaw-union-chattanooga.html,2024-01-01 to 2024-03-31
Ford Motor Company,Automotive,New Rules Will Still Push Carmakers to Sell More Electric Cars,New Biden administration auto rules are less forceful than an earlier proposal but will still add to market pressure for cheaper electric vehicles.,2024-03-20T15:35:27+0000,https://www.nytimes.com/2024/03/20/business/new-rules-will-still-push-carmakers-to-sell-more-electric-cars.html,2024-01-01 to 2024-03-31
Ford Motor Company,Automotive,BMW Is a Surprise Winner in Electric Vehicles,"Once considered a laggard, the German luxury carmaker is one of only a few established automakers that has been able to compete effectively against Tesla.",2024-03-09T10:02:32+0000,https://www.nytimes.com/2024/03/09/business/bmw-electric-vehicles.html,2024-01-01 to 2024-03-31
Ford Motor Company,Automotive,"How China Built BYD, Its Tesla Killer","The leading Chinese electric vehicle company, with origins as a battery maker, has posted two years of million-car growth in sales.",2024-02-12T05:01:59+0000,https://www.nytimes.com/2024/02/12/business/byd-china-electric-vehicle.html,2024-01-01 to 2024-03-31
Ford Motor Company,Automotive,Big Labor Gamble: Push to Unionize Every U.S. Auto Plant,A looming election at a Volkswagen plant in Chattanooga could be pivotal in the United Automobile Workers’ effort to organize the entire industry.,2024-03-02T08:00:28+0000,https://www.nytimes.com/2024/03/02/business/economy/uaw-auto-workers-union.html,2024-01-01 to 2024-03-31
Ford Motor Company,Automotive,"The New York Times News Quiz, Jan. 19, 2024",Did you follow the news this week? Take our quiz to see how well you stack up with other Times readers.,2024-01-19T10:02:14+0000,https://www.nytimes.com/interactive/2024/01/19/briefing/news-quiz-trump-iowa-iran.html,2024-01-01 to 2024-03-31
Ford Motor Company,Automotive,"American Firms Invested $1 Billion in Chinese Chips, Lawmakers Find",A congressional investigation determined that U.S. funding helped fuel the growth of a sector now viewed by Washington as a security threat.,2024-02-08T14:00:12+0000,https://www.nytimes.com/2024/02/08/business/economy/china-chips-house-select-committee.html,2024-01-01 to 2024-03-31
Ford Motor Company,Automotive,The Farming Conundrum,Agriculture is a big contributor to climate change — is there a path to reinvention?,2024-02-29T19:35:42+0000,https://www.nytimes.com/2024/02/29/climate/the-farming-conundrum.html,2024-01-01 to 2024-03-31
Ford Motor Company,Automotive,Biden Administration Is Said to Slow Early Stage of Shift to Electric Cars,"The change to planned rules was an election-year concession to labor unions and auto executives, according to people familiar with the plan.",2024-02-17T10:03:42+0000,https://www.nytimes.com/2024/02/17/climate/biden-epa-auto-emissions.html,2024-01-01 to 2024-03-31
Ford Motor Company,Automotive,Where Electric Vehicles Are (and Aren’t) Taking Off Across the U.S.,New data show where E.V.s are booming and reveal some surprising places where they’re getting a foothold.,2024-03-06T10:04:14+0000,https://www.nytimes.com/interactive/2024/03/06/climate/hybrid-electric-vehicle-popular.html,2024-01-01 to 2024-03-31
Ford Motor Company,Automotive,"State of the Union Guests Highlight Biden’s Efforts on Gun Violence, the Climate and More","The White House’s invited guests included the sister of a 9-year-old girl killed in the Uvalde school shooting, the head of the U.A.W. and business owners focused on the environment.",2024-03-07T21:53:08+0000,https://www.nytimes.com/2024/03/07/us/politics/state-of-the-union-guests.html,2024-01-01 to 2024-03-31
Ford Motor Company,Automotive,"How Toyota, a Laggard on Electric Cars, Got Its Fight Back","The auto giant lobbied hard against tougher pollution rules. This week, the E.P.A.’s new rules proved favorable to hybrid technology, an area that Toyota dominates.",2024-03-22T14:54:32+0000,https://www.nytimes.com/2024/03/22/climate/toyota-hybrid-epa-pollution.html,2024-01-01 to 2024-03-31
Ford Motor Company,Automotive,Can Intel Serve Two Masters?,"Biden is counting on it to be a national champion chipmaker, but it still has shareholders to please.",2024-03-29T19:00:08+0000,https://www.nytimes.com/2024/03/29/opinion/intel-gelsinger-chips-biden.html,2024-01-01 to 2024-03-31
Ford Motor Company,Automotive,The Fallout From a Credit Card Shake-Up,"A proposed settlement between Visa and Mastercard and merchants on swipe fees promises savings, but it may also alter the economics of premium credit cards.",2024-03-27T11:43:49+0000,https://www.nytimes.com/2024/03/27/business/dealbook/credit-card-swipe-fees.html,2024-01-01 to 2024-03-31
Ford Motor Company,Automotive,Why Are American Drivers So Deadly?,"After decades of declining fatality rates, dangerous driving has surged again.",2024-01-10T10:01:53+0000,https://www.nytimes.com/2024/01/10/magazine/dangerous-driving.html,2024-01-01 to 2024-03-31
Ford Motor Company,Automotive,Read the Filing From Fani Willis,"Fani T. Willis, the Fulton County, Ga., district attorney said in a court filing that her relationship with a subordinate should not disqualify her from the election interference case.",2024-02-02T21:12:02+0000,https://www.nytimes.com/interactive/2024/02/02/us/fani-willis-response.html,2024-01-01 to 2024-03-31
General Motors,Automotive,General Motors Quits Sharing Driving Behavior With Data Brokers,"G.M. had provided information about braking, acceleration and speed to LexisNexis Risk Solution and Verisk, firms that generated driver risk profiles for insurers.",2024-03-22T18:42:28+0000,https://www.nytimes.com/2024/03/22/technology/gm-onstar-driver-data.html,2024-01-01 to 2024-03-31
General Motors,Automotive,Your Car May Be Spying on You,"Modern vehicles can track all kinds of data, including location and driving style, raising a host of troubling privacy issues.",2024-03-18T10:00:12+0000,https://www.nytimes.com/2024/03/18/podcasts/the-daily/car-gm-insurance-spying.html,2024-01-01 to 2024-03-31
General Motors,Automotive,Florida Man Sues G.M. and LexisNexis Over Sale of His Cadillac Data,"Romeo Chicco’s auto insurance rate doubled because of information about his speeding, braking and acceleration, according to his complaint.",2024-03-14T22:51:46+0000,https://www.nytimes.com/2024/03/14/technology/gm-lexis-nexis-driving-data.html,2024-01-01 to 2024-03-31
General Motors,Automotive,"A Looming TikTok Ban, a Royal Photoshop Mystery and Your Snitching Car",Maybe go ahead and download your favorite TikToks.,2024-03-15T09:04:44+0000,https://www.nytimes.com/2024/03/15/podcasts/tiktok-princess-photoshop.html,2024-01-01 to 2024-03-31
General Motors,Automotive,Automakers Are Sharing Consumers’ Driving Behavior With Insurance Companies,"LexisNexis, which generates consumer risk profiles for the insurers, knew about every trip G.M. drivers had taken in their cars, including when they sped, braked too hard or accelerated rapidly.",2024-03-11T09:00:51+0000,https://www.nytimes.com/2024/03/11/technology/carmakers-driver-tracking-insurance.html,2024-01-01 to 2024-03-31
General Motors,Automotive,Toyota’s Hybrid-First Strategy Is Delivering Big Profits,"Toyota, the world’s largest automaker, has been criticized for selling few electric vehicles, but its decision to focus on hybrids is paying off financially.",2024-03-09T10:02:31+0000,https://www.nytimes.com/2024/03/09/business/toyotas-hybrid-electric-vehicles.html,2024-01-01 to 2024-03-31
General Motors,Automotive,How Apple Used its Car Project to Drive Wider Innovation,"The tech giant has dropped its plans to develop an electric vehicle, but some of the development at the heart of the effort has helped power other products and services.",2024-02-28T13:06:19+0000,https://www.nytimes.com/2024/02/28/business/dealbook/apple-car-project-to-drive-wider-innovation.html,2024-01-01 to 2024-03-31
General Motors,Automotive,China’s Electric Vehicles Are Going to Hit Detroit Like a Wrecking Ball,"Do we really want America to become a backwater of bloated, expensive, gas-guzzling cars?",2024-02-27T10:03:31+0000,https://www.nytimes.com/2024/02/27/opinion/gm-ford-electric-vehicles.html,2024-01-01 to 2024-03-31
General Motors,Automotive,"For Michigan’s Economy, Electric Vehicles Are Promising and Scary","In a presidential battleground state, electric vehicles have emerged as a contested piece of the economic future — a job-killer or a job-creator.",2024-02-19T18:00:25+0000,https://www.nytimes.com/2024/02/19/business/economy/michigan-economy-2024-election.html,2024-01-01 to 2024-03-31
General Motors,Automotive,G.M. Profits Hurt by Electric Car Business and Strike,"The automaker has placed a bet on electric vehicles, but it has struggled to produce and sell the vehicles in large numbers.",2024-01-30T11:30:07+0000,https://www.nytimes.com/2024/01/30/business/general-motors-fourth-quarter-earnings.html,2024-01-01 to 2024-03-31
General Motors,Automotive,Cruise Says Hostility to Regulators Led to Grounding of Its Autonomous Cars,"A law firm’s review found that executives had failed to fully explain an October crash, which the Justice Department is also investigating.",2024-01-25T20:00:08+0000,https://www.nytimes.com/2024/01/25/technology/cruise-crash-report-san-francisco.html,2024-01-01 to 2024-03-31
General Motors,Automotive,Auto Sales Are Expected to Slow After a Strong 2023,"Automakers sold more cars in 2023 than a year ago as supply chain chaos ended, but sales are now under pressure from higher interest rates.",2024-01-03T16:31:58+0000,https://www.nytimes.com/2024/01/03/business/economy/auto-sales-general-motors.html,2024-01-01 to 2024-03-31
General Motors,Automotive,Tesla Sales Rebound After Steep Price Cuts,The leading U.S. electric-vehicle maker also drew buyers eager to take advantage of government incentives that will be harder to get in 2024.,2024-01-02T13:51:40+0000,https://www.nytimes.com/2024/01/02/business/tesla-fourth-quarter-sales.html,2024-01-01 to 2024-03-31
General Motors,Automotive,Automakers Are Rerouting Car Shipments Away From Baltimore,The city’s port ranks first in the country for the volume of automobiles and light trucks it handles.,2024-03-26T20:00:08+0000,https://www.nytimes.com/2024/03/26/us/baltimore-bridge-collapse-automakers.html,2024-01-01 to 2024-03-31
General Motors,Automotive,Energy Dept. Offers $2.3 Billion Loan to Boost Lithium Production,"Demand for lithium, which is used in electric vehicle batteries, has soared, but domestic production of the metal has lagged behind other countries.",2024-03-14T17:13:03+0000,https://www.nytimes.com/2024/03/14/us/politics/us-lithium-loan-electric-vehicles.html,2024-01-01 to 2024-03-31
General Motors,Automotive,Federal Regulator Questions Carmakers About Unwanted Tracking via Their Apps,The Federal Communications Commission is concerned about abusive partners using connected car apps to harass and track their victims.,2024-01-11T17:33:22+0000,https://www.nytimes.com/2024/01/11/technology/fcc-car-apps-stalking.html,2024-01-01 to 2024-03-31
General Motors,Automotive,Hybrid Cars Enjoy a Renaissance as All-Electric Sales Slow,"Automakers like Ford, Kia and Toyota are offering more hybrid options to appeal to buyers who aren’t ready for fully electric vehicles.",2024-01-17T15:26:48+0000,https://www.nytimes.com/2024/01/17/business/hybrid-cars-electric-vehicles.html,2024-01-01 to 2024-03-31
General Motors,Automotive,Tesla Recalls 1.6 Million Cars in China to Fix Self-Driving Systems,The recall follows a similar move by the company in the United States to upgrade the cars’ Autopilot feature.,2024-01-05T16:34:44+0000,https://www.nytimes.com/2024/01/05/business/tesla-china-recall.html,2024-01-01 to 2024-03-31
General Motors,Automotive,China Acknowledges Imprisoning a British Man on Spy Charges,"A businessman who had worked in China for decades vanished from view in 2018, but his fate had been unknown, and publicly unremarked upon, until now.",2024-01-27T04:49:51+0000,https://www.nytimes.com/2024/01/26/world/asia/china-britain-spy.html,2024-01-01 to 2024-03-31
General Motors,Automotive,China Auto Giant BYD Sells More Electric Vehicles Than Ever,"Sales by BYD, the country’s dominant automaker, topped 3 million last year, including 1.6 million fully battery-powered cars. It’s a sign of China’s rapid growth in EVs.",2024-01-01T12:43:30+0000,https://www.nytimes.com/2024/01/01/business/byd-2023-sales.html,2024-01-01 to 2024-03-31
General Motors,Automotive,A Fast-Paced History of ‘Women Behind the Wheel’,"In a chronicle laced with memoir, Nancy A. Nichols explores how the automobile has provided both freedom and dangers for female motorists.",2024-03-05T10:01:33+0000,https://www.nytimes.com/2024/03/05/books/review/nancy-a-nichols-women-behind-the-wheel.html,2024-01-01 to 2024-03-31
General Motors,Automotive,"How China Built BYD, Its Tesla Killer","The leading Chinese electric vehicle company, with origins as a battery maker, has posted two years of million-car growth in sales.",2024-02-12T05:01:59+0000,https://www.nytimes.com/2024/02/12/business/byd-china-electric-vehicle.html,2024-01-01 to 2024-03-31
General Motors,Automotive,Tesla Profit From Car Sales Falls as Price Cuts Hurt,"A tax benefit boosted quarterly earnings, but that masked a decline in earnings from carmaking caused by intensifying competition.",2024-01-24T21:21:45+0000,https://www.nytimes.com/2024/01/24/business/teslas-electric-vehicles-profit-price-cuts.html,2024-01-01 to 2024-03-31
General Motors,Automotive,Hertz Will Shrink Electric Fleet After Being Burned by Tesla’s Price Cuts,"The rental car company blamed the sharp drop in the value of electric vehicles and higher repair costs for its decision to sell 20,000 cars.",2024-01-11T21:53:42+0000,https://www.nytimes.com/2024/01/11/business/hertz-electric-vehicles-tesla.html,2024-01-01 to 2024-03-31
General Motors,Automotive,VW Workers Seek Union Vote at Tennessee Plant for Third Time,"The United Automobile Workers said a “supermajority” of the 4,000 eligible workers at a Volkswagen factory had signed cards backing the union.",2024-03-18T14:00:06+0000,https://www.nytimes.com/2024/03/18/business/volkswagen-uaw-union-chattanooga.html,2024-01-01 to 2024-03-31
General Motors,Automotive,Truck Makers Team Up to Push for Electric Vehicle Chargers,"Daimler, Navistar and Volvo have been criticized for not selling many electric heavy trucks, but the companies say the country first needs many more chargers.",2024-01-30T10:02:04+0000,https://www.nytimes.com/2024/01/30/business/electric-vehicles-trucks.html,2024-01-01 to 2024-03-31
General Motors,Automotive,Volkswagen Leans on Electric Vehicles and Nostalgia to Grow in U.S.,It and other foreign automakers are trying to exploit upheaval caused by new technology to gain market share from their dominant rivals.,2024-02-20T21:15:19+0000,https://www.nytimes.com/2024/02/20/business/vw-electric-vehicles-us.html,2024-01-01 to 2024-03-31
General Motors,Automotive,"How Ford’s F-150 Lightning, Once in Hot Demand, Lost Its Luster","Some buyers said the electric Lightning did not meet expectations, and Ford has slashed its production plans for the pickup because sales are lagging.",2024-02-07T10:02:53+0000,https://www.nytimes.com/2024/02/07/business/fords-f150-lightning-electric-pickup-trucks.html,2024-01-01 to 2024-03-31
General Motors,Automotive,A High School Romance Goes the Distance,"Julia Gerard and Adam Romund began dating their senior year of high school. And after each had both earned an undergraduate degree, it was clear that an engagement was imminent.",2024-01-05T05:00:16+0000,https://www.nytimes.com/2024/01/05/style/julie-gerard-adam-romund-wedding.html,2024-01-01 to 2024-03-31
General Motors,Automotive,The F.T.C. Takes on A.I. Deals,The agency is concerned that transactions including Microsoft’s $13 billion investment in OpenAI could hinder competition and innovation.,2024-01-26T12:48:49+0000,https://www.nytimes.com/2024/01/26/business/dealbook/ftc-ai-deals-microsoft-openai.html,2024-01-01 to 2024-03-31
General Motors,Automotive,New Rules Will Still Push Carmakers to Sell More Electric Cars,New Biden administration auto rules are less forceful than an earlier proposal but will still add to market pressure for cheaper electric vehicles.,2024-03-20T15:35:27+0000,https://www.nytimes.com/2024/03/20/business/new-rules-will-still-push-carmakers-to-sell-more-electric-cars.html,2024-01-01 to 2024-03-31
General Motors,Automotive,Thursday Briefing,A deadly blast in Iran.,2024-01-04T05:14:48+0000,https://www.nytimes.com/2024/01/04/briefing/iran-bombing-hamas-leader.html,2024-01-01 to 2024-03-31
General Motors,Automotive,Microsoft Tops Apple to Become Most Valuable Public Company,The shift is indicative of the importance of new artificial intelligence technology to Silicon Valley and Wall Street investors.,2024-01-12T21:47:56+0000,https://www.nytimes.com/2024/01/12/technology/microsoft-apple-most-valuable-company.html,2024-01-01 to 2024-03-31
General Motors,Automotive,"A Reliable, Collaborative Partner in the Clean Energy Transition",Here are some of the creative partnerships that are enabling a battery innovator to drive the EV mobility revolution forward.,2024-02-19T07:41:16+0000,https://www.nytimes.com/paidpost/lg-energy-solution/a-reliable-collaborative-partner-in-the-clean-energy-transition.html,2024-01-01 to 2024-03-31
General Motors,Automotive,BMW Is a Surprise Winner in Electric Vehicles,"Once considered a laggard, the German luxury carmaker is one of only a few established automakers that has been able to compete effectively against Tesla.",2024-03-09T10:02:32+0000,https://www.nytimes.com/2024/03/09/business/bmw-electric-vehicles.html,2024-01-01 to 2024-03-31
