company,sector,headline,snippet,pub_date,url,quarter
JPMorgan Chase,Finance/Banking,"New Fare System Raises Security Concerns, but Officials Promise Safety",New York City plans to replace the MetroCard system with one that uses commuters’ phones or credit cards at turnstiles. Will passengers’ personal data be safe?,2017-10-27T16:41:07+0000,https://www.nytimes.com/2017/10/27/nyregion/new-fare-system-metrocard-security-hacking.html,2017-10-01 to 2017-12-31
JPMorgan Chase,Finance/Banking,China’s Tightening Grip on Tech Giants: DealBook Briefing,"If Beijing moves to take board seats at companies like Tencent and an Alibaba affiliate, it may hamper their deal-making overseas.",2017-10-12T11:20:07+0000,https://www.nytimes.com/2017/10/12/business/dealbook/china-tech-tencent-alibaba.html,2017-10-01 to 2017-12-31
JPMorgan Chase,Finance/Banking,"Uber’s Latest Mess, Facebook, Tax Pessimism: DealBook Briefing",A showdown looms at the ride-hailing company after its co-founder Travis Kalanick responded to a proposal to limit his power by naming two new directors.,2017-10-02T10:48:26+0000,https://www.nytimes.com/2017/10/02/business/uber-travis-kalanick-board.html,2017-10-01 to 2017-12-31
JPMorgan Chase,Finance/Banking,Women’s Whisper Network Raises Its Voice,A behind-the-scenes support system in the workplace is gaining momentum in a digital age that allows women to share their experiences publicly.,2017-11-04T09:00:13+0000,https://www.nytimes.com/2017/11/04/business/sexual-harassment-whisper-network.html,2017-10-01 to 2017-12-31
JPMorgan Chase,Finance/Banking,The Winklevoss Twins’ Path to Bitcoin Fortune: DealBook Briefing,Cameron and Tyler Winklevoss made a risky bet five years ago: They loaded up on Bitcoin. That stockpile is now worth around $1.3 billion.,2017-12-19T11:41:00+0000,https://www.nytimes.com/2017/12/19/business/dealbook/bitcoin-hedge-fund.html,2017-10-01 to 2017-12-31
JPMorgan Chase,Finance/Banking,"Senate Plan Gives Health Care Industry Hope, for Now: DealBook Briefing","The bipartisan proposal buoyed the stocks of insurers and hospital operators, but there’s still no assurance of a permanent fix.",2017-10-18T11:02:23+0000,https://www.nytimes.com/2017/10/18/business/dealbook/senators-health-care.html,2017-10-01 to 2017-12-31
JPMorgan Chase,Finance/Banking,Tech Executives Head Back to Capitol Hill: DealBook Briefing,"Lawyers for Facebook, Google and Twitter will testify again on Russian interference in the 2016 election, but may say less than lawmakers want to hear.",2017-11-01T10:51:07+0000,https://www.nytimes.com/2017/11/01/business/dealbook/tech-washington-russia.html,2017-10-01 to 2017-12-31
JPMorgan Chase,Finance/Banking,Uber’s C.E.O. and More at the DealBook Conference: DealBook Briefing,"Dara Khosrowshahi will hold his first public interview since becoming chief of the ride-hailing giant, while other speakers include Laurene Powell Jobs.",2017-10-16T11:02:09+0000,https://www.nytimes.com/2017/10/16/business/dealbook/uber-ceo-dealbook-conference.html,2017-10-01 to 2017-12-31
JPMorgan Chase,Finance/Banking,Fox’s Disney Talks Could Still Lead to a Sale: DealBook Briefing,"Now that the Murdochs have signaled an openness to selling assets, expect a host of potential suitors to try and persuade them to revive deal talks.",2017-11-07T12:51:12+0000,https://www.nytimes.com/2017/11/07/business/dealbook/fox-disney-sale.html,2017-10-01 to 2017-12-31
JPMorgan Chase,Finance/Banking,Ken Chenault’s Retirement Makes a Small Club Smaller: DealBook Briefing,"When the American Express C.E.O. steps down in February, there may be just three black men running Fortune 500 companies.",2017-10-19T11:00:21+0000,https://www.nytimes.com/2017/10/19/business/dealbook/ken-chenault-american-express.html,2017-10-01 to 2017-12-31
JPMorgan Chase,Finance/Banking,Will Robots Take Our Children’s Jobs?,Artificial intelligence may make half of today’s jobs obsolete in 20 years. What careers will be left when our children grow up?,2017-12-11T10:00:03+0000,https://www.nytimes.com/2017/12/11/style/robots-jobs-children.html,2017-10-01 to 2017-12-31
JPMorgan Chase,Finance/Banking,"DealBook Briefing: Bitcoin Surges Past $16,000","As his company closes in on a deal for much of the Fox media empire, the C.E.O. may have to postpone retirement yet again to oversee post-merger work.",2017-12-07T12:15:16+0000,https://www.nytimes.com/2017/12/07/business/dealbook/disney-iger-ceo.html,2017-10-01 to 2017-12-31
JPMorgan Chase,Finance/Banking,DealBook Briefing: Nelson Peltz’s Trian Pushes Back as P.&G. Reviews Vote,Trian Fund Management accused Procter & Gamble of wasting shareholder money contesting a tally that showed Mr. Peltz narrowly winning a board seat.,2017-11-22T12:22:57+0000,https://www.nytimes.com/2017/11/22/business/dealbook/fcc-net-neutrality.html,2017-10-01 to 2017-12-31
JPMorgan Chase,Finance/Banking,Trump Congratulated Murdoch on the Disney Deal: DealBook Briefing,"While the Trump administration has moved to block one media deal, the president offered support to another — and said that it would be a “great thing” for jobs.",2017-12-14T12:24:17+0000,https://www.nytimes.com/2017/12/14/business/dealbook/disney-fox-takeover.html,2017-10-01 to 2017-12-31
JPMorgan Chase,Finance/Banking,Icahn Picks New Board Fight With Xerox: DealBook Briefing,The activist investor launched his second campaign to change the management of the copy-machine maker.,2017-12-11T12:30:24+0000,https://www.nytimes.com/2017/12/11/business/dealbook/bitcoin-futures-trading.html,2017-10-01 to 2017-12-31
JPMorgan Chase,Finance/Banking,DealBook Briefing: Pass-Throughs vs. Corporations — Who’s the Bigger Winner?,Two senators have argued that big corporations are being given preferential treatment compared with pass-throughs. The problem that is wrong.,2017-11-29T12:16:29+0000,https://www.nytimes.com/2017/11/29/business/dealbook/kind-bars-mars.html,2017-10-01 to 2017-12-31
JPMorgan Chase,Finance/Banking,The Finger-Pointing at the Finance Firm TIAA,Ex-employees and whistle-blowers question whether the provider of investment advice to people in public and nonprofit jobs does put its customers first.,2017-10-21T09:00:02+0000,https://www.nytimes.com/2017/10/21/business/the-finger-pointing-at-the-finance-firm-tiaa.html,2017-10-01 to 2017-12-31
JPMorgan Chase,Finance/Banking,DealBook Briefing: Who Could Succeed John Skipper at ESPN?,"John Skipper, the president of ESPN, has stepped down today, citing a “substance addiction” problem. There is no obvious successor for Mr. Skipper.",2017-12-18T12:26:10+0000,https://www.nytimes.com/2017/12/18/business/dealbook/ceos-taxes-trump.html,2017-10-01 to 2017-12-31
Goldman Sachs,Finance/Banking,Goldman Sachs Sees $5 Billion Earnings Hit Ahead of New Tax Law,"The bank estimated a $5 billion charge to fourth-quarter earnings, much of it coming from taxes on overseas assets, a regulatory filing shows.",2017-12-29T16:40:46+0000,https://www.nytimes.com/2017/12/29/business/goldman-sachs-taxes.html,2017-10-01 to 2017-12-31
Goldman Sachs,Finance/Banking,One of Bitcoin’s Biggest Champions Turns Bearish: DealBook Briefing,"Michael Novogratz, the former Fortress executive, told Bloomberg that he was shelving plans for a cryptocurrency hedge fund and said bitcoin will fall to $8,000.",2017-12-22T12:18:28+0000,https://www.nytimes.com/2017/12/22/business/dealbook/bitcoin-fall-blockchain.html,2017-10-01 to 2017-12-31
Goldman Sachs,Finance/Banking,Republican Tax Cuts Would Lift Some Industries More Than Others,"Financial firms would see a larger tax cut than manufacturers, a University of Pennsylvania study concluded.",2017-12-18T23:51:26+0000,https://www.nytimes.com/2017/12/18/us/politics/republican-tax-cuts-industries-.html,2017-10-01 to 2017-12-31
Goldman Sachs,Finance/Banking,Goldman Sachs’s China Deal Prompts Questions About Country’s U.S. Investment,The bank’s $5 billion pact with an arm of the Chinese government to make deals in the United States highlights political divisions over trade and investment.,2017-11-15T18:34:22+0000,https://www.nytimes.com/2017/11/15/business/goldman-sachs-china-trade-deal.html,2017-10-01 to 2017-12-31
Goldman Sachs,Finance/Banking,Inside the Race for the Top Job on Wall Street,Harvey Schwartz and David Solomon are vying to run Goldman Sachs. One is a smooth-talking D.J. The other is a publicity-shy black belt in karate.,2017-11-22T16:26:56+0000,https://www.nytimes.com/2017/11/22/business/goldman-sachs-harvey-schwartz-david-solomon.html,2017-10-01 to 2017-12-31
Goldman Sachs,Finance/Banking,DealBook Briefing: Trump Is Still Not a Fan of AT&T-Time Warner,The business community is buzzing about the F.C.C.’s plan to dismantle net neutrality regulations and the Justice Department’s lawsuit to block AT&T’s bid for Time Warner.,2017-11-21T11:31:07+0000,https://www.nytimes.com/2017/11/21/business/dealbook/att-time-warner-justice-department.html,2017-10-01 to 2017-12-31
Goldman Sachs,Finance/Banking,Marty Chavez Muses on Rocky Times and the Road Ahead,The chief financial officer of Goldman Sachs looks ahead to some loosening of post-Recession banking regulations and says he worries most about cyberattacks.,2017-11-14T07:00:01+0000,https://www.nytimes.com/2017/11/14/business/dealbook/marty-chavez-goldman-sachs.html,2017-10-01 to 2017-12-31
Goldman Sachs,Finance/Banking,China Eases Limits on Foreign Stakes in Financial Firms,"The move, which comes after President Trump left Beijing complaining about its trade policies, could give China’s troubled financial system a needed shake-up.",2017-11-10T11:28:15+0000,https://www.nytimes.com/2017/11/10/business/china-foreign-investment-limits.html,2017-10-01 to 2017-12-31
Goldman Sachs,Finance/Banking,New Jersey’s Next Governor: A Rich Donor With Progressive Roots,"Before Philip D. Murphy was a governor, he was a Goldman Sachs executive. And before that, he was raised in a home that revered the Kennedys.",2017-11-08T10:05:57+0000,https://www.nytimes.com/2017/11/08/nyregion/new-jersey-governor-phil-murphy.html,2017-10-01 to 2017-12-31
Goldman Sachs,Finance/Banking,The New York Fed Chief Is Stepping Down — but Not Quietly,"William C. Dudley, who is stepping down from his post earlier than expected, warned against moving too aggressively to roll back financial regulations.",2017-11-06T14:39:45+0000,https://www.nytimes.com/2017/11/06/business/dudley-new-york-fed.html,2017-10-01 to 2017-12-31
Goldman Sachs,Finance/Banking,"Goldman Sachs Had Good Earnings, but It Could Learn From Morgan Stanley","Goldman Sachs posted strong results, but its rival on Wall Street has earnings that look more repeatable.",2017-10-17T19:15:21+0000,https://www.nytimes.com/2017/10/17/business/dealbook/goldman-sachs-morgan-stanley-earnings.html,2017-10-01 to 2017-12-31
Goldman Sachs,Finance/Banking,"For Philip Murphy, Key Résumé Entries Are Often Left Unspoken","Mr. Murphy, the Democratic candidate for governor of New Jersey, spent many years at Goldman Sachs and four years as German ambassador. But he rarely discusses either.",2017-10-31T20:19:01+0000,https://www.nytimes.com/2017/10/31/nyregion/for-philip-murphy-key-resume-entries-are-often-left-unspoken.html,2017-10-01 to 2017-12-31
Goldman Sachs,Finance/Banking,"With Deal-Making in the Doldrums, Goldman Tries Something New",Goldman Sachs has a small team cooking up acquisition ideas for big clients. It’s an experiment that could bolster revenue for Goldman’s trading operation.,2017-10-11T19:40:53+0000,https://www.nytimes.com/2017/10/11/business/dealbook/goldman-sachs-dealmaking.html,2017-10-01 to 2017-12-31
Goldman Sachs,Finance/Banking,"Jennifer Marcus, Jesse Santamaria",The couple met in 2014 through the dating app Hinge.,2017-11-19T05:00:01+0000,https://www.nytimes.com/2017/11/19/fashion/weddings/jennifer-marcus-jesse-santamaria.html,2017-10-01 to 2017-12-31
Goldman Sachs,Finance/Banking,"Diana Sher, Matthew Miller",The couple met in 2013 through a mutual friend.,2017-12-17T05:15:13+0000,https://www.nytimes.com/2017/12/17/fashion/weddings/diana-sher-matthew-miller.html,2017-10-01 to 2017-12-31
Goldman Sachs,Finance/Banking,Treasury Auctions Set for the Week of Oct. 2,The following tax-exempt fixed-income issues are scheduled for pricing this week.,2017-10-01T21:01:28+0000,https://www.nytimes.com/2017/10/01/business/treasury-auctions-set-for-the-week-of-oct-2.html,2017-10-01 to 2017-12-31
Goldman Sachs,Finance/Banking,U.S. Banks Make Progress on Their Living Wills,"Regulators cleared the resolution plans of the eight biggest banks, though four need improvements. That’s an improvement from last year when five failed outright.",2017-12-21T01:40:29+0000,https://www.nytimes.com/2017/12/20/business/dealbook/banks-living-wills.html,2017-10-01 to 2017-12-31
Goldman Sachs,Finance/Banking,Treasury Auctions Set for the Week of Oct. 16,The following tax-exempt fixed-income issues are scheduled for pricing this week.,2017-10-15T21:26:57+0000,https://www.nytimes.com/2017/10/15/business/treasury-auctions-set-for-the-week-of-oct-16.html,2017-10-01 to 2017-12-31
Goldman Sachs,Finance/Banking,Treasury Auctions Set for the Week of Nov. 27,The following tax-exempt fixed-income issues are scheduled for pricing this week.,2017-11-26T22:58:29+0000,https://www.nytimes.com/2017/11/26/business/treasury-auctions-nov-27.html,2017-10-01 to 2017-12-31
Goldman Sachs,Finance/Banking,"William Dudley, New York Fed President, Is Expected to Retire","Mr. Dudley, who led the regional bank in the wake of the financial crisis, is a vocal proponent of improving the “culture” at big banks.",2017-11-05T19:51:51+0000,https://www.nytimes.com/2017/11/05/business/new-york-fed-dudley-retire.html,2017-10-01 to 2017-12-31
Goldman Sachs,Finance/Banking,Gary Cohn and Steven Mnuchin Risk Their Reputations,Pleasing their boss at all costs isn’t worth it.,2017-10-09T07:21:24+0000,https://www.nytimes.com/2017/10/09/opinion/gary-cohn-steve-mnuchin.html,2017-10-01 to 2017-12-31
Goldman Sachs,Finance/Banking,"Key European Agencies Move to Continent, Signs of Brexit’s Toll",The relocation of the European Medicines Agency and the European Banking Authority indicate how Britain’s impending exit from the European Union could diminish its economic clout.,2017-11-20T18:06:56+0000,https://www.nytimes.com/2017/11/20/business/uk-eu-ema-brexit.html,2017-10-01 to 2017-12-31
Goldman Sachs,Finance/Banking,Four Senators Seek Longer Foreclosure Delay in Puerto Rico,A bipartisan group is asking that a moratorium on foreclosures in Puerto Rico be extended to March 2019 as residents repair damage from Hurricane Maria.,2017-12-22T21:58:28+0000,https://www.nytimes.com/2017/12/22/business/puerto-rico-mortgage-foreclosures.html,2017-10-01 to 2017-12-31
Goldman Sachs,Finance/Banking,Treasury Auctions Set for the Week of Nov. 6,The following tax-exempt fixed-income issues are scheduled for pricing this week.,2017-11-05T22:58:31+0000,https://www.nytimes.com/2017/11/05/business/treasury-auctions-november-6.html,2017-10-01 to 2017-12-31
Goldman Sachs,Finance/Banking,"As Chip Makers Consolidate, Marvell Will Buy Cavium in $6 Billion Deal",The deal comes amid fears that a rush of consolidation has left the chip making industry too heavily concentrated.,2017-11-20T17:37:51+0000,https://www.nytimes.com/2017/11/20/business/dealbook/marvell-cavium-chips.html,2017-10-01 to 2017-12-31
Goldman Sachs,Finance/Banking,"Republicans’ Mistakes on Writing, and Selling, Tax Plan Could Cost Them",The party’s leaders in the House have not delivered a proposal that fully deals with criticisms that it helps mainly the wealthy.,2017-11-02T22:13:30+0000,https://www.nytimes.com/2017/11/02/business/dealbook/republicans-tax-plan.html,2017-10-01 to 2017-12-31
Goldman Sachs,Finance/Banking,How Not to Price an I.P.O.: A Couple of Lessons From This Week,Bankers are well paid to find the right price when a company has an initial public offering. But on Thursday there may have been miscalculations.,2017-11-03T22:01:44+0000,https://www.nytimes.com/2017/11/03/business/dealbook/how-not-to-price-an-ipo-a-couple-of-lessons-from-this-week.html,2017-10-01 to 2017-12-31
Goldman Sachs,Finance/Banking,White House Dials Back Trump’s Vow to Clear Puerto Rico’s Debt,"Mick Mulvaney, the director of the Office of Management and Budget, said the island would have to solve its own fiscal woes despite the catastrophic damage it has endured from two powerful hurricanes.",2017-10-04T07:07:57+0000,https://www.nytimes.com/2017/10/04/business/dealbook/trump-puerto-rico-debt.html,2017-10-01 to 2017-12-31
Goldman Sachs,Finance/Banking,"Greek Leader to Meet With Trump, and 2 More Banks Report Earnings","Also in the coming week, China’s Communist Party congress is meeting, and reports on housing come out.",2017-10-16T00:57:22+0000,https://www.nytimes.com/2017/10/15/business/the-week-ahead.html,2017-10-01 to 2017-12-31
Goldman Sachs,Finance/Banking,Sleepy New Jersey Governor’s Race Turns Fiery in First Debate,"Lt. Gov. Kim Guadagno repeatedly linked Philip D. Murphy to Goldman Sachs, and he tried to paint her as being attached to Gov. Chris Christie and President Trump.",2017-10-11T02:27:28+0000,https://www.nytimes.com/2017/10/10/nyregion/new-jersey-governor-race-murphy-guadagno.html,2017-10-01 to 2017-12-31
Goldman Sachs,Finance/Banking,The Deal Makers on CVS’s Bid for Aetna: DealBook Briefing,"An army of firms helped put together the year’s biggest announced merger, with at least $120 million in potential fees to go around for the banks alone.",2017-12-04T11:49:05+0000,https://www.nytimes.com/2017/12/04/business/dealbook/cvs-aetna-deal.html,2017-10-01 to 2017-12-31
Goldman Sachs,Finance/Banking,Tax Cuts Could Boost U.S. Bank Stocks. But Other Issues Are More Pressing.,"The big institutions, including JPMorgan Chase and Citigroup, are trading at prices well above book value — and must confront problems like sluggish loan growth and rising defaults.",2017-10-12T21:05:35+0000,https://www.nytimes.com/2017/10/12/business/tax-cuts-bank-stocks.html,2017-10-01 to 2017-12-31
Goldman Sachs,Finance/Banking,"Ivanka, Louise and the Little People",What a regal and perverse populism the Trump administration continues to practice.,2017-11-25T19:30:19+0000,https://www.nytimes.com/2017/11/25/opinion/sunday/ivanka-trump-louise-linton-populism.html,2017-10-01 to 2017-12-31
Goldman Sachs,Finance/Banking,Conversations With the Candidates for New Jersey Governor,"The New York Times conducted interviews with Philip D. Murphy, the Democratic candidate, and Lt. Gov. Kim Guadagno, the Republican candidate, for New Jersey governor. We also solicited questions from readers for the candidates. Here are edited exc...",2017-11-02T21:50:59+0000,https://www.nytimes.com/2017/11/02/nyregion/conversations-with-the-candidates-for-new-jersey-governor.html,2017-10-01 to 2017-12-31
Goldman Sachs,Finance/Banking,"Uber’s Latest Mess, Facebook, Tax Pessimism: DealBook Briefing",A showdown looms at the ride-hailing company after its co-founder Travis Kalanick responded to a proposal to limit his power by naming two new directors.,2017-10-02T10:48:26+0000,https://www.nytimes.com/2017/10/02/business/uber-travis-kalanick-board.html,2017-10-01 to 2017-12-31
Goldman Sachs,Finance/Banking,Facebook Job Ads Raise Concerns About Age Discrimination,"The ability to aim a message at a particular audience has been a crucial marketing tool, but may be at odds with laws against bias in hiring.",2017-12-20T22:46:07+0000,https://www.nytimes.com/2017/12/20/business/facebook-job-ads.html,2017-10-01 to 2017-12-31
Goldman Sachs,Finance/Banking,Treasury Auctions Set for the Week of Oct. 23,The following tax-exempt fixed-income issues are scheduled for pricing this week.,2017-10-23T01:16:07+0000,https://www.nytimes.com/2017/10/22/business/treasury-auctions-set-for-the-week-of-oct-23.html,2017-10-01 to 2017-12-31
Goldman Sachs,Finance/Banking,"Sessions Avoids AT&T Talk, G.O.P. Merges Taxes and Health Insurance: DealBook Briefing","The attorney general refrained from offering his view on the proposed deal, as the Justice Department weighs whether to sue to block the transaction.",2017-11-14T12:44:38+0000,https://www.nytimes.com/2017/11/14/business/dealbook/silicon-valley-tax-options.html,2017-10-01 to 2017-12-31
Goldman Sachs,Finance/Banking,"Saudi Arabia’s Grand Plan to Move Beyond Oil: Big Goals, Bigger Hurdles","The government has made significant social changes, but progress toward diversifying the economy has been halting.",2017-10-25T18:08:54+0000,https://www.nytimes.com/2017/10/25/world/middleeast/saudi-arabias-grand-plan-to-move-beyond-oil-big-goals-bigger-hurdles.html,2017-10-01 to 2017-12-31
Goldman Sachs,Finance/Banking,Investors Push Into a Resurging Market: House Flipping,"Funds that finance house flippers offer reliable returns of about 8 percent, for those who can invest at least $100,000.",2017-10-20T16:04:03+0000,https://www.nytimes.com/2017/10/20/your-money/house-flipping-loans.html,2017-10-01 to 2017-12-31
Goldman Sachs,Finance/Banking,Europe Gets Tougher on Tech’s Taxes: DealBook Briefing,"Regulators will take Ireland to court over Apple’s taxes and order Luxembourg to collect $293 million from Amazon, turning up the heat on American tech giants.",2017-10-04T10:30:06+0000,https://www.nytimes.com/2017/10/04/business/dealbook/europe-apple-amazon-taxes.html,2017-10-01 to 2017-12-31
Goldman Sachs,Finance/Banking,Phil Murphy for Governor of New Jersey,"The Democratic candidate, a former financier and ambassador, offers the best opportunity to end the chaos of the Chris Christie years.",2017-10-30T01:20:11+0000,https://www.nytimes.com/2017/10/29/opinion/editorials/phil-murphy-governor-jersey.html,2017-10-01 to 2017-12-31
Goldman Sachs,Finance/Banking,"Black Executives Join Forces, Forming a PAC to Back Them Up","Once an informal network, a group of friends and associates is organizing a united political push on issues like education, employment and voting rights.",2017-10-24T09:41:55+0000,https://www.nytimes.com/2017/10/24/business/black-executives-pac.html,2017-10-01 to 2017-12-31
Goldman Sachs,Finance/Banking,Procter & Gamble and Peltz Spar Over Who Won: DealBook Briefing,"Even if the company prevails in the costliest board fight ever, that fact that many big investors sided with Mr. Peltz highlights the power of activists.",2017-10-11T11:29:47+0000,https://www.nytimes.com/2017/10/11/business/dealbook/procter-gamble-nelson-peltz.html,2017-10-01 to 2017-12-31
Goldman Sachs,Finance/Banking,A Historic Tax Heist,In which Republican donors pick your children’s pockets.,2017-12-02T06:55:25+0000,https://www.nytimes.com/2017/12/02/opinion/editorials/a-historic-tax-heist.html,2017-10-01 to 2017-12-31
Goldman Sachs,Finance/Banking,Victoria Beckham Raises $40 Million in Private Equity Investment,"The Spice Girl turned fashion designer, who introduced her brand in 2008, will use the cash to enter new product categories and expand retail operations.",2017-11-27T11:14:01+0000,https://www.nytimes.com/2017/11/27/fashion/fashion-victoria-beckham-neo-investment-partners.html,2017-10-01 to 2017-12-31
Goldman Sachs,Finance/Banking,We Work. We Live. We Work Out. Eventually We Die.,"WeWork wants you to work nice with others and live nice with others. And now, at its new gyms, work out nice with others.",2017-10-12T21:57:28+0000,https://www.nytimes.com/2017/10/12/style/wework-fitness-gyms.html,2017-10-01 to 2017-12-31
Goldman Sachs,Finance/Banking,U.S. Targets Terrorist Financing With New Round of Sanctions,"The fresh round of sanctions was unveiled by Steven Mnuchin, the Treasury secretary, as he embarks on a four-country trip to the Middle East.",2017-10-25T14:00:01+0000,https://www.nytimes.com/2017/10/25/us/politics/us-targets-terrorist-financing-with-new-round-of-sanctions.html,2017-10-01 to 2017-12-31
Goldman Sachs,Finance/Banking,"Senate Plan Gives Health Care Industry Hope, for Now: DealBook Briefing","The bipartisan proposal buoyed the stocks of insurers and hospital operators, but there’s still no assurance of a permanent fix.",2017-10-18T11:02:23+0000,https://www.nytimes.com/2017/10/18/business/dealbook/senators-health-care.html,2017-10-01 to 2017-12-31
Goldman Sachs,Finance/Banking,"Congress, Jerusalem, Facebook: Your Thursday Evening Briefing",Here’s what you need to know at the end of the day.,2017-12-21T23:12:42+0000,https://www.nytimes.com/2017/12/21/briefing/congress-jerusalem-facebook.html,2017-10-01 to 2017-12-31
Goldman Sachs,Finance/Banking,China’s Tightening Grip on Tech Giants: DealBook Briefing,"If Beijing moves to take board seats at companies like Tencent and an Alibaba affiliate, it may hamper their deal-making overseas.",2017-10-12T11:20:07+0000,https://www.nytimes.com/2017/10/12/business/dealbook/china-tech-tencent-alibaba.html,2017-10-01 to 2017-12-31
Goldman Sachs,Finance/Banking,"Citigroup, Twitter, Lyft: Prince’s Arrest Touches Many",Prince Alwaleed’s arrest is likely to reverberate across dozens of publicly listed companies that count him as a major investor.,2017-11-05T04:47:34+0000,https://www.nytimes.com/2017/11/05/business/saudi-prince-alwaleed-investor.html,2017-10-01 to 2017-12-31
Goldman Sachs,Finance/Banking,London Stock Exchange C.E.O. Rolet to Step Down Immediately,Xavier Rolet said he had no intention to return as chief executive or as a director after an investor waged a public fight to retain him.,2017-11-29T08:42:16+0000,https://www.nytimes.com/2017/11/29/business/dealbook/lse-xavier-rolet.html,2017-10-01 to 2017-12-31
