company,sector,headline,snippet,pub_date,url,quarter
Apple Inc,Technology,California Attorney General Is a No-Show on Tech Investigations,"Attorney General Xavier Becerra is in Google and Facebook’s backyard. But unlike nearly all other state attorneys general, he won’t say whether he’s investigating them.",2019-10-31T16:45:15+0000,https://www.nytimes.com/2019/10/31/technology/tech-investigations-california-attorney-general-becerra.html,2019-10-01 to 2019-12-31
Apple Inc,Technology,Apple Enters Show Business With a Black-Carpet Premiere,"Apple TV Plus arrives Friday with “The Morning Show,” starring Reese Witherspoon and Jennifer Aniston, as its flagship streaming program.",2019-10-30T09:00:09+0000,https://www.nytimes.com/2019/10/30/business/media/apple-tv-plus.html,2019-10-01 to 2019-12-31
Apple Inc,Technology,10 Watches That Changed What’s on Your Wrist,We asked experts which timepieces have shaped modern design. Here are their choices.,2019-10-26T09:00:29+0000,https://www.nytimes.com/2019/10/26/fashion/watches-design-audemars-piguet-apple-watch.html,2019-10-01 to 2019-12-31
Apple Inc,Technology,16 Useful Gems in Apple’s New iOS 13,"iOS 13, Apple’s new operating system for the iPhone, comes with tons of new tools under the hood. Here are some of the most helpful.",2019-10-24T21:30:11+0000,https://www.nytimes.com/2019/10/24/smarter-living/16-useful-gems-in-apples-new-ios-13.html,2019-10-01 to 2019-12-31
Apple Inc,Technology,"China Sharpens Hacking to Hound Its Minorities, Far and Wide","New, more sophisticated attacks are targeting Uighurs’ phones — even iPhones and even abroad, security researchers say. They warn that foreigners could be next.",2019-10-22T09:00:14+0000,https://www.nytimes.com/2019/10/22/technology/china-hackers-ethnic-minorities.html,2019-10-01 to 2019-12-31
Apple Inc,Technology,"The Week in Business: A Brexit Battering, and Mark Zuckerberg Plays Defense","Plus, the monthlong strike at General Motors may be over soon.",2019-10-20T11:00:06+0000,https://www.nytimes.com/2019/10/20/business/economy/this-week-in-business-brexit-mark-zuckerberg-facebook-boeing.html,2019-10-01 to 2019-12-31
Apple Inc,Technology,"In House Antitrust Hearing, Lawmakers Focus on Harms to Privacy","Members of Congress questioned whether the power of Facebook, Google, Apple and Amazon could hurt consumer privacy.",2019-10-18T18:57:49+0000,https://www.nytimes.com/2019/10/18/technology/tech-antitrust-hearing.html,2019-10-01 to 2019-12-31
Apple Inc,Technology,Europe’s Margrethe Vestager Takes a Rare Step Toward Big Tech,The E.U.’s top antitrust regulator ordered Broadcom to halt specific practices while the bloc investigates possible anticompetitive activity.,2019-10-16T12:49:18+0000,https://www.nytimes.com/2019/10/16/business/-big-tech-europe-antitrust.html,2019-10-01 to 2019-12-31
Apple Inc,Technology,The Reason Your Photos Are About to Get a Lot Better,Google’s Pixel 4 is the newest example of how computational photography is driving the future of phone cameras.,2019-10-15T15:00:09+0000,https://www.nytimes.com/2019/10/15/technology/personaltech/google-pixel-photography.html,2019-10-01 to 2019-12-31
Apple Inc,Technology,Apple Removes App That Helps Hong Kong Protesters Track the Police,"Apple said it was removing the HKmap.live app, which was criticized by Chinese state media, because the Hong Kong authorities said protesters used it to attack the police.",2019-10-10T03:57:11+0000,https://www.nytimes.com/2019/10/09/technology/apple-hong-kong-app.html,2019-10-01 to 2019-12-31
Apple Inc,Technology,Chinese Media’s Attacks on Apple and N.B.A. Help Inflame Nationalism,Outlets are trying to intimidate multinational companies into toeing the party line while Beijing tries to rein in the Hong Kong protests.,2019-10-09T11:13:03+0000,https://www.nytimes.com/2019/10/09/world/asia/china-apple-nba-hong-kong.html,2019-10-01 to 2019-12-31
Apple Inc,Technology,Tech Giants Shift Profits to Avoid Taxes. There’s a Plan to Stop Them.,"Countries have clashed in recent years over how — and where — to tax companies that operate across borders, particularly those that sell online.",2019-10-09T19:58:35+0000,https://www.nytimes.com/2019/10/09/us/politics/tech-giants-taxes-oecd.html,2019-10-01 to 2019-12-31
Apple Inc,Technology,The World’s Wokest Sports League Bows to China,"The N.B.A. apologizes on behalf of Daryl Morey, a general manager who voiced support for democracy.",2019-10-08T01:30:53+0000,https://www.nytimes.com/2019/10/07/opinion/nba-china-hong-kong.html,2019-10-01 to 2019-12-31
Apple Inc,Technology,Facebook Encryption Eyed in Fight Against Online Child Sex Abuse,The debate over privacy in the digital age increasingly pits tech companies against law enforcement agencies as explicit imagery explodes.,2019-10-02T23:13:55+0000,https://www.nytimes.com/2019/10/02/technology/encryption-online-child-sex-abuse.html,2019-10-01 to 2019-12-31
Apple Inc,Technology,How Much Watching Time Do You Have This Weekend?,Watch something steamy or something sudsy — or some serious craft talk with Lupita Nyong’o.,2019-12-12T22:32:29+0000,https://www.nytimes.com/2019/12/12/arts/television/lupita-nyongo-greenleaf-apple-tree-yard.html,2019-10-01 to 2019-12-31
Apple Inc,Technology,Apple Card Investigated After Gender Discrimination Complaints,A prominent software developer said on Twitter that the credit card was “sexist” against women applying for credit.,2019-11-10T19:06:42+0000,https://www.nytimes.com/2019/11/10/business/Apple-credit-card-investigation.html,2019-10-01 to 2019-12-31
Apple Inc,Technology,Hong Kong Protesters Are Targeting Starbucks. Apple Could Be Next.,Pro-democracy demonstrators have begun singling out companies that they consider enemies of their movement. Vandalism and calls for boycotts have followed.,2019-10-15T14:05:32+0000,https://www.nytimes.com/2019/10/15/business/hong-kong-starbucks-vandalism.html,2019-10-01 to 2019-12-31
Apple Inc,Technology,"The Best Movies and TV Shows Coming to Netflix, Apple TV Plus and More in December","Every month, subscription streaming services add a new batch of titles to their libraries. Here are our picks for December.",2019-12-01T15:00:09+0000,https://www.nytimes.com/2019/12/01/arts/television/new-to-stream-netflix.html,2019-10-01 to 2019-12-31
Apple Inc,Technology,Facebook and Barr Escalate Standoff Over Encrypted Messages,"With 1.5 billion users, Facebook’s WhatsApp is perhaps the world’s most commonly used encrypted communications platform.",2019-12-10T15:07:14+0000,https://www.nytimes.com/2019/12/10/technology/whatsapp-barr-encryption.html,2019-10-01 to 2019-12-31
Apple Inc,Technology,Disney Bars Netflix TV Ads in Battle for Streaming Supremacy,"ABC, Freeform and other Disney-owned entertainment networks will no longer accept Netflix ads in another sign of how the streaming wars are intensifying.",2019-10-04T17:51:27+0000,https://www.nytimes.com/2019/10/04/business/media/disney-netflix-advertising.html,2019-10-01 to 2019-12-31
Apple Inc,Technology,Google to Buy Fitbit for $2.1 Billion,The deal represents an aggressive attempt by Google to bolster its lineup of hardware products.,2019-11-01T13:08:17+0000,https://www.nytimes.com/2019/11/01/technology/google-fitbit.html,2019-10-01 to 2019-12-31
Apple Inc,Technology,"This Hanukkah, Let Michael Solomonov Make Dinner","For a Whole Foods holiday meal, the Zahav chef serves chicken schnitzel and other fried delights.",2019-12-09T20:08:53+0000,https://www.nytimes.com/2019/12/09/dining/hanukkah-dinner-michael-solomonov.html,2019-10-01 to 2019-12-31
Apple Inc,Technology,Netflix Keeps an Eye on the Mouse,"More companies are streaming, but Reed Hastings says he expects to learn the most from one: Disney.",2019-11-11T21:18:28+0000,https://www.nytimes.com/2019/11/11/business/dealbook/netflix-reed-hastings.html,2019-10-01 to 2019-12-31
Apple Inc,Technology,‘Stranger Things’ Helps Netflix Increase Subscribers,The streaming giant regained some footing after losing U.S. subscribers this year. But new rivals will make it tough for that growth to continue.,2019-10-16T17:04:59+0000,https://www.nytimes.com/2019/10/16/business/media/netflix-q3-earnings.html,2019-10-01 to 2019-12-31
Apple Inc,Technology,"Justice Dept. Could Widen Its Scrutiny of Tech Companies, Official Says","Law enforcement officials could potentially challenge Google, Facebook and others on fronts beyond potential antitrust violations.",2019-11-18T16:15:40+0000,https://www.nytimes.com/2019/11/18/us/politics/technology-antitrust-justice.html,2019-10-01 to 2019-12-31
Apple Inc,Technology,"Google Makes a Bid for Banking, Where Tech Firms Go to Stumble",Attempts to create tech-focused alternatives to traditional banking have struggled to be more than a niche product.,2019-11-13T22:48:27+0000,https://www.nytimes.com/2019/11/13/business/google-banking-checking-account.html,2019-10-01 to 2019-12-31
Apple Inc,Technology,How a Tweet Put the NBA in Hot Water in China,"A quickly deleted post by a Houston Rockets executive opened the league, which has had huge success in China, up to blowback in a vital overseas market.",2019-10-07T10:28:27+0000,https://www.nytimes.com/2019/10/07/sports/basketball/nba-china.html,2019-10-01 to 2019-12-31
Apple Inc,Technology,Amazon Wants to Surveil Your Dog,"“Amazon is building the infrastructure to monitor us all,” a privacy advocate says.",2019-10-01T21:00:09+0000,https://www.nytimes.com/2019/10/01/opinion/amazon-privacy.html,2019-10-01 to 2019-12-31
Apple Inc,Technology,"The Promise and Peril of Vaping, Part 2: The Story of Juul","They pledged to help people stop smoking. Instead, Juul created a new generation of nicotine addicts — and a public health scare.",2019-10-30T10:00:07+0000,https://www.nytimes.com/2019/10/30/podcasts/the-daily/juul-dangers.html,2019-10-01 to 2019-12-31
Apple Inc,Technology,The Week in Business: Google Is Coming for Your Health Records,,2019-11-17T12:00:05+0000,https://www.nytimes.com/2019/11/17/business/this-week-in-business-google-health-records.html,2019-10-01 to 2019-12-31
Apple Inc,Technology,The Spectacular Rise and Fall of WeWork,He sold a utopian vision that ultimately left a company in shambles. Then he walked away with more than $1 billion.,2019-11-18T11:03:46+0000,https://www.nytimes.com/2019/11/18/podcasts/the-daily/wework-adam-neumann.html,2019-10-01 to 2019-12-31
Apple Inc,Technology,Pixel 4 Review: Google Needs to Do More to Stand Out,"The new Pixel 4 is a solid higher-end phone. But dollar for dollar, it pales against the latest iPhones and Galaxy devices. Here’s why.",2019-10-21T13:00:14+0000,https://www.nytimes.com/2019/10/21/technology/personaltech/pixel-4-review.html,2019-10-01 to 2019-12-31
Apple Inc,Technology,‘Marriage Story’ and ‘The Irishman’ Propel Netflix to Most Golden Globe Nominations,"Streaming services had a big day with Netflix leading the TV and film categories. Apple’s centerpiece series, “The Morning Show,” and its two stars all received nominations.",2019-12-09T10:00:18+0000,https://www.nytimes.com/2019/12/09/movies/golden-globes-nominations.html,2019-10-01 to 2019-12-31
Apple Inc,Technology,‘There’s No Going Back’,How genetic databases are transforming policing and testing the limits of privacy.,2019-12-27T11:00:15+0000,https://www.nytimes.com/2019/12/27/podcasts/the-daily/genetic-privacy-dna.html,2019-10-01 to 2019-12-31
Apple Inc,Technology,The Week in Tech: Navigating the Chinese Minefield,American tech companies want access to customers in China. But they’re learning that can come with a lot of baggage.,2019-10-11T13:00:09+0000,https://www.nytimes.com/2019/10/11/technology/china-apple-minefield.html,2019-10-01 to 2019-12-31
Apple Inc,Technology,Google to Store and Analyze Millions of Health Records,The tech company’s deal with Ascension is part of a push to use artificial intelligence to aid health services.,2019-11-12T00:34:36+0000,https://www.nytimes.com/2019/11/11/business/google-ascension-health-data.html,2019-10-01 to 2019-12-31
Apple Inc,Technology,Facebook Calls Truce With Publishers as It Unveils Facebook News,"The social network introduced a new section of its mobile app dedicated to news content, offering stories from a mix of publications.",2019-10-25T10:00:04+0000,https://www.nytimes.com/2019/10/25/technology/facebook-publishers-news.html,2019-10-01 to 2019-12-31
Apple Inc,Technology,Gift Ideas for Car Lovers or Commuters,"Hot Wheels big and small, smartphone holders, night-vision aids and more.",2019-12-11T11:00:14+0000,https://www.nytimes.com/2019/12/11/business/car-gifts.html,2019-10-01 to 2019-12-31
Apple Inc,Technology,The Twilight of the Tech Idols,Technology executives like WeWork’s Adam Neumann are the new bankers.,2019-10-10T15:48:21+0000,https://www.nytimes.com/2019/10/10/opinion/wework-adam-neumann-tech.html,2019-10-01 to 2019-12-31
Apple Inc,Technology,Goldman Sachs Near Deal to Settle 1MDB Inquiry,The Wall Street bank would pay a fine of as much as $2 billion and have a subsidiary plead guilty to settle an inquiry into the looting of a sovereign wealth fund in Malaysia.,2019-12-20T11:04:04+0000,https://www.nytimes.com/2019/12/20/business/dealbook/dealbook-goldman-sachs-near-deal-to-settle-1mdb-inquiry.html,2019-10-01 to 2019-12-31
Apple Inc,Technology,"Many Facial-Recognition Systems Are Biased, Says U.S. Study","Algorithms falsely identified African-American and Asian faces 10 to 100 times more than Caucasian faces, researchers for the National Institute of Standards and Technology found.",2019-12-19T22:04:19+0000,https://www.nytimes.com/2019/12/19/technology/facial-recognition-bias.html,2019-10-01 to 2019-12-31
Apple Inc,Technology,"Google, in Rare Stumble, Posts 23% Decline in Profit","Alphabet, Google’s parent, said its profits fell after a sharp increase in spending for research and development.",2019-10-28T20:32:14+0000,https://www.nytimes.com/2019/10/28/technology/google-alphabet-earnings.html,2019-10-01 to 2019-12-31
Apple Inc,Technology,There Is a Reason Tech Isn’t Safe,Kudos to Uber for addressing harassment. Other companies should follow suit.,2019-12-13T11:00:07+0000,https://www.nytimes.com/2019/12/13/opinion/uber-silicon-valley.html,2019-10-01 to 2019-12-31
Apple Inc,Technology,Barr Pushes Facebook for Access to WhatsApp Messages,"The Justice Department has long sought access to encrypted messages, alarming privacy experts.",2019-10-03T18:41:10+0000,https://www.nytimes.com/2019/10/03/us/politics/barr-whatsapp-facebook-encryption.html,2019-10-01 to 2019-12-31
Apple Inc,Technology,The Week in Tech: WhatsApp’s Spyware Fight Is at Least Good P.R.,"The messaging service is suing a cybersurveillance company. Whether it’s successful or not, it is a strong statement from WhatsApp and its owner, Facebook.",2019-11-01T13:00:06+0000,https://www.nytimes.com/2019/11/01/technology/whatsapp-nso.html,2019-10-01 to 2019-12-31
Apple Inc,Technology,These Apps Are an Uber Driver’s Co-Pilot,"Gridwise, Mystro and others help drivers predict where to get the best routes, and also manage the nitty-gritty for tax purposes.",2019-10-17T10:00:04+0000,https://www.nytimes.com/2019/10/17/business/apps-uber-lyft-drivers.html,2019-10-01 to 2019-12-31
Apple Inc,Technology,Facebook Testing a Way to Let You Move Photos to Rival Sites,"The company, accused by the E.U. of stifling competition, is trying a tool in Ireland that would allow users to move photos and videos to Google.",2019-12-02T15:14:52+0000,https://www.nytimes.com/2019/12/02/technology/facebook-photos-EU.html,2019-10-01 to 2019-12-31
Apple Inc,Technology,Children’s Gifts That Come in Green,Eco-conscious presents range from a World Wildlife Fund ‘adoption’ to a tea set made of recycled plastic.,2019-11-28T10:04:12+0000,https://www.nytimes.com/2019/11/28/fashion/childrens-green-gifts-wwf-patagonia.html,2019-10-01 to 2019-12-31
Apple Inc,Technology,F.T.C. Is Said to Consider an Injunction Against Facebook,"Such an action would seek to block a technical integration of WhatsApp, Facebook Messenger and Instagram, people familiar with the matter said.",2019-12-12T21:23:40+0000,https://www.nytimes.com/2019/12/12/technology/ftc-facebook-injunction.html,2019-10-01 to 2019-12-31
Apple Inc,Technology,Where Will Sundar Pichai Take Google?,Alphabet’s new chief executive has a plate full of challenges. But it’s still a company with a lot of potential.,2019-12-04T19:31:52+0000,https://www.nytimes.com/2019/12/04/opinion/google-larry-page-sergey-brin.html,2019-10-01 to 2019-12-31
Apple Inc,Technology,"Business Is Thrilling Again. Enjoy the Spectacle, From a Distance.","The world of tech start-ups is super exciting, our columnist says. But for investors, that’s not necessarily a good thing.",2019-10-11T11:15:04+0000,https://www.nytimes.com/2019/10/11/business/enjoy-stock-market-spectacle-from-a-distance.html,2019-10-01 to 2019-12-31
Apple Inc,Technology,"Young Sheldon, Meet SpongeBob: CBS and Viacom Are Back Together","Shari Redstone gets her wish, bringing about the merger of two media giants in a $25 billion deal. The plan is to become a content arms dealer in the streaming wars.",2019-12-04T18:34:46+0000,https://www.nytimes.com/2019/12/04/business/media/viacom-cbs-merger.html,2019-10-01 to 2019-12-31
Apple Inc,Technology,Inside the Debate Between Netflix and Big Theater Chains Over ‘The Irishman’,"Scorsese’s Netflix gangster epic will play in select theaters before it streams. “It’s a disgrace,” says John Fithian, the head of the theater owners organization.",2019-11-01T12:00:05+0000,https://www.nytimes.com/2019/11/01/business/irishman-netflix-theaters.html,2019-10-01 to 2019-12-31
Apple Inc,Technology,Atlanta Asks Google Whether It Targeted Black Homeless People,City officials asked Google to verify a report that its contractors sought to scan the faces of black homeless people to improve facial-recognition software.,2019-10-04T22:04:50+0000,https://www.nytimes.com/2019/10/04/technology/google-facial-recognition-atlanta-homeless.html,2019-10-01 to 2019-12-31
Apple Inc,Technology,The Week in Tech: Facebook Fights Back,A remarkable leak from an internal meeting shows the company is gearing up to fight government intervention.,2019-10-04T13:00:10+0000,https://www.nytimes.com/2019/10/04/technology/the-week-in-tech-facebook-fights-back.html,2019-10-01 to 2019-12-31
Apple Inc,Technology,"Sundance Gets Real, With a Lineup of Newsy Films for 2020",The 118 feature-length movies selected for the indie festival include Julianne Moore as Gloria Steinem and a documentary on Parkland survivors.,2019-12-04T18:00:10+0000,https://www.nytimes.com/2019/12/04/business/media/2020-sundance-film-festival.html,2019-10-01 to 2019-12-31
Apple Inc,Technology,Airbnb’s New Rules and a Look at the Streaming Wars,"Highlights from yesterday’s DealBook conference, which featured some of the biggest newsmakers in business and policy.",2019-11-07T11:19:54+0000,https://www.nytimes.com/2019/11/07/business/dealbook/dealbook-conference-airbnb-netflix.html,2019-10-01 to 2019-12-31
Microsoft,Technology,Why Twitch Is Still the King of Live Game Streaming,"Facebook, Microsoft, Twitter and others are spending millions on video game streaming to compete with Amazon’s Twitch in a fight to court millennials.",2019-12-15T19:58:37+0000,https://www.nytimes.com/2019/12/15/business/tech-video-game-streaming-twitch.html,2019-10-01 to 2019-12-31
Microsoft,Technology,"Big Tech Is Under Attack, and Investors Couldn’t Care Less","Giant tech stocks have posted a remarkable year, shrugging off the trade war, bipartisan political hostility and regulatory threats.",2019-12-10T10:00:19+0000,https://www.nytimes.com/2019/12/10/business/tech-stocks-apple-amazon-microsoft-google.html,2019-10-01 to 2019-12-31
Microsoft,Technology,Amazon Accuses Trump of ‘Improper Pressure’ on JEDI Contract,"In a legal complaint, Amazon said the president had attacked it behind the scenes to harm its C.E.O., Jeff Bezos, “his perceived political enemy.”",2019-12-09T16:20:47+0000,https://www.nytimes.com/2019/12/09/technology/amazon-jedi-dod-contract-trump.html,2019-10-01 to 2019-12-31
Microsoft,Technology,How Laws Against Child Sexual Abuse Imagery Can Make It Harder to Detect,Tech companies are deploying artificial intelligence to detect new photos and videos. But such efforts may run afoul of the law.,2019-11-12T08:00:06+0000,https://www.nytimes.com/2019/11/12/us/online-child-sex-abuse.html,2019-10-01 to 2019-12-31
Microsoft,Technology,"Microsoft Surface Pro X Review: Powerful Computer, but So-So Tablet","With its new Surface, Microsoft has made progress blending the best of mobile devices and personal computers. But it falls short in offering a fingertip-friendly experience for tablets.",2019-11-05T05:01:15+0000,https://www.nytimes.com/2019/11/05/technology/personaltech/microsoft-surface-pro-x-review.html,2019-10-01 to 2019-12-31
Microsoft,Technology,"What, if Anything, Should Be Done to Rein in Big Tech?","Makan Delrahim, Kevin Systrom and Bill Gates weighed in on antitrust issues.",2019-11-11T21:16:06+0000,https://www.nytimes.com/2019/11/11/business/dealbook/makan-delrahim-kevin-systrom-bill-gates-regulation-technology.html,2019-10-01 to 2019-12-31
Microsoft,Technology,Microsoft Says Russians Hacked Antidoping Agency Computers,The Russians were supposed to turn over their own computer data to avoid further penalties. Then they went on the offensive.,2019-10-28T23:25:36+0000,https://www.nytimes.com/2019/10/28/sports/olympics/russia-doping-wada-hacked.html,2019-10-01 to 2019-12-31
Microsoft,Technology,"Microsoft Wins Pentagon’s $10 Billion JEDI Contract, Thwarting Amazon","Amazon was considered a front-runner for the cloud computing project before President Trump began criticizing the company’s founder, Jeff Bezos.",2019-10-25T23:02:47+0000,https://www.nytimes.com/2019/10/25/technology/dod-jedi-contract.html,2019-10-01 to 2019-12-31
Microsoft,Technology,Microsoft Rides Cloud to a 21% Increase in Profits,"The company’s cloud computing efforts again pushed profits higher, to $10.7 billion in the latest quarter.",2019-10-23T20:24:37+0000,https://www.nytimes.com/2019/10/23/technology/microsoft-earnings-cloud.html,2019-10-01 to 2019-12-31
Microsoft,Technology,The Week in Tech: WhatsApp’s Spyware Fight Is at Least Good P.R.,"The messaging service is suing a cybersurveillance company. Whether it’s successful or not, it is a strong statement from WhatsApp and its owner, Facebook.",2019-11-01T13:00:06+0000,https://www.nytimes.com/2019/11/01/technology/whatsapp-nso.html,2019-10-01 to 2019-12-31
Microsoft,Technology,Building for Real With Digital Blocks,"To improve community structures with citizens’ input, the United Nations uses a computer game inspired by Lego.",2019-10-15T15:45:30+0000,https://www.nytimes.com/2019/10/15/opinion/building-digital-blocks-Lego.html,2019-10-01 to 2019-12-31
Microsoft,Technology,"Bill Gates Met With Jeffrey Epstein Many Times, Despite His Past",Mr. Gates has minimized his ties to Mr. Epstein. But a Times investigation reveals they had a closer relationship than previously known.,2019-10-12T17:17:07+0000,https://www.nytimes.com/2019/10/12/business/jeffrey-epstein-bill-gates.html,2019-10-01 to 2019-12-31
Microsoft,Technology,Amazon Protesting Pentagon’s $10 Billion JEDI Contract,The company said there should be an examination of whether political bias helped Microsoft win the bid.,2019-11-14T23:54:55+0000,https://www.nytimes.com/2019/11/14/technology/dod-jedi-contract.html,2019-10-01 to 2019-12-31
Microsoft,Technology,What Can Astronauts and Search-and-Rescue Squads Teach Us About Teamwork?,"Few teams work as closely as astronauts, floating through space in a cramped capsule, away from Earth for months or years at a time.",2019-11-19T23:16:53+0000,https://www.nytimes.com/paidpost/microsoft-teams/what-can-astronauts-and-search-and-rescue-squads-teach-us-about-teamwork.html,2019-10-01 to 2019-12-31
Microsoft,Technology,Gates on Warren’s Wealth Tax: ‘I’ve Paid More Than Anyone’,"Bill Gates, the billionaire co-founder of Microsoft, expressed skepticism over Senator Elizabeth Warren’s plan to raise taxes on the wealthy. Ms. Warren has offered to meet with Mr. Gates to explain her ideas.",2019-11-07T15:39:11+0000,https://www.nytimes.com/video/us/politics/100000006812398/warren-bill-gates.html,2019-10-01 to 2019-12-31
Microsoft,Technology,Iranian Hackers Target Trump Campaign as Threats to 2020 Mount,"The news, according to two people with knowledge of the attacks, followed a Microsoft report that said hackers had targeted a campaign, U.S. officials and journalists.",2019-10-04T17:06:14+0000,https://www.nytimes.com/2019/10/04/technology/iranian-campaign-hackers-microsoft.html,2019-10-01 to 2019-12-31
Microsoft,Technology,"Diane Hu, Alexander Sappington","The couple met at Princeton, from which each graduated, the bride cum laude and the groom summa cum laude.",2019-12-22T05:00:00+0000,https://www.nytimes.com/2019/12/22/fashion/weddings/diane-hu-alexander-sappington.html,2019-10-01 to 2019-12-31
Microsoft,Technology,Should the Week Be Four Days Instead of Five?,Microsoft Japan recently tested a shortened workweek and found that productivity improved by about 40 percent. Do you think all schools and companies should try this?,2019-11-13T10:00:05+0000,https://www.nytimes.com/2019/11/13/learning/should-the-week-be-four-days-instead-of-five.html,2019-10-01 to 2019-12-31
