company,sector,headline,snippet,pub_date,url,quarter
BlackRock,Finance/Banking,A New Bid to Crack the Code on Gun Violence,Amalgamated Bank and the nonprofit Guns Down America are trying a different way to use the financial system to clamp down on mass shootings.,2022-09-06T12:14:44+0000,https://www.nytimes.com/2022/09/06/business/dealbook/gun-violence-amalgamated-bank-code.html,2022-07-01 to 2022-09-30
BlackRock,Finance/Banking,Dissecting the Royal Family’s Wealth,"The Windsors benefit from a complex array of holdings, which face the same economic challenges as Britain as a whole.",2022-09-09T12:28:52+0000,https://www.nytimes.com/2022/09/09/business/dealbook/britain-royal-family-wealth.html,2022-07-01 to 2022-09-30
BlackRock,Finance/Banking,The Barbados Rebellion: An Island Nation’s Fight for Climate Justice,The Caribbean is trapped between crushing debt and a climate disaster caused by rich nations. Prime Minister Mia Mottley is battling for a fairer system.,2022-07-27T09:07:03+0000,https://www.nytimes.com/interactive/2022/07/27/magazine/barbados-climate-debt-mia-mottley.html,2022-07-01 to 2022-09-30
BlackRock,Finance/Banking,"Corrections: July 30, 2022","Corrections that appeared in print on Saturday, July 30, 2022.",2022-07-30T03:34:22+0000,https://www.nytimes.com/2022/07/29/pageoneplus/corrections-july-30-2022.html,2022-07-01 to 2022-09-30
NVIDIA,AI/Chip Manufacturing,U.S. Restricts Sales of Sophisticated Chips to China and Russia,"Limits were placed on high-end GPUs that power supercomputers and artificial intelligence, said Nvidia and AMD, two Silicon Valley chip makers.",2022-09-01T01:14:31+0000,https://www.nytimes.com/2022/08/31/technology/gpu-chips-china-russia.html,2022-07-01 to 2022-09-30
NVIDIA,AI/Chip Manufacturing,Biden Administration Releases Plan for $50 Billion Investment in Chips,The Commerce Department issued guidelines for companies angling to receive federal funding aimed at bolstering the domestic semiconductor industry.,2022-09-06T07:00:09+0000,https://www.nytimes.com/2022/09/06/business/economy/biden-tech-chips.html,2022-07-01 to 2022-09-30
NVIDIA,AI/Chip Manufacturing,A Darkened Outlook for Britain,"The political instability comes as Britain gears up for a difficult summer, amid surging energy prices and labor shortages.",2022-07-06T13:48:07+0000,https://www.nytimes.com/2022/07/06/business/dealbook/uk-britain-economy-boris-johnson.html,2022-07-01 to 2022-09-30
NVIDIA,AI/Chip Manufacturing,The Andy Jassy Way at Amazon,The longtime lieutenant to Jeff Bezos has made more changes than many expected since becoming C.E.O.,2022-07-18T12:28:54+0000,https://www.nytimes.com/2022/07/18/business/dealbook/andy-jassy-amazon.html,2022-07-01 to 2022-09-30
NVIDIA,AI/Chip Manufacturing,Big Tech Reconsiders the “Made in China” Way,"Apple, Google and Microsoft are among the technology firms looking to shift some of their manufacturing out of China.",2022-09-01T11:54:05+0000,https://www.nytimes.com/2022/09/01/business/dealbook/big-tech-reconsiders-made-in-china-iphone.html,2022-07-01 to 2022-09-30
Advanced Micro Devices,AI/Chip Manufacturing,U.S. Restricts Sales of Sophisticated Chips to China and Russia,"Limits were placed on high-end GPUs that power supercomputers and artificial intelligence, said Nvidia and AMD, two Silicon Valley chip makers.",2022-09-01T01:14:31+0000,https://www.nytimes.com/2022/08/31/technology/gpu-chips-china-russia.html,2022-07-01 to 2022-09-30
Advanced Micro Devices,AI/Chip Manufacturing,Biden Administration Releases Plan for $50 Billion Investment in Chips,The Commerce Department issued guidelines for companies angling to receive federal funding aimed at bolstering the domestic semiconductor industry.,2022-09-06T07:00:09+0000,https://www.nytimes.com/2022/09/06/business/economy/biden-tech-chips.html,2022-07-01 to 2022-09-30
Intel,AI/Chip Manufacturing,Biden Attends Groundbreaking for Intel Chip Factory in Ohio,"President Biden said Intel had decided to build a $20 billion factory in Ohio because of the CHIPS and Science Act, which provides the company with subsidies to build semiconductor manufacturing facilities in America.",2022-09-09T18:57:59+0000,https://www.nytimes.com/video/business/100000008526647/biden-computer-chip-factory-intel-ohio.html,2022-07-01 to 2022-09-30
Intel,AI/Chip Manufacturing,How Silicon Chips Rule the World,"Maintaining the flow of oil is still crucial for the world economy. But now the supply of semiconductors is also critical for commerce, and war and peace.",2022-09-09T09:00:29+0000,https://www.nytimes.com/2022/09/09/business/silicon-markets-china-taiwan.html,2022-07-01 to 2022-09-30
Intel,AI/Chip Manufacturing,Taxpayers for U.S. Chips,What a $280 billion law signed by President Biden this week might mean for Americans.,2022-08-10T17:42:07+0000,https://www.nytimes.com/2022/08/10/technology/us-computer-chips.html,2022-07-01 to 2022-09-30
Intel,AI/Chip Manufacturing,"In Ohio, Biden Says Democrats Have Started a Manufacturing Revival","President Biden attended the groundbreaking for an Intel computer chip factory in a heavily Republican part of Ohio, an effort to focus voter attention on parts of the economy that are improving.",2022-09-09T19:54:45+0000,https://www.nytimes.com/2022/09/09/us/politics/ohio-biden-democrats-manufacturing-revival.html,2022-07-01 to 2022-09-30
Intel,AI/Chip Manufacturing,Congress Is Giving Billions to the Chip Industry. Strings Are Attached.,"Industrial policy is back in Washington, as a vast semiconductor and science bill gives the government new sway over a strategic industry.",2022-08-03T09:00:31+0000,https://www.nytimes.com/2022/08/03/business/economy/chip-industry-congress.html,2022-07-01 to 2022-09-30
Intel,AI/Chip Manufacturing,E.U. Scores Major Legal Victory Against Google,A court rejected Google’s appeal of a record-setting antitrust fine related to Android and online search.,2022-09-14T10:32:21+0000,https://www.nytimes.com/2022/09/14/business/eu-google-antitrust-fine.html,2022-07-01 to 2022-09-30
Intel,AI/Chip Manufacturing,China Locks Down Major Southern City of Chengdu,"The drastic response to a rise in Covid cases adds to the pressures facing Sichuan Province, which already had been dealing with drought, heat and wildfires.",2022-09-01T06:56:43+0000,https://www.nytimes.com/2022/09/01/world/asia/china-covid-lockdown-chengdu.html,2022-07-01 to 2022-09-30
Intel,AI/Chip Manufacturing,China Has Leapfrogged the U.S. in Key Technologies. Can a New Law Help?,"While Congress argued over whether and how to support American chip makers and research in other technologies, China was surging ahead.",2022-07-29T00:26:29+0000,https://www.nytimes.com/2022/07/28/us/politics/us-china-semiconductors.html,2022-07-01 to 2022-09-30
Intel,AI/Chip Manufacturing,"Why Elon Musk Can’t Back Out of Buying Twitter, According to Twitter",Here are some of the company’s main legal arguments.,2022-07-13T00:19:31+0000,https://www.nytimes.com/2022/07/12/technology/twitter-musk-lawsuit-reasons.html,2022-07-01 to 2022-09-30
Intel,AI/Chip Manufacturing,The Semiconductor Problem,The military relies on advanced semiconductors. The U.S. doesn’t make any.,2022-07-14T10:26:16+0000,https://www.nytimes.com/2022/07/14/briefing/semiconductor-bill-congress-biden.html,2022-07-01 to 2022-09-30
Intel,AI/Chip Manufacturing,DeSantis Claims Win in Campaign Against E.S.G.,"Florida is the latest state to adopt a series of sweeping restrictions on environmental, social and governance investing.",2022-08-24T12:14:26+0000,https://www.nytimes.com/2022/08/24/business/dealbook/desantis-florida-esg-investing.html,2022-07-01 to 2022-09-30
Intel,AI/Chip Manufacturing,Five Action Movies to Stream Now,"This month’s picks include an Indian thriller, a Japanese teen assassin movie and an intense, character-driven Kenyan heist flick.",2022-09-09T15:56:03+0000,https://www.nytimes.com/2022/09/09/movies/action-movies-streaming.html,2022-07-01 to 2022-09-30
Intel,AI/Chip Manufacturing,What Twitter’s Subpoenas Say About Its Plan to Fight Elon Musk in Court,"Twitter has sent out requests for information from the banks that are backing the billionaire’s purchase, which he is trying to walk away from.",2022-08-02T13:50:18+0000,https://www.nytimes.com/2022/08/02/business/musk-banks-twitter-subpoena.html,2022-07-01 to 2022-09-30
Intel,AI/Chip Manufacturing,Senate Advances Expansive Industrial Policy Bill to Counter China,"The vote indicated bipartisan support for the legislation, which had been at risk of being scaled back substantially until Republicans rallied around a more extensive bill.",2022-07-26T16:08:43+0000,https://www.nytimes.com/2022/07/26/us/politics/senate-industrial-policy-bill.html,2022-07-01 to 2022-09-30
Intel,AI/Chip Manufacturing,"Kazuo Inamori, Major Industrialist in Postwar Japan, Dies at 90","Founding two giant companies, he helped turn his country into an economic giant while encouraging employees to approach work with an almost spiritual devotion.",2022-09-02T18:00:04+0000,https://www.nytimes.com/2022/09/02/business/kazuo-inamori-dead.html,2022-07-01 to 2022-09-30
Intel,AI/Chip Manufacturing,Biden Administration Releases Plan for $50 Billion Investment in Chips,The Commerce Department issued guidelines for companies angling to receive federal funding aimed at bolstering the domestic semiconductor industry.,2022-09-06T07:00:09+0000,https://www.nytimes.com/2022/09/06/business/economy/biden-tech-chips.html,2022-07-01 to 2022-09-30
Intel,AI/Chip Manufacturing,Silicon Valley Had Its Heyday. Can Tech Ecosystems Now Grow Inland?,"The AOL co-founder Steve Case sees a need for entrepreneurial hubs beyond the coasts. “Let’s have it be a few dozen cities,” he says.",2022-09-24T12:00:05+0000,https://www.nytimes.com/2022/09/24/business/dealbook/steve-case-rise-of-rest.html,2022-07-01 to 2022-09-30
Intel,AI/Chip Manufacturing,From Boom to Gloom: Tech Recruiters Struggle to Find Work,"As tech companies slow hiring and lay off workers, once-busy recruiters are shifting to other roles and cutting their rates.",2022-09-07T09:00:30+0000,https://www.nytimes.com/2022/09/07/technology/recruiters-tech-layoffs.html,2022-07-01 to 2022-09-30
Intel,AI/Chip Manufacturing,The U.S. Is Behind in the Competition for the ‘Oil’ of the 21st Century,Semiconductor supremacy isn’t something we can buy. It’s something we must build.,2022-07-25T19:00:11+0000,https://www.nytimes.com/2022/07/25/opinion/america-tech-visas.html,2022-07-01 to 2022-09-30
Intel,AI/Chip Manufacturing,How the C.I.A. Tracked the Leader of Al Qaeda,The U.S. search for Ayman al-Zawahri had spanned decades. His presence on a balcony at a safe house in Kabul presented an opportunity to strike.,2022-08-02T23:10:42+0000,https://www.nytimes.com/2022/08/02/us/politics/cia-qaeda-al-zawahri.html,2022-07-01 to 2022-09-30
Intel,AI/Chip Manufacturing,"‘House of the Dragon’ Season 1, Episode 4 Recap: The Full Targaryen",Most of this week was dedicated to the royal family and its “queer customs.”,2022-09-12T02:10:04+0000,https://www.nytimes.com/2022/09/11/arts/television/house-of-the-dragon-recap-episode-4.html,2022-07-01 to 2022-09-30
Intel,AI/Chip Manufacturing,Maybe Joe Biden Knows Joe Manchin Better Than We Thought,There is at least one person in politics who was not taken by surprise by the new climate and tax package.,2022-08-01T09:00:09+0000,https://www.nytimes.com/2022/08/01/opinion/biden-manchin-inflation-climate-change.html,2022-07-01 to 2022-09-30
Intel,AI/Chip Manufacturing,"Deniers, Enablers, Accepters","We break down elected Republicans into three groups, based on their stances toward false claims about the 2020 election.",2022-08-24T10:18:44+0000,https://www.nytimes.com/2022/08/24/briefing/republicans-trump-election-fraud.html,2022-07-01 to 2022-09-30
Intel,AI/Chip Manufacturing,"Wake Up, Billionaires: The Occupiers Are Coming for the Hamptons",Along for an early morning “billionaire wake-up call” with protesters on Meadow Lane.,2022-07-13T20:40:27+0000,https://www.nytimes.com/2022/07/13/style/occupy-the-hamptons-protests.html,2022-07-01 to 2022-09-30
Intel,AI/Chip Manufacturing,Xi Jinping’s Vision for Tech Self-Reliance in China Runs Into Reality,"After heavy national investment in semiconductors to break a dependence on global chips, Mr. Xi seems unhappy with the results.",2022-08-29T07:00:16+0000,https://www.nytimes.com/2022/08/29/technology/china-semiconductors-technology.html,2022-07-01 to 2022-09-30
Intel,AI/Chip Manufacturing,Decoding the Surprise Inflation Report,A stubbornly high inflation reading has divided experts on what the Fed should do when it weighs another interest rate hike next week.,2022-09-14T11:44:55+0000,https://www.nytimes.com/2022/09/14/business/dealbook/inflation-fed-interest-rate-increase-markets.html,2022-07-01 to 2022-09-30
Intel,AI/Chip Manufacturing,Taking Stock of Pelosi’s Taiwan Trip,More fallout may be ahead for businesses and investors from a visit that tested China’s appetite for confrontation.,2022-08-03T13:09:20+0000,https://www.nytimes.com/2022/08/03/business/dealbook/pelosi-taiwan-business.html,2022-07-01 to 2022-09-30
Intel,AI/Chip Manufacturing,Will China Move on Taiwan?,An escalation from Beijing would have far-reaching economic consequences.,2022-07-26T12:57:50+0000,https://www.nytimes.com/2022/07/26/business/dealbook/chinese-aggression-taiwan.html,2022-07-01 to 2022-09-30
Intel,AI/Chip Manufacturing,A Darkened Outlook for Britain,"The political instability comes as Britain gears up for a difficult summer, amid surging energy prices and labor shortages.",2022-07-06T13:48:07+0000,https://www.nytimes.com/2022/07/06/business/dealbook/uk-britain-economy-boris-johnson.html,2022-07-01 to 2022-09-30
Intel,AI/Chip Manufacturing,The Andy Jassy Way at Amazon,The longtime lieutenant to Jeff Bezos has made more changes than many expected since becoming C.E.O.,2022-07-18T12:28:54+0000,https://www.nytimes.com/2022/07/18/business/dealbook/andy-jassy-amazon.html,2022-07-01 to 2022-09-30
Intel,AI/Chip Manufacturing,Twitter Unloads on Musk,"The company contends that Musk breached his agreement to buy it by not using “reasonable best efforts” to close the deal, and so has no right to bail out.",2022-07-13T12:03:41+0000,https://www.nytimes.com/2022/07/13/business/dealbook/elon-musk-twitter-lawsuit.html,2022-07-01 to 2022-09-30
Intel,AI/Chip Manufacturing,Doing the Math on the Inflation Reduction Act,"The bill involves at least $260 billion in spending over 10 years, with a focus on energy and climate, but it would raise taxes by more than that, a congressional analysis found.",2022-08-02T13:36:04+0000,https://www.nytimes.com/2022/08/02/business/dealbook/inflation-reduction-act-analysis.html,2022-07-01 to 2022-09-30
Intel,AI/Chip Manufacturing,Transcript: Ezra Klein Interviews Felicia Wong,"The September 16, 2022 episode of “The Ezra Klein Show.”",2022-09-16T15:58:06+0000,https://www.nytimes.com/2022/09/16/podcasts/ezra-klein-interviews-felicia-wong.html,2022-07-01 to 2022-09-30
Intel,AI/Chip Manufacturing,Read Los Angeles County’s Trial Brief in the Bryant Case,Los Angeles County presented some of the key points of its defense to Vanessa Bryant’s lawsuit in a trial brief.,2022-08-18T16:08:53+0000,https://www.nytimes.com/interactive/2022/08/18/sports/basketball/nba-vanessa-bryant-trial-brief.html,2022-07-01 to 2022-09-30
Broadcom,AI/Chip Manufacturing,The Semiconductor Problem,The military relies on advanced semiconductors. The U.S. doesn’t make any.,2022-07-14T10:26:16+0000,https://www.nytimes.com/2022/07/14/briefing/semiconductor-bill-congress-biden.html,2022-07-01 to 2022-09-30
Taiwan Semiconductor,AI/Chip Manufacturing,How Silicon Chips Rule the World,"Maintaining the flow of oil is still crucial for the world economy. But now the supply of semiconductors is also critical for commerce, and war and peace.",2022-09-09T09:00:29+0000,https://www.nytimes.com/2022/09/09/business/silicon-markets-china-taiwan.html,2022-07-01 to 2022-09-30
Taiwan Semiconductor,AI/Chip Manufacturing,‘The Eye of the Storm’: Taiwan Is Caught in a Great Game Over Microchips,"Worried about the Chinese threat to Taiwan, the U.S. and others have tried to expand their piece of the island’s semiconductor production.",2022-08-29T07:00:15+0000,https://www.nytimes.com/2022/08/29/technology/taiwan-chips.html,2022-07-01 to 2022-09-30
Taiwan Semiconductor,AI/Chip Manufacturing,Mostly Bluster: Why China Went Easy on Taiwan’s Economy,The economic bans that China imposed on Taiwan for hosting Speaker Nancy Pelosi were not especially painful. Increasing the pressure could hurt China’s own economy.,2022-08-12T09:00:31+0000,https://www.nytimes.com/2022/08/12/business/china-taiwan-economy.html,2022-07-01 to 2022-09-30
Taiwan Semiconductor,AI/Chip Manufacturing,"Japan Once Led the World in Microchips. Now, It’s Racing to Catch Up.","As it reckons with supply chain vulnerabilities, the country is spending billions to revitalize domestic production and seeking to form a coalition with “like-minded” nations.",2022-08-04T09:00:30+0000,https://www.nytimes.com/2022/08/04/business/japan-semiconductors-chips.html,2022-07-01 to 2022-09-30
Taiwan Semiconductor,AI/Chip Manufacturing,Taking Stock of Pelosi’s Taiwan Trip,More fallout may be ahead for businesses and investors from a visit that tested China’s appetite for confrontation.,2022-08-03T13:09:20+0000,https://www.nytimes.com/2022/08/03/business/dealbook/pelosi-taiwan-business.html,2022-07-01 to 2022-09-30
Taiwan Semiconductor,AI/Chip Manufacturing,The U.S. Is Behind in the Competition for the ‘Oil’ of the 21st Century,Semiconductor supremacy isn’t something we can buy. It’s something we must build.,2022-07-25T19:00:11+0000,https://www.nytimes.com/2022/07/25/opinion/america-tech-visas.html,2022-07-01 to 2022-09-30
Taiwan Semiconductor,AI/Chip Manufacturing,The Semiconductor Problem,The military relies on advanced semiconductors. The U.S. doesn’t make any.,2022-07-14T10:26:16+0000,https://www.nytimes.com/2022/07/14/briefing/semiconductor-bill-congress-biden.html,2022-07-01 to 2022-09-30
Taiwan Semiconductor,AI/Chip Manufacturing,Will China Move on Taiwan?,An escalation from Beijing would have far-reaching economic consequences.,2022-07-26T12:57:50+0000,https://www.nytimes.com/2022/07/26/business/dealbook/chinese-aggression-taiwan.html,2022-07-01 to 2022-09-30
Taiwan Semiconductor,AI/Chip Manufacturing,"U.S. Delegation Visits Taiwan for Trade Talks, Risking China’s Ire","Gov. Eric J. Holcomb of Indiana led a group that arrived on the island Sunday, even as visits this month by U.S. officials have angered Beijing.",2022-08-21T15:52:58+0000,https://www.nytimes.com/2022/08/21/world/asia/us-delegation-taiwan-trade.html,2022-07-01 to 2022-09-30
Taiwan Semiconductor,AI/Chip Manufacturing,"As China Vows More Military Exercises, Taiwan Is Undeterred",China’s drills have hardened Taiwan’s understated approach to navigating a big-power rivalry over its political future.,2022-08-11T09:00:30+0000,https://www.nytimes.com/2022/08/11/world/asia/china-taiwan-drills-economy-military.html,2022-07-01 to 2022-09-30
Taiwan Semiconductor,AI/Chip Manufacturing,The Taiwan Connection,How the war in Ukraine could affect the crisis over Taiwan.,2022-08-02T20:33:53+0000,https://www.nytimes.com/2022/08/02/briefing/russia-ukraine-war-taiwan.html,2022-07-01 to 2022-09-30
Taiwan Semiconductor,AI/Chip Manufacturing,U.S. to Begin Formal Trade Talks With Taiwan,"The announcement comes amid tensions with China over the self-governing island, which several American lawmakers recently visited.",2022-08-18T03:13:55+0000,https://www.nytimes.com/2022/08/17/business/economy/us-taiwan-trade-talks.html,2022-07-01 to 2022-09-30
Taiwan Semiconductor,AI/Chip Manufacturing,Why Pelosi’s Taiwan Visit Is Raising U.S.-China Tensions,"Beijing has vigorously protested Ms. Pelosi’s trip, warning of unspecified consequences for the United States.",2022-07-29T11:44:58+0000,https://www.nytimes.com/2022/07/29/world/asia/china-taiwan-pelosi-explained.html,2022-07-01 to 2022-09-30
Taiwan Semiconductor,AI/Chip Manufacturing,"I’m Taiwanese, and I Want to Thank Nancy Pelosi",Taiwan needs more leaders to stand with us against China.,2022-08-05T09:00:18+0000,https://www.nytimes.com/2022/08/05/opinion/taiwan-china-pelosi-democracy.html,2022-07-01 to 2022-09-30
Taiwan Semiconductor,AI/Chip Manufacturing,China Has Leapfrogged the U.S. in Key Technologies. Can a New Law Help?,"While Congress argued over whether and how to support American chip makers and research in other technologies, China was surging ahead.",2022-07-29T00:26:29+0000,https://www.nytimes.com/2022/07/28/us/politics/us-china-semiconductors.html,2022-07-01 to 2022-09-30
Taiwan Semiconductor,AI/Chip Manufacturing,"Pelosi Is Expected to Go to Taiwan, Biden Administration Officials Say",The House speaker arrived in Singapore on Monday. The prospect of a visit by the speaker to Taiwan has jangled nerves in both Beijing and Washington.,2022-07-31T09:27:32+0000,https://www.nytimes.com/2022/07/31/world/asia/pelosi-taiwan-china.html,2022-07-01 to 2022-09-30
Taiwan Semiconductor,AI/Chip Manufacturing,Biden and Xi Conduct Marathon Call During Time of Rising Tensions,"White House officials characterized the call, which lasted two hours and 17 minutes, as a relationship-tending mission.",2022-07-28T17:23:40+0000,https://www.nytimes.com/2022/07/28/us/politics/biden-xi-call-china.html,2022-07-01 to 2022-09-30
Taiwan Semiconductor,AI/Chip Manufacturing,Xi Jinping’s Vision for Tech Self-Reliance in China Runs Into Reality,"After heavy national investment in semiconductors to break a dependence on global chips, Mr. Xi seems unhappy with the results.",2022-08-29T07:00:16+0000,https://www.nytimes.com/2022/08/29/technology/china-semiconductors-technology.html,2022-07-01 to 2022-09-30
Taiwan Semiconductor,AI/Chip Manufacturing,Congress Is Giving Billions to the Chip Industry. Strings Are Attached.,"Industrial policy is back in Washington, as a vast semiconductor and science bill gives the government new sway over a strategic industry.",2022-08-03T09:00:31+0000,https://www.nytimes.com/2022/08/03/business/economy/chip-industry-congress.html,2022-07-01 to 2022-09-30
Taiwan Semiconductor,AI/Chip Manufacturing,Your Tuesday Briefing: China Charges 28 People in Beating of Women,Plus the controversy over seabed mining and the geopolitical drama surrounding Taiwan’s microchips,2022-08-29T21:02:44+0000,https://www.nytimes.com/2022/08/29/briefing/beating-women-china-taiwan.html,2022-07-01 to 2022-09-30
Taiwan Semiconductor,AI/Chip Manufacturing,Biden Administration Releases Plan for $50 Billion Investment in Chips,The Commerce Department issued guidelines for companies angling to receive federal funding aimed at bolstering the domestic semiconductor industry.,2022-09-06T07:00:09+0000,https://www.nytimes.com/2022/09/06/business/economy/biden-tech-chips.html,2022-07-01 to 2022-09-30
Taiwan Semiconductor,AI/Chip Manufacturing,The U.S. Relationship With China Does Not Need to Be So Tense,Tensions over Taiwan underscore the need for the United States to engage more deeply with China on more than just trade.,2022-08-06T15:00:05+0000,https://www.nytimes.com/2022/08/06/opinion/pelosi-taiwan-biden-china-policy.html,2022-07-01 to 2022-09-30
Taiwan Semiconductor,AI/Chip Manufacturing,Taxpayers for U.S. Chips,What a $280 billion law signed by President Biden this week might mean for Americans.,2022-08-10T17:42:07+0000,https://www.nytimes.com/2022/08/10/technology/us-computer-chips.html,2022-07-01 to 2022-09-30
Taiwan Semiconductor,AI/Chip Manufacturing,Major Covid Holdouts in Asia Drop Border Restrictions,"Hong Kong, Taiwan and Japan have relaxed their pandemic rules, as they look to bolster their economies and play catch-up with much of the world.",2022-09-23T05:31:45+0000,https://www.nytimes.com/2022/09/23/world/asia/asia-travel-reopening-japan-taiwan-hong-kong.html,2022-07-01 to 2022-09-30
Taiwan Semiconductor,AI/Chip Manufacturing,Classic Internet Censorship,New regulations in Indonesia show that strict online controls are no longer confined to autocratic countries like China.,2022-08-01T04:24:48+0000,https://www.nytimes.com/2022/08/01/briefing/zelensky-donbas-ukraine-evacuation-prison.html,2022-07-01 to 2022-09-30
Taiwan Semiconductor,AI/Chip Manufacturing,China’s Domestic Troubles Will Hang Over Biden-Xi Call,Some American officials suspect that what is really driving China’s president to lash out recently is a desire to divert attention from his economic and pandemic problems at home.,2022-07-28T01:05:58+0000,https://www.nytimes.com/2022/07/27/us/politics/biden-jinping-china-taiwan.html,2022-07-01 to 2022-09-30
Taiwan Semiconductor,AI/Chip Manufacturing,"The U.S. Touts Big Investments for Mexico, Testing Its Nationalist Policies",U.S. officials are looking south for a strategic partner to create a regional manufacturing hub that can rival China. But there are still doubts over Mexico’s willingness to cater to foreign industry.,2022-09-13T17:52:36+0000,https://www.nytimes.com/2022/09/13/world/americas/us-mexico-investments-biden.html,2022-07-01 to 2022-09-30
Taiwan Semiconductor,AI/Chip Manufacturing,"Far From Routine, Asia Trip Presents Thorny Tests for Kamala Harris",A visit for Shinzo Abe’s controversial state funeral also includes outreach to Asian allies over military advances by North Korea and China.,2022-09-28T08:01:34+0000,https://www.nytimes.com/2022/09/28/world/asia/kamala-harris-asia.html,2022-07-01 to 2022-09-30
