company,sector,headline,snippet,pub_date,url,quarter
Amazon,Technology,Google Cuts Hundreds of Jobs in Engineering and Other Divisions,"The company, which has been working to trim expenses, laid off employees who worked on core engineering, the Google Assistant product and hardware such as the Pixel phone.",2024-01-11T05:06:59+0000,https://www.nytimes.com/2024/01/11/technology/google-layoffs.html,2024-01-01 to 2024-03-31
Amazon,Technology,Nvidia Says Growth Will Continue as A.I. Hits ‘Tipping Point’,"The A.I. chip maker’s revenue more than tripled, and profits rose ninefold. It also projected that its revenue would more than triple again.",2024-02-21T22:04:16+0000,https://www.nytimes.com/2024/02/21/technology/nvidia-earnings.html,2024-01-01 to 2024-03-31
Amazon,Technology,Remembering Toby Keith and His Complexities,"A conversation about his loudest (and quieter) moments, and how patriotism has played into country music.",2024-02-27T23:32:45+0000,https://www.nytimes.com/2024/02/27/arts/music/popcast-toby-keith.html,2024-01-01 to 2024-03-31
Amazon,Technology,Popcast (Deluxe): What’s an Industry Plant Anyway? Plus: Ariana Grande,"Discussing the quick ascent of the downtempo R&B singer 4batz, the new Ariana Grande album, “eternal sunshine,” music at the Oscars and more.",2024-03-14T18:48:02+0000,https://www.nytimes.com/2024/03/14/arts/music/popcast-deluxe-industry-plant-4batz-ariana-grande.html,2024-01-01 to 2024-03-31
Amazon,Technology,"Popcast (Deluxe): Playboi Carti, Waxahatchee and 12 More to Watch",A breakdown of new albums and songs for 2024 (and a handful of possible but dubious releases).,2024-01-24T23:24:35+0000,https://www.nytimes.com/2024/01/24/arts/music/popcast-deluxe-playboi-carti-artists-to-watch.html,2024-01-01 to 2024-03-31
Amazon,Technology,Popcast (Deluxe): Pop Stars vs. the Attention Economy,"Jennifer Lopez’s new film and album, “This Is Me … Now,” plus other messy rollouts for pop stars including Dua Lipa, Justin Timberlake and Camila Cabello.",2024-02-22T15:01:09+0000,https://www.nytimes.com/2024/02/22/arts/music/popcast-deluxe-pop-stars-vs-the-attention-economy.html,2024-01-01 to 2024-03-31
Amazon,Technology,What Did We Learn From a Year in Live Shows?,"Concerts paused during the height of the pandemic, and returned at full power in 2023. Our pop music editor saw a lot of them.",2024-01-10T20:36:55+0000,https://www.nytimes.com/2024/01/10/arts/music/popcast-live-shows-2023.html,2024-01-01 to 2024-03-31
Amazon,Technology,Rivian Will Delay Construction of a $5 Billion Factory in Georgia,"The money-losing electric vehicle company, which makes vans, trucks and S.U.V.s, is trying to preserve cash as it works to produce and sell more affordable vehicles.",2024-03-07T22:15:45+0000,https://www.nytimes.com/2024/03/07/business/economy/rivian-georgia-factory.html,2024-01-01 to 2024-03-31
Amazon,Technology,"SZA’s Intergalactic Escape, and 8 More New Songs","Hear tracks by Rhiannon Giddens, Norah Jones, Les Amazones d’Afrique and others.",2024-02-23T17:34:15+0000,https://www.nytimes.com/2024/02/23/arts/music/playlist-sza-norah-jones-ag-cook.html,2024-01-01 to 2024-03-31
Amazon,Technology,What Sports Fans Need to Know About a New Streaming Service,"The joint venture announced by Disney, Fox and Warner Bros. Discovery will offer a lot, but it may not be enough on its own for serious fans.",2024-02-07T10:56:05+0000,https://www.nytimes.com/2024/02/07/business/sports-streaming-service-disney-fox-warner.html,2024-01-01 to 2024-03-31
Amazon,Technology,A Huge Win for Activists Puts Climate on the 2024 Agenda,The Biden administration will examine how a natural gas mega-project will impact the climate.,2024-01-25T18:49:32+0000,https://www.nytimes.com/2024/01/25/climate/a-huge-win-for-activists-puts-climate-on-the-2024-agenda.html,2024-01-01 to 2024-03-31
Amazon,Technology,"E.U. Takes Aim at Alphabet, Apple and Meta in Wide-Ranging Investigations",The inquiries signal the bloc’s intention to tightly enforce sweeping new competition rules that took effect this month.,2024-03-25T11:44:47+0000,https://www.nytimes.com/2024/03/25/business/apple-facebook-google-eu-investigation.html,2024-01-01 to 2024-03-31
Amazon,Technology,How Usher Arrived at the Super Bowl Halftime Show,"A conversation about his long career path through several generations of R&B, and what he might do on such a big stage.",2024-02-08T15:17:59+0000,https://www.nytimes.com/2024/02/08/arts/music/popcast-usher-super-bowl.html,2024-01-01 to 2024-03-31
Amazon,Technology,"Popcast (Deluxe): Lil Nas X, Ariana Grande and 21 Savage Kick Off 2024","Pop’s premier troll returns while one of its biggest voices turns her attention to gossip, and the first blockbuster rap album of the year arrives.",2024-01-17T20:31:36+0000,https://www.nytimes.com/2024/01/17/arts/music/popcast-deluxe-lil-nas-x-ariana-grande-21-savage.html,2024-01-01 to 2024-03-31
Amazon,Technology,Thursday Briefing: Indonesia’s New Leader,"Also, a coalition forms in Pakistan and motorbikes pile high in Vietnam.",2024-02-14T20:50:55+0000,https://www.nytimes.com/2024/02/14/world/asia/indonesia-vote-pakistan-coalition-asia.html,2024-01-01 to 2024-03-31
Amazon,Technology,"Popcast (Deluxe): ‘Saltburn,’ Jacob Elordi and the New Heartthrob Era","Plus: Barry Keoghan’s “Murder on the Dancefloor,” Jeremy Allen White’s stripped-down moment and Nathan Fielder’s “The Curse” wraps up.",2024-01-11T21:40:25+0000,https://www.nytimes.com/2024/01/11/arts/music/popcast-deluxe-saltburn-jacob-elordi.html,2024-01-01 to 2024-03-31
Amazon,Technology,"Tate McRae, Dua Lipa and the Fight to Be ‘Main Pop Girl’","A conversation about a title that emerged from stan communities, and how it’s played a role in pop singers’ careers.",2024-03-13T19:12:33+0000,https://www.nytimes.com/2024/03/13/arts/music/popcast-main-pop-girl.html,2024-01-01 to 2024-03-31
Amazon,Technology,"The Best of Late Night, at the Movies and Beyond","The new horror-thriller “Late Night With the Devil” isn’t the only time late-night hosts, shows and sets become fodder for on-screen moments in film and TV.",2024-03-26T15:02:26+0000,https://www.nytimes.com/2024/03/26/movies/late-night-tv-movies.html,2024-01-01 to 2024-03-31
Amazon,Technology,Google DeepMind C.E.O. Demis Hassabis on the Path From Chatbots to A.G.I.,The mind behind DeepMind.,2024-02-23T10:04:31+0000,https://www.nytimes.com/2024/02/23/podcasts/google-deepmind-demis-hassabis.html,2024-01-01 to 2024-03-31
Amazon,Technology,"Pitchfork, the Early Years","With the music website’s future uncertain, Ryan Schreiber and Chris Kaskie look back at its start.",2024-01-24T13:49:00+0000,https://www.nytimes.com/2024/01/24/arts/music/popcast-pitchfork.html,2024-01-01 to 2024-03-31
Amazon,Technology,"Pitchfork, the Early Years","With the music website’s future uncertain, Ryan Schreiber and Chris Kaskie look back at its start.",2024-01-24T13:49:00+0000,https://www.nytimes.com/2024/01/24/arts/music/popcast-pitchfork.html,2024-01-01 to 2024-03-31
Amazon,Technology,Covering the Rise of Tracy Chapman,"In 1988, “Fast Car” turned the singer-songwriter into a star. She was skeptical of the spotlight, and learning to wield her power.",2024-02-21T20:26:37+0000,https://www.nytimes.com/2024/02/21/arts/music/popcast-tracy-chapman.html,2024-01-01 to 2024-03-31
Amazon,Technology,Lil Jon: The Popcast (Deluxe) Interview,"An in-depth interview with the Atlanta hip-hop and EDM legend, tracing his path through punk, skateboarding and crunk music on the way to this year’s Super Bowl.",2024-03-27T21:59:36+0000,https://www.nytimes.com/2024/03/27/arts/music/lil-jon-popcast-deluxe-interview.html,2024-01-01 to 2024-03-31
Amazon,Technology,Super Bowl Broadcast Is a Crossroads for CBS Sports,"The storied network is facing a wave of change, including new leadership, the possible sale of its parent company and the continued challenge of streaming.",2024-02-09T10:03:31+0000,https://www.nytimes.com/2024/02/09/business/media/super-bowl-cbs-sports.html,2024-01-01 to 2024-03-31
Amazon,Technology,Three Great Documentaries to Stream,"Economic exploitation, climate change, entrenched corruption: These acclaimed films find fascination in catastrophe.",2024-01-30T17:48:13+0000,https://www.nytimes.com/2024/01/30/movies/documentaries-streaming.html,2024-01-01 to 2024-03-31
Amazon,Technology,girl in red: The Popcast (Deluxe) Interview,"An interview with the Norwegian singer girl in red (Marie Ulven) about her second album, “I’m Doing It Again Baby!,” opening for Taylor Swift and more.",2024-03-06T17:45:28+0000,https://www.nytimes.com/2024/03/06/arts/music/girl-in-red-interview-popcast-deluxe.html,2024-01-01 to 2024-03-31
Amazon,Technology,"2024 Grammys, Dissected: Taylor, Miley, SZA, Tracy, Joni and More",Was this the year the awards got it correct?,2024-02-07T00:41:47+0000,https://www.nytimes.com/2024/02/06/arts/music/popcast-2024-grammys.html,2024-01-01 to 2024-03-31
Amazon,Technology,What Do You Do if You Hate Both Biden and Trump?,It’s the election of our discontent.,2024-03-15T09:03:03+0000,https://www.nytimes.com/2024/03/15/opinion/uncommitted-voters-biden-trump.html,2024-01-01 to 2024-03-31
Amazon,Technology,"The A.I. Election, Bitcoin’s Wall Street Debut and TikTok’s Doodad Era",“Two truly terrible ways to make money this week.”,2024-01-19T10:02:26+0000,https://www.nytimes.com/2024/01/19/podcasts/ai-elections-bitcoin-tiktok.html,2024-01-01 to 2024-03-31
Amazon,Technology,The Justin Timberlake Conundrum,"His sixth solo album, “Everything I Thought It Was,” has been met with critical dismissal and weaker sales. Where can the onetime pop superstar turn next?",2024-03-26T20:22:54+0000,https://www.nytimes.com/2024/03/26/arts/music/popcast-justin-timberlake.html,2024-01-01 to 2024-03-31
JPMorgan Chase,Finance/Banking,JPMorgan Fined $348 Million for Lapses in Trade Monitoring,"Regulators, which rely on the bank for information that helps prevent insider trading and market manipulation, said customer data from around 30 platforms was missing.",2024-03-14T19:52:00+0000,https://www.nytimes.com/2024/03/14/business/jpmorgan-fine-trading-lapses.html,2024-01-01 to 2024-03-31
JPMorgan Chase,Finance/Banking,"One Year After Bank Crisis, a Struggle Over What Needs to Change",Silicon Valley Bank’s collapse last March set the stage for a clash between bankers and their regulators.,2024-03-10T09:00:55+0000,https://www.nytimes.com/2024/03/10/business/silicon-valley-bank-one-year-regulations.html,2024-01-01 to 2024-03-31
JPMorgan Chase,Finance/Banking,Can Redditors Revive the I.P.O. Market?,"The market for new listings has been rough for investors, but the social media company believes it has a secret weapon in its prospectus: its users.",2024-02-23T13:07:09+0000,https://www.nytimes.com/2024/02/23/business/dealbook/reddit-redditors-ipo.html,2024-01-01 to 2024-03-31
JPMorgan Chase,Finance/Banking,More Wall Street Firms Are Flip-Flopping on Climate. Here’s Why.,Financial giants were already trimming their climate pledges amid Republican attacks. Then came concerns about legal risks.,2024-02-19T10:05:40+0000,https://www.nytimes.com/2024/02/19/business/climate-blackrock-state-street-jpmorgan-pimco.html,2024-01-01 to 2024-03-31
JPMorgan Chase,Finance/Banking,Wall Street’s Climate Retreat,"BlackRock, JPMorgan Chase and State Street are quitting or scaling back their ties to an influential global investment coalition.",2024-02-16T12:50:58+0000,https://www.nytimes.com/2024/02/16/business/dealbook/wall-streets-climate-retreat.html,2024-01-01 to 2024-03-31
JPMorgan Chase,Finance/Banking,Jamie Dimon Reshuffles Management Team at JPMorgan Chase,"Many consider the moves a sign of a succession plan at the nation’s largest bank, although the stalwart Mr. Dimon has signaled he is not going anywhere.",2024-01-26T13:58:49+0000,https://www.nytimes.com/2024/01/26/business/jamie-dimon-jpmorgan-reshuffle.html,2024-01-01 to 2024-03-31
JPMorgan Chase,Finance/Banking,Epstein’s Longtime Accountant Sheds Light on Disgraced Financier’s Businesses,"In unreleased testimony, Richard Kahn said that he had not been aware that Jeffrey Epstein was abusing women, and that none had asked for his help.",2024-02-01T19:29:44+0000,https://www.nytimes.com/2024/02/01/business/jeffrey-epstein-accountant-testimony.html,2024-01-01 to 2024-03-31
JPMorgan Chase,Finance/Banking,A Consensus Emerges at Davos: Trump Will Win Re-Election,"In private, many business and political leaders at the World Economic Forum say they expect Donald Trump to return to the White House.",2024-01-19T13:11:26+0000,https://www.nytimes.com/2024/01/19/business/dealbook/davos-trump-biden-election.html,2024-01-01 to 2024-03-31
JPMorgan Chase,Finance/Banking,"Biggest U.S. Banks Earn Billions, Even After Insurance Bill","JPMorgan Chase, Bank of America and Wells Fargo reported healthy quarterly profits. Citigroup said its ongoing restructuring would result in about 20,000 job cuts.",2024-01-12T14:22:42+0000,https://www.nytimes.com/2024/01/12/business/citibank-morgan-stanley-bank-america-wells-fargo.html,2024-01-01 to 2024-03-31
JPMorgan Chase,Finance/Banking,India Is Chasing China’s Economy. But Something Is Holding It Back.,"Long-term investment in India by businesses is stagnant, and foreign money is falling, even as the government is driving growth with infrastructure spending.",2024-01-02T05:01:27+0000,https://www.nytimes.com/2024/01/02/business/india-economy-foreign-direct-investment.html,2024-01-01 to 2024-03-31
JPMorgan Chase,Finance/Banking,These Seven Tech Stocks Are Driving the Market,See how a handful of stocks have had an outsize impact on the performance of the S&P 500,2024-01-22T10:00:20+0000,https://www.nytimes.com/interactive/2024/01/22/business/magnificent-seven-stocks-tech.html,2024-01-01 to 2024-03-31
JPMorgan Chase,Finance/Banking,Two of Epstein’s Closest Advisers Are Sued by His Victims,Jeffrey Epstein’s longtime accountant and his personal lawyer were accused of enabling the disgraced financier’s sex trafficking.,2024-02-16T23:24:06+0000,https://www.nytimes.com/2024/02/16/business/epstein-advisers-lawsuit.html,2024-01-01 to 2024-03-31
JPMorgan Chase,Finance/Banking,Bank of America Pledged to Stop Financing Coal. Now It’s Backtracking.,The changes come as Republican lawmakers step up efforts to punish businesses that consider climate change and the environment in their operations.,2024-02-03T10:03:52+0000,https://www.nytimes.com/2024/02/03/climate/bank-of-america-esg.html,2024-01-01 to 2024-03-31
JPMorgan Chase,Finance/Banking,Goldman Sachs Sticks the Landing at End of Tumultuous Year,"The Wall Street bank earned $2 billion in the fourth quarter, beating expectations, after a period marked by management missteps.",2024-01-16T13:38:33+0000,https://www.nytimes.com/2024/01/16/business/goldman-sachs-profit.html,2024-01-01 to 2024-03-31
JPMorgan Chase,Finance/Banking,"The New York Times News Quiz, March 22, 2024",Did you follow the news this week? Take our quiz to see how well you stack up with other Times readers.,2024-03-22T09:06:40+0000,https://www.nytimes.com/interactive/2024/03/22/briefing/news-quiz-trump-biden-texas.html,2024-01-01 to 2024-03-31
JPMorgan Chase,Finance/Banking,New York Community Bank Reports $2.4 Billion More in Losses as C.E.O. Resigns,"The lender said its earnings were far weaker than it had earlier stated, and it disclosed the discovery of “material weaknesses” in its internal controls.",2024-03-01T00:54:58+0000,https://www.nytimes.com/2024/02/29/business/nycb-losses-ceo.html,2024-01-01 to 2024-03-31
JPMorgan Chase,Finance/Banking,"Weekly Student News Quiz: U.S. Airstrikes, Extreme Cold, 'Mean Girls'",Have you been paying attention to the news recently? See how many of these 10 questions you can get right.,2024-01-23T13:11:36+0000,https://www.nytimes.com/interactive/2024/01/23/learning/23StudentNewsQuiz.html,2024-01-01 to 2024-03-31
JPMorgan Chase,Finance/Banking,"Generative A.I.’s Biggest Impact Will Be in Banking and Tech, Report Says","For some companies, the new technology is an opportunity to enhance productivity and profit. Will their workers benefit as well?",2024-02-01T10:02:36+0000,https://www.nytimes.com/2024/02/01/business/ai-impact-jobs.html,2024-01-01 to 2024-03-31
JPMorgan Chase,Finance/Banking,Big Dreams Come Back to Bite New York Community Bank,Acquiring billions of dollars in assets from Signature Bank when it went under last year contributed to the Long Island lender’s troubles.,2024-02-08T10:03:20+0000,https://www.nytimes.com/2024/02/08/business/new-york-community-bank-troubles.html,2024-01-01 to 2024-03-31
JPMorgan Chase,Finance/Banking,"Unsealed Documents Shed Light on Epstein’s Misdeeds, and Little Else","The court documents include unredacted names of the disgraced financier and sex-offender’s associates, most of which had been widely publicized already.",2024-01-04T00:13:40+0000,https://www.nytimes.com/2024/01/03/nyregion/jeffrey-epstein-court-documents.html,2024-01-01 to 2024-03-31
JPMorgan Chase,Finance/Banking,What to Know About Capital One’s Proposed Acquisition of Discover,"Before two of the largest credit card companies in the United States can complete a $35 billion deal, they’ll face an uphill battle with regulators.",2024-02-20T20:46:00+0000,https://www.nytimes.com/2024/02/20/business/capital-one-discover-what-to-know.html,2024-01-01 to 2024-03-31
JPMorgan Chase,Finance/Banking,Investors Bail on Boeing Following Max 9 Grounding,The jet maker’s share price fell sharply in premarket trading on Monday after hundreds of flights were canceled and safety inspections resumed.,2024-01-08T12:50:25+0000,https://www.nytimes.com/2024/01/08/business/dealbook/boeing-stock-max-9-grounding.html,2024-01-01 to 2024-03-31
JPMorgan Chase,Finance/Banking,"The Big Buzz at Davos: A.I., Ukraine, China, and the Middle East","C.E.O.s and world leaders gather in the Swiss Alps this year as war, trade risks and disruptive new technologies loom large.",2024-01-16T13:27:34+0000,https://www.nytimes.com/2024/01/16/business/dealbook/buzz-davos-ai-ukraine-china-gaza.html,2024-01-01 to 2024-03-31
JPMorgan Chase,Finance/Banking,"After Divorcing, They Turned to Each Other. Again.","After Pamela Dillon and Stephen Dillon split in 2008, they became business partners. Over a decade later, they realized they were still in love.",2024-01-26T05:00:33+0000,https://www.nytimes.com/2024/01/26/style/pamela-dillon-stephen-dillon-wedding.html,2024-01-01 to 2024-03-31
JPMorgan Chase,Finance/Banking,A Famed Analyst’s Final Forecast Is the Fall of the U.S. Economy,"Dick Bove, the ubiquitous banking expert, is going out swinging after more than half a century in the business.",2024-01-27T10:01:02+0000,https://www.nytimes.com/2024/01/27/business/dick-bove-retirement.html,2024-01-01 to 2024-03-31
JPMorgan Chase,Finance/Banking,"Ron DeSantis, Nikki Haley and Politically Obtuse Plutocrats",The big money still doesn’t understand today’s G.O.P.,2024-01-05T00:00:07+0000,https://www.nytimes.com/2024/01/04/opinion/nikki-haley-ron-desantis.html,2024-01-01 to 2024-03-31
JPMorgan Chase,Finance/Banking,Why One Shaky Bank Is Stirring Fears of a Wider Financial Mess,New York Community Bancorp’s plunging stock price highlights risks that loom over lenders large and small.,2024-02-06T16:05:00+0000,https://www.nytimes.com/2024/02/06/business/banks-real-estate-fears.html,2024-01-01 to 2024-03-31
JPMorgan Chase,Finance/Banking,Investors Pour Money Into Wall St. as Stocks Set New Highs,The influx of cash reflects optimism about the economy and company earnings despite high interest rates and stubborn inflation.,2024-03-22T13:31:53+0000,https://www.nytimes.com/2024/03/22/business/stock-market-rally.html,2024-01-01 to 2024-03-31
JPMorgan Chase,Finance/Banking,Why New York’s Plan to Give Migrants Debit Cards Came Under Fire,A pilot program in New York City to give migrant families debit cards to buy food became an easy target for right-wing critics. Here’s a quick explainer.,2024-02-23T17:23:04+0000,https://www.nytimes.com/2024/02/23/nyregion/migrants-debit-cards-adams.html,2024-01-01 to 2024-03-31
JPMorgan Chase,Finance/Banking,Microsoft Tops Apple to Become Most Valuable Public Company,The shift is indicative of the importance of new artificial intelligence technology to Silicon Valley and Wall Street investors.,2024-01-12T21:47:56+0000,https://www.nytimes.com/2024/01/12/technology/microsoft-apple-most-valuable-company.html,2024-01-01 to 2024-03-31
JPMorgan Chase,Finance/Banking,The F.T.C. Boosts Biden’s Fight Against Inflation,The regulator’s move to block Kroger’s $25 billion bid for Albertsons could win the president points with voters squeezed by rising prices.,2024-02-27T13:04:00+0000,https://www.nytimes.com/2024/02/27/business/dealbook/biden-inflation-kroger-albertsons.html,2024-01-01 to 2024-03-31
JPMorgan Chase,Finance/Banking,Bank Runs Spooked Regulators. Now a Clampdown Is Coming.,Federal Reserve officials and other bank regulators could roll out a new proposal this spring to ward off a repeat of 2023’s banking turmoil.,2024-03-05T10:04:02+0000,https://www.nytimes.com/2024/03/05/business/economy/silicon-valley-bank-federal-reserve.html,2024-01-01 to 2024-03-31
JPMorgan Chase,Finance/Banking,What We’re Watching in 2024,"From elections and A.I. to antitrust and shadow banking, here are the big themes that could define the worlds of business and policy.",2024-01-02T12:31:56+0000,https://www.nytimes.com/2024/01/02/business/dealbook/ai-antitrust-elections-watching-2024.html,2024-01-01 to 2024-03-31
JPMorgan Chase,Finance/Banking,‘Zombie Offices’ Spell Trouble for Some Banks,Bank tremors serve as a reminder: Just because a crisis hasn’t hit immediately doesn’t mean commercial real estate pain isn’t coming.,2024-02-08T17:06:02+0000,https://www.nytimes.com/2024/02/08/business/economy/commercial-real-estate-banking-industry.html,2024-01-01 to 2024-03-31
JPMorgan Chase,Finance/Banking,Jay Powell Signals a Retreat on Banking Rules,The Fed chair said regulators could scale back or rework a sweeping capital-requirements proposal that Wall Street has been fighting for months.,2024-03-07T13:06:41+0000,https://www.nytimes.com/2024/03/07/business/dealbook/fed-powell-banks-capital-rules.html,2024-01-01 to 2024-03-31
JPMorgan Chase,Finance/Banking,It’s Time to Protest Nuclear War Again,A new series from Times Opinion about the threat of nuclear weapons in an unstable world.,2024-03-04T10:01:53+0000,https://www.nytimes.com/interactive/2024/10/10/opinion/nuclear-weapons-nytimes.html,2024-01-01 to 2024-03-31
JPMorgan Chase,Finance/Banking,How Houthi Attacks Have Upended Global Shipping,"Hundreds of ships are avoiding the Red Sea and sailing an extra 4,000 miles around Africa because of the Houthi attacks, and it comes at considerable economic cost.",2024-01-21T03:08:43+0000,https://www.nytimes.com/interactive/2024/01/20/world/middleeast/houthi-red-sea-shipping.html,2024-01-01 to 2024-03-31
JPMorgan Chase,Finance/Banking,On the Ground of Biden’s Antitrust Agenda,"Doha Mekki, one of President Biden’s key antitrust enforcers, talks about the Justice Department’s big wins and losses, and what could be in store if President Biden gets another four years.",2024-02-17T13:00:04+0000,https://www.nytimes.com/2024/02/17/business/dealbook/doha-mekki-biden-antitrust.html,2024-01-01 to 2024-03-31
JPMorgan Chase,Finance/Banking,The Fight Over D.E.I. in the C-suite,"Claudine Gay’s resignation as Harvard president is adding to the wider debate in boardrooms over diversity, equity and inclusion policies.",2024-01-04T13:06:28+0000,https://www.nytimes.com/2024/01/04/business/dealbook/claudine-gay-dei-esg.html,2024-01-01 to 2024-03-31
JPMorgan Chase,Finance/Banking,Unpacking the Washington Math for a Big Payment Deal,"Regulators have been tough on big financial mergers, though there are nuances in Capital One’s $35.3 billion takeover bid for Discover.",2024-02-20T13:05:29+0000,https://www.nytimes.com/2024/02/20/business/dealbook/regulators-capital-one-discover.html,2024-01-01 to 2024-03-31
JPMorgan Chase,Finance/Banking,Technology Companies Are Cutting Jobs and Wall Street Likes It,The sector is laying off workers after a hiring boom during the pandemic and their share prices are soaring.,2024-01-30T13:24:06+0000,https://www.nytimes.com/2024/01/30/business/dealbook/tech-layoffs.html,2024-01-01 to 2024-03-31
JPMorgan Chase,Finance/Banking,G.O.P. Donors Face a Dilemma as Another Trump Rival Falls,"Ron DeSantis’s exit, and Nikki Haley’s struggle to make headway against Donald Trump, are forcing Republicans to make a tough choice.",2024-01-22T12:46:57+0000,https://www.nytimes.com/2024/01/22/business/dealbook/donors-trump-desantis-haley.html,2024-01-01 to 2024-03-31
JPMorgan Chase,Finance/Banking,Bitcoin Heads to Wall Street. Now What?,"A new kind of exchange-traded fund linked to the cryptocurrency could begin trading as soon as Thursday, and the investment world is buzzing.",2024-01-11T12:57:24+0000,https://www.nytimes.com/2024/01/11/business/dealbook/bitcoin-etf-wall-street-crypto-investing.html,2024-01-01 to 2024-03-31
JPMorgan Chase,Finance/Banking,The F.T.C. Takes on A.I. Deals,The agency is concerned that transactions including Microsoft’s $13 billion investment in OpenAI could hinder competition and innovation.,2024-01-26T12:48:49+0000,https://www.nytimes.com/2024/01/26/business/dealbook/ftc-ai-deals-microsoft-openai.html,2024-01-01 to 2024-03-31
JPMorgan Chase,Finance/Banking,Is Microsoft Building an Unassailable Lead in A.I.?,"Hiring Mustafa Suleyman, the DeepMind co-founder, is a coup for the tech giant’s ambitions. But regulators may be skeptical.",2024-03-20T12:24:03+0000,https://www.nytimes.com/2024/03/20/business/dealbook/microsoft-suleyman-ai-inflection.html,2024-01-01 to 2024-03-31
