company,sector,headline,snippet,pub_date,url,quarter
Apple Inc,Technology,How the Frightful Five Put Start-Ups in a Lose-Lose Situation,"In Silicon Valley, small companies used to unseat big ones. Now the clutches of the five biggest tech companies are hard to escape.",2017-10-18T09:00:24+0000,https://www.nytimes.com/2017/10/18/technology/frightful-five-start-ups.html,2017-10-01 to 2017-12-31
Apple Inc,Technology,Google’s Pixel 2 Smartphone Is a Powerful Extravagance,"Google’s new Pixel 2 phone is clearly impressive, according to our reviewer. But whether that makes the device worth buying is another matter.",2017-10-17T13:00:26+0000,https://www.nytimes.com/2017/10/17/technology/personaltech/googles-pixel-2-smartphone-is-a-powerful-extravagance.html,2017-10-01 to 2017-12-31
Apple Inc,Technology,Tech’s Troubling New Trend: Diversity Is in Your Head,"If the goal can be achieved by hiring a group of 12 white male employees, you can guess who will remain left out.",2017-10-16T23:10:51+0000,https://www.nytimes.com/2017/10/16/opinion/diversity-tech-women-silicon-valley.html,2017-10-01 to 2017-12-31
Apple Inc,Technology,Leaping Into a System Upgrade,"Even if you’ve skipped the past few Mac operating system updates, you can go right to macOS High Sierra if your computer meets the requirements.",2017-10-16T13:26:22+0000,https://www.nytimes.com/2017/10/16/technology/personaltech/macos-high-sierra-upgrade.html,2017-10-01 to 2017-12-31
Apple Inc,Technology,U.S. and Europe May Collide on Taxing Apple and Amazon,Other countries have their eyes on the money that lawmakers want to put on American tax rolls. But a European crackdown could work in Washington’s favor.,2017-10-13T09:00:22+0000,https://www.nytimes.com/2017/10/13/business/economy/corporate-tax.html,2017-10-01 to 2017-12-31
Apple Inc,Technology,Have a Group Chat on an iPad,"Apple’s FaceTime software doesn’t yet support more than one-to-one video calls, but other compatible apps let you chat with a several people at once.",2017-10-12T13:28:51+0000,https://www.nytimes.com/2017/10/12/technology/personaltech/ipad-facetime-google-hangouts.html,2017-10-01 to 2017-12-31
Apple Inc,Technology,"Tech Giants, Once Seen as Saviors, Are Now Viewed as Threats",American tech companies positioned themselves as entities that brought positive change by connecting people and spreading information. Perceptions are shifting.,2017-10-12T21:42:33+0000,https://www.nytimes.com/2017/10/12/technology/tech-giants-threats.html,2017-10-01 to 2017-12-31
Apple Inc,Technology,"Google Buying Apple? Sorry, That Was Just a Test",A far-fetched headline and short story that were part of a technology test mistakenly went out on the Dow Jones Newswire on Tuesday morning.,2017-10-10T22:38:06+0000,https://www.nytimes.com/2017/10/10/business/media/dow-jones-google-apple.html,2017-10-01 to 2017-12-31
Apple Inc,Technology,Apple Joins Forces With Steven Spielberg’s Amblin Television,The tech giant begins spending the $1 billion it has set aside for new programming with a reboot of the 1980s NBC show “Amazing Stories.”,2017-10-10T20:51:16+0000,https://www.nytimes.com/2017/10/10/business/media/apple-spielberg-amblin.html,2017-10-01 to 2017-12-31
Apple Inc,Technology,The Frightful Five Want to Rule Entertainment. They Are Hitting Limits.,"Apple, Google and other tech giants are pushing deeper into cultural industries — and stumbling in ways that suggest a certain cluelessness.",2017-10-11T09:05:50+0000,https://www.nytimes.com/2017/10/11/technology/the-frightful-five-want-to-rule-entertainment-they-are-hitting-limits.html,2017-10-01 to 2017-12-31
Apple Inc,Technology,Spotting Those MacBook Battery Burners,"Some programs use more of your portable power than others, but there are quick ways to tell which apps are the energy hogs.",2017-10-10T13:41:01+0000,https://www.nytimes.com/2017/10/10/technology/personaltech/macbook-battery-burners.html,2017-10-01 to 2017-12-31
Apple Inc,Technology,M.L.B. Says Apple Watch in Diamondbacks’ Dugout Was Not Used to Cheat,"M.L.B. fined the team and Ariel Prieto, the coach who wore the watch, an undisclosed amount for violating rules on electronic devices, but said an investigation showed that the incident was a mistake.",2017-10-06T23:10:26+0000,https://www.nytimes.com/2017/10/06/sports/baseball/diamondbacks-coach-watch-dugout.html,2017-10-01 to 2017-12-31
Apple Inc,Technology,"Apple’s New Emojis: Dinosaurs, Dumplings and ‘ILY’",The latest update includes hundreds of pictograms that continue the iPhone maker’s push for diverse and inclusive images.,2017-10-06T12:33:42+0000,https://www.nytimes.com/2017/10/06/technology/new-emojis-apple.html,2017-10-01 to 2017-12-31
Apple Inc,Technology,Upgrading to a Modern Mac,"If it has been quite a while since you bought new hardware and software, make sure you can open files in ancient formats on your new computer.",2017-10-05T13:53:42+0000,https://www.nytimes.com/2017/10/05/technology/personaltech/upgrading-to-a-modern-mac.html,2017-10-01 to 2017-12-31
Apple Inc,Technology,"E.U., Citing Amazon and Apple, Tells Nations to Collect Tax","The European Commission said it would take Ireland to court for not clawing back billions from Apple, and ordered Luxembourg to recover around $293 million from Amazon.",2017-10-04T09:48:46+0000,https://www.nytimes.com/2017/10/04/business/eu-tax-amazon-apple.html,2017-10-01 to 2017-12-31
Apple Inc,Technology,Keeping Your Reading List in Sync,Microsoft Edge can keep the web pages and e-books you’ve saved up to date on your other Windows 10 devices.,2017-10-04T14:00:55+0000,https://www.nytimes.com/2017/10/04/technology/personaltech/keeping-your-reading-list-in-sync.html,2017-10-01 to 2017-12-31
Apple Inc,Technology,Using the New iPad Apps Dock,Apple’s iOS 11 update for the iPad brings new ways to quickly jump to your favorite apps and other tablet controls.,2017-10-03T13:33:28+0000,https://www.nytimes.com/2017/10/03/technology/personaltech/using-the-new-ipad-apps-dock.html,2017-10-01 to 2017-12-31
Apple Inc,Technology,"When Picking Apples on a Farm With 5,000 Rules, Watch Out for the Ladders",Produce growers represent a textbook example of what businesses describe as regulatory fatigue. President Trump is tapping into the discontent.,2017-12-27T10:00:44+0000,https://www.nytimes.com/2017/12/27/business/picking-apples-on-a-farm-with-5000-rules-watch-out-for-the-ladders.html,2017-10-01 to 2017-12-31
Apple Inc,Technology,What Are the Billboard Charts Really Measuring?,"Changes to the formulas used to build albums and singles charts will weigh paid streams more than free ones. What will the impact be? A conversation, on Popcast.",2017-10-27T18:56:16+0000,https://www.nytimes.com/2017/10/27/arts/music/billboard-chart-streaming-rule-change.html,2017-10-01 to 2017-12-31
Apple Inc,Technology,How Qualcomm Became Vulnerable to a Takeover Bid,The shifting balance of power in the cellphone industry explains why a major chip maker is suddenly a takeover target.,2017-11-07T23:52:09+0000,https://www.nytimes.com/2017/11/07/business/qualcomm-broadcom-takeover-bid.html,2017-10-01 to 2017-12-31
Apple Inc,Technology,Resuming Camera Uploads With Dropbox,"If your phone’s photos have stopped automatically uploading to the online file-storage service, check your settings.",2017-12-22T19:35:22+0000,https://www.nytimes.com/2017/12/22/technology/personaltech/iphone-pictures-dropbox.html,2017-10-01 to 2017-12-31
Apple Inc,Technology,Listen to ‘The Daily’: Jeff Sessions in the Hot Seat,The attorney general denied lying to Congress about Russian contacts and sidestepped questions about feeling pressure to investigate Hillary Clinton.,2017-11-15T10:41:52+0000,https://www.nytimes.com/2017/11/15/podcasts/the-daily/jeff-sessions-russia-uranium-one.html,2017-10-01 to 2017-12-31
Apple Inc,Technology,Broadcom Puts Qualcomm on the Clock,"Broadcom is nominating 11 directors at Qualcomm, a move that pressures Qualcomm to engage before its annual meeting in March.",2017-12-04T17:44:24+0000,https://www.nytimes.com/2017/12/04/business/dealbook/broadcom-qualcomm.html,2017-10-01 to 2017-12-31
Apple Inc,Technology,Why Tech Is Starting to Make Me Uneasy,Reporting on technology has changed this year — what once felt like a world of boundless possibility now comes freighted with worry.,2017-10-11T23:33:50+0000,https://www.nytimes.com/2017/10/11/insider/tech-column-dread.html,2017-10-01 to 2017-12-31
Apple Inc,Technology,Google’s New Gadgets Come With a Big Helping of A.I.,The company that makes most of its money through online ads did its best to show its commitment to devices like the new Pixel phone.,2017-10-04T19:41:44+0000,https://www.nytimes.com/2017/10/04/technology/google-pixel-hardware.html,2017-10-01 to 2017-12-31
Apple Inc,Technology,The Streaming Landscape After Disney’s Deal,"Netflix is the clear leader in the streaming wars, but Disney’s deal with 21st Century Fox changes things. Here’s a look at the various streaming services.",2017-12-14T23:30:14+0000,https://www.nytimes.com/2017/12/14/business/media/disney-streaming-21st-century-fox.html,2017-10-01 to 2017-12-31
Apple Inc,Technology,Broadcom Is Said to Weigh Takeover Bid of Qualcomm,"Should Broadcom decide to pursue a deal, it would be the biggest takeover bid in the semiconductor business to date.",2017-11-03T20:32:35+0000,https://www.nytimes.com/2017/11/03/business/dealbook/broadcom-qualcomm-takeover-bid.html,2017-10-01 to 2017-12-31
Apple Inc,Technology,"Eric Schmidt, Alphabet’s ‘Ambassador,’ to Step Down: DealBook Briefing",Eric Schmidt is stepping down as executive chairman of Google-parent Alphabet.,2017-12-21T12:41:19+0000,https://www.nytimes.com/2017/12/21/business/dealbook/taxes-workers-att.html,2017-10-01 to 2017-12-31
Apple Inc,Technology,Broadcom Targets Qualcomm in Largest-Ever Tech Deal,The $105 billion takeover bid sets up a battle between two chip makers whose products touch nearly every smartphone in the world.,2017-11-06T12:18:47+0000,https://www.nytimes.com/2017/11/06/business/dealbook/broadcom-qualcomm-merger.html,2017-10-01 to 2017-12-31
Apple Inc,Technology,How Evil Is Tech?,Our devices consume our time and dilute our social interactions.,2017-11-21T00:56:35+0000,https://www.nytimes.com/2017/11/20/opinion/how-evil-is-tech.html,2017-10-01 to 2017-12-31
Apple Inc,Technology,"Andy Rubin, Android Creator, Steps Away From Firm Amid Misconduct Report",Mr. Rubin is taking a leave of absence from the start-up Essential amid a report that he had an inappropriate relationship with a subordinate while he was a Google executive.,2017-11-29T20:23:24+0000,https://www.nytimes.com/2017/11/29/technology/andy-rubin-android-google-misconduct.html,2017-10-01 to 2017-12-31
Apple Inc,Technology,Ways to Stop Facebook From Eating Your Battery,"The mobile app for the social network can be a bit of a battery hog, but you can do a few things to rein in the power grab.",2017-11-24T15:04:21+0000,https://www.nytimes.com/2017/11/24/technology/personaltech/facebook-battery-drain.html,2017-10-01 to 2017-12-31
Apple Inc,Technology,More American Jobs? Broadcom Deal Might Mean the Opposite,"President Trump hailed Broadcom’s decision to bring its headquarters to the United States, but if its takeover bid for Qualcomm goes through, it may cost jobs.",2017-12-12T01:21:38+0000,https://www.nytimes.com/2017/12/11/business/dealbook/broadcom-qualcomm-trump.html,2017-10-01 to 2017-12-31
Apple Inc,Technology,How Alabama’s Election Could Reshape Washington’s Policy Battles: DealBook Briefing,"Reducing Republicans’ majority in the Senate by just one seat may have big effects on debates about health care, infrastructure, taxes and more.",2017-12-12T12:30:55+0000,https://www.nytimes.com/2017/12/12/business/dealbook/alabama-senate-election.html,2017-10-01 to 2017-12-31
Apple Inc,Technology,"Didi Chuxing, a Chinese Rival to Uber, Raises $4 Billion","The latest fund-raising round includes Japan’s SoftBank and values the company at $56 billion, raising the stakes in the global ride-hailing market.",2017-12-21T07:51:06+0000,https://www.nytimes.com/2017/12/21/business/dealbook/didi-chuxing-softbank-uber.html,2017-10-01 to 2017-12-31
Apple Inc,Technology,One of Bitcoin’s Biggest Champions Turns Bearish: DealBook Briefing,"Michael Novogratz, the former Fortress executive, told Bloomberg that he was shelving plans for a cryptocurrency hedge fund and said bitcoin will fall to $8,000.",2017-12-22T12:18:28+0000,https://www.nytimes.com/2017/12/22/business/dealbook/bitcoin-fall-blockchain.html,2017-10-01 to 2017-12-31
Apple Inc,Technology,E.U. Said to Order Luxembourg to Collect Back Taxes From Amazon,The decision comes as European authorities consider a raft of proposals aimed at increasing the amount of tax paid by American technology companies.,2017-10-03T17:30:46+0000,https://www.nytimes.com/2017/10/03/business/amazon-luxembourg-tax.html,2017-10-01 to 2017-12-31
Apple Inc,Technology,Mountain of Debt Casts Shadow Over Broadcom-Qualcomm Deal,Beyond the issue of whether Qualcomm is willing to negotiate with Broadcom is the nearly $90 billion in cash necessary to close the chip makers’ deal.,2017-11-06T19:32:18+0000,https://www.nytimes.com/2017/11/06/business/dealbook/broadcom-qualcomm-debt.html,2017-10-01 to 2017-12-31
Apple Inc,Technology,Icahn Picks New Board Fight With Xerox: DealBook Briefing,The activist investor launched his second campaign to change the management of the copy-machine maker.,2017-12-11T12:30:24+0000,https://www.nytimes.com/2017/12/11/business/dealbook/bitcoin-futures-trading.html,2017-10-01 to 2017-12-31
Apple Inc,Technology,Why the AT&T-Time Warner Merger Makes Sense,The proposal will not hurt competition or consumers. The Justice Department has no solid antitrust reasons to block it.,2017-11-16T10:45:18+0000,https://www.nytimes.com/2017/11/16/opinion/att-time-warner-merger.html,2017-10-01 to 2017-12-31
Apple Inc,Technology,Why the AT&T-Time Warner Merger Makes Sense,The proposal will not hurt competition or consumers. The Justice Department has no solid antitrust reasons to block it.,2017-11-16T10:45:18+0000,https://www.nytimes.com/2017/11/16/opinion/att-time-warner-merger.html,2017-10-01 to 2017-12-31
Apple Inc,Technology,Big Tech’s Rivals Pounce at Chances to Win in Washington,"Media, telecom and other industries struggled to find lawmakers who would be critical of big technology companies. Not anymore.",2017-10-25T17:01:15+0000,https://www.nytimes.com/2017/10/25/technology/big-tech-government-regulation.html,2017-10-01 to 2017-12-31
Apple Inc,Technology,How Would That Couch Look at Home? Check Your Phone,New apps and online programs have features that help you see what furniture looks like in your space.,2017-10-03T09:00:27+0000,https://www.nytimes.com/2017/10/03/style/apps-for-decorating-rooms.html,2017-10-01 to 2017-12-31
Apple Inc,Technology,How Google’s Physical Keys Will Protect Your Password,"Google has a new way to safeguard your online accounts. Here’s how the program works, and why it may (or may not) be a better security choice for you.",2017-10-25T19:12:05+0000,https://www.nytimes.com/2017/10/25/technology/personaltech/google-keys-advanced-protection-program.html,2017-10-01 to 2017-12-31
Apple Inc,Technology,Weinstein Company Will Not Get Planned Cash Infusion,"Colony Capital will no longer provide an immediate financial lifeline, people briefed on the matter said, but the troubled studio still has other options.",2017-10-25T23:31:57+0000,https://www.nytimes.com/2017/10/25/business/media/weinstein-company-colony-capital.html,2017-10-01 to 2017-12-31
Apple Inc,Technology,"Farhad and Mike’s Week in Tech: More Uber Drama, and Few Answers From Facebook","Uber’s board voted to make nice on a set of corporate governance changes, while Facebook’s Russia drama continued.",2017-10-06T13:00:13+0000,https://www.nytimes.com/2017/10/06/technology/farhad-and-mikes-week-in-tech-more-uber-drama-and-few-answers-from-facebook.html,2017-10-01 to 2017-12-31
Apple Inc,Technology,Netflix Says It Will Spend Up to $8 Billion on Content Next Year,The company beat expectations by adding 5.3 million subscribers in the third quarter and said it would ramp up its spending on original content.,2017-10-16T23:48:46+0000,https://www.nytimes.com/2017/10/16/business/media/netflix-earnings.html,2017-10-01 to 2017-12-31
Apple Inc,Technology,China Names and Shames Tech Tycoon With Debt Blacklist,The ambitious head of an embattled tech company is the latest casualty of China’s efforts to rein in irresponsible borrowing through public humiliation.,2017-12-13T13:55:08+0000,https://www.nytimes.com/2017/12/13/business/china-blacklist-jia-yueting-leeco.html,2017-10-01 to 2017-12-31
Apple Inc,Technology,That Game on Your Phone May Be Tracking What You’re Watching on TV,"The start-up Alphonso collects viewing data for advertisers through mobile gaming apps that can track users on the devices’ microphones, even when the apps aren’t in use.",2017-12-28T21:20:06+0000,https://www.nytimes.com/2017/12/28/business/media/alphonso-app-tracking.html,2017-10-01 to 2017-12-31
Apple Inc,Technology,Labor Case Before Supreme Court and Jobs Numbers for September,The week begins with court arguments on whether companies can prevent workers from joining together to sue them. It ends with a report on hiring.,2017-10-02T01:04:43+0000,https://www.nytimes.com/2017/10/01/business/week-ahead-supreme-court-jobs-report.html,2017-10-01 to 2017-12-31
Apple Inc,Technology,"Sessions Avoids AT&T Talk, G.O.P. Merges Taxes and Health Insurance: DealBook Briefing","The attorney general refrained from offering his view on the proposed deal, as the Justice Department weighs whether to sue to block the transaction.",2017-11-14T12:44:38+0000,https://www.nytimes.com/2017/11/14/business/dealbook/silicon-valley-tax-options.html,2017-10-01 to 2017-12-31
Apple Inc,Technology,DealBook Briefing: Peltz Gets His Seat on Procter & Gamble’s Board,Procter & Gamble has appointed activist investor Nelson Peltz to its board following a certified recount of shareholder votes cast at its annual meeting in October.,2017-12-15T12:06:02+0000,https://www.nytimes.com/2017/12/15/business/dealbook/rupert-murdoch-fox.html,2017-10-01 to 2017-12-31
Apple Inc,Technology,"Microsoft to Expand Campus, as Amazon Looks Elsewhere","The software giant plans to invest billions of dollars in renovating its campus in Redmond, Wash., to create a more urban atmosphere.",2017-11-29T06:00:30+0000,https://www.nytimes.com/2017/11/29/realestate/commercial/microsoft-headquarters-redmond-washington.html,2017-10-01 to 2017-12-31
Apple Inc,Technology,The Tax Bill’s Winners and Losers,"President Trump has called the tax cuts a Christmas present for the entire nation, but the fine print reveals some will get nicer gifts than others.",2017-12-16T21:26:16+0000,https://www.nytimes.com/2017/12/16/business/the-winners-and-losers-in-the-tax-bill.html,2017-10-01 to 2017-12-31
Apple Inc,Technology,Are Honey Nut Cheerios Healthy? We Look Inside the Box,"America’s best-selling breakfast cereal has about nine times as much sugar as normal Cheerios. Sugar, brown sugar and honey are among its top six ingredients.",2017-11-10T10:00:29+0000,https://www.nytimes.com/2017/11/10/business/honey-nut-cheerios-sugar.html,2017-10-01 to 2017-12-31
Apple Inc,Technology,Where Self-Driving Cars Go to Learn,"Arizona’s promise to keep the driverless car industry free of regulations has attracted dozens of companies, including Uber, Waymo and Lyft.",2017-11-11T17:53:42+0000,https://www.nytimes.com/2017/11/11/technology/arizona-tech-industry-favorite-self-driving-hub.html,2017-10-01 to 2017-12-31
Apple Inc,Technology,Fox-Disney Deal Gives Rupert Murdoch His King Lear Moment,"As he prepares to sell off much of 21st Century Fox, the 86-year-old magnate is testing the ties that bind the family-run fief.",2017-12-14T13:15:50+0000,https://www.nytimes.com/2017/12/14/business/media/rupert-murdoch-21st-century-fox.html,2017-10-01 to 2017-12-31
Apple Inc,Technology,Broadcom Proposes Unseating Qualcomm Board as Takeover Fight Escalates,Broadcom proposed replacing Qualcomm’s entire board as it tries to move ahead with a $105 billion bid for the mobile chip maker.,2017-12-04T12:22:24+0000,https://www.nytimes.com/2017/12/04/technology/broadcom-qualcomm-board.html,2017-10-01 to 2017-12-31
Apple Inc,Technology,"Inside Amazon, Diversity Concerns Flare Up After Harassment Accusations","Amazon’s handling of accusations of sexual harassment involving Roy Price, who ran its movie and television operations, has set off confusion, debate and finger-pointing.",2017-10-20T23:41:34+0000,https://www.nytimes.com/2017/10/20/technology/amazon-sexual-harassment.html,2017-10-01 to 2017-12-31
Apple Inc,Technology,"Spain, Harvey Weinstein, Donald Trump: Your Thursday Briefing",Here’s what you need to know to start your day.,2017-10-12T04:00:27+0000,https://www.nytimes.com/2017/10/12/briefing/spain-catalonia-weinstein-trump.html,2017-10-01 to 2017-12-31
Microsoft,Technology,Microsoft Moves to End Secrecy in Sexual Harassment Claims,Microsoft eliminated forced arbitration agreements with employees who make sexual harassment claims and is supporting a proposed federal law to ban such agreements.,2017-12-19T10:00:25+0000,https://www.nytimes.com/2017/12/19/technology/microsoft-sexual-harassment-arbitration.html,2017-10-01 to 2017-12-31
Microsoft,Technology,Dealing With Destructive System Updates,"Software updates are supposed to make your computer better, but when they do the opposite, be prepared to do some troubleshooting.",2017-12-29T14:54:06+0000,https://www.nytimes.com/2017/12/29/technology/personaltech/destructive-system-updates.html,2017-10-01 to 2017-12-31
Microsoft,Technology,Escaping a Malware Trap,"Fake tech-support alerts and other poisoned web pages can put your computer at risk, so learn how to spot them and keep your security software updated.",2017-12-27T14:43:23+0000,https://www.nytimes.com/2017/12/27/technology/personaltech/escaping-malware-trap.html,2017-10-01 to 2017-12-31
Microsoft,Technology,"Microsoft to Expand Campus, as Amazon Looks Elsewhere","The software giant plans to invest billions of dollars in renovating its campus in Redmond, Wash., to create a more urban atmosphere.",2017-11-29T06:00:30+0000,https://www.nytimes.com/2017/11/29/realestate/commercial/microsoft-headquarters-redmond-washington.html,2017-10-01 to 2017-12-31
Microsoft,Technology,What the Tax Bill Fails to Address: Technology’s Tsunami,"Technology is changing everything about how Americans work, but the industry is left largely unscathed by the Republican tax bill that Congress took up this week.",2017-12-20T15:15:13+0000,https://www.nytimes.com/2017/12/20/technology/tax-bill-technology.html,2017-10-01 to 2017-12-31
Microsoft,Technology,Moving Away From Windows 10 Home,"If you want to upgrade your PC to the more advanced version of Windows 10, you can do it right from your computer’s settings.",2017-12-19T14:44:31+0000,https://www.nytimes.com/2017/12/19/technology/personaltech/moving-away-from-windows-10-home.html,2017-10-01 to 2017-12-31
Microsoft,Technology,"Net Neutrality Protests Move Online, Yet Big Tech Is Quiet","While some technology companies used their websites to proclaim support for equal internet access, some of the giants, including Google and Microsoft, were lying low.",2017-12-12T17:58:49+0000,https://www.nytimes.com/2017/12/12/technology/net-neutrality-fcc-tech.html,2017-10-01 to 2017-12-31
Microsoft,Technology,Turning Off Programs That Start Up When You Do,"If outdated programs are still set to open when you log into the computer, you can turn them off or choose new apps to start up when you do.",2017-12-07T16:31:18+0000,https://www.nytimes.com/2017/12/07/technology/personaltech/turning-off-programs.html,2017-10-01 to 2017-12-31
Microsoft,Technology,How to Create Windows 10 Start Menu Folders,"If you find your Start menu is overloaded, you can save space by storing groups of apps in folders.",2017-11-30T15:27:31+0000,https://www.nytimes.com/2017/11/30/technology/personaltech/windows-start-folders.html,2017-10-01 to 2017-12-31
Microsoft,Technology,"Skype Vanishes From App Stores in China, Including Apple’s","The app still functions in China, but its fate there is unclear as the government moves against foreign-run tools for online communication.",2017-11-21T10:32:36+0000,https://www.nytimes.com/2017/11/21/business/skype-app-china.html,2017-10-01 to 2017-12-31
Microsoft,Technology,Microsoft Office Mobile Apps: Free or With a Fee,"You can usually do basic editing with the free touch-screen versions of Microsoft’s Office apps, but you need to pay up to fully use the programs.",2017-11-07T14:51:42+0000,https://www.nytimes.com/2017/11/07/technology/personaltech/microsoft-office-mobile-apps.html,2017-10-01 to 2017-12-31
Microsoft,Technology,Enlarge the Screen in Windows 10,The built-in Magnifier tool that comes with Windows can be adjusted so you can zoom in just how you like.,2017-11-13T14:47:37+0000,https://www.nytimes.com/2017/11/13/technology/personaltech/screen-windows-10.html,2017-10-01 to 2017-12-31
Microsoft,Technology,LinkedIn Faces Setback in China as It Runs Afoul of New Rules,"The careers and networking service will no longer accept job ads from individuals in China, as Beijing cracks down on abusive pyramid schemes.",2017-11-10T11:34:11+0000,https://www.nytimes.com/2017/11/10/business/linkedin-china.html,2017-10-01 to 2017-12-31
Microsoft,Technology,Our Guide to the Holiday Season’s Biggest Video Games and Consoles,The industry is pushing out a diverse lineup of titles and promoting new consoles to compete for people’s wallets.,2017-11-08T16:29:34+0000,https://www.nytimes.com/2017/11/08/technology/personaltech/holiday-video-games-consoles.html,2017-10-01 to 2017-12-31
