company,sector,headline,snippet,pub_date,url,quarter
Ford Motor Company,Automotive,Automakers Build War Chests to Finance a Self-Driving Future,"Ford, General Motors and Fiat Chrysler have revamped their businesses to enhance profitability and lay the foundation to develop high-tech models.",2017-10-26T21:52:10+0000,https://www.nytimes.com/2017/10/26/business/detroit-automakers.html,2017-10-01 to 2017-12-31
Ford Motor Company,Automotive,Ford Chief Outlines Investment Shift Away From Passenger Cars,"The executive, Jim Hackett, told investors that the company would focus development on trucks, S.U.V.s, and electric or self-driving vehicles.",2017-10-03T20:30:19+0000,https://www.nytimes.com/2017/10/03/business/ford-chief.html,2017-10-01 to 2017-12-31
Ford Motor Company,Automotive,Ford Apologizes for Sexual Harassment at Chicago Factories,The company’s chief executive released an apology two days after a New York Times article detailed decades of misconduct.,2017-12-22T00:07:55+0000,https://www.nytimes.com/2017/12/21/us/ford-apology-sexual-harassment.html,2017-10-01 to 2017-12-31
Ford Motor Company,Automotive,"China Will Lead an Electric Car Future, Ford’s Chairman Says",Ford Motor said Tuesday that it planned to offer 15 new models in China by 2025 that run at least in part on batteries.,2017-12-05T12:31:34+0000,https://www.nytimes.com/2017/12/05/business/ford-china-electric-cars.html,2017-10-01 to 2017-12-31
Ford Motor Company,Automotive,Listen to ‘The Daily’: Sexual Harassment at Ford,"Decades after the company tried to tackle sexual misconduct at two plants, new allegations of abuse raise questions about the possibility of change.",2017-12-21T11:16:03+0000,https://www.nytimes.com/2017/12/21/podcasts/the-daily/ford-sexual-harassment.html,2017-10-01 to 2017-12-31
Ford Motor Company,Automotive,Can Ford Turn Itself Into a Tech Company?,Its very name was synonymous with the 20th-century economy. Now it’s trying to catch up with Silicon Valley on self-driving cars.,2017-11-09T06:59:24+0000,https://www.nytimes.com/interactive/2017/11/09/magazine/tech-design-autonomous-future-cars-detroit-ford.html,2017-10-01 to 2017-12-31
Ford Motor Company,Automotive,"Ford Will Build Electric Cars in Mexico, Shifting Its Plan","The move will take advantage of lower costs and clear the way for a new Michigan plant to make driverless vehicles instead, which Ford said would mean even more jobs.",2017-12-08T00:34:22+0000,https://www.nytimes.com/2017/12/07/business/ford-plant-electric.html,2017-10-01 to 2017-12-31
Ford Motor Company,Automotive,"Arjay Miller, Who Led a Resurgence at Ford, Dies at 101","Mr. Miller was president of the car company in the 1960s, then became dean of Stanford’s Graduate School of Business.",2017-11-08T15:42:31+0000,https://www.nytimes.com/2017/11/08/obituaries/arjay-miller-who-led-a-resurgence-at-ford-dies-at-101.html,2017-10-01 to 2017-12-31
Ford Motor Company,Automotive,Ford Chooses a Detroit Base to Take On Silicon Valley,"The automaker, long absent from the city proper, will create a hub there for work on self-driving and electric cars.",2017-12-14T21:31:58+0000,https://www.nytimes.com/2017/12/14/business/ford-detroit.html,2017-10-01 to 2017-12-31
Ford Motor Company,Automotive,How Tough Is It to Change a Culture of Harassment? Ask Women at Ford,"Decades after the company tried to tackle sexual misconduct at two Chicago plants, continued abuse raises questions about the possibility of change.",2017-12-19T13:52:21+0000,https://www.nytimes.com/interactive/2017/12/19/us/ford-chicago-sexual-harassment.html,2017-10-01 to 2017-12-31
Ford Motor Company,Automotive,G.M. and Ford Lay Out Plans to Expand Electric Models,General Motors says it will add at least 20 electric vehicles to its lineup by 2023. Ford followed with its own initiative with 13 offerings.,2017-10-02T16:00:30+0000,https://www.nytimes.com/2017/10/02/business/general-motors-electric-cars.html,2017-10-01 to 2017-12-31
Ford Motor Company,Automotive,11 of Our Best Weekend Reads,"Mount Everest, Christmas carols, the year in pictures and the most expensive house in America (for now). Read all about them and get some breakfast recipes, too.",2017-12-23T12:49:15+0000,https://www.nytimes.com/2017/12/23/reader-center/11-of-our-best-weekend-reads.html,2017-10-01 to 2017-12-31
Ford Motor Company,Automotive,"Kenichi Yamamoto, Father of Mazda’s Rotary Engine, Is Dead at 95",He led the engineering team that produced an innovative answer to the conventional piston automotive engine. He later led the company.,2017-12-29T23:32:39+0000,https://www.nytimes.com/2017/12/29/obituaries/kenichi-yamamoto-dead-father-of-mazda-rotary-engine.html,2017-10-01 to 2017-12-31
Ford Motor Company,Automotive,"Lyft to Begin Operations in Toronto, Its First Market Outside the U.S.","The ride-hailing company, a major rival to Uber in the United States, made the announcement after receiving an injection of new financing.",2017-11-13T14:28:41+0000,https://www.nytimes.com/2017/11/13/business/lyft-toronto-canada.html,2017-10-01 to 2017-12-31
Ford Motor Company,Automotive,Kobe Steel Scandal Is Now Subject of Justice Department Inquiry,"The company’s American unit was asked to turn over documents relating to the sale of substandard metals. Boeing, Ford and General Motors are among its customers.",2017-10-17T21:45:04+0000,https://www.nytimes.com/2017/10/17/business/kobe-steel-justice-department.html,2017-10-01 to 2017-12-31
Ford Motor Company,Automotive,Cost of Volkswagen Scandal Could Hurt Company’s Electric Vehicle Push,"The carmaker reported an increase in revenue, but said it still had work to do to overcome the damage caused by its diesel emissions cheating.",2017-10-27T16:19:39+0000,https://www.nytimes.com/2017/10/27/business/volkswagen-scandal-electric.html,2017-10-01 to 2017-12-31
Ford Motor Company,Automotive,"Congress, Jerusalem, Facebook: Your Thursday Evening Briefing",Here’s what you need to know at the end of the day.,2017-12-21T23:12:42+0000,https://www.nytimes.com/2017/12/21/briefing/congress-jerusalem-facebook.html,2017-10-01 to 2017-12-31
Ford Motor Company,Automotive,Carmakers Try to Keep Waste Out of the Ground as Well as the Air,Automakers have been trying for years to stop sending anything to landfills. Now they are using other would-be trash to make parts.,2017-12-21T16:53:57+0000,https://www.nytimes.com/2017/12/21/business/car-companies-recylcing.html,2017-10-01 to 2017-12-31
Ford Motor Company,Automotive,Japanese Carmakers Call Kobe Steel’s Products Safe Despite Scandal,"A round of positive findings from Toyota, Honda and Mazda could help lift a cloud over the Japanese supplier, which has said its inspectors falsified data.",2017-10-19T11:30:31+0000,https://www.nytimes.com/2017/10/19/business/kobe-steel-scandal-safe.html,2017-10-01 to 2017-12-31
Ford Motor Company,Automotive,"Jerusalem, Winter Olympics, Yemen: Your Wednesday Briefing",Here’s what you need to know to start your day.,2017-12-05T19:17:21+0000,https://www.nytimes.com/2017/12/05/briefing/jerusalem-winter-olympics-yemen.html,2017-10-01 to 2017-12-31
Ford Motor Company,Automotive,Automakers Shouldn’t Fight Emissions Standards,"Auto executives say they are committed to taking on climate change, but industry lobbyists are undermining fuel economy and emissions standards.",2017-10-19T08:55:12+0000,https://www.nytimes.com/2017/10/19/opinion/automakers-shouldnt-fight-emissions-standards.html,2017-10-01 to 2017-12-31
Ford Motor Company,Automotive,"Now on Oracle’s Campus, a $43 Million Public High School",Putting a publicly funded charter school on the campus of a Silicon Valley giant is a new twist on the evolving relationship between big tech companies and schools.,2017-12-03T22:52:33+0000,https://www.nytimes.com/2017/12/03/technology/now-on-oracles-campus-a-43-million-public-high-school.html,2017-10-01 to 2017-12-31
Ford Motor Company,Automotive,Mexico Braces for the Possible Collapse of Nafta,"Officials say they are prepared to exit the talks rather than accept a deal they see as harmful. Already, they are looking to contain the effects and to adapt.",2017-10-16T20:38:38+0000,https://www.nytimes.com/2017/10/16/world/americas/mexico-nafta.html,2017-10-01 to 2017-12-31
Ford Motor Company,Automotive,Kobe Steel’s Falsified Data Is Another Blow to Japan’s Reputation,"Employees altered inspection certificates to meet specifications, setting off a rush by Toyota, Boeing and others to see if they had used the raw materials.",2017-10-10T10:51:18+0000,https://www.nytimes.com/2017/10/10/business/kobe-steel-japan.html,2017-10-01 to 2017-12-31
Ford Motor Company,Automotive,"Tax Plan Would Scrap Electric-Car Credit, Dampening Market","The Republican proposal calls for abolishing a $7,500 credit for purchases of all-electric and plug-in hybrid vehicles, just as automakers are expanding lineups.",2017-11-02T22:26:36+0000,https://www.nytimes.com/2017/11/02/business/tax-electric-cars.html,2017-10-01 to 2017-12-31
Ford Motor Company,Automotive,Labor Case Before Supreme Court and Jobs Numbers for September,The week begins with court arguments on whether companies can prevent workers from joining together to sue them. It ends with a report on hiring.,2017-10-02T01:04:43+0000,https://www.nytimes.com/2017/10/01/business/week-ahead-supreme-court-jobs-report.html,2017-10-01 to 2017-12-31
Ford Motor Company,Automotive,Would You Like My Car to Make You Some Water?,Engineers are finding ways to have cars do much more than take us from Point A to Point B — including producing and dispensing water.,2017-10-19T15:38:40+0000,https://www.nytimes.com/2017/10/19/automobiles/wheels/car-water-engineers.html,2017-10-01 to 2017-12-31
Ford Motor Company,Automotive,California Today: A Tax Bill Test for State Republicans,"Thursday: How the legislation could impact the state, more Hollywood fallout for Kevin Spacey, and a push to make the Playboy Mansion a historic monument.",2017-11-09T13:22:03+0000,https://www.nytimes.com/2017/11/09/us/california-today-a-tax-bill-test-for-state-republicans.html,2017-10-01 to 2017-12-31
Ford Motor Company,Automotive,"China to Export Trumpchi Cars to U.S., Maybe With a New Name","GAC Motor wants to lead an export push as China prepares the rest of its auto industry to go global and, in particular, target the American market.",2017-11-17T17:58:52+0000,https://www.nytimes.com/2017/11/17/business/china-gac-trumpchi.html,2017-10-01 to 2017-12-31
Ford Motor Company,Automotive,"Kobe Steel Problems May Be More Widespread, Raising Fears on High-Speed Rail",Falsified data on quality has raised concerns about whether Japan’s renowned high-speed rail network may be affected.,2017-10-12T07:41:54+0000,https://www.nytimes.com/2017/10/12/business/kobe-steel-japan-trains.html,2017-10-01 to 2017-12-31
Ford Motor Company,Automotive,"G.M. Unveils Its Driverless Cars, Aiming to Lead the Pack","Previously reluctant to show the autonomous vehicles it is developing, General Motors now wants to signal its progress in getting them to market.",2017-11-29T13:00:01+0000,https://www.nytimes.com/2017/11/29/business/gm-driverless-cars.html,2017-10-01 to 2017-12-31
Ford Motor Company,Automotive,Uber Strikes Deal With Volvo to Bring Self-Driving Cars to Its Network,"Uber has agreed to buy up to 24,000 self-driving Volvos for its ride-hailing network once the technology is production-ready.",2017-11-20T14:00:19+0000,https://www.nytimes.com/2017/11/20/technology/uber-deal-volvo-self-driving-cars-.html,2017-10-01 to 2017-12-31
Ford Motor Company,Automotive,Kobe Steel Scandal Grows to Include Subsidiaries,"The steel maker, admitting data was falsified, now estimates 500 customers could have gotten potentially substandard products.",2017-10-13T12:36:07+0000,https://www.nytimes.com/2017/10/13/business/kobe-steel-scandal.html,2017-10-01 to 2017-12-31
Ford Motor Company,Automotive,Volkswagen Sales in U.S. Rebound After Diesel Scandal,"Two years after the automaker’s cheating on emissions compliance was revealed, its dealers are finding renewed customer interest.",2017-11-01T22:06:57+0000,https://www.nytimes.com/2017/11/01/business/volkswagen-sales-diesel.html,2017-10-01 to 2017-12-31
Ford Motor Company,Automotive,"In Self-Driving Race, Waymo Sets Its Own Terms","Waymo, the self-driving vehicle unit of Alphabet, showed its latest advances at Castle, its test track in California’s Central Valley.",2017-10-31T07:01:01+0000,https://www.nytimes.com/2017/10/31/technology/driverless-cars-waymo.html,2017-10-01 to 2017-12-31
Ford Motor Company,Automotive,Lyft Is Said to Explore I.P.O. as It Raises $1 Billion Led by Alphabet,"The ride-hailing company is exploring a 2018 initial public offering, as it added fresh capital to its coffers from investors including a venture arm spun out of Google.",2017-10-19T18:16:20+0000,https://www.nytimes.com/2017/10/19/technology/lyft-capitalg-alphabet.html,2017-10-01 to 2017-12-31
Ford Motor Company,Automotive,"China Craves Electric Cars, While U.S. Flirts With Ending Tax Credit","As American lawmakers weigh a repeal, automakers are gathering in China, a country demanding they sell more electric cars.",2017-11-16T11:52:08+0000,https://www.nytimes.com/2017/11/16/business/energy-environment/electric-cars-china.html,2017-10-01 to 2017-12-31
Ford Motor Company,Automotive,"For Electric Car Owners, ‘Range Anxiety’ Gives Way to ‘Charging Time Trauma’","Compared to a short pit stop at a gas station, charging an electric vehicle can be a time-consuming experience. But change is at hand.",2017-10-05T13:51:44+0000,https://www.nytimes.com/2017/10/05/automobiles/wheels/electric-cars-charging.html,2017-10-01 to 2017-12-31
Ford Motor Company,Automotive,Stocks Indexes Close Largely Unchanged After Tax Plan Is Unveiled,Homebuilder stocks slipped as investors parsed proposals to cap the mortgage interest deduction and collapse tax brackets.,2017-11-02T18:01:30+0000,https://www.nytimes.com/2017/11/02/business/stock-markets.html,2017-10-01 to 2017-12-31
Ford Motor Company,Automotive,The Patriarchs Are Falling. The Patriarchy Is Stronger Than Ever.,Can the electrifying power of #MeToo be harnessed to the slow slog of building a more gender-equal society?,2017-12-28T16:00:15+0000,https://www.nytimes.com/2017/12/28/opinion/sunday/patriarchy-feminism-metoo.html,2017-10-01 to 2017-12-31
Ford Motor Company,Automotive,List of Safety Picks Dings Some Cars for a Failure to Illuminate,New crash and headlight requirements established by the Insurance Institute for Highway Safety cut in half the number of vehicles to earn a coveted safety designation.,2017-12-07T05:02:14+0000,https://www.nytimes.com/2017/12/07/business/iihs-top-safety-picks.html,2017-10-01 to 2017-12-31
Ford Motor Company,Automotive,"Geely Buys Stake in Volvo Trucks, Despite China Restrictions",The government in Beijing has unveiled an array of new regulations to temper outbound investment. But Chinese companies are still going global.,2017-12-27T15:11:38+0000,https://www.nytimes.com/2017/12/27/business/dealbook/china-volvo-geely.html,2017-10-01 to 2017-12-31
Ford Motor Company,Automotive,Wage Growth Remains ‘Pedestrian’: DealBook Briefing,"The United States economy added 228,000 jobs in November and the unemployment rate remained at 4.1 percent. But earnings growth continued to disappoint.",2017-12-08T12:17:25+0000,https://www.nytimes.com/2017/12/08/business/dealbook/trump-taxes-schwarzman.html,2017-10-01 to 2017-12-31
Ford Motor Company,Automotive,Where Self-Driving Cars Go to Learn,"Arizona’s promise to keep the driverless car industry free of regulations has attracted dozens of companies, including Uber, Waymo and Lyft.",2017-11-11T17:53:42+0000,https://www.nytimes.com/2017/11/11/technology/arizona-tech-industry-favorite-self-driving-hub.html,2017-10-01 to 2017-12-31
Ford Motor Company,Automotive,China Says It’s Open for Business. Foreign Firms Find It’s Not That Simple.,"Chinese officials reiterated a welcoming message to corporate leaders at a conference on Wednesday, but the reality on the ground is more complex.",2017-12-06T19:46:01+0000,https://www.nytimes.com/2017/12/06/business/china-global-business-xi-jinping.html,2017-10-01 to 2017-12-31
Ford Motor Company,Automotive,Trying to Bypass Anxiety on the Road to Driverless Cars,Volvo is putting cameras in vehicles to see people interact with driver-assistance features and will use the data in designing fully autonomous cars.,2017-12-12T05:01:20+0000,https://www.nytimes.com/2017/12/12/business/volvo-driverless.html,2017-10-01 to 2017-12-31
Ford Motor Company,Automotive,Detroit: The Most Exciting City in America?,How a 21st-century Detroit navigates the dangers of regeneration is a particularly poignant question on the 50th anniversary of the 1967 Detroit race riots.,2017-11-20T10:00:38+0000,https://www.nytimes.com/2017/11/20/travel/detroit-michigan-downtown.html,2017-10-01 to 2017-12-31
Ford Motor Company,Automotive,Investing by Betting on the Sponsors of Sports,A sportscaster and a financial planner have started an exchange-traded fund aimed at enabling avid sports fans to invest in what they know.,2017-10-13T16:43:19+0000,https://www.nytimes.com/2017/10/13/business/mutfund/investing-betting-sponsors-sports.html,2017-10-01 to 2017-12-31
Ford Motor Company,Automotive,"The Near Future of Driving: Eyes Forward, but No Hands at 10 and 2","The Cadillac Super Cruise system is the latest in semiautonomous driving technology, allowing drivers to keep their hands off the wheel as long as they pay attention to the road.",2017-11-16T17:20:23+0000,https://www.nytimes.com/2017/11/16/business/cadillac-super-cruise.html,2017-10-01 to 2017-12-31
Ford Motor Company,Automotive,Tesla’s Dangerous Sprint Into the Future,"For Elon Musk’s company, autonomous driving is just a pit stop on the road to a better planet. Can it survive long enough to get there?",2017-11-07T07:03:40+0000,https://www.nytimes.com/interactive/2017/11/07/magazine/tech-design-future-autonomous-cars-factory-tesla-sustainability-gigafactory.html,2017-10-01 to 2017-12-31
Ford Motor Company,Automotive,‘Army’ of Lobbyists Hits Capitol Hill to Preserve Nafta,The Trump administration is going to battle with businesses over trade. Businesses are organizing to fight back.,2017-10-24T16:01:46+0000,https://www.nytimes.com/2017/10/24/us/politics/nafta-lobby-congress.html,2017-10-01 to 2017-12-31
Ford Motor Company,Automotive,Australia Mourns the End of Its Car Manufacturing Industry,"On Friday, Holden employees bid farewell to Australia’s last car factory, wondering if the government could have done more to save it.",2017-10-20T08:56:20+0000,https://www.nytimes.com/2017/10/20/world/australia/holden-automaker-factory-closes.html,2017-10-01 to 2017-12-31
Ford Motor Company,Automotive,Rethinking ‘McNamara’s War’,How much blame does the whiz-kid defense secretary deserve for Vietnam?,2017-11-28T10:45:21+0000,https://www.nytimes.com/2017/11/28/opinion/rethinking-mcnamaras-war.html,2017-10-01 to 2017-12-31
Ford Motor Company,Automotive,China Hastens the World Toward an Electric-Car Future,The biggest automakers in the world are being forced to follow Beijing’s lead as China takes steps to dominate in electric vehicles and technology.,2017-10-09T21:58:00+0000,https://www.nytimes.com/2017/10/09/business/china-hastens-the-world-toward-an-electric-car-future.html,2017-10-01 to 2017-12-31
Ford Motor Company,Automotive,"How to Be a C.E.O., From a Decade’s Worth of Them",Adam Bryant has interviewed 525 chief executives through his years writing the Corner Office column. Here’s what he has learned.,2017-10-27T09:00:28+0000,https://www.nytimes.com/2017/10/27/business/how-to-be-a-ceo.html,2017-10-01 to 2017-12-31
Ford Motor Company,Automotive,"North Korea, Rohingya, Prince Harry: Your Wednesday Briefing",Here’s what you need to know to start your day.,2017-11-28T19:01:14+0000,https://www.nytimes.com/2017/11/28/briefing/north-korea-rohingya-prince-harry.html,2017-10-01 to 2017-12-31
Ford Motor Company,Automotive,"The Electric Future, Waymo Documents, Uber: DealBook Briefing","Governments worldwide are looking to electric cars, and the world’s automotive companies are scrambling to prepare.",2017-10-03T10:40:08+0000,https://www.nytimes.com/2017/10/03/business/dealbook/electric-cars-waymo-uber.html,2017-10-01 to 2017-12-31
Ford Motor Company,Automotive,Ken Chenault’s Retirement Makes a Small Club Smaller: DealBook Briefing,"When the American Express C.E.O. steps down in February, there may be just three black men running Fortune 500 companies.",2017-10-19T11:00:21+0000,https://www.nytimes.com/2017/10/19/business/dealbook/ken-chenault-american-express.html,2017-10-01 to 2017-12-31
Ford Motor Company,Automotive,China’s Next Potential Boom Spot: The Places People Overlook,"New highways and trains and changes in farming are opening up the country’s poorer cities and rural areas, long laggards amid China’s torrid growth.",2017-12-01T22:47:59+0000,https://www.nytimes.com/2017/12/01/business/china-rural-economy.html,2017-10-01 to 2017-12-31
Ford Motor Company,Automotive,"Matt Lauer, North Korea, Reno: Your Wednesday Briefing",Here’s what you need to know to start your day.,2017-11-29T10:39:11+0000,https://www.nytimes.com/2017/11/29/briefing/north-korea-donald-trump-reno.html,2017-10-01 to 2017-12-31
Ford Motor Company,Automotive,"Robert Yates, Nascar Team Owner and Master Engine Builder, Dies at 74","Mr. Yates’s clients included Junior Johnson, Richard Petty and Bobby and Davey Allison, and his team won 57 races.",2017-10-04T22:48:10+0000,https://www.nytimes.com/2017/10/04/obituaries/robert-yates-dead-nascar-team-owner-and-racing-engine-builder.html,2017-10-01 to 2017-12-31
Ford Motor Company,Automotive,Trump’s Trade Approach Diverges Sharply from Free Trade Republicans,Deep divisions over the future of trade policy threaten to disrupt a brittle coalition between free market and populist Republicans.,2017-11-15T19:35:39+0000,https://www.nytimes.com/2017/11/15/business/trump-free-trade-republicans.html,2017-10-01 to 2017-12-31
Ford Motor Company,Automotive,How to Make Cars Cooperate,"As giant companies race toward self-driving technology, smaller firms are using vehicle to vehicle technology to work toward a more profound — and in some ways opposing — goal.",2017-11-09T06:58:51+0000,https://www.nytimes.com/interactive/2017/11/09/magazine/tech-design-autonomous-future-cars-v2v-traffic-peloton.html,2017-10-01 to 2017-12-31
General Motors,Automotive,Carmakers Try to Keep Waste Out of the Ground as Well as the Air,Automakers have been trying for years to stop sending anything to landfills. Now they are using other would-be trash to make parts.,2017-12-21T16:53:57+0000,https://www.nytimes.com/2017/12/21/business/car-companies-recylcing.html,2017-10-01 to 2017-12-31
General Motors,Automotive,"Ford Will Build Electric Cars in Mexico, Shifting Its Plan","The move will take advantage of lower costs and clear the way for a new Michigan plant to make driverless vehicles instead, which Ford said would mean even more jobs.",2017-12-08T00:34:22+0000,https://www.nytimes.com/2017/12/07/business/ford-plant-electric.html,2017-10-01 to 2017-12-31
General Motors,Automotive,"G.M. Unveils Its Driverless Cars, Aiming to Lead the Pack","Previously reluctant to show the autonomous vehicles it is developing, General Motors now wants to signal its progress in getting them to market.",2017-11-29T13:00:01+0000,https://www.nytimes.com/2017/11/29/business/gm-driverless-cars.html,2017-10-01 to 2017-12-31
General Motors,Automotive,Opel’s New Owner Vows to Make What General Motors Couldn’t: Money,The French maker of Peugeot cars outlined a plan to return Opel to profit for the first time since the last century. But there are many obstacles.,2017-11-09T19:29:45+0000,https://www.nytimes.com/2017/11/09/business/opel-vauxhall-psa.html,2017-10-01 to 2017-12-31
General Motors,Automotive,"The Near Future of Driving: Eyes Forward, but No Hands at 10 and 2","The Cadillac Super Cruise system is the latest in semiautonomous driving technology, allowing drivers to keep their hands off the wheel as long as they pay attention to the road.",2017-11-16T17:20:23+0000,https://www.nytimes.com/2017/11/16/business/cadillac-super-cruise.html,2017-10-01 to 2017-12-31
General Motors,Automotive,"China Craves Electric Cars, While U.S. Flirts With Ending Tax Credit","As American lawmakers weigh a repeal, automakers are gathering in China, a country demanding they sell more electric cars.",2017-11-16T11:52:08+0000,https://www.nytimes.com/2017/11/16/business/energy-environment/electric-cars-china.html,2017-10-01 to 2017-12-31
General Motors,Automotive,Trump’s ‘Tremendous Success’ Abroad Is Overstated,President Trump recapped 10 months of his foreign policy in a speech on Wednesday that contained several inaccurate claims.,2017-11-16T00:42:50+0000,https://www.nytimes.com/2017/11/15/us/politics/fact-check-trump-foreign-policy.html,2017-10-01 to 2017-12-31
General Motors,Automotive,Examining Trump’s Asia Deals That He Says Are Worth Billions,"Abroad this week, President Trump said he struck deals with China, Japan and South Korea — citing earlier agreements and relying on wishful thinking.",2017-11-10T20:55:54+0000,https://www.nytimes.com/2017/11/10/us/politics/fact-check-trump-asia-deals.html,2017-10-01 to 2017-12-31
General Motors,Automotive,"General Motors Posts a Loss From Asset Sale, but Shares Rise",The automaker took a charge associated with shedding its Opel and Vauxhall divisions in Europe. Its chief said the quarter reflected “solid results.”,2017-10-24T12:28:52+0000,https://www.nytimes.com/2017/10/24/business/general-motors-earnings.html,2017-10-01 to 2017-12-31
