company,sector,headline,snippet,pub_date,url,quarter
JPMorgan Chase,Finance/Banking,The Legal Onslaught Facing Credit Card Companies,"Visa faces questions about whether it enabled a porn site to profit from images of child sexual abuse, and both Mastercard and Visa face a new antitrust suit from Disney.",2022-08-01T13:23:52+0000,https://www.nytimes.com/2022/08/01/business/dealbook/pornhub-visa-mastercard-disney.html,2022-07-01 to 2022-09-30
JPMorgan Chase,Finance/Banking,Adam Neumann Gets a New Backer,WeWork’s founder is back with a billion-dollar venture.,2022-08-15T11:54:39+0000,https://www.nytimes.com/2022/08/15/business/dealbook/adam-neumann-flow-new-company-wework-real-estate.html,2022-07-01 to 2022-09-30
JPMorgan Chase,Finance/Banking,A Tax Loophole’s Powerful Defender,Senator Kyrsten Sinema had one main request before she would support a key spending bill: Preserve a tax loophole that mainly benefits people in private equity.,2022-08-05T13:02:45+0000,https://www.nytimes.com/2022/08/05/business/dealbook/sinema-tax-loophole-carried-interest.html,2022-07-01 to 2022-09-30
JPMorgan Chase,Finance/Banking,Crypto Crashed. Wall Street Won.,"Plus, a legal twist for collapsed investment firm and founder Bill Hwang.",2022-07-05T12:29:26+0000,https://www.nytimes.com/2022/07/05/business/dealbook/bitcoin-crypto-crash-wall-street-archegos.html,2022-07-01 to 2022-09-30
JPMorgan Chase,Finance/Banking,The New Deciders on Corporate Taxes,A climate and tax bill could give a lot of power to an organization called the Financial Accounting Standards Board.,2022-08-04T13:04:51+0000,https://www.nytimes.com/2022/08/04/business/dealbook/inflation-reduction-act-fasb-accountants-corporate-minimum-tax.html,2022-07-01 to 2022-09-30
JPMorgan Chase,Finance/Banking,The New Deciders on Corporate Taxes,A climate and tax bill could give a lot of power to an organization called the Financial Accounting Standards Board.,2022-08-04T13:04:51+0000,https://www.nytimes.com/2022/08/04/business/dealbook/inflation-reduction-act-fasb-accountants-corporate-minimum-tax.html,2022-07-01 to 2022-09-30
JPMorgan Chase,Finance/Banking,Decoding the Surprise Inflation Report,A stubbornly high inflation reading has divided experts on what the Fed should do when it weighs another interest rate hike next week.,2022-09-14T11:44:55+0000,https://www.nytimes.com/2022/09/14/business/dealbook/inflation-fed-interest-rate-increase-markets.html,2022-07-01 to 2022-09-30
JPMorgan Chase,Finance/Banking,"For People Just Leaving Prison, a Novel Kind of Support: Cash","Joining a raft of initiatives aimed at helping the formerly incarcerated, a program gives money to defray expenses they face, including court fines and rent.",2022-07-07T09:00:23+0000,https://www.nytimes.com/2022/07/07/business/cash-assistance-incarcerated.html,2022-07-01 to 2022-09-30
JPMorgan Chase,Finance/Banking,How Well Has Jackson Hole Predicted the Economy?,"The Federal Reserve chairman, Jay Powell, is expected to discuss inflation, interest rates and growth in his annual address from the economic symposium on Friday.",2022-08-26T12:12:51+0000,https://www.nytimes.com/2022/08/26/business/dealbook/jackson-hole-prediction-economy-powell.html,2022-07-01 to 2022-09-30
JPMorgan Chase,Finance/Banking,The Markets Face a Rare Double Decline,"The losses in tech stocks and bonds is wrecking investor portfolios, and analysts warn of more sell-offs.",2022-09-30T12:21:24+0000,https://www.nytimes.com/2022/09/30/business/tech-stocks-bonds-nasdaq-bear-market.html,2022-07-01 to 2022-09-30
JPMorgan Chase,Finance/Banking,Penn Station Plan Makes a High-Stakes Bet on the Future of Office Work,"Despite near record-high office vacancies, Gov. Kathy Hochul has backed a real estate project at the New York transit hub that would be one of the largest in American history.",2022-08-29T07:00:24+0000,https://www.nytimes.com/2022/08/29/nyregion/manhattan-offices-hochul.html,2022-07-01 to 2022-09-30
Goldman Sachs,Finance/Banking,Goldman Sachs Prepares for Layoffs as Deal-Making Slows,The bank reported in July that its profit had fallen because of shakier economic conditions.,2022-09-12T13:47:45+0000,https://www.nytimes.com/2022/09/12/business/dealbook/goldman-sachs-layoffs.html,2022-07-01 to 2022-09-30
Goldman Sachs,Finance/Banking,Texting on Private Apps Costs Wall Street Firms $1.8 Billion in Fines,The S.E.C. fined several big banks for not monitoring employees who used private apps to discuss work or preserving those messages.,2022-09-27T22:29:00+0000,https://www.nytimes.com/2022/09/27/business/banks-fined-texting-sec.html,2022-07-01 to 2022-09-30
Goldman Sachs,Finance/Banking,‘Act of Sabotage’ Hits Europe’s Energy and Stocks Markets,"Natural gas prices soared in Europe and stocks fell, as officials  investigate the causes of the Nordstream 1 and 2 gas pipeline explosions.",2022-09-28T12:24:48+0000,https://www.nytimes.com/2022/09/28/business/dealbook/sabotage-nordstream-europe-russia-gas-stocks.html,2022-07-01 to 2022-09-30
Goldman Sachs,Finance/Banking,Zelensky Asks Businesses to Join a ‘Marshall Plan’ for Ukraine,Ukraine estimates it would cost $750 billion to rebuild the war-battered country.,2022-09-23T12:07:46+0000,https://www.nytimes.com/2022/09/23/business/dealbook/zelensky-marshall-plan-investor-fund-ukraine.html,2022-07-01 to 2022-09-30
Goldman Sachs,Finance/Banking,Cracking Down on a Wall Street Trend: E.S.G. Makeovers,"In recent years, financial firms have revamped dozens of mutual funds into E.S.G. dedicated funds — seeking to cash in on growing demand for such investments.",2022-09-17T12:00:03+0000,https://www.nytimes.com/2022/09/17/business/dealbook/esg-wall-street.html,2022-07-01 to 2022-09-30
Goldman Sachs,Finance/Banking,Misty Copeland Creates Program to Bring More Diversity to Ballet,The American Ballet Theater dancer announced an extracurricular initiative that Copeland hopes will bring more Black and Latino children to dance.,2022-09-15T17:00:07+0000,https://www.nytimes.com/2022/09/15/arts/dance/misty-copeland-diversity-ballet.html,2022-07-01 to 2022-09-30
Goldman Sachs,Finance/Banking,Will Return to Office Get Serious in September?,"Bosses want employees back, but it looks like the return will be gradual and depend on the future of Covid.",2022-09-06T04:06:05+0000,https://www.nytimes.com/2022/09/06/nyregion/return-to-office-remote-work.html,2022-07-01 to 2022-09-30
Goldman Sachs,Finance/Banking,"Goldman Sachs Beats Rivals, Benefiting From Volatile Markets","Despite better-than-expected profit, the Wall Street giant’s leaders said they would slow hiring and review stock repurchases as the economy becomes more “uncertain.”",2022-07-18T16:07:26+0000,https://www.nytimes.com/2022/07/18/business/goldman-sachs-earnings.html,2022-07-01 to 2022-09-30
Goldman Sachs,Finance/Banking,West Virginia Punishes Banks That It Says Don’t Support Coal,The move to exclude the institutions from state business is part of a growing effort by Republican officials to shut out companies that are backing away from fossil fuels.,2022-07-28T13:33:00+0000,https://www.nytimes.com/2022/07/28/business/west-virginia-fossil-fuel-banks.html,2022-07-01 to 2022-09-30
Goldman Sachs,Finance/Banking,3 takeaways from big banks’ latest financial reports.,"Wall Street bank executives said consumer spending was up, markets were volatile and they did not think the economy was headed for a recession.",2022-07-18T18:14:19+0000,https://www.nytimes.com/2022/07/18/business/second-quarter-bank-earnings.html,2022-07-01 to 2022-09-30
Goldman Sachs,Finance/Banking,The Andy Jassy Way at Amazon,The longtime lieutenant to Jeff Bezos has made more changes than many expected since becoming C.E.O.,2022-07-18T12:28:54+0000,https://www.nytimes.com/2022/07/18/business/dealbook/andy-jassy-amazon.html,2022-07-01 to 2022-09-30
Goldman Sachs,Finance/Banking,"Daniel Goldman, Ex-Trump Prosecutor, Tops Crowded Field in N.Y. Primary",Mr. Goldman won a heavily contested primary race for a rare open seat covering parts of Manhattan and Brooklyn.,2022-08-24T04:42:11+0000,https://www.nytimes.com/2022/08/24/nyregion/daniel-goldman-trump-ny-primary.html,2022-07-01 to 2022-09-30
Goldman Sachs,Finance/Banking,How Russian Gas in Europe Is Dwindling,"The fuel that once flowed freely has been abruptly reduced, sending prices soaring and forcing European governments to struggle for solutions.",2022-09-07T09:00:36+0000,https://www.nytimes.com/2022/09/07/business/russia-gas-europe.html,2022-07-01 to 2022-09-30
Goldman Sachs,Finance/Banking,"Wages climbed 5.1 percent, a still-rapid pace as Fed awaits slowdown.","Central bankers are closely watching wage growth, which has been picking up rapidly before accounting for inflation.",2022-07-08T12:52:39+0000,https://www.nytimes.com/2022/07/08/business/wages-climbed-5-1-percent-a-still-rapid-pace-as-fed-awaits-slowdown.html,2022-07-01 to 2022-09-30
Goldman Sachs,Finance/Banking,Fed Announces Plan to Assess Climate Risks to Banks,"The Federal Reserve will put big banks through climate scenario tests next year, but the exercises will not force banks to raise capital.",2022-09-29T15:51:10+0000,https://www.nytimes.com/2022/09/29/business/fed-banks-climate-change.html,2022-07-01 to 2022-09-30
Goldman Sachs,Finance/Banking,Another subpoena blitz in Twitter vs. Musk.,"Elon Musk subpoenaed the banks advising Twitter in its deal, and Twitter sent subpoenas to several people close to Mr. Musk.",2022-08-04T14:10:11+0000,https://www.nytimes.com/2022/08/04/business/elon-musk-twitter-subpoena.html,2022-07-01 to 2022-09-30
Goldman Sachs,Finance/Banking,15-Year-Old Arrested in Fatal Stabbing of 14-Year-Old in Subway,"The teenager who died appeared to have known his attacker, officials said. A dispute between them in the street spilled into the subway.",2022-07-10T01:32:09+0000,https://www.nytimes.com/2022/07/09/nyregion/harlem-subway-stabbing.html,2022-07-01 to 2022-09-30
Goldman Sachs,Finance/Banking,There’s a New Cop on the Banking Beat: Chief Climate Risk Officer,"The Office of the Comptroller of the Currency, which oversees big banks, hired a chemical engineer to review the risks climate change poses to banks.",2022-09-12T20:29:59+0000,https://www.nytimes.com/2022/09/12/business/banking-regulator-climate-risk-officer.html,2022-07-01 to 2022-09-30
Goldman Sachs,Finance/Banking,The Week in Business: Rail Strike Averted,Higher-than-expected inflation in August rattled financial markets. The Federal Reserve is expected to approve another big rate increase. But Social Security recipients have a reason to cheer.,2022-09-18T11:00:06+0000,https://www.nytimes.com/2022/09/18/business/the-week-in-business-rail-strike.html,2022-07-01 to 2022-09-30
Goldman Sachs,Finance/Banking,Global Markets Fall on Worries About Inflation and Interest Rates,"The S&P 500 fell 1.7 percent, putting the index on track for a second consecutive weekly decline, and the yield on the 10-year Treasury note, a benchmark for borrowing costs, rose slightly.",2022-09-23T13:06:28+0000,https://www.nytimes.com/2022/09/23/business/global-markets-inflation-interest-rates.html,2022-07-01 to 2022-09-30
Goldman Sachs,Finance/Banking,Don’t Return to the Office for Your Boss. Go Back for Yourself.,"Many offices are desolate, open plan landscapes dotted with individuals staring at screens, headphones on. It doesn’t have to be that way.",2022-08-06T15:00:07+0000,https://www.nytimes.com/2022/08/06/opinion/return-to-the-office-remote-hybrid.html,2022-07-01 to 2022-09-30
Goldman Sachs,Finance/Banking,How Wall Street Escaped the Crypto Meltdown,"As cryptocurrency prices plunged and funds failed, strict rules on risky assets helped Wall Street companies sidestep the worst. Retail investors weren’t as lucky.",2022-07-05T09:00:13+0000,https://www.nytimes.com/2022/07/05/business/economy/wall-st-cryptocurrency-prices.html,2022-07-01 to 2022-09-30
Goldman Sachs,Finance/Banking,"Ex-congressman, banker and F.B.I. trainee are charged with insider trading.",The federal authorities filed criminal and civil charges against nine people in a series of unrelated cases that netted more than $7 million in gains from trading ahead of corporate mergers.,2022-07-25T18:21:15+0000,https://www.nytimes.com/2022/07/25/business/sec-insider-trading.html,2022-07-01 to 2022-09-30
Goldman Sachs,Finance/Banking,"In a House Race With Big Names, 2 Women With Local Ties Rise","Carlina Rivera, a Manhattan councilwoman, and Yuh-Line Niou, a state assemblywoman, are vying to defeat rivals who include current and former members of Congress.",2022-08-05T09:00:26+0000,https://www.nytimes.com/2022/08/05/nyregion/rivera-niou-ny10.html,2022-07-01 to 2022-09-30
Goldman Sachs,Finance/Banking,"Peloton, the Troubled Fitness Company, Loses Another Top Executive",The company’s chief marketing officer announced her departure on the heels of a management shake-up that included the exit of two of its founders.,2022-09-26T12:49:23+0000,https://www.nytimes.com/2022/09/26/business/peloton-executive-departure.html,2022-07-01 to 2022-09-30
Goldman Sachs,Finance/Banking,Why the 1 Percent Buyback Tax Doesn’t Scare Investors,"Democrats hope the tax will encourage companies to spend more on workers and operations, but strategists think it’s unlikely to deter corporations from repurchasing their stock.",2022-08-16T13:43:49+0000,https://www.nytimes.com/2022/08/16/business/1-percent-buyback-tax.html,2022-07-01 to 2022-09-30
Goldman Sachs,Finance/Banking,Twitter Whistle-blower Is Set to Testify in Washington,"Elon Musk’s legal team will follow closely the testimony of Twitter’s former head of security, Peiter Zatko, before the Senate Judiciary Committee.",2022-09-13T12:01:02+0000,https://www.nytimes.com/2022/09/13/business/dealbook/twitter-whistle-blower-senate-musk.html,2022-07-01 to 2022-09-30
Goldman Sachs,Finance/Banking,Biden’s Student Loan Plan Sets Off Fierce Debate Among Economists,"Liberals and more moderate Democrats are arguing over the impact on inflation, the federal budget deficit and high earners.",2022-08-30T07:00:10+0000,https://www.nytimes.com/2022/08/30/business/economy/biden-student-loans-economists.html,2022-07-01 to 2022-09-30
Goldman Sachs,Finance/Banking,"More Fed officials back a big July rate move, but downplay recession fears.","A central bank governor and president spoke in favor of a 0.75 percentage point rate increase this month, even as recession worries abound.",2022-07-07T20:08:22+0000,https://www.nytimes.com/2022/07/07/business/federal-reserve-interest-rate-increase-recession.html,2022-07-01 to 2022-09-30
Goldman Sachs,Finance/Banking,"After Enduring a Pandemic, Small Businesses Face New Worries",It has been a tough few years for companies without the scale to cruise through disruption. Making money isn’t getting any easier.,2022-07-26T09:00:17+0000,https://www.nytimes.com/2022/07/26/business/economy/small-business-recession.html,2022-07-01 to 2022-09-30
Goldman Sachs,Finance/Banking,Silicon Valley’s Elite Get Dragged Into Musk-Twitter Trial,More than 100 subpoenas have been issued to techies like Jack Dorsey and Marc Andreessen as Twitter tries to force Elon Musk to complete a $44 billion deal. Law firms are stoked.,2022-08-29T09:00:36+0000,https://www.nytimes.com/2022/08/29/technology/musk-twitter-trial-lawyers.html,2022-07-01 to 2022-09-30
Goldman Sachs,Finance/Banking,Hugh Jackman Swaps West Village Home for Chelsea Penthouse,"The actor and his wife bought the penthouse for $21.1 million. The biggest closing in August, atop the Crown Building on Fifth Avenue, sold for $53.4 million.",2022-09-02T09:00:16+0000,https://www.nytimes.com/2022/09/02/realestate/hugh-jackman-chelsea-penthouse-nyc.html,2022-07-01 to 2022-09-30
Goldman Sachs,Finance/Banking,The Cost of Extreme Heat,"Britain this morning recorded its highest temperature ever, bringing parts of the country to a standstill and testing infrastructure.",2022-07-19T12:48:23+0000,https://www.nytimes.com/2022/07/19/business/dealbook/uk-heatwave-economy.html,2022-07-01 to 2022-09-30
Goldman Sachs,Finance/Banking,A Tax Loophole’s Powerful Defender,Senator Kyrsten Sinema had one main request before she would support a key spending bill: Preserve a tax loophole that mainly benefits people in private equity.,2022-08-05T13:02:45+0000,https://www.nytimes.com/2022/08/05/business/dealbook/sinema-tax-loophole-carried-interest.html,2022-07-01 to 2022-09-30
Goldman Sachs,Finance/Banking,Wonking Out: Much Ado About Wages,Why workers’ pay has become central to inflation debates.,2022-07-29T17:30:05+0000,https://www.nytimes.com/2022/07/29/opinion/wages-inflation-workers-prices.html,2022-07-01 to 2022-09-30
Goldman Sachs,Finance/Banking,"A broad, rapid rise in prices spells trouble.",,2022-07-13T09:01:14+0000,https://www.nytimes.com/2022/07/12/business/june-inflation-cpi.html,2022-07-01 to 2022-09-30
Goldman Sachs,Finance/Banking,"The Fed Is Cooling Down the Economy, but Stocks Are Hot. What Gives?","Investors are pinning their hopes on a rosy outcome for inflation and growth, driving the S&P 500 up 12 percent in the past two months.",2022-08-09T15:54:42+0000,https://www.nytimes.com/2022/08/09/business/stocks-rates-inflation.html,2022-07-01 to 2022-09-30
Goldman Sachs,Finance/Banking,"The Dollar Is Extremely Strong, Pushing Down the World","The value of the U.S. dollar is the strongest it has been in a generation, devaluing other currencies and unsettling the global economic outlook.",2022-07-16T09:00:04+0000,https://www.nytimes.com/interactive/2022/07/16/business/strong-dollar.html,2022-07-01 to 2022-09-30
Goldman Sachs,Finance/Banking,"The Feelings Were There, Even When Words Were Not","After talking to Abrielle Moore for weeks, Kobina Johnson got her number and then sent a one-word message: “hey.” When he learned it upset her, he sent another (longer) note that led to a first date.",2022-09-09T04:00:10+0000,https://www.nytimes.com/2022/09/09/style/abrielle-moore-kobina-johnson-wedding.html,2022-07-01 to 2022-09-30
Goldman Sachs,Finance/Banking,"Without Knowing It, Opening the Door to Romance","Jobina Fortson and Bradley Evans met when he knocked on her dorm-room door at Howard University looking to use her printer. Eleven years later, they married.",2022-09-16T04:00:04+0000,https://www.nytimes.com/2022/09/16/style/jobina-fortson-bradley-evans-wedding.html,2022-07-01 to 2022-09-30
Goldman Sachs,Finance/Banking,Wall Street Doesn’t Hate This Spending Bill,It’s the type of tax-and-spend legislation that investors usually frown upon. But analysts are seeing plenty of positives in the Inflation Reduction Act.,2022-08-17T13:16:53+0000,https://www.nytimes.com/2022/08/17/business/dealbook/inflation-reduction-act-stocks.html,2022-07-01 to 2022-09-30
Goldman Sachs,Finance/Banking,The Two Big Questions About Student Debt Relief,"No, helping former students won’t cause inflation to explode.",2022-08-25T23:00:05+0000,https://www.nytimes.com/2022/08/25/opinion/student-debt-relief-biden.html,2022-07-01 to 2022-09-30
Goldman Sachs,Finance/Banking,Global Markets Tumble as Recession Fears Return,Central banks around the world raised interest rates this week to combat inflation. That’s raising concerns among investors about an economic slump.,2022-09-23T20:09:03+0000,https://www.nytimes.com/2022/09/23/business/stock-market-today.html,2022-07-01 to 2022-09-30
Goldman Sachs,Finance/Banking,"At the Fed’s Big Conference, Investors Will Grasp for Hints About Rate Path","The Federal Reserve chair will speak at a key annual economics conference, which is focused on economic constraints. But investors will be listening for clues about the central bank’s path ahead.",2022-08-25T09:00:21+0000,https://www.nytimes.com/2022/08/25/business/economy/fed-conference-jerome-powell.html,2022-07-01 to 2022-09-30
Goldman Sachs,Finance/Banking,Barcelona Spent Its Way Into Crisis. Can It Now Spend Its Way Out?,"One of the world’s biggest soccer teams needed to close a $700 million shortfall. Its president, Joan Laporta, may have done it. But the club’s problems are not over.",2022-08-03T11:29:27+0000,https://www.nytimes.com/2022/08/03/sports/soccer/barcelona-laporta-de-jong.html,2022-07-01 to 2022-09-30
Goldman Sachs,Finance/Banking,OPEC Plus members agree to a small increase in oil production.,"Politically, the paltry increase would appear to be a snub of President Biden, who went to Saudi Arabia seeking assurances from big producers that they would act to cool oil markets.",2022-08-03T08:35:08+0000,https://www.nytimes.com/2022/08/03/business/energy-environment/opec-plus-meeting.html,2022-07-01 to 2022-09-30
Goldman Sachs,Finance/Banking,Bitter Race to Lead U.K. Is Ending With Little to Offer for Economic Ills,The contest to succeed Boris Johnson as Conservative Party leader and prime minister has often seemed divorced from Britain’s fast-growing problems.,2022-08-31T21:44:41+0000,https://www.nytimes.com/2022/08/31/world/europe/uk-prime-minister-truss-sunak.html,2022-07-01 to 2022-09-30
Goldman Sachs,Finance/Banking,They Wanted Good Light and a Dog Park. But the Front Door Could Not Face South. ,"Guided by the principles of Vastu Shastra, an ancient Indian philosophy of design, two first-time buyers searched the Brooklyn waterfront for a place where they could start a family.",2022-09-22T09:00:02+0000,https://www.nytimes.com/interactive/2022/09/22/realestate/three-bedroom-brooklyn-williamsburg-dumbo.html,2022-07-01 to 2022-09-30
Goldman Sachs,Finance/Banking,The Week in Business: Job Growth Is Solid but Slowing,Jobs growth is slowing but still strong. Bed Bath & Beyond gets a reprieve. A former Uber executive goes to trial.,2022-09-04T17:54:34+0000,https://www.nytimes.com/2022/09/04/business/jobs-growth-federal-reserve.html,2022-07-01 to 2022-09-30
Goldman Sachs,Finance/Banking,McKinsey Is a Consulting Powerhouse. But Is It a Force for Good?,"“When McKinsey Comes to Town,” by the Times reporters Walt Bogdanich and Michael Forsythe, argues that the legendary firm has accrued an inordinate amount of influence chasing profits at the expense of moral principle.",2022-09-29T13:00:07+0000,https://www.nytimes.com/2022/09/29/books/review/when-mckinsey-comes-to-town-walt-bogdanich-michael-forsythe.html,2022-07-01 to 2022-09-30
Goldman Sachs,Finance/Banking,"Not the Win We Wanted, but a Win Nonetheless",Biden’s plan for student loan forgiveness is an important step forward.,2022-08-26T23:00:03+0000,https://www.nytimes.com/2022/08/26/opinion/student-loan-debt-cancellation.html,2022-07-01 to 2022-09-30
Goldman Sachs,Finance/Banking,What Comes Next in the Fed’s Fight Against Inflation?,"Wall Street will watch the central bank’s economic forecasts closely on Wednesday, when another jumbo-size rate increase is expected.",2022-09-20T09:00:17+0000,https://www.nytimes.com/2022/09/20/business/economy/federal-reserve-preview-forecasts.html,2022-07-01 to 2022-09-30
Goldman Sachs,Finance/Banking,The Fed Appears More Optimistic Than Some Investors. Here’s Why.,"In some corners of the market, investors just don’t see how the Federal Reserve can lower inflation without risking high unemployment.",2022-09-23T17:38:09+0000,https://www.nytimes.com/2022/09/23/business/fed-stocks-wall-street.html,2022-07-01 to 2022-09-30
Goldman Sachs,Finance/Banking,Will Companies Help Their Employees Get Abortions?,There’s no ducking this fight.,2022-07-01T19:00:05+0000,https://www.nytimes.com/2022/07/01/opinion/abortion-employer-employees.html,2022-07-01 to 2022-09-30
Goldman Sachs,Finance/Banking,The Republican War on Sex,"In the America where I came of age, I was told my life was worth more than my ability to have babies. And my sexuality was nothing to be ashamed of.",2022-07-02T12:16:12+0000,https://www.nytimes.com/2022/07/02/opinion/abortion-ban-sex.html,2022-07-01 to 2022-09-30
Goldman Sachs,Finance/Banking,Stocks Slide in One of Wall Street’s Worst Weeks This Year,Pessimism is deepening as bellwether companies like FedEx and General Electric warn of worsening economic and business conditions.,2022-09-16T14:38:26+0000,https://www.nytimes.com/2022/09/16/business/stock-market-economy.html,2022-07-01 to 2022-09-30
Goldman Sachs,Finance/Banking,Will a Renewed Iran Nuclear Deal Mean Cheaper Energy?,A successful deal to restrain Iran’s nuclear program would mean that Washington lifts tough sanctions on Iran’s oil and gas exports. But it may already be too late for that to help this winter.,2022-09-01T09:00:43+0000,https://www.nytimes.com/2022/09/01/world/europe/iran-nuclear-deal-energy-prices.html,2022-07-01 to 2022-09-30
Goldman Sachs,Finance/Banking,"Biden, Oil and the Middle East","Under pressure as tight oil supplies hurt the U.S. economy, Biden will go to Saudi Arabia for a meeting with M.B.S.",2022-07-14T12:54:39+0000,https://www.nytimes.com/2022/07/14/business/dealbook/biden-saudi-arabia-oil-middle-east-netflix.html,2022-07-01 to 2022-09-30
Goldman Sachs,Finance/Banking,"In a Surprise, Russia Says the Gas Pipeline to Germany Will Remain Closed","Nord Stream 1, operated by state-owned Gazprom, won’t reopen Saturday as expected, heightening fears Russia will step up its use of energy to pressure Europe.",2022-09-02T14:00:10+0000,https://www.nytimes.com/2022/09/02/business/gazprom-nordstream.html,2022-07-01 to 2022-09-30
Goldman Sachs,Finance/Banking,Biden’s Student Loan Plan Squarely Targets the Middle Class,President Biden is offering what independent analysts suggest would be his most targeted assistance yet to middle-class workers — while trying to repair what he casts as a broken bridge to the middle class.,2022-08-25T19:25:57+0000,https://www.nytimes.com/2022/08/25/us/politics/biden-student-loans-middle-class.html,2022-07-01 to 2022-09-30
