company,sector,headline,snippet,pub_date,url,quarter
Apple Inc,Technology,Facebook Starts Planning for Permanent Remote Workers,The move is a stark change from an office-centric culture. But there’s a catch: Salaries are likely to change to match local costs of living.,2020-05-21T22:41:55+0000,https://www.nytimes.com/2020/05/21/technology/facebook-remote-work-coronavirus.html,2020-04-01 to 2020-06-30
Apple Inc,Technology,F.B.I. Finds Links Between Pensacola Gunman and Al Qaeda,"The gunman in December’s shooting, a Saudi cadet who had trained with the U.S. military, had been in contact with the terrorist group, officials said.",2020-05-18T13:22:04+0000,https://www.nytimes.com/2020/05/18/us/politics/justice-department-al-qaeda-florida-naval-base-shooting.html,2020-04-01 to 2020-06-30
Apple Inc,Technology,Stocks Surge as Oil Prices Rally,The latest on stock market and business news during the coronavirus outbreak.,2020-05-18T04:12:59+0000,https://www.nytimes.com/2020/05/18/business/stock-market-today-coronavirus.html,2020-04-01 to 2020-06-30
Apple Inc,Technology,Your iPhone Costs Too Much,"It’s a failure that all the energy and marketing muscle goes to the Lexus of smartphones, not the Corollas. This is starting to change.",2020-05-07T16:46:06+0000,https://www.nytimes.com/article/iphone-costs.html,2020-04-01 to 2020-06-30
Apple Inc,Technology,"Eager to Corral the Coronavirus, U.K. Tests a Disputed Tracing App",The British government’s tool to track infected people puts it at odds with Apple and Google on privacy.,2020-05-07T14:27:11+0000,https://www.nytimes.com/2020/05/07/world/europe/uk-coronavirus-contact-tracing.html,2020-04-01 to 2020-06-30
Apple Inc,Technology,Apple iPhone SE Review: A Superb Smartphone for a Humble Price,"For $399, this smartphone hits the high notes: speedy, a great camera and a nice screen. Took long enough, didn’t it?",2020-05-06T19:12:14+0000,https://www.nytimes.com/2020/05/06/technology/personaltech/apple-iphone-se-review.html,2020-04-01 to 2020-06-30
Apple Inc,Technology,Apple’s First-Quarter Sales Are Up Despite Coronavirus Slowdown,"The tech giant signaled confidence by announcing another big stock buyback, but it declined to forecast sales for the current quarter.",2020-04-30T22:35:06+0000,https://www.nytimes.com/2020/04/30/technology/apple-sales-earnings-coronavirus.html,2020-04-01 to 2020-06-30
Apple Inc,Technology,The Immunity of the Tech Giants,"When the pandemic is over, we most certainly should fear the industry more than ever.",2020-05-01T20:49:25+0000,https://www.nytimes.com/2020/05/01/opinion/tech-companies-coronavirus.html,2020-04-01 to 2020-06-30
Apple Inc,Technology,Jeff Bezos Doubles Down on Amazon’s Pandemic Response,Amazon’s chief said that pandemic-related expenses would consume all profits in the current quarter — and that it was part of a deliberate strategy.,2020-05-01T10:51:15+0000,https://www.nytimes.com/2020/05/01/business/dealbook/bezos-amazon-coronavirus.html,2020-04-01 to 2020-06-30
Apple Inc,Technology,"The F.B.I.’s Director, a Critic of Strong Encryption, Once Defended It",Christopher Wray has said tough encryption offered by companies like Facebook and Apple blinds law enforcement. But his law firm defended it five years ago.,2020-04-30T17:02:28+0000,https://www.nytimes.com/2020/04/30/technology/christopher-wray-fbi-encryption.html,2020-04-01 to 2020-06-30
Apple Inc,Technology,"The Bad News Won’t Stop, but Markets Keep Rising","Trillions in stimulus dollars have convinced Wall Street that the government has its back, and investors are seizing on even glimmers of good news about the pandemic.",2020-04-29T22:39:03+0000,https://www.nytimes.com/2020/04/29/business/stock-markets.html,2020-04-01 to 2020-06-30
Apple Inc,Technology,A Scramble for Virus Apps That Do No Harm,Dozens of tracking apps for smartphones are being used or developed to help contain the coronavirus pandemic. But there are worries about privacy and hastily written software.,2020-04-29T09:00:29+0000,https://www.nytimes.com/2020/04/29/business/coronavirus-cellphone-apps-contact-tracing.html,2020-04-01 to 2020-06-30
Apple Inc,Technology,Investors Bet Giant Companies Will Dominate After Crisis,"The virus outbreak supercharged a continuing shift in the markets, with a few giant companies now exerting the most influence over the direction of stocks since the tech boom.",2020-04-28T15:55:04+0000,https://www.nytimes.com/2020/04/28/business/coronavirus-stocks.html,2020-04-01 to 2020-06-30
Apple Inc,Technology,Why Apple’s iPad Is the Gadget of the Pandemic,Shelter-in-place orders have transformed the tablet computer from a superfluous device into a must-have.,2020-04-21T09:00:19+0000,https://www.nytimes.com/2020/04/21/technology/personaltech/apple-ipad-gadget-pandemic.html,2020-04-01 to 2020-06-30
Apple Inc,Technology,When Your Phone Says You’ve Been Exposed to the Coronavirus,Silicon Valley wants to help end the pandemic. Is that a good thing?,2020-04-21T21:55:03+0000,https://www.nytimes.com/2020/04/21/opinion/coronavirus-apple-google.html,2020-04-01 to 2020-06-30
Apple Inc,Technology,Why Apple’s New Phone Doesn’t Matter,New smartphones have become like refrigerators. They’re just not that exciting.,2020-04-15T16:46:37+0000,https://www.nytimes.com/2020/04/15/technology/iphone-se.html,2020-04-01 to 2020-06-30
Apple Inc,Technology,"Apple, in a Virtual Unveiling, Introduces a $399 iPhone","The new iPhone SE has the design of an older generation of iPhones, with the same computing power as newer ones.",2020-04-15T15:00:08+0000,https://www.nytimes.com/2020/04/15/technology/personaltech/apple-new-iphone-se.html,2020-04-01 to 2020-06-30
Apple Inc,Technology,Why Can’t America Make Enough Masks or Ventilators?,"The president has promoted himself as a champion of American manufacturing, but now he avoids addressing its shortcomings.",2020-04-14T09:00:17+0000,https://www.nytimes.com/2020/04/14/opinion/coronavirus-industry-manufacturing.html,2020-04-01 to 2020-06-30
Apple Inc,Technology,We’re Shopping a Ton Online. Let’s Be Conscientious About It,How we shop during the pandemic could have big consequences.,2020-04-13T16:53:03+0000,https://www.nytimes.com/2020/04/13/technology/coronavirus-ethical-shopping.html,2020-04-01 to 2020-06-30
Apple Inc,Technology,Apple and Google Team Up to ‘Contact Trace’ the Coronavirus,The technology giants said they would embed a feature in iPhones and Android devices to enable users to track infected people they’d come close to.,2020-04-10T17:01:26+0000,https://www.nytimes.com/2020/04/10/technology/apple-google-coronavirus-contact-tracing.html,2020-04-01 to 2020-06-30
Apple Inc,Technology,Domestic Abusers Can Control Your Devices. Here’s How to Fight Back.,"Here’s how to record abuse without being discovered, safeguard your devices, and, ultimately, protect yourself.",2020-04-06T22:00:08+0000,https://www.nytimes.com/2020/04/06/smarter-living/wirecutter/domestic-abusers-can-control-your-devices-heres-how-to-fight-back.html,2020-04-01 to 2020-06-30
Apple Inc,Technology,Jenny Slate and Kristen Bell Leave Voice Roles as Black Characters,"The actresses say the parts on “Big Mouth” and “Central Park” should have gone to people of color, and creators of the animated shows have apologized.",2020-06-25T18:08:36+0000,https://www.nytimes.com/2020/06/25/arts/television/jenny-slate-big-mouth.html,2020-04-01 to 2020-06-30
Apple Inc,Technology,Beyond ‘Black Mirror’: 7 Shows That Serve Bite-Size Scares,"The Netflix hit rejuvenated interest in short, dark TV tales, and now streaming services are awash in eerie stories with last-minute twists. Here’s a blood-spattered buffet of horror anthologies.",2020-05-04T17:26:50+0000,https://www.nytimes.com/2020/05/04/arts/television/best-horror-creepshow.html,2020-04-01 to 2020-06-30
Apple Inc,Technology,How to Make the Perfect Playlist,Need something fresh to listen to? Maybe something inspiring? These tips will help.,2020-04-10T21:30:07+0000,https://www.nytimes.com/2020/04/10/smarter-living/make-the-perfect-playlist-spotify-apple-music-pandora.html,2020-04-01 to 2020-06-30
Apple Inc,Technology,"The Best Movies and TV Shows Coming to Netflix, Amazon and More in April","Every month, subscription streaming services add a new batch of titles to their libraries. Here are our picks for April.",2020-04-01T19:35:44+0000,https://www.nytimes.com/2020/04/01/arts/television/new-to-stream-netflix.html,2020-04-01 to 2020-06-30
Apple Inc,Technology,How Do I Get HBO Max if I Already Have HBO?,Almost 35 million people have HBO. But not all of them can get HBO Max. Here’s what you need to know.,2020-05-27T20:39:59+0000,https://www.nytimes.com/article/hbo-max-amazon-roku.html,2020-04-01 to 2020-06-30
Apple Inc,Technology,Frosted Flakes,We explore “Tiger King” and what it says about America’s unique relationship to freedom.,2020-04-09T18:29:18+0000,https://www.nytimes.com/2020/04/09/podcasts/still-processing-tiger-king.html,2020-04-01 to 2020-06-30
Apple Inc,Technology,Big Tech’s Worries Should Worry You,"When the most successful companies are anxious, you know we’re in scary times.",2020-05-01T17:26:57+0000,https://www.nytimes.com/2020/05/01/technology/coronavirus-big-tech-earnings.html,2020-04-01 to 2020-06-30
Apple Inc,Technology,Corporate America Says Black Lives Matter. It Needs to Hold Up a Mirror.,It’s time for companies to move beyond mere tweets and hire more black employees at every level.,2020-06-15T09:00:14+0000,https://www.nytimes.com/2020/06/15/opinion/black-lives-matter-corporate-pledges.html,2020-04-01 to 2020-06-30
Apple Inc,Technology,Inside Mark Zuckerberg’s Brain,What Facebook’s C.E.O. is doing to confront the coronavirus — and what he’s afraid of.,2020-05-18T16:28:54+0000,https://www.nytimes.com/2020/05/18/technology/mark-zuckerberg-coronavirus.html,2020-04-01 to 2020-06-30
Apple Inc,Technology,"Sorry, eBay and Uber. You’re Hated.",Why the middlemen are the internet’s villains.,2020-06-24T16:44:50+0000,https://www.nytimes.com/2020/06/24/technology/internet-middlemen.html,2020-04-01 to 2020-06-30
Apple Inc,Technology,The Sunday Read: ‘Letters of Recommendation’,"Our worlds are smaller now. So for today, expand yours by peering through the views offered by a writer’s window, a grandmother’s diary and a believer’s superstition.",2020-05-17T13:00:09+0000,https://www.nytimes.com/2020/05/17/podcasts/the-daily/letters-of-recommendation.html,2020-04-01 to 2020-06-30
Apple Inc,Technology,One Meat Plant. One Thousand Infections.,"“I came to America thinking I could never go through hell.” After surviving civil war in Sudan, one of America’s most vulnerable workers faces the coronavirus.",2020-05-04T09:57:31+0000,https://www.nytimes.com/2020/05/04/podcasts/the-daily/meat-processing-coronavirus.html,2020-04-01 to 2020-06-30
Apple Inc,Technology,How Facebook Is Undermining ‘Black Lives Matter’,The company publicly supports the racial justice movement. But content on the platform may be compromising the cause.,2020-06-22T09:52:57+0000,https://www.nytimes.com/2020/06/22/podcasts/the-daily/facebook-twitter-black-lives-matter-trump.html,2020-04-01 to 2020-06-30
Apple Inc,Technology,Conviction in the Philippines Reveals Facebook’s Dangers,The conviction of the journalist Maria Ressa shows that Facebook’s harms can’t be ignored.,2020-06-16T17:12:11+0000,https://www.nytimes.com/2020/06/16/technology/facebook-philippines.html,2020-04-01 to 2020-06-30
Apple Inc,Technology,Amazon Says Jeff Bezos Is Willing to Testify Before Congress,Lawmakers had requested that he testify as part of their antitrust investigation into the big tech companies.,2020-06-15T14:12:41+0000,https://www.nytimes.com/2020/06/15/technology/amazon-jeff-bezos-congress.html,2020-04-01 to 2020-06-30
Apple Inc,Technology,Facebook Loses Antitrust Decision in Germany Over Data Collection,"In a closely watched case, Facebook lost an appeal related to charges that it has violated competition laws by abusing its dominance in social media.",2020-06-23T18:05:52+0000,https://www.nytimes.com/2020/06/23/technology/facebook-antitrust-germany.html,2020-04-01 to 2020-06-30
Apple Inc,Technology,Amazon Set to Face Antitrust Charges in European Union,The European Commission plans to bring charges that Amazon abused its dominance in e-commerce.,2020-06-11T14:19:40+0000,https://www.nytimes.com/2020/06/11/technology/amazon-antitrust-european-union.html,2020-04-01 to 2020-06-30
Apple Inc,Technology,"News Quiz: George Floyd, Twitter, Coronavirus",Did you follow the headlines this week?,2020-05-29T07:30:01+0000,https://www.nytimes.com/interactive/2020/05/29/briefing/george-floyd-twitter-coronavirus-news-quiz.html,2020-04-01 to 2020-06-30
Apple Inc,Technology,Amazon Said to Be Under Scrutiny in 2 States for Abuse of Power,Inquiries in California and Washington are a sign that the scrutiny of the tech giant continues to intensify.,2020-06-12T22:18:18+0000,https://www.nytimes.com/2020/06/12/technology/state-inquiry-antitrust-amazon.html,2020-04-01 to 2020-06-30
Apple Inc,Technology,Amazon Makes No Promises on Bezos Testimony,The company said it would be happy to send someone to testify. But it never mentions Jeff Bezos.,2020-05-15T22:44:45+0000,https://www.nytimes.com/2020/05/15/technology/jeff-bezos-amazon-testimony-congress.html,2020-04-01 to 2020-06-30
Apple Inc,Technology,Why All the Shouting About Google?,Here’s the one question that matters: Does Google rig the system to squash its rivals and hurt us?,2020-05-22T17:17:32+0000,https://www.nytimes.com/2020/05/22/technology/google-antitrust.html,2020-04-01 to 2020-06-30
Apple Inc,Technology,The Virus Revealed Our Essential Tech (and Weeded Out the Excess),"A computer with a good internet connection, communication apps and entertainment are the only tech we really need, ever.",2020-04-15T09:00:23+0000,https://www.nytimes.com/2020/04/15/technology/personaltech/virus-essential-tech.html,2020-04-01 to 2020-06-30
Apple Inc,Technology,Congress Calls on Jeff Bezos of Amazon to Testify,"Lawmakers want to question Mr. Bezos, Amazon’s chief executive, as part of its antitrust investigation.",2020-05-01T14:55:37+0000,https://www.nytimes.com/2020/05/01/technology/jeff-bezos-congress.html,2020-04-01 to 2020-06-30
Apple Inc,Technology,"After a Terrible First Quarter, Executives Offer Some Hope","While the pandemic has made it hard to offer forecasts, some corporate leaders said things might be getting a little better — or at least no worse.",2020-05-05T18:12:26+0000,https://www.nytimes.com/2020/05/05/business/economy/coronavirus-earnings-first-quarter.html,2020-04-01 to 2020-06-30
Apple Inc,Technology,Corporate Hashtag Activism,Brands are trying to show solidarity with customers’ strongly held values without giving offense.,2020-06-03T11:20:57+0000,https://www.nytimes.com/2020/06/03/business/dealbook/protests-company-response.html,2020-04-01 to 2020-06-30
Apple Inc,Technology,"Michael Hawley, Programmer, Professor and Pianist, Dies at 58","A man of manifold interests, his achievements ranged from developing ideas behind the so-called Internet of Things to publishing the world’s biggest book.",2020-06-25T00:12:42+0000,https://www.nytimes.com/2020/06/24/technology/michael-hawley-dead.html,2020-04-01 to 2020-06-30
Apple Inc,Technology,Jack Dorsey Vows to Donate $1 Billion to Fight the Coronavirus,The founder of Twitter and Square said he was putting nearly a third of his total wealth toward the effort.,2020-04-07T22:18:37+0000,https://www.nytimes.com/2020/04/07/technology/jack-dorsey-donate-1-billion-coronavirus.html,2020-04-01 to 2020-06-30
Apple Inc,Technology,Zoom’s Biggest Rivals Are Coming for It,"Facebook, Google and other behemoths are training their sights on Silicon Valley’s company of the moment.",2020-04-24T18:15:09+0000,https://www.nytimes.com/2020/04/24/technology/zoom-rivals-virus-facebook-google.html,2020-04-01 to 2020-06-30
Apple Inc,Technology,"No, the Best Doesn’t Win",“It just works” are some of the most powerful words in technology.,2020-04-27T17:00:42+0000,https://www.nytimes.com/2020/04/27/technology/no-the-best-doesnt-win.html,2020-04-01 to 2020-06-30
Apple Inc,Technology,"The Idea: Build It, and They Can Find Coronavirus Tests",Three start-up veterans who created an online directory of testing sites are among a wave of volunteers contributing to the virus fight.,2020-06-08T09:00:17+0000,https://www.nytimes.com/2020/06/08/technology/coronavirus-test-sites-startups.html,2020-04-01 to 2020-06-30
Apple Inc,Technology,The Coronavirus Could Rewrite the Rules for Silicon Valley,"Amazon may be bigger than ever, but change is coming for the tech giants, too.",2020-04-30T19:43:51+0000,https://www.nytimes.com/2020/04/30/opinion/coronavirus-amazon-earnings.html,2020-04-01 to 2020-06-30
Apple Inc,Technology,Berkshire Hathaway Lost $49.7 Billion in First Quarter Stung by Coronavirus,The huge loss reflects the hit that the crisis has inflicted on Warren E. Buffett’s vast conglomerate.,2020-05-02T12:25:17+0000,https://www.nytimes.com/2020/05/02/business/berkshire-hathaway-stock-warren-buffett.html,2020-04-01 to 2020-06-30
Apple Inc,Technology,Facebook to Introduce an App for Gaming,Video games are surging in popularity in the pandemic. So Facebook is rolling out an app designed for creating and watching live gameplay.,2020-04-19T15:00:07+0000,https://www.nytimes.com/2020/04/19/technology/facebook-app-gaming.html,2020-04-01 to 2020-06-30
Apple Inc,Technology,"Retailers, Battered by Pandemic, Now Confront Protests","Even as major chains boarded up stores and halted operations, they largely sought to convey empathy for demonstrators and did not condemn the damage to their businesses.",2020-06-01T20:33:08+0000,https://www.nytimes.com/2020/06/01/business/stores-protests-damage.html,2020-04-01 to 2020-06-30
Apple Inc,Technology,The Risk of ‘Overnight Ruin’,"Jay Clayton, the nation’s top securities regulator, has been thrust into a political firestorm. Where does that leave the S.E.C.?",2020-06-22T11:12:35+0000,https://www.nytimes.com/2020/06/22/business/dealbook/clayton-sec-berman.html,2020-04-01 to 2020-06-30
Apple Inc,Technology,Thursday’s Live-Streaming Events: A Second City Special and a Theatrical Premiere,"Appointment viewing is back. Here’s what to look out for today online, and when to tune in.",2020-04-16T09:00:18+0000,https://www.nytimes.com/2020/04/16/arts/live-streaming-events-concerts-coronavirus.html,2020-04-01 to 2020-06-30
Apple Inc,Technology,How a Cannabis Expert Spends Her Sundays,"“‘Antsy’ is a good word for how they’re feeling right now,” Sharron Cannon said of her patients at Curaleaf, where demand is high.",2020-06-19T09:00:19+0000,https://www.nytimes.com/2020/06/19/nyregion/coronavirus-weed-nyc.html,2020-04-01 to 2020-06-30
Apple Inc,Technology,U.S. Is Said to Plan to File Antitrust Charges Against Google,The case may be joined by state attorneys general in what would be one of the biggest antitrust actions by the United States since the late 1990s.,2020-05-16T00:04:23+0000,https://www.nytimes.com/2020/05/15/technology/google-antitrust-investigation.html,2020-04-01 to 2020-06-30
Apple Inc,Technology,"Former Hulu Boss Will Lead WarnerMedia, Home of HBO and CNN","Just before the start of HBO Max, AT&T names Jason Kilar as the head of its entertainment and news unit. He replaces John Stankey, who remains AT&T’s president.",2020-04-01T16:11:39+0000,https://www.nytimes.com/2020/04/01/business/media/warner-media-jason-kilar-john-stankey.html,2020-04-01 to 2020-06-30
Apple Inc,Technology,"Some Companies Seeking Bailouts Had Piles of Cash, Then Spent It","They poured the money into stock buybacks and dividends. Now, those hurting from the pandemic want government aid.",2020-04-24T09:00:17+0000,https://www.nytimes.com/2020/04/24/business/coronavirus-bailouts-buybacks-cash.html,2020-04-01 to 2020-06-30
Apple Inc,Technology,"Europe’s Privacy Law Hasn’t Shown Its Teeth, Frustrating Advocates","Nearly two years in, there has been little enforcement of the General Data Protection Regulation, once seen as ushering in a new era.",2020-04-27T09:00:16+0000,https://www.nytimes.com/2020/04/27/technology/GDPR-privacy-law-europe.html,2020-04-01 to 2020-06-30
Apple Inc,Technology,"The Reopening, in 5 Charts","As states ease lockdown orders, Americans are eating out, booking flights and buying houses again. Here’s what that looks like.",2020-05-26T11:25:30+0000,https://www.nytimes.com/2020/05/26/business/dealbook/coronavirus-reopening-economy.html,2020-04-01 to 2020-06-30
Apple Inc,Technology,Privacy Cannot Be a Casualty of the Coronavirus,Many Americans now rely on digital tools to work remotely and stay connected. They shouldn’t have to sacrifice their privacy to use them.,2020-04-07T22:00:41+0000,https://www.nytimes.com/2020/04/07/opinion/digital-privacy-coronavirus.html,2020-04-01 to 2020-06-30
Apple Inc,Technology,An L.G.B.T. Landmark,"In an unexpected ruling, the Supreme Court said that the Civil Rights Act protects workers if they’re fired “merely for being gay or transgender.”",2020-06-16T11:06:26+0000,https://www.nytimes.com/2020/06/16/business/dealbook/supreme-court-lgbt.html,2020-04-01 to 2020-06-30
Apple Inc,Technology,A Former Google Executive Takes Aim at His Old Company With a Start-Up,Sridhar Ramaswamy once ran Google’s $115 billion advertising arm. But he grew disillusioned and worried that growth was too much of a priority.,2020-06-19T09:00:27+0000,https://www.nytimes.com/2020/06/19/technology/google-neeva-executive.html,2020-04-01 to 2020-06-30
Apple Inc,Technology,A Privacy Absolutist Isn’t So Sure Anymore,"The urgency of the pandemic has made Charlie Warzel, an Opinion writer for The Times, question his beliefs on the dangers of location tracking.",2020-04-17T16:39:07+0000,https://www.nytimes.com/2020/04/17/technology/coronavirus-location-tracking.html,2020-04-01 to 2020-06-30
Apple Inc,Technology,Review: ‘Hollywood’ Gives Movie History a Sudsy Rewrite,"Ryan Murphy’s latest for Netflix starts an intriguing journey into an alternative 1940s Tinseltown, then swerves into schmaltz.",2020-04-30T14:39:57+0000,https://www.nytimes.com/2020/04/30/arts/television/hollywood-review.html,2020-04-01 to 2020-06-30
Apple Inc,Technology,"When the C.E.O., Already Facing a Crisis, Gets the Coronavirus","Business cratered at Booking Holdings, the online travel giant. Then its chief executive found out he was sick, too.",2020-05-26T09:00:20+0000,https://www.nytimes.com/2020/05/26/technology/ceo-coronavirus-booking-holdings-fogel.html,2020-04-01 to 2020-06-30
Apple Inc,Technology,What Happened to the Great American Logistics Machine?,"Nobody could make supply chains sing like the United States. And now maybe nobody can, period.",2020-05-22T09:00:31+0000,https://www.nytimes.com/2020/05/22/business/logistics-supply-chains.html,2020-04-01 to 2020-06-30
Apple Inc,Technology,It’s Now Amazon’s Turn in the Spotlight,The tech superpower faces hard questions over how it’s handling worker safety.,2020-04-06T16:48:48+0000,https://www.nytimes.com/2020/04/06/technology/coronavirus-amazon-workers.html,2020-04-01 to 2020-06-30
Apple Inc,Technology,"Trump Campaign Has Spent $325,000 on Facebook Ads Featuring Brad Parscale’s Page","Until this week, Mr. Parscale, the president’s campaign manager, was one of only three people whose Facebook and Instagram pages had been used by the campaign to display ads. The others were Donald Trump and Mike Pence.",2020-06-30T21:10:44+0000,https://www.nytimes.com/2020/06/30/us/politics/brad-parscale-trump.html,2020-04-01 to 2020-06-30
Apple Inc,Technology,Facebook Invests $5.7 Billion in Indian Internet Giant Jio,"It was the largest bet by the social network on the developing market, where millions of people have gone online in recent years.",2020-04-22T02:20:18+0000,https://www.nytimes.com/2020/04/21/technology/facebook-jio-india.html,2020-04-01 to 2020-06-30
Apple Inc,Technology,9 Great Music Documentaries to Stream on Netflix,"No hagiographies to be found here, with looks at the lives and careers of Quincy Jones, Nina Simone and Taylor Swift, among others.",2020-05-12T15:58:03+0000,https://www.nytimes.com/2020/05/12/arts/netflix-music-documentaries.html,2020-04-01 to 2020-06-30
Apple Inc,Technology,Our Ingenuity Shapes Facebook,We mortals are showing one of the internet era’s mightiest companies how it should evolve.,2020-04-24T16:58:32+0000,https://www.nytimes.com/2020/04/24/technology/our-ingenuity-shapes-facebook.html,2020-04-01 to 2020-06-30
Apple Inc,Technology,Two Veteran C.E.O.s Risk $1.8 Billion on a Streaming App. In a Pandemic.,Jeffrey Katzenberg and Meg Whitman had to cancel a starry Hollywood party for their short-video platform because of the virus. But Quibi is still going live.,2020-04-05T18:39:11+0000,https://www.nytimes.com/2020/04/05/business/media/quibi-streaming-app-jeffrey-katzenberg-meg-whitman.html,2020-04-01 to 2020-06-30
Apple Inc,Technology,"Milton Glaser, Master Designer of ‘I ♥ NY’ Logo, Is Dead at 91","He was also a founder of New York magazine, created a memorable Bob Dylan poster and produced designs for everything from supermarkets to restaurants to “Mad Men.”",2020-06-27T02:19:19+0000,https://www.nytimes.com/2020/06/26/obituaries/milton-glaser-dead.html,2020-04-01 to 2020-06-30
Apple Inc,Technology,HBO Max Is Here to Take On Netflix. Is It Too Late?,"AT&T’s streaming platform goes live on Wednesday. At $15 a month, it’s more expensive than its rivals and comes at a time when household income is dropping.",2020-05-26T17:31:46+0000,https://www.nytimes.com/2020/05/26/business/media/hbo-max-netflix-streaming.html,2020-04-01 to 2020-06-30
