company,sector,headline,snippet,pub_date,url,quarter
Apple Inc,Technology,Your Wednesday Evening Briefing,Here’s what you need to know at the end of the day.,2022-09-07T21:55:35+0000,https://www.nytimes.com/2022/09/07/briefing/voter-fraud-putin-speech-wakanda.html,2022-07-01 to 2022-09-30
Apple Inc,Technology,Judge Hands Elon Musk a Win in Court,"The billionaire can amend his lawsuit to include claims from a Twitter whistle-blower, but lost an effort to delay a trial over whether he could drop his bid to buy the company.",2022-09-07T12:12:51+0000,https://www.nytimes.com/2022/09/07/business/dealbook/elon-musk-twitter-dispute-court.html,2022-07-01 to 2022-09-30
Apple Inc,Technology,The Week in Business: Job Growth Is Solid but Slowing,Jobs growth is slowing but still strong. Bed Bath & Beyond gets a reprieve. A former Uber executive goes to trial.,2022-09-04T17:54:34+0000,https://www.nytimes.com/2022/09/04/business/jobs-growth-federal-reserve.html,2022-07-01 to 2022-09-30
Apple Inc,Technology,An Apple Watch for Your 5-Year-Old? More Parents Say Yes.,"As Apple prepares to unveil new models next week, the smart watch has found an unexpected audience: children as young as 5.",2022-09-01T09:01:01+0000,https://www.nytimes.com/2022/09/01/technology/apple-watch-children-kids.html,2022-07-01 to 2022-09-30
Apple Inc,Technology,Tech Companies Slowly Shift Production Away From China,"Worried about geopolitical tensions and stung by pandemic shutdowns, Google, Apple and others are moving some work to nearby countries.",2022-09-01T09:01:10+0000,https://www.nytimes.com/2022/09/01/business/tech-companies-china.html,2022-07-01 to 2022-09-30
Apple Inc,Technology,Big Tech Reconsiders the “Made in China” Way,"Apple, Google and Microsoft are among the technology firms looking to shift some of their manufacturing out of China.",2022-09-01T11:54:05+0000,https://www.nytimes.com/2022/09/01/business/dealbook/big-tech-reconsiders-made-in-china-iphone.html,2022-07-01 to 2022-09-30
Apple Inc,Technology,How the Find My App Became an Accidental Friendship Fixture,"Introduced 10 years ago, the app has slowly become a popular way to keep track of friends. But it comes with considerable privacy concerns.",2022-08-20T07:00:12+0000,https://www.nytimes.com/2022/08/20/technology/find-my-app-friends.html,2022-07-01 to 2022-09-30
Apple Inc,Technology,She Had an AirTag in Her Lost Luggage. It Led Police to a Baggage Handler’s Home.,An airport worker in Florida was charged with two counts of grand theft after a tracking device aided a sheriff’s investigation.,2022-08-19T11:16:43+0000,https://www.nytimes.com/2022/08/19/us/airtags-luggage-theft.html,2022-07-01 to 2022-09-30
Apple Inc,Technology,Change These Default Settings and Be Happier With Your Tech,"Simple steps can make your smartphone, computer and TV work better for you.",2022-08-10T09:00:26+0000,https://www.nytimes.com/2022/08/10/technology/personaltech/default-settings-change.html,2022-07-01 to 2022-09-30
Apple Inc,Technology,Clock Running Out on Antitrust Bill Targeting Big Tech,A sweeping bill that would enact the strongest restrictions on Big Tech companies in the United States has been stalled in the Senate.,2022-08-05T20:08:00+0000,https://www.nytimes.com/2022/08/05/business/antitrust-bill-klobuchar.html,2022-07-01 to 2022-09-30
Apple Inc,Technology,Pixar’s Ousted Founder Returns With Apple and ‘Luck’,John Lasseter was toppled five years ago by allegations about his workplace behavior. He’s back with an animated film and a studio that could be Pixar 2.0.,2022-08-01T09:00:21+0000,https://www.nytimes.com/2022/08/01/business/media/john-lasseter-luck-apple.html,2022-07-01 to 2022-09-30
Apple Inc,Technology,Recession? Not for Big Tech.,Many companies are navigating tough times better than investors had feared.,2022-07-29T19:00:08+0000,https://www.nytimes.com/2022/07/29/opinion/recession-not-for-big-tech.html,2022-07-01 to 2022-09-30
Apple Inc,Technology,"Apple Continues to Grow, but Profits Drop as Costs Rise",The iPhone maker said it was hurt by Covid-related shutdowns of factories in Shanghai but benefited from its growing services business.,2022-07-28T21:17:33+0000,https://www.nytimes.com/2022/07/28/business/apple-earnings.html,2022-07-01 to 2022-09-30
Apple Inc,Technology,Big Tech Is Proving Resilient as the Economy Cools,"Tech companies are slowing their frenetic hiring, but a combination of dominance and diversity is turning out to be — yet again — an overwhelming asset.",2022-07-28T22:46:11+0000,https://www.nytimes.com/2022/07/28/business/big-tech-resilient-economy.html,2022-07-01 to 2022-09-30
Apple Inc,Technology,The Fed Won’t Say the ‘R’ Word,"Chair Jerome Powell was asked in every way possible whether the economy was in, or headed toward, a recession.",2022-07-28T12:34:01+0000,https://www.nytimes.com/2022/07/28/business/dealbook/federal-reserve-recession-facebook-antitrust.html,2022-07-01 to 2022-09-30
Apple Inc,Technology,The Default Tech Settings You Should Turn Off Right Away,"These controls, which are buried inside products from Apple, Google, Meta and others, make us share more data than we need to.",2022-07-27T09:00:26+0000,https://www.nytimes.com/2022/07/27/technology/personaltech/default-settings-turn-off.html,2022-07-01 to 2022-09-30
Apple Inc,Technology,Big Tech and the Fed,"Some tech companies’ earnings are flagging, in what could be a positive sign for the Federal Reserve.",2022-07-27T12:09:22+0000,https://www.nytimes.com/2022/07/27/business/dealbook/big-tech-fed.html,2022-07-01 to 2022-09-30
Apple Inc,Technology,Will Streaming Save Sports or Kill It?,Sports are the lifeblood of TV but also choking it. Big Tech is following a similar playbook.,2022-07-26T17:00:59+0000,https://www.nytimes.com/2022/07/26/technology/streaming-sports.html,2022-07-01 to 2022-09-30
Apple Inc,Technology,Cooling the Economy Without Crushing It,Several signs of economic stress may keep the Fed from raising interest rates to a full percentage point.,2022-07-25T12:50:24+0000,https://www.nytimes.com/2022/07/25/business/dealbook/fed-interest-rates.html,2022-07-01 to 2022-09-30
Apple Inc,Technology,Why Big Tech Is Making a Big Play for Live Sports,Competing for rights to broadcast games from the N.F.L. and other leagues could be hard for broadcast and cable companies that “aren’t playing by the same financial rules.”,2022-07-24T09:00:13+0000,https://www.nytimes.com/2022/07/24/technology/sports-streaming-rights.html,2022-07-01 to 2022-09-30
Apple Inc,Technology,Apple Agrees to $50 Million Settlement Over Butterfly Keyboard Complaints,"A class-action lawsuit represented customers who sought repairs for the troubled MacBook keyboard, released in certain laptops from 2015 to 2019. Many were frustrated by typing errors.",2022-07-20T21:53:32+0000,https://www.nytimes.com/2022/07/20/technology/apple-macbook-butterfly-key-settlement.html,2022-07-01 to 2022-09-30
Apple Inc,Technology,Who Will Make Apple Fashionable Now?,"With the metaverse looming, a shift in designer could make a big difference.",2022-07-20T10:35:32+0000,https://www.nytimes.com/2022/07/20/style/apple-jony-ive-headset.html,2022-07-01 to 2022-09-30
Apple Inc,Technology,"Apple Ends Consulting Agreement With Jony Ive, Its Former Design Leader","Three years after promising to work “long into the future” with the man behind its candy-colored computers, Apple and Mr. Ive are through.",2022-07-12T21:14:22+0000,https://www.nytimes.com/2022/07/12/technology/apple-jony-ive-end-agreement.html,2022-07-01 to 2022-09-30
Apple Inc,Technology,Former Apple Lawyer Pleads Guilty to Insider Trading,The official was the senior director of corporate law at Apple until he was fired in late 2018.,2022-07-01T01:34:46+0000,https://www.nytimes.com/2022/06/30/business/apple-levoff-insider-trading.html,2022-07-01 to 2022-09-30
Apple Inc,Technology,‘Succession’ Wins Best Drama at Emmys as HBO Triumphs Again,It was the sixth time in eight years that HBO has taken the television industry’s biggest prize for a recurring series. “Ted Lasso” won best comedy.,2022-09-13T03:15:22+0000,https://www.nytimes.com/2022/09/12/arts/television/emmys-succession-ted-lasso.html,2022-07-01 to 2022-09-30
Apple Inc,Technology,40 TV Shows to Watch This Fall,"Noteworthy premieres include new seasons of buzzy hits (“Abbott Elementary,” “The Handmaid’s Tale”), reboots and revivals (“Quantum Leap,” “Willow”) and more.",2022-09-08T11:00:18+0000,https://www.nytimes.com/2022/09/08/arts/television/tv-shows-this-fall.html,2022-07-01 to 2022-09-30
Apple Inc,Technology,5 Things to Do This Weekend,"A selection of entertainment highlights this weekend, including a behind-the-scenes look at Apple TV+'s ""Five Days at Memorial.""",2022-08-12T09:00:01+0000,https://www.nytimes.com/interactive/2022/08/12/arts/weekend-editors-picks-five-days-at-memorial.html,2022-07-01 to 2022-09-30
Apple Inc,Technology,"The Best Movies and TV Shows Coming to HBO, Hulu, Apple TV+ and More in July","Every month, streaming services add movies and TV shows to their libraries. Here are our picks for some of July’s most promising new titles.",2022-07-02T00:10:53+0000,https://www.nytimes.com/2022/07/01/arts/television/hbo-hulu-amazon.html,2022-07-01 to 2022-09-30
Apple Inc,Technology,The Word of the Year Is ‘Uncertainty’,Did tech win the pandemic or not? We likely won’t be able to tell for a while.,2022-07-28T16:04:00+0000,https://www.nytimes.com/2022/07/28/technology/tech-uncertainty.html,2022-07-01 to 2022-09-30
Apple Inc,Technology,Parler Returns to Google Play Store,Google said that Parler had more robust content moderation practices than it did when it was banned in the aftermath of the Jan. 6 riot.,2022-09-02T19:23:55+0000,https://www.nytimes.com/2022/09/02/technology/parler-google-play.html,2022-07-01 to 2022-09-30
Apple Inc,Technology,E.U. Scores Major Legal Victory Against Google,A court rejected Google’s appeal of a record-setting antitrust fine related to Android and online search.,2022-09-14T10:32:21+0000,https://www.nytimes.com/2022/09/14/business/eu-google-antitrust-fine.html,2022-07-01 to 2022-09-30
Apple Inc,Technology,Streaming Is Sadder Now,"When Netflix and other companies face a loss of faith in the growth potential of streaming, we all will feel it.",2022-07-20T16:34:56+0000,https://www.nytimes.com/2022/07/20/technology/streaming-netflix.html,2022-07-01 to 2022-09-30
Apple Inc,Technology,Snap reports its slowest quarterly growth and a wider loss in the second quarter.,"The company declined to forecast its future financial performance, citing “uncertainties related to the operating environment.”",2022-07-21T20:12:16+0000,https://www.nytimes.com/2022/07/21/business/snap-earnings.html,2022-07-01 to 2022-09-30
Apple Inc,Technology,We Know Shockingly Little About What Makes Humanity Prosper,Patrick Collison calls for a new “science of progress.”,2022-09-27T09:00:07+0000,https://www.nytimes.com/2022/09/27/opinion/ezra-klein-podcast-patrick-collison.html,2022-07-01 to 2022-09-30
Apple Inc,Technology,Google Says Trump’s Truth Social Must Scrub Violent Content to Join Play Store,"The social media app is not available on Google’s app store, and the former president’s company and Google are publicly disagreeing about why.",2022-08-30T20:57:56+0000,https://www.nytimes.com/2022/08/30/technology/google-trump-truth-social-violent-content.html,2022-07-01 to 2022-09-30
Apple Inc,Technology,Amazon Moves to End a Long-Running Antitrust Case in Europe,The retail giant said it would stop collecting nonpublic data on rivals and give merchants more ways to reach customers.,2022-07-14T12:39:05+0000,https://www.nytimes.com/2022/07/14/business/amazon-europe-antitrust.html,2022-07-01 to 2022-09-30
Apple Inc,Technology,Amazon is giving Prime Video a face-lift.,The company hopes a new interface — replacing a much-maligned predecessor — will make the streaming service easier and more inviting for viewers.,2022-07-18T18:00:08+0000,https://www.nytimes.com/2022/07/18/business/amazon-is-giving-prime-video-a-face-lift.html,2022-07-01 to 2022-09-30
Apple Inc,Technology,The Office Is Dying. It’s Time to Rethink How We Work.,Anne Helen Petersen and Charlie Warzel discuss how the great retreat from office life could make work better for everyone.,2022-08-16T09:00:12+0000,https://www.nytimes.com/2022/08/16/opinion/ezra-klein-podcast-anne-helen-petersen-charlie-warzel.html,2022-07-01 to 2022-09-30
Apple Inc,Technology,‘Operating With Increased Intensity’: Zuckerberg Leads Meta Into Next Phase,Facebook’s founder is setting a relentless pace as he pushes his company through a tech transformation during a global economic slowdown.,2022-07-26T14:55:33+0000,https://www.nytimes.com/2022/07/26/technology/zuckerberg-meta-facebook-earnings.html,2022-07-01 to 2022-09-30
Apple Inc,Technology,A Coal Miner’s Political Transformation,What Braxton Wright has learned by participating in one of the longest work stoppages in U.S. history.,2022-08-22T10:00:07+0000,https://www.nytimes.com/2022/08/22/podcasts/the-daily/alabama-coal-mine-strike.html,2022-07-01 to 2022-09-30
Apple Inc,Technology,Why Peloton Is Selling on Amazon,"The dream was to sell directly to customers. Now Peloton is on Amazon, Casper is in a furniture shop, and it’s awkward.",2022-08-25T17:56:26+0000,https://www.nytimes.com/2022/08/25/technology/peloton-amazon.html,2022-07-01 to 2022-09-30
Apple Inc,Technology,Abortion rights loom larger in investment decisions.,"After the Supreme Court overturned Roe v. Wade, Alinea, an investing app geared toward young adults, saw a new focus on companies that support reproductive health.",2022-09-01T13:25:06+0000,https://www.nytimes.com/2022/09/01/business/abortion-rights-investing.html,2022-07-01 to 2022-09-30
Apple Inc,Technology,Lawmakers ask F.T.C. chair to investigate TikTok’s data practices.,Questions are surfacing once again about whether TikTok poses a national security threat because it is owned by a Chinese company.,2022-07-05T23:21:37+0000,https://www.nytimes.com/2022/07/05/business/lawmakers-tiktok-national-security.html,2022-07-01 to 2022-09-30
Apple Inc,Technology,F.T.C. Sues to Block Meta’s Virtual Reality Deal as It Confronts Big Tech,The move is a potential blow to Meta’s metaverse efforts and signals a shift in how the Federal Trade Commission is approaching tech deals.,2022-07-27T17:50:07+0000,https://www.nytimes.com/2022/07/27/technology/meta-facebook-vr-ftc.html,2022-07-01 to 2022-09-30
Apple Inc,Technology,Meta reports first revenue decline and a 36 percent profit drop.,"It was the first time the social media giant’s revenue had fallen since it went public a decade ago, as it confronts increased regulatory scrutiny and a turbulent economy.",2022-07-27T20:17:54+0000,https://www.nytimes.com/2022/07/27/technology/meta-earnings-revenue-decline.html,2022-07-01 to 2022-09-30
Apple Inc,Technology,"Peloton, the Troubled Fitness Company, Loses Another Top Executive",The company’s chief marketing officer announced her departure on the heels of a management shake-up that included the exit of two of its founders.,2022-09-26T12:49:23+0000,https://www.nytimes.com/2022/09/26/business/peloton-executive-departure.html,2022-07-01 to 2022-09-30
Apple Inc,Technology,Mark Zuckerberg Prepares Meta Employees for a Tougher 2022,"In an internal meeting this week, Mr. Zuckerberg said the tech giant was facing one of the “worst downturns that we’ve seen in recent history.”",2022-07-01T22:44:10+0000,https://www.nytimes.com/2022/07/01/technology/meta-facebook-mark-zuckerberg.html,2022-07-01 to 2022-09-30
Apple Inc,Technology,The Office’s Last Stand,It’s either the end of the era of flexibility around where work takes place — or the beginning of outright rebellion.,2022-08-28T09:00:16+0000,https://www.nytimes.com/2022/08/28/business/the-offices-last-stand.html,2022-07-01 to 2022-09-30
Apple Inc,Technology,Snap Cuts 20% of Employees and Restructures,"The maker of Snapchat discontinued some of its products and appointed a chief operating officer, amid financial struggles.",2022-08-31T13:15:08+0000,https://www.nytimes.com/2022/08/31/technology/snap-layoffs-restructuring.html,2022-07-01 to 2022-09-30
Apple Inc,Technology,The Books Merger That’s About Amazon,The U.S. wants to stop Penguin Random House from buying Simon & Schuster. The elephant in the room is Amazon.,2022-08-02T17:22:32+0000,https://www.nytimes.com/2022/08/02/technology/penguin-random-house-amazon.html,2022-07-01 to 2022-09-30
Apple Inc,Technology,Twitter Unloads on Musk,"The company contends that Musk breached his agreement to buy it by not using “reasonable best efforts” to close the deal, and so has no right to bail out.",2022-07-13T12:03:41+0000,https://www.nytimes.com/2022/07/13/business/dealbook/elon-musk-twitter-lawsuit.html,2022-07-01 to 2022-09-30
Apple Inc,Technology,"Chipotle closes a Maine store, and workers say it’s because of a union drive.","The shutdown was announced hours before a hearing on a possible vote to unionize the location, which employees said was understaffed.",2022-07-20T21:27:25+0000,https://www.nytimes.com/2022/07/20/business/economy/chipotle-union-maine.html,2022-07-01 to 2022-09-30
Apple Inc,Technology,The Week in Business: Amazon’s Latest Acquisition,"Netflix reports a drop in subscribers, but it could have been worse. The Fed announces its next rate increase. And we’ll hear how strong, or weak, the U.S. economy is.",2022-07-24T11:00:06+0000,https://www.nytimes.com/2022/07/24/business/amazon-one-medical.html,2022-07-01 to 2022-09-30
Apple Inc,Technology,Zelensky Asks Businesses to Join a ‘Marshall Plan’ for Ukraine,Ukraine estimates it would cost $750 billion to rebuild the war-battered country.,2022-09-23T12:07:46+0000,https://www.nytimes.com/2022/09/23/business/dealbook/zelensky-marshall-plan-investor-fund-ukraine.html,2022-07-01 to 2022-09-30
Apple Inc,Technology,Defense Firm Said U.S. Spies Backed Its Bid for Pegasus Spyware Maker,"The American contractor L3Harris is said to have cited support from intelligence officials for its effort to acquire NSO, the Israeli spyware company blacklisted by the Biden administration.",2022-07-10T19:31:58+0000,https://www.nytimes.com/2022/07/10/us/politics/defense-firm-said-us-spies-backed-its-bid-for-pegasus-spyware-maker.html,2022-07-01 to 2022-09-30
Apple Inc,Technology,"Philanthropy, the Billionaires’ Way",Patagonia founder Yvon Chouinard’s decision to give away billions to fight climate change was made possible by an increasingly popular tax maneuver.,2022-09-16T11:45:42+0000,https://www.nytimes.com/2022/09/16/business/dealbook/philanthropy-patagonia-billionaires-way-taxes.html,2022-07-01 to 2022-09-30
Apple Inc,Technology,Sweeping Children’s Online Safety Bill Is Passed in California,"The new rules, which would require many online services to increase protections for children, could change how popular social media and game platforms treat minors.",2022-08-30T08:57:12+0000,https://www.nytimes.com/2022/08/30/business/california-children-online-safety.html,2022-07-01 to 2022-09-30
Apple Inc,Technology,The climate philanthropists,The founder of the Patagonia clothing company is handing the business to a nonprofit group. We look at climate giving and why this move is different.,2022-09-16T15:51:35+0000,https://www.nytimes.com/2022/09/16/climate/yvon-chouinard-patagonia-philanthropy.html,2022-07-01 to 2022-09-30
Apple Inc,Technology,Twitter Whistle-blower Is Set to Testify in Washington,"Elon Musk’s legal team will follow closely the testimony of Twitter’s former head of security, Peiter Zatko, before the Senate Judiciary Committee.",2022-09-13T12:01:02+0000,https://www.nytimes.com/2022/09/13/business/dealbook/twitter-whistle-blower-senate-musk.html,2022-07-01 to 2022-09-30
Apple Inc,Technology,I Was Wrong About Facebook,"Yes, 13 years ago I was an evangelist for the social media platform.",2022-07-21T09:00:22+0000,https://www.nytimes.com/2022/07/21/opinion/farhad-manjoo-facebook.html,2022-07-01 to 2022-09-30
Apple Inc,Technology,Why You Should Be Wary of Wall Street’s Upbeat Stock Forecasts,"Amid rising inflation and the threat of recession, corporate earnings are coming under pressure.",2022-07-22T13:00:10+0000,https://www.nytimes.com/2022/07/22/business/stock-market-wall-street-earnings.html,2022-07-01 to 2022-09-30
Apple Inc,Technology,The Long Road to Driverless Trucks,Self-driving eighteen-wheelers are now on highways in states like California and Texas. But there are still human “safety drivers” behind the wheel. What will it take to get them out?,2022-09-28T09:00:17+0000,https://www.nytimes.com/2022/09/28/business/driverless-trucks-highways.html,2022-07-01 to 2022-09-30
Apple Inc,Technology,On Gum Drop Grapes and Other Fruits Designed to Taste Like Candy,Advances in plant breeding and indoor growing have led to produce that promises to be perfectly sweet.,2022-07-18T14:24:25+0000,https://www.nytimes.com/2022/07/18/t-magazine/candy-sweet-fruit.html,2022-07-01 to 2022-09-30
Apple Inc,Technology,The Deep Roots of Weleda’s Skin Food,"For almost a century, the ultrarich moisturizer has been made from plants grown by methods both scientific and spiritual.",2022-08-20T09:00:26+0000,https://www.nytimes.com/2022/08/20/style/weleda-skin-food.html,2022-07-01 to 2022-09-30
Apple Inc,Technology,‘Act of Sabotage’ Hits Europe’s Energy and Stocks Markets,"Natural gas prices soared in Europe and stocks fell, as officials  investigate the causes of the Nordstream 1 and 2 gas pipeline explosions.",2022-09-28T12:24:48+0000,https://www.nytimes.com/2022/09/28/business/dealbook/sabotage-nordstream-europe-russia-gas-stocks.html,2022-07-01 to 2022-09-30
Apple Inc,Technology,"Amazon Wants to Be Your Doctor, Too","The internet giant acquired One Medical, a national chain of primary care clinics, for $3.9 billion.",2022-07-22T12:38:54+0000,https://www.nytimes.com/2022/07/22/business/dealbook/amazon-acquires-one-medical.html,2022-07-01 to 2022-09-30
Apple Inc,Technology,A Dad Took Photos of His Naked Toddler for the Doctor. Google Flagged Him as a Criminal.,"Google has an automated tool to detect abusive images of children. But the system can get it wrong, and the consequences are serious.",2022-08-21T09:00:25+0000,https://www.nytimes.com/2022/08/21/technology/google-surveillance-toddler-photo.html,2022-07-01 to 2022-09-30
Apple Inc,Technology,Reinventing the Humble Tank Top,The old-fashioned undergarment is enjoying a renaissance.,2022-08-17T09:00:24+0000,https://www.nytimes.com/2022/08/17/style/reinventing-the-humble-tank-top.html,2022-07-01 to 2022-09-30
Apple Inc,Technology,Warnings Signs Multiply Ahead of Pivotal Fed Meeting,"Economists expect the Federal Reserve to raise interest rates by 75 basis points this week, adding to fears a recession is coming.",2022-09-19T11:40:58+0000,https://www.nytimes.com/2022/09/19/business/dealbook/federal-reserve-interest-rates-powell-recession.html,2022-07-01 to 2022-09-30
Apple Inc,Technology,"Stone Ridge, N.Y.: Antique Homes and Welcoming Neighbors","Known for its old stone houses and friendly vibe, this Ulster County hamlet is also conveniently located, with plenty of places to shop and beautiful scenery.",2022-08-17T10:00:21+0000,https://www.nytimes.com/2022/08/17/realestate/stone-ridge-ny-antique-homes-and-welcoming-neighbors.html,2022-07-01 to 2022-09-30
Apple Inc,Technology,A Teen’s Journey Into the Internet’s Darkness and Back Again,"As anxiety and depression soar among adolescents, researchers struggle to understand how exactly social media affects mental health.",2022-08-22T09:00:29+0000,https://www.nytimes.com/2022/08/22/health/adolescents-mental-health-technology.html,2022-07-01 to 2022-09-30
Apple Inc,Technology,"Lake Superior Is Cold, Sparsely Settled and Known for Bad Weather. Perfect for Cruising, Some Say.","As cruising picks up, one small Wisconsin port weighs the pros and cons of more ships and their impact on the town and the environment.",2022-09-13T09:00:21+0000,https://www.nytimes.com/2022/09/13/travel/lake-superior-cruise-ships.html,2022-07-01 to 2022-09-30
Apple Inc,Technology,"Zach Sang, the Ryan Seacrest of the Youth, Wants to Save Radio","The former syndication star and top-flight interviewer is rebuilding his daily show on Amazon’s new app, Amp.",2022-08-31T14:00:07+0000,https://www.nytimes.com/2022/08/31/arts/music/zach-sang-radio-amazon-amp.html,2022-07-01 to 2022-09-30
Apple Inc,Technology,"Guns, Gorillas and Netflix: A Belgian Prince in Congo","Emmanuel de Merode is trying to protect Virunga National Park, catching the eye of Hollywood, and its philanthropists, along the way. “Complicated” doesn’t even begin to describe the story.",2022-09-22T09:00:25+0000,https://www.nytimes.com/2022/09/22/style/congo-belgian-prince.html,2022-07-01 to 2022-09-30
Microsoft,Technology,The Markets Face a Rare Double Decline,"The losses in tech stocks and bonds is wrecking investor portfolios, and analysts warn of more sell-offs.",2022-09-30T12:21:24+0000,https://www.nytimes.com/2022/09/30/business/tech-stocks-bonds-nasdaq-bear-market.html,2022-07-01 to 2022-09-30
Microsoft,Technology,Opening Paul Allen’s Treasure Chest,"It’s been a closely guarded secret which masterworks in the Microsoft co-founder’s collection will be auctioned at Christie’s in November. Here, highlights of a billionaire’s bounty.",2022-09-23T00:00:11+0000,https://www.nytimes.com/2022/09/22/arts/design/paul-allen-collection-art-christies-auction.html,2022-07-01 to 2022-09-30
