company,sector,headline,snippet,pub_date,url,quarter
Morgan Stanley,Finance/Banking,Missing Chinese Banker Resigns After Investigation,"China Renaissance Holdings said its chairman and chief executive, Bao Fan, had stepped down after disappearing nearly a year ago.",2024-02-02T10:11:59+0000,https://www.nytimes.com/2024/02/02/business/bao-fan-china-renaissance.html,2024-01-01 to 2024-03-31
Morgan Stanley,Finance/Banking,Chinese Leader Gives Early Estimate of Economic Growth,"Speaking at the Davos global forum a day before China is set to release economic data, Premier Li Qiang said the economy grew “around 5.2 percent.”",2024-01-16T12:50:50+0000,https://www.nytimes.com/2024/01/16/business/chinese-premier-li-qiang-2023-gdp.html,2024-01-01 to 2024-03-31
Morgan Stanley,Finance/Banking,"Reddit Prices I.P.O. at $34 a Share, in a Positive Sign for Tech",The social media company raised $748 million in the offering. Its shares begin trading on the New York Stock Exchange on Thursday.,2024-03-20T21:37:34+0000,https://www.nytimes.com/2024/03/20/technology/reddit-ipo-stock-price.html,2024-01-01 to 2024-03-31
Morgan Stanley,Finance/Banking,"Capital One to Acquire Discover, Creating a Consumer Lending Colossus","The all-stock deal, which is valued at $35.3 billion, will combine two of the largest credit card companies in the United States.",2024-02-19T20:06:57+0000,https://www.nytimes.com/2024/02/19/business/capital-one-discover-merger.html,2024-01-01 to 2024-03-31
Morgan Stanley,Finance/Banking,"Generative A.I.’s Biggest Impact Will Be in Banking and Tech, Report Says","For some companies, the new technology is an opportunity to enhance productivity and profit. Will their workers benefit as well?",2024-02-01T10:02:36+0000,https://www.nytimes.com/2024/02/01/business/ai-impact-jobs.html,2024-01-01 to 2024-03-31
Morgan Stanley,Finance/Banking,"Recreating a Nearly Defunct, but Long Admired, Watch Brand","As Breitling takes over Universal Genève, it reveals its strategy for making the brand successful again.",2024-01-18T10:04:14+0000,https://www.nytimes.com/2024/01/18/fashion/watches-universal-geneve-breitling.html,2024-01-01 to 2024-03-31
Morgan Stanley,Finance/Banking,Is China’s Era of High Growth Over?,"Beijing unveiled an annual economic target in line with last year’s, as it looks to refocus on strategically important sectors.",2024-03-05T13:27:33+0000,https://www.nytimes.com/2024/03/05/business/dealbook/china-era-high-growth-over.html,2024-01-01 to 2024-03-31
Morgan Stanley,Finance/Banking,"Biggest U.S. Banks Earn Billions, Even After Insurance Bill","JPMorgan Chase, Bank of America and Wells Fargo reported healthy quarterly profits. Citigroup said its ongoing restructuring would result in about 20,000 job cuts.",2024-01-12T14:22:42+0000,https://www.nytimes.com/2024/01/12/business/citibank-morgan-stanley-bank-america-wells-fargo.html,2024-01-01 to 2024-03-31
Morgan Stanley,Finance/Banking,Shipping Costs Soar in Wake of Red Sea Attacks,"Ships risking Houthi attacks must pay high insurance premiums, while vessels avoiding the region lose time going around Africa.",2024-01-24T19:59:53+0000,https://www.nytimes.com/2024/01/24/business/red-sea-attacks-shipping-costs.html,2024-01-01 to 2024-03-31
Morgan Stanley,Finance/Banking,Not Just for Scooby-Doo Anymore — the Secret Door Is Having a Moment,"Homeowners are adding hidden doors and rooms to foil burglars, eke out extra storage space and prepare for Armageddon.",2024-03-07T10:00:36+0000,https://www.nytimes.com/2024/03/07/realestate/design-trend-secret-doors.html,2024-01-01 to 2024-03-31
Morgan Stanley,Finance/Banking,True Love. Is There a Hack for That?,"Disenchanted with dating apps, some users have taken to blaming — and gaming — the mysterious algorithms that power them.",2024-02-09T10:00:53+0000,https://www.nytimes.com/2024/02/09/style/dating-app-hacks-algorithm.html,2024-01-01 to 2024-03-31
Morgan Stanley,Finance/Banking,Chill in the Housing Market Seeps Into Other Industries,"The slowdown in the residential real estate market, a crucial cog in the American economy, is threatening sectors like home improvement and storage.",2024-01-01T10:00:40+0000,https://www.nytimes.com/2024/01/01/business/housing-market-services-retailers.html,2024-01-01 to 2024-03-31
Morgan Stanley,Finance/Banking,We Still Need to Talk About Government Debt,"Last weekend’s deal is good news, but the basic problems remain.",2024-01-08T20:00:03+0000,https://www.nytimes.com/2024/01/08/opinion/budget-deal-us-government-debt.html,2024-01-01 to 2024-03-31
Morgan Stanley,Finance/Banking,Biden Said the U.S. Is Ready to Strike in Yemen Again,"Also, a Midwest blizzard snarled roads and airports. Here’s the latest at the end of Friday.",2024-01-12T22:36:09+0000,https://www.nytimes.com/2024/01/12/briefing/us-strikes-yemen-houthi-snow-storm-midwest.html,2024-01-01 to 2024-03-31
Morgan Stanley,Finance/Banking,It’s Not You: Dating Apps Are Getting Worse,"Hinge, Tinder, Bumble: They used to be free and maybe too good to be true. Now paid versions and fatigue are making dating apps worse — and expensive.",2024-03-16T11:00:16+0000,https://www.nytimes.com/2024/03/16/opinion/dating-apps-hinge-tinder-bumble.html,2024-01-01 to 2024-03-31
Morgan Stanley,Finance/Banking,The Other Side of Soaring Employment Numbers,"The latest data on jobs and wages are positive on the surface, but a large group of voters are still downbeat about the state of the economy.",2024-02-05T13:02:48+0000,https://www.nytimes.com/2024/02/05/business/dealbook/jobs-report-biden-trump-economy.html,2024-01-01 to 2024-03-31
Morgan Stanley,Finance/Banking,"In Hong Kong, China’s Grip Can Feel Like ‘Death by a Thousand Cuts’","As Hong Kong’s leaders embrace China’s top-down political culture, many believe the city’s dynamism and vitality are slipping away.",2024-03-19T23:58:28+0000,https://www.nytimes.com/2024/03/19/world/asia/hong-kong-security-law-china.html,2024-01-01 to 2024-03-31
Morgan Stanley,Finance/Banking,$89 Million Can’t Fix Her Mistakes,"After a dramatic rise in business and society, the art-world mogul Louise Blouin finds herself unloading a Hamptons dream home in bankruptcy court.",2024-02-21T16:50:59+0000,https://www.nytimes.com/2024/02/21/style/louise-blouin-hamptons-bankruptcy-art-society.html,2024-01-01 to 2024-03-31
Morgan Stanley,Finance/Banking,A Consensus Emerges at Davos: Trump Will Win Re-Election,"In private, many business and political leaders at the World Economic Forum say they expect Donald Trump to return to the White House.",2024-01-19T13:11:26+0000,https://www.nytimes.com/2024/01/19/business/dealbook/davos-trump-biden-election.html,2024-01-01 to 2024-03-31
Morgan Stanley,Finance/Banking,Unpacking the Washington Math for a Big Payment Deal,"Regulators have been tough on big financial mergers, though there are nuances in Capital One’s $35.3 billion takeover bid for Discover.",2024-02-20T13:05:29+0000,https://www.nytimes.com/2024/02/20/business/dealbook/regulators-capital-one-discover.html,2024-01-01 to 2024-03-31
Morgan Stanley,Finance/Banking,The Big Dilemma Facing ByteDance’s U.S. Investors,"Potential bidders are circling TikTok as many in Congress demand its split from its Chinese parent. But obstacles remain, starting with Beijing.",2024-03-15T12:19:33+0000,https://www.nytimes.com/2024/03/15/business/dealbook/bytedance-tiktok-us-investors.html,2024-01-01 to 2024-03-31
Morgan Stanley,Finance/Banking,BlackRock’s Giant Bet on Infrastructure,"The Wall Street giant agreed to buy Global Infrastructure Partners, whose assets include airports and oil pipelines, in its biggest takeover in 15 years.",2024-01-12T13:13:33+0000,https://www.nytimes.com/2024/01/12/business/dealbook/blackrock-infrastructure-deal.html,2024-01-01 to 2024-03-31
Morgan Stanley,Finance/Banking,The Zelensky-Trump Divide at Davos,Ukraine’s leader and the potential re-election of Donald Trump as president are dominating discussion at the World Economic Forum.,2024-01-17T13:22:12+0000,https://www.nytimes.com/2024/01/17/business/dealbook/zelensky-trump-divide-davos.html,2024-01-01 to 2024-03-31
Morgan Stanley,Finance/Banking,Elon Musk Extends His Anywhere-but-Delaware Campaign,The billionaire moved SpaceX’s incorporation out of the state. Wall Street is wondering if Tesla will follow suit.,2024-02-15T13:06:25+0000,https://www.nytimes.com/2024/02/15/business/dealbook/musk-spacex-delaware-tesla.html,2024-01-01 to 2024-03-31
Morgan Stanley,Finance/Banking,Why Is Antisemitism Low on the Agenda at Davos?,Some business and political leaders say more attention should be paid to a topic that is dominating discussion in U.S. boardrooms.,2024-01-18T13:31:44+0000,https://www.nytimes.com/2024/01/18/business/dealbook/antisemitism-davos.html,2024-01-01 to 2024-03-31
Morgan Stanley,Finance/Banking,The F.T.C. Boosts Biden’s Fight Against Inflation,The regulator’s move to block Kroger’s $25 billion bid for Albertsons could win the president points with voters squeezed by rising prices.,2024-02-27T13:04:00+0000,https://www.nytimes.com/2024/02/27/business/dealbook/biden-inflation-kroger-albertsons.html,2024-01-01 to 2024-03-31
Morgan Stanley,Finance/Banking,TikTok Faces a Senate Showdown,"A bill to potentially ban the video app breezed through the House, but its fate is less certain in the upper chamber as Big Tech weighs the wider implications.",2024-03-14T12:08:28+0000,https://www.nytimes.com/2024/03/14/business/dealbook/tiktok-ban-senate-showdown.html,2024-01-01 to 2024-03-31
Morgan Stanley,Finance/Banking,Kam Ghaffarian’s Moonshots,"The entrepreneur wants to help build the new space economy, one Prada spacesuit and Jeff Koons-filled lunar lander at a time.",2024-02-18T10:06:13+0000,https://www.nytimes.com/2024/02/18/business/kam-ghaffarians-moonshots.html,2024-01-01 to 2024-03-31
Morgan Stanley,Finance/Banking,The Secret of Thomas Mann’s Translator,"A new novel about Thomas Mann’s longstanding American translator portrays a woman ahead of her time and, despite her shortcomings, important to leading Mann to a Nobel Prize.",2024-01-30T18:15:09+0000,https://www.nytimes.com/2024/01/30/books/booksupdate/mrs-lowe-porter-jo-salas.html,2024-01-01 to 2024-03-31
Morgan Stanley,Finance/Banking,"Spurned, Slighted, Rejected: 25 Oscar Snubs We’ll Never Get Over","Greta Gerwig, you’re not alone. These artists and films memorably — outrageously in our view — got the brush-off from the academy. We’re still in disbelief.",2024-03-08T19:07:06+0000,https://www.nytimes.com/2024/03/08/movies/oscar-snubs-history.html,2024-01-01 to 2024-03-31
Morgan Stanley,Finance/Banking,"Sure, It Won an Oscar. But Is It Criterion?",How the Criterion Collection became the film world’s arbiter of taste.,2024-02-29T10:04:01+0000,https://www.nytimes.com/2024/02/29/magazine/criterion-collection.html,2024-01-01 to 2024-03-31
Bank of America,Finance/Banking,Can Redditors Revive the I.P.O. Market?,"The market for new listings has been rough for investors, but the social media company believes it has a secret weapon in its prospectus: its users.",2024-02-23T13:07:09+0000,https://www.nytimes.com/2024/02/23/business/dealbook/reddit-redditors-ipo.html,2024-01-01 to 2024-03-31
Bank of America,Finance/Banking,More Wall Street Firms Are Flip-Flopping on Climate. Here’s Why.,Financial giants were already trimming their climate pledges amid Republican attacks. Then came concerns about legal risks.,2024-02-19T10:05:40+0000,https://www.nytimes.com/2024/02/19/business/climate-blackrock-state-street-jpmorgan-pimco.html,2024-01-01 to 2024-03-31
Bank of America,Finance/Banking,Bank of America Pledged to Stop Financing Coal. Now It’s Backtracking.,The changes come as Republican lawmakers step up efforts to punish businesses that consider climate change and the environment in their operations.,2024-02-03T10:03:52+0000,https://www.nytimes.com/2024/02/03/climate/bank-of-america-esg.html,2024-01-01 to 2024-03-31
Bank of America,Finance/Banking,"Biggest U.S. Banks Earn Billions, Even After Insurance Bill","JPMorgan Chase, Bank of America and Wells Fargo reported healthy quarterly profits. Citigroup said its ongoing restructuring would result in about 20,000 job cuts.",2024-01-12T14:22:42+0000,https://www.nytimes.com/2024/01/12/business/citibank-morgan-stanley-bank-america-wells-fargo.html,2024-01-01 to 2024-03-31
Bank of America,Finance/Banking,"Trump Advisers Talk of Palestinian Expulsions, but Activists Focus on Biden","Donald J. Trump’s son-in-law and his former ambassador to Israel have amplified policy proposals embraced by Israel’s far-right wing, but U.S. activists say their anger still rests with the current administration.",2024-03-26T20:25:31+0000,https://www.nytimes.com/2024/03/26/us/politics/trump-gaza.html,2024-01-01 to 2024-03-31
Bank of America,Finance/Banking,A House Is Not a Home,Israel has been destroying Palestinian houses for decades. Palestinians carry the story of their homes and their homeland wherever they go.,2024-03-25T09:00:08+0000,https://www.nytimes.com/2024/03/25/opinion/israel-palestine-homes.html,2024-01-01 to 2024-03-31
Bank of America,Finance/Banking,"Raised in the West Bank, Shot in Vermont","Three months after an attack, its victims grapple with what it means to be Palestinian in America.",2024-02-28T10:05:29+0000,https://www.nytimes.com/2024/02/28/magazine/vermont-shooting-palestinian.html,2024-01-01 to 2024-03-31
Bank of America,Finance/Banking,Biden Caught in a Political Bind Over Israel Policy,His steadfast support of the Gaza war effort is angering young people and Arab Americans in an election year. But any change risks alienating Jewish voters.,2024-02-24T22:25:55+0000,https://www.nytimes.com/2024/02/24/world/middleeast/biden-netanyahu-israel-policy-election.html,2024-01-01 to 2024-03-31
Bank of America,Finance/Banking,"I’m the Mayor of Dearborn, Mich., and My City Feels Betrayed",I worry Biden will be remembered not as the president who saved American democracy but as the president who sacrificed it for Netanyahu.,2024-02-20T10:03:04+0000,https://www.nytimes.com/2024/02/20/opinion/biden-dearborn-michigan-gaza.html,2024-01-01 to 2024-03-31
Bank of America,Finance/Banking,Palestinian American Teenager Is Killed in the West Bank,"Tawfic Abdel Jabbar, 17, who was fatally shot on Friday, was raised in New Orleans and had planned to attend business school there.",2024-01-20T18:42:46+0000,https://www.nytimes.com/2024/01/20/world/middleeast/palestinian-american-killed-west-bank.html,2024-01-01 to 2024-03-31
Bank of America,Finance/Banking,Banks Sue Regulators Over Anti-Redlining Rule,A new lawsuit says federal agencies overstepped their authority in a rule forcing banks to do business in underserved communities.,2024-02-06T00:01:16+0000,https://www.nytimes.com/2024/02/05/business/banks-redlining-lawsuit-regulators.html,2024-01-01 to 2024-03-31
Bank of America,Finance/Banking,Why Big Banks (and Some Odd Allies) Oppose a Plan to Protect Banks,Federal regulators want to raise capital requirements for big banks. Their plan is drawing criticism from groups that aren’t normally aligned with the industry.,2024-01-18T10:01:52+0000,https://www.nytimes.com/2024/01/18/business/banks-capital-basel-iii-endgame.html,2024-01-01 to 2024-03-31
Bank of America,Finance/Banking,Consumer Bureau Proposes Overdraft Fee Limits for Large Banks,"The options would include charging a benchmark fee, set by the bureau, that would be significantly lower than the current $35 standard.",2024-01-17T10:03:34+0000,https://www.nytimes.com/2024/01/17/business/cfpb-bank-overdraft-fees-rule.html,2024-01-01 to 2024-03-31
Bank of America,Finance/Banking,More Regulation? Big Banks Say They’re Safe Enough Already.,"With unlikely allies, big banks are resisting regulators’ plan to strengthen them.",2024-01-22T20:02:53+0000,https://www.nytimes.com/2024/01/22/opinion/banks-regulation-financial-crisis.html,2024-01-01 to 2024-03-31
Bank of America,Finance/Banking,Big Dreams Come Back to Bite New York Community Bank,Acquiring billions of dollars in assets from Signature Bank when it went under last year contributed to the Long Island lender’s troubles.,2024-02-08T10:03:20+0000,https://www.nytimes.com/2024/02/08/business/new-york-community-bank-troubles.html,2024-01-01 to 2024-03-31
Bank of America,Finance/Banking,"One Year After Bank Crisis, a Struggle Over What Needs to Change",Silicon Valley Bank’s collapse last March set the stage for a clash between bankers and their regulators.,2024-03-10T09:00:55+0000,https://www.nytimes.com/2024/03/10/business/silicon-valley-bank-one-year-regulations.html,2024-01-01 to 2024-03-31
Bank of America,Finance/Banking,"The Soft Landing Is Global, but It’s Cushiest in America",Economies all over the world are lowering inflation while avoiding serious recession — but growth in the United States stands out.,2024-02-02T19:09:10+0000,https://www.nytimes.com/2024/02/02/business/economy/soft-landing-economy-inflation.html,2024-01-01 to 2024-03-31
Bank of America,Finance/Banking,Two Climate Advisers Quit U.S. Export-Import Bank Over Fossil Fuel Plans,"The bank is set to vote Thursday on financing an oil project in Bahrain, the latest in a string of overseas fossil fuel projects.",2024-02-05T19:22:47+0000,https://www.nytimes.com/2024/02/05/climate/export-import-bank-climate.html,2024-01-01 to 2024-03-31
Bank of America,Finance/Banking,‘Zombie Offices’ Spell Trouble for Some Banks,Bank tremors serve as a reminder: Just because a crisis hasn’t hit immediately doesn’t mean commercial real estate pain isn’t coming.,2024-02-08T17:06:02+0000,https://www.nytimes.com/2024/02/08/business/economy/commercial-real-estate-banking-industry.html,2024-01-01 to 2024-03-31
Bank of America,Finance/Banking,Bank Runs Spooked Regulators. Now a Clampdown Is Coming.,Federal Reserve officials and other bank regulators could roll out a new proposal this spring to ward off a repeat of 2023’s banking turmoil.,2024-03-05T10:04:02+0000,https://www.nytimes.com/2024/03/05/business/economy/silicon-valley-bank-federal-reserve.html,2024-01-01 to 2024-03-31
Bank of America,Finance/Banking,Americans’ Savings Are Shrinking. Should We Be Worried?,"Despite the decline, American consumers still have money to spend.",2024-02-26T20:00:02+0000,https://www.nytimes.com/2024/02/26/opinion/consumer-spending-savings-recession.html,2024-01-01 to 2024-03-31
Bank of America,Finance/Banking,"Kate Banks, Children’s Author Who Wrote About Grief, Dies at 64",She became an award-winning author of children’s books and young-adult novels despite debilitating health issues and the murder of her father.,2024-03-27T20:06:57+0000,https://www.nytimes.com/2024/03/27/books/kate-banks-dead.html,2024-01-01 to 2024-03-31
Bank of America,Finance/Banking,U.S. Defends Israel’s Occupation of the West Bank at Top U.N. Court,"A U.S. official urged judges not to call for Israel’s withdrawal from occupied territory, arguing that Israel faced “very real security needs” and that a Palestinian state must be established for a lasting peace.",2024-02-22T02:07:04+0000,https://www.nytimes.com/2024/02/21/world/middleeast/us-israel-hague-court.html,2024-01-01 to 2024-03-31
Bank of America,Finance/Banking,Biden Orders Sanctions on 4 Israelis Over West Bank Violence,"The order served as both a sharp-edged diplomatic notice to Israel and a message to Arab Americans, a key part of the political coalition the president needs to be re-elected.",2024-02-01T17:10:02+0000,https://www.nytimes.com/2024/02/01/world/middleeast/biden-sanctions-israel-west-bank.html,2024-01-01 to 2024-03-31
Bank of America,Finance/Banking,The Great Rupture in American Jewish Life,What happens when liberalism and Zionism can no longer be reconciled?,2024-03-22T09:04:25+0000,https://www.nytimes.com/2024/03/22/opinion/israel-american-jews-zionism.html,2024-01-01 to 2024-03-31
Bank of America,Finance/Banking,Will America’s Good News on Inflation Last?,One of the biggest economic surprises of 2023 was how quickly inflation faded. A dig into the details offers hints at whether it will last into 2024.,2024-01-03T10:54:16+0000,https://www.nytimes.com/2024/01/03/business/economy/inflation-prices.html,2024-01-01 to 2024-03-31
Bank of America,Finance/Banking,Fed Chair Says Central Bank Need Not ‘Hurry’ to Cut Rates,"Jerome Powell said that strong economic growth gives Federal Reserve officials room to be patient, and he emphasized the institution’s political independence.",2024-03-29T16:57:12+0000,https://www.nytimes.com/2024/03/29/business/economy/federal-reserve-jerome-powell-interest-rates.html,2024-01-01 to 2024-03-31
Bank of America,Finance/Banking,"James D. Robinson III, Transformative Head of American Express, Dies at 88",He led the company from 1977 to 1993 and helped turn Wall Street into a more competitive financial marketplace.,2024-03-18T19:29:41+0000,https://www.nytimes.com/2024/03/18/business/james-d-robinson-3d-dead.html,2024-01-01 to 2024-03-31
Bank of America,Finance/Banking,Americans Feel Better About the Economy. Will That Help Biden?,The White House is embracing a nascent uptick in economic sentiment. It is likely good news — but how it will map to votes is complicated.,2024-01-22T14:55:10+0000,https://www.nytimes.com/2024/01/22/business/economy/economic-confidence-biden.html,2024-01-01 to 2024-03-31
Bank of America,Finance/Banking,A Russian Bank Account May Offer Clues to a North Korean Arms Deal,"Moscow may be trying to help Pyongyang with access to the international financial system in exchange for missiles and ammunition, U.S.-allied intelligence officials suggest.",2024-02-06T05:01:15+0000,https://www.nytimes.com/2024/02/06/world/asia/north-korea-russia-missiles-bank.html,2024-01-01 to 2024-03-31
Bank of America,Finance/Banking,America Between Jesus and Faust,Should we want a new American genesis?,2024-02-09T19:10:59+0000,https://www.nytimes.com/2024/02/09/opinion/america-jesus-future-genesis.html,2024-01-01 to 2024-03-31
Bank of America,Finance/Banking,"U.S. Approves $500 Million for Bahrain Oil Project, Despite Opposition","The financing faced criticism that it doesn’t mesh with U.S. commitments on climate change. Earlier, two climate advisers had resigned over the plan.",2024-03-14T22:04:31+0000,https://www.nytimes.com/2024/03/14/climate/exim-financing-biden-bahrain-oil.html,2024-01-01 to 2024-03-31
Bank of America,Finance/Banking,What if Federal Reparations Weren’t a Fiction?,Federal reparations would help redress both the grievances of American history and the racial inequities that still define the present.,2024-02-13T10:01:35+0000,https://www.nytimes.com/2024/02/13/opinion/black-americans-federal-reparations.html,2024-01-01 to 2024-03-31
Bank of America,Finance/Banking,Looking for a Lower Credit Card Interest Rate? Good Luck.,Comparison sites often emphasize the big banks’ offerings even though smaller banks and credit unions typically charge significantly less.,2024-02-23T14:00:33+0000,https://www.nytimes.com/2024/02/23/your-money/credit-card-interest-rates-banks.html,2024-01-01 to 2024-03-31
Bank of America,Finance/Banking,"Trump’s Tariffs Hurt U.S. Jobs but Swayed American Voters, Study Says","New research finds that former President Donald J. Trump’s tariffs did not bring back U.S. jobs, but voters appeared to reward him for the levies anyway.",2024-02-02T10:03:26+0000,https://www.nytimes.com/2024/02/02/us/politics/trump-tariffs-jobs-voters.html,2024-01-01 to 2024-03-31
Bank of America,Finance/Banking,He Loved Basketball and Wanted to Help His Family Stores. A Bullet Ended It All.,"A Palestinian-American teenager was killed by gunfire the West Bank. “This is a shock to the whole family, the community and anyone else with a heart that knows him,” a relative said.",2024-01-21T10:01:53+0000,https://www.nytimes.com/2024/01/21/us/tawfic-abdel-jabbar-palestian-american.html,2024-01-01 to 2024-03-31
Bank of America,Finance/Banking,Yellen Says Stable Financial System Is Key to U.S. Economic Strength,"The Treasury secretary will offer an upbeat assessment of the economy on Tuesday, a year after the nation’s banking system faced turmoil.",2024-02-06T02:34:43+0000,https://www.nytimes.com/2024/02/05/business/yellen-house-testimony.html,2024-01-01 to 2024-03-31
Bank of America,Finance/Banking,We Might Be One Step Closer to Saving America’s Amazon,A federal judge’s ruling may hold a glimmer of hope for the Mobile-Tensaw Delta.,2024-02-05T10:03:12+0000,https://www.nytimes.com/2024/02/05/opinion/alabama-coal-ash-epa.html,2024-01-01 to 2024-03-31
Bank of America,Finance/Banking,Palestinian Authority’s Government Submits Resignation as U.S. Calls for Change,It was not clear whether the appointment of a new prime minister and cabinet would be enough to revamp the authority or persuade Israel to let it govern Gaza after the war there ends.,2024-02-26T14:06:10+0000,https://www.nytimes.com/2024/02/26/world/middleeast/palestinian-authority-government-pm-resigns.html,2024-01-01 to 2024-03-31
Bank of America,Finance/Banking,‘America Is Under Attack’: Inside the Anti-D.E.I. Crusade,The backlash against “wokeism” has led a growing number of states to ban D.E.I. programs at public universities. Thousands of emails and other documents reveal the playbook — and grievances — behind one strand of the anti-D.E.I. campaign.,2024-01-20T21:35:53+0000,https://www.nytimes.com/interactive/2024/01/20/us/dei-woke-claremont-institute.html,2024-01-01 to 2024-03-31
