company,sector,headline,snippet,pub_date,url,quarter
Morgan Stanley,Finance/Banking,E.U. Officials Urge France and Italy to Accelerate Economic Reforms,"In an annual review of member states’ budgets, the concern is that some countries are not moving fast enough to reduce their deficits.",2014-06-02T14:04:12+0000,https://www.nytimes.com/2014/06/03/business/international/eu-officials-urge-member-states-to-accelerate-economic-reforms.html,2014-04-01 to 2014-06-30
Morgan Stanley,Finance/Banking,"Big Banks Erred Widely on Troubled Mortgages, U.S. Regulator Confirms",A new report from a banking regulator offers a snapshot of the morass of problems that mortgage holders who fell behind in payments experienced during the financial crisis.,2014-04-30T18:08:05+0000,https://dealbook.nytimes.com/2014/04/30/regulators-report-discovers-more-issues-with-bank-foreclosure-practices/,2014-04-01 to 2014-06-30
Morgan Stanley,Finance/Banking,Shares of Arista Networks Surge in Debut,"The company, which has pioneered some of the high-speed computer products that have advanced so-called cloud technology, raised $226 million in its initial public offering after pricing its shares well above the expected range.",2014-06-06T16:01:34+0000,https://dealbook.nytimes.com/2014/06/06/shares-of-arista-networks-surge-in-debut/,2014-04-01 to 2014-06-30
Morgan Stanley,Finance/Banking,Endurance Bids $3.2 Billion for Aspen Insurance,"Endurance Specialty Holdings, a provider of casualty and property insurance, made an unsolicited $3.2 billion takeover bid for Aspen Insurance Holdings.",2014-04-14T14:34:21+0000,https://dealbook.nytimes.com/2014/04/14/endurance-bids-3-2-billion-for-aspen-insurance/,2014-04-01 to 2014-06-30
Morgan Stanley,Finance/Banking,A Vacant Chair for Blythe Masters,"The JPMorgan executive’s exit from the bank could solve a longstanding search for a chairman of Glencore, the giant Swiss trading house, speculates Christopher Hughes of Reuters Breakingviews.",2014-04-03T16:35:54+0000,https://dealbook.nytimes.com/2014/04/03/a-vacant-chair-for-blythe-masters/,2014-04-01 to 2014-06-30
Bank of America,Finance/Banking,Jeremy Murphy Leaves Barclays for Bank of America,"Mr. Murphy is the latest investment banker to depart Barclays, which is seeking to reduce the size of its investment bank in response to stiffer regulations.",2014-06-30T16:18:02+0000,https://dealbook.nytimes.com/2014/06/30/barclays-retail-banker-jeremy-murphy-to-join-bank-of-america/,2014-04-01 to 2014-06-30
Bank of America,Finance/Banking,Bank of America and the Financial Crisis,"Bank of America, including Countrywide, issued about $640 billion in mortgage-backed securities before the financial crisis.",2014-06-11T03:08:34+0000,https://www.nytimes.com/interactive/2014/06/10/business/dealbook/11bank-timelime.html,2014-04-01 to 2014-06-30
Bank of America,Finance/Banking,UBS Hires Veteran Bank of America Executive,"UBS has hired Jerry Marcus, a former head of Bank of America Merrill Lynch’s retail investment banking group, as a vice chairman for its Americas investment bank, the Swiss firm said on Thursday.",2014-06-12T19:23:17+0000,https://dealbook.nytimes.com/2014/06/12/ubs-hires-veteran-bank-of-america-executive/,2014-04-01 to 2014-06-30
Bank of America,Finance/Banking,Bank of America Mortgage Settlement Is Said to Be Deadlocked,"The bank made its final multibillion-dollar settlement offer Monday, but it was said to be short of what the Justice Department wants it to pay for its role in the mortgage crisis.",2014-06-11T01:12:58+0000,https://dealbook.nytimes.com/2014/06/10/bank-of-america-mortgage-settlement-is-said-to-be-deadlocked/,2014-04-01 to 2014-06-30
Bank of America,Finance/Banking,"Bank Tool Is Expanding Unbanked Households, Regulators Say",New York’s attorney general is taking aim at databases that have been criticized for limiting access to banking services.,2014-06-16T01:00:13+0000,https://dealbook.nytimes.com/2014/06/15/bank-account-screening-tool-is-scrutinized-as-excessive/,2014-04-01 to 2014-06-30
Bank of America,Finance/Banking,Medtronic-Covidien Deal Rewards Just 2 Advisory Firms,"Complex mergers in recent years often have been an excuse to bring in extra investment bankers but the $43 billion Medtronic-Covidien deal bucked the trend, Antony Currie writes in Reuters Breakingviews.",2014-06-17T16:33:11+0000,https://dealbook.nytimes.com/2014/06/17/medtronic-covidien-deal-rewards-just-2-advisory-firms/,2014-04-01 to 2014-06-30
Bank of America,Finance/Banking,Merrill Lynch to Pay More than $32 Million for Overcharging Clients,"The Financial Industry Regulatory Authority ordered Merrill Lynch to pay a fine and restitution for overcharging about 41,000 small businesses and 6,800 charities over upfront sales fees on certain mutual funds.",2014-06-16T19:58:21+0000,https://dealbook.nytimes.com/2014/06/16/merrill-lynch-to-pay-more-than-32-million-for-overcharging-clients/,2014-04-01 to 2014-06-30
Bank of America,Finance/Banking,Deal for Zales May Be Done In by Bank of America’s Conflicts,"Zale’s largest shareholder, TIG Advisors, is highlighting Bank of America’s conflict of interest in a sale to Signet Jewelers. That and other factors may lead shareholders to reject the deal, Steven M. Davidoff writes in the Deal Professor column.",2014-05-16T15:37:50+0000,https://dealbook.nytimes.com/2014/05/16/deal-for-zales-may-be-done-in-by-bank-of-americas-conflicts/,2014-04-01 to 2014-06-30
Bank of America,Finance/Banking,Hong Kong Considers Limits on Mainland Chinese Visitors,"As a politically volatile summer nears, Hong Kong’s leader floats the idea of reducing the number of visits by mainland Chinese.",2014-05-28T05:54:03+0000,https://sinosphere.blogs.nytimes.com/2014/05/28/hong-kong-considers-limits-on-mainland-chinese-visitors/,2014-04-01 to 2014-06-30
Bank of America,Finance/Banking,Cobham Acquires Wireless Communications Company for $1.46 Billion,The British aerospace company Cobham will pay about $920 million for the wireless communications company Aeroflex Holding Corporation and assume $540 million in debt.,2014-05-20T09:25:45+0000,https://dealbook.nytimes.com/2014/05/20/cobham-acquires-wireless-communications-company-for-1-46-billion/,2014-04-01 to 2014-06-30
Bank of America,Finance/Banking,The Advisers Behind the Deal for DirecTV,"Even for the telecommunications industry, AT&T’s $48.5 billion bid for DirecTV is a blockbuster deal. And should it be completed, the deal could bestow a wealth of fees upon the advisers who worked on it.",2014-05-19T11:03:04+0000,https://dealbook.nytimes.com/2014/05/19/the-advisers-behind-the-deal-for-directv/,2014-04-01 to 2014-06-30
Bank of America,Finance/Banking,Bank of America Shareholders Press Officials After $4 Billion Error,"Bank officials said they were conducting a “third-party review” of how the problem happened, but declined to name the firm conducting the review.",2014-05-07T21:32:03+0000,https://dealbook.nytimes.com/2014/05/07/bank-of-america-shareholders-question-officials-after-4-billion-error/,2014-04-01 to 2014-06-30
Bank of America,Finance/Banking,"Derivatives Markets Growing Again, With Few New Protections","Even with new laws, derivatives remain mostly opaque, which means that the risks to governments and taxpayers are also opaque, Mayra Rodríguez Valladares writes in the Another View column.",2014-05-13T20:35:36+0000,https://dealbook.nytimes.com/2014/05/13/derivatives-markets-growing-again-with-few-new-protections/,2014-04-01 to 2014-06-30
Bank of America,Finance/Banking,"Telling Off the C.E.O., Once a Year","When investors get to speak at the annual meeting of banks, anger, scorn and even singing can result.",2014-05-12T23:21:29+0000,https://dealbook.nytimes.com/2014/05/12/telling-off-the-c-e-o-once-a-year/,2014-04-01 to 2014-06-30
Bank of America,Finance/Banking,Private Equity Group to Buy Mauser for $1.7 Billion,"Clayton, Dubilier & Rice will acquire Mauser from Dubai International Capital, which bought the German industrial packaging company for $1.1 billion in 2007.",2014-05-12T08:29:24+0000,https://dealbook.nytimes.com/2014/05/12/private-equity-group-to-buy-mauser-for-1-7-billion/,2014-04-01 to 2014-06-30
Bank of America,Finance/Banking,"At Bank of America, a $4 Billion Wet Blanket on the Party",An accounting error has cast a shadow over a bank’s comeback — and shareholders may well want some answers at the annual meeting.,2014-05-03T17:32:15+0000,https://www.nytimes.com/2014/05/04/business/at-bank-of-america-a-4-billion-wet-blanket-on-the-party.html,2014-04-01 to 2014-06-30
Bank of America,Finance/Banking,Bank of America’s Bad Accounting,"If a new accounting rule had been in effect, it appears that the bank could not have made the mistake that forced it to withdraw its capital plan.",2014-04-28T23:59:08+0000,https://dealbook.nytimes.com/2014/04/28/bank-of-americas-bad-accounting/,2014-04-01 to 2014-06-30
Bank of America,Finance/Banking,What Bank of America’s Accounting Mistake Can Teach the Market,Do big banks have strong enough management of their risks and good internal controls to detect accounting problems? Mayra Rodríguez Valladares examines the problem in Another View.,2014-04-30T19:30:20+0000,https://dealbook.nytimes.com/2014/04/30/what-bank-of-americas-accounting-mistake-can-teach-the-market/,2014-04-01 to 2014-06-30
Bank of America,Finance/Banking,Doing the Math of a Bank of America Settlement,Bank of America was always expected to pay more than JPMorgan Chase’s $13 billion settlement. But how much more?,2014-04-28T12:18:31+0000,https://dealbook.nytimes.com/2014/04/28/doing-the-math-of-a-bank-of-america-settlement/,2014-04-01 to 2014-06-30
Bank of America,Finance/Banking,The Six Banks Leading Alibaba’s Giant I.P.O.,"Six firms were listed as Alibaba’s lead underwriters, listed mostly in alphabetical order. The I.P.O. could end up raising more than $20 billion.",2014-05-07T00:39:20+0000,https://dealbook.nytimes.com/2014/05/06/the-six-banks-who-are-leading-alibabas-giant-i-p-o/,2014-04-01 to 2014-06-30
Bank of America,Finance/Banking,Deutsche Bank Hires Consumer M.&A. Adviser,"Jeff Rose, a managing director in the mergers group focused on consumer and retail at Bank of America Merrill Lynch, will join Deutsche Bank as head of its consumer and retail investment banking coverage in the Americas.",2014-05-05T19:56:48+0000,https://dealbook.nytimes.com/2014/05/05/deutsche-bank-hires-consumer-m-a-adviser/,2014-04-01 to 2014-06-30
Bank of America,Finance/Banking,Ex-Finance Chief at Bank of America to Pay $7.5 Million in Settlement,The New York State attorney general accused accused the bank’s top executives of withholding material information related to its 2008 merger with Merrill Lynch.,2014-04-25T16:55:54+0000,https://dealbook.nytimes.com/2014/04/25/ex-finance-chief-at-bank-of-america-to-pay-7-5-million-in-settlement/,2014-04-01 to 2014-06-30
Bank of America,Finance/Banking,Bank of America Finds a Mistake: $4 Billion Less Capital,"After Bank of America reported its error, the the Federal Reserve required the bank to suspend a share buyback and a planned increase in its quarterly dividend.",2014-04-28T13:18:50+0000,https://dealbook.nytimes.com/2014/04/28/bank-of-america-suspends-buyback-and-dividend-increase/,2014-04-01 to 2014-06-30
Bank of America,Finance/Banking,Justice Dept. Seeks Mortgage Deal With Bank of America,"The Justice Department made Bank of America an opening settlement offer of roughly $20 billion several weeks ago, according to people briefed on the matter.",2014-04-25T01:55:59+0000,https://dealbook.nytimes.com/2014/04/24/justice-dept-offers-bank-of-america-a-mortgage-deal/,2014-04-01 to 2014-06-30
Bank of America,Finance/Banking,A Dinner Among Survivors of the Financial Crisis,"At a charity event on Wednesday, the chief of Goldman Sachs was overheard recounting a dinner with Jamie Dimon and Peter Sands, where they traded stories from the dark days of 2008.",2014-05-01T12:11:54+0000,https://dealbook.nytimes.com/2014/05/01/a-dinner-among-survivors-of-the-financial-crisis/,2014-04-01 to 2014-06-30
Bank of America,Finance/Banking,"Big Banks Erred Widely on Troubled Mortgages, U.S. Regulator Confirms",A new report from a banking regulator offers a snapshot of the morass of problems that mortgage holders who fell behind in payments experienced during the financial crisis.,2014-04-30T18:08:05+0000,https://dealbook.nytimes.com/2014/04/30/regulators-report-discovers-more-issues-with-bank-foreclosure-practices/,2014-04-01 to 2014-06-30
Bank of America,Finance/Banking,Bank of America Not Alone in Reporting Anemic Results,"Bank of America’s $276 million loss provides some valuable perspective on the difficulties in running a big bank these days, Antony Currie of Reuters Breakingviews writes.",2014-04-16T18:34:58+0000,https://dealbook.nytimes.com/2014/04/16/bank-of-america-not-alone-in-reporting-anemic-results/,2014-04-01 to 2014-06-30
Bank of America,Finance/Banking,"Bank of America, Weighed by Legal Costs, Posts Loss","Bank of America recorded a $276 million loss in the first quarter, a sign it is still paying for its mortgage problems nearly six years after the financial crisis.",2014-04-16T11:31:05+0000,https://dealbook.nytimes.com/2014/04/16/bank-of-america-swings-to-quarterly-loss-on-legal-costs/,2014-04-01 to 2014-06-30
Bank of America,Finance/Banking,$772 Million Penalty for Bank of America Credit Card Practices,The Consumer Financial Protection Bureau said that the bank “illegally charged” its customers for credit services that were not received. The bank was ordered to refund more than a million customers.,2014-04-09T17:24:58+0000,https://dealbook.nytimes.com/2014/04/09/800-million-penalty-for-bank-of-america-credit-card-practices/,2014-04-01 to 2014-06-30
Bank of America,Finance/Banking,Morgan Stanley Gets Most Relief From First-Quarter Earnings,"Morgan Stanley’s chief executive, James P. Gorman, presided over a far better start to the year than in 2013, and momentum seems to be building toward increasing the firm’s return on equity, writes Antony Currie of Reuters Breakingviews.",2014-04-17T19:32:35+0000,https://dealbook.nytimes.com/2014/04/17/morgan-stanley-gets-most-relief-from-first-quarter-earnings/,2014-04-01 to 2014-06-30
Bank of America,Finance/Banking,Citi’s Stock Seems Priced for More Mediocrity,"Despite Citi’s strong earnings, the bank is trading at just 83 percent of its tangible book value, the only major financial firm currently stuck at less than its net worth, Antony Currie writes in Reuters Breakingviews.",2014-04-14T18:23:39+0000,https://dealbook.nytimes.com/2014/04/14/citis-stock-seems-priced-for-more-mediocrity/,2014-04-01 to 2014-06-30
Bank of America,Finance/Banking,Detroit Wins Judge’s Nod for Contract Settlement,A federal judge held up the bankrupt city’s settlement as an example of “the very spirit of negotiation and compromise” that he hoped other creditors would follow.,2014-04-11T14:50:11+0000,https://dealbook.nytimes.com/2014/04/11/judge-approves-pact-to-end-detroit-swap-deal/,2014-04-01 to 2014-06-30
Bank of America,Finance/Banking,"Banks Ease Hours for Junior Staff, but Workload Stays Same","In the last six months, many of the major banks have instituted what amounts to a radically new policy of urging junior staff members to take a few days off a month, on the weekends.",2014-04-10T00:49:06+0000,https://dealbook.nytimes.com/2014/04/09/banks-ease-hours-for-junior-staff-but-workload-stays-same/,2014-04-01 to 2014-06-30
Bank of America,Finance/Banking,"A Pivotal Financial Crisis Case, Ending With a Whimper","In a settlement with Kenneth Lewis, the former Bank of America chief, regulators took a strong case and rendered it weak, writes Jesse Eisinger in The Trade column.",2014-04-02T16:10:54+0000,https://dealbook.nytimes.com/2014/04/02/a-pivotal-financial-crisis-case-ending-with-a-whimper/,2014-04-01 to 2014-06-30
Bank of America,Finance/Banking,Giving a Debtor a Big Club Against Lenders,"A federal district court’s view on a sale of a piece of a loan is problematic, writes Stephen J. Lubben in the In Debt column.",2014-04-02T17:59:34+0000,https://dealbook.nytimes.com/2014/04/02/giving-a-debtor-a-big-club-against-lenders/,2014-04-01 to 2014-06-30
Bank of America,Finance/Banking,"New Leader, New Attack on Exports",The campaign against the Export-Import Bank gains steam now that the House has elected a new majority leader.,2014-06-24T01:19:30+0000,https://www.nytimes.com/2014/06/24/opinion/joe-nocera-new-leader-new-attack-on-exports.html,2014-04-01 to 2014-06-30
Bank of America,Finance/Banking,Wasserstein & Co. to Buy Back American Lawyer,"An investor consortium has bought back ALM Media from its current owners, Apax Partners and the Royal Bank of Scotland.",2014-06-04T16:21:13+0000,https://dealbook.nytimes.com/2014/06/04/wasserstein-co-to-buy-back-american-lawyer/,2014-04-01 to 2014-06-30
Bank of America,Finance/Banking,A Banking Forum in Europe and a Raft of U.S. Economic Data,"The European Central Bank is hosting a forum in Portugal, and American figures on consumer confidence, home prices and first-quarter growth are due.",2014-05-26T00:52:46+0000,https://www.nytimes.com/2014/05/26/business/a-banking-forum-in-europe-and-a-raft-of-us-economic-data.html,2014-04-01 to 2014-06-30
Bank of America,Finance/Banking,Groups Pool Funds to Protect More of Amazon Rain Forest,"An agreement between government and private partners will allow for an additional 34,000 square miles of Brazilian rain forest to be added to a conservation program.",2014-05-21T13:31:00+0000,https://www.nytimes.com/2014/05/22/world/americas/groups-pool-funds-to-protect-more-of-amazon-rain-forest.html,2014-04-01 to 2014-06-30
Bank of America,Finance/Banking,Deadly Illness in Nicaragua Baffles Experts,"Across Central America, a kidney disease has killed at least 20,000 people over a decade and is so poorly understood that it does not have a universally agreed upon name.",2014-05-09T02:28:38+0000,https://www.nytimes.com/2014/05/09/world/americas/deadly-illness-in-nicaragua-baffles-experts.html,2014-04-01 to 2014-06-30
Bank of America,Finance/Banking,Bank of America’s Big Loss,Bank of America posts a $276 million loss. | Fed chairwoman suggests new rules for short-term borrowing. | Moelis & Company faces an I.P.O. market chill. | Investors got a glimpse of Alibaba’s growth in Yahoo’s earnings report. | Questions about t...,2014-04-16T12:15:07+0000,https://dealbook.nytimes.com/2014/04/16/morning-agenda-bank-of-america-posts-a-loss/,2014-04-01 to 2014-06-30
Bank of America,Finance/Banking,Bank of America legal hangover lingers,"Bank of America posted a surprise quarterly loss, sending shares lower, as the bank sets aside a bigger-than-expected $6 billion stockpile to cover legal expenses. Conway G. Gittens reports.",2014-04-16T15:24:26+0000,https://www.nytimes.com/video/multimedia/100000002828522/bank-of-america-legal-hangover-lingers.html,2014-04-01 to 2014-06-30
Bank of America,Finance/Banking,Morning Agenda: An Impasse in Bank of America Settlement,Bank of America’s mortgage settlement is said to be deadlocked. | The manager of Harvard’s endowment plans to step down. | A.I.G. has named its next chief executive. | The banking industry is trying to adapt to stricter regulations and low market ...,2014-06-11T14:46:07+0000,https://dealbook.nytimes.com/2014/06/11/morning-agenda-an-impasse-in-bank-of-america-settlement/,2014-04-01 to 2014-06-30
Bank of America,Finance/Banking,SunTrust Settles With Justice Dept. Over Mortgages; Talks Continue for Citigroup and Bank of America,SunTrust has agreed to pay $968 million over “excessive” problems with mortgages that continued well after the 2008 crisis.,2014-06-18T00:48:32+0000,https://dealbook.nytimes.com/2014/06/17/suntrust-settles-with-justice-dept-over-mortgages-talks-continue-for-citigroup-and-bank-of-america/,2014-04-01 to 2014-06-30
Bank of America,Finance/Banking,John Kimble and Adam Banks,Mr. Kimble is an assistant commissioner for the New York City Department of Housing Preservation and Development; Mr. Banks is a lawyer.,2014-05-04T04:15:04+0000,https://www.nytimes.com/2014/05/04/fashion/weddings/john-kimble-and-adam-banks.html,2014-04-01 to 2014-06-30
Bank of America,Finance/Banking,"Weekend Reading: Targeting Big Banks. No, Not Those Big Banks.",The news this week that criminal charges were nearing against a French bank and a Swiss bank received a mixed reaction from a public weary over the mantra that Wall Street is “too big to jail.”,2014-05-02T19:52:22+0000,https://dealbook.nytimes.com/2014/05/02/weekend-reading-targeting-big-banks-no-not-those-big-banks/,2014-04-01 to 2014-06-30
Bank of America,Finance/Banking,"Big Banks’ Earnings Reports, and E.U. to Act on Bank Laws","Citigroup, Bank of America, Morgan Stanley and Goldman Sachs will report earnings, and the E.U. is expected to pass laws aimed at reducing nations’ vulnerability to the problems of their big banks.",2014-04-13T23:39:55+0000,https://www.nytimes.com/2014/04/14/business/big-banks-earnings-reports-and-eu-to-act-on-bank-laws.html,2014-04-01 to 2014-06-30
Bank of America,Finance/Banking,Top Officer of Barclays in America Is Leaving,"Hugh E. McGee III will leave his post on Wednesday, even as the bank prepares to create a new holding company for its American business by July 2016.",2014-04-29T13:03:19+0000,https://dealbook.nytimes.com/2014/04/29/head-of-barclays-u-s-business-to-step-down/,2014-04-01 to 2014-06-30
Bank of America,Finance/Banking,Deutsche Bank Economist to Join China’s Central Bank,"Jun Ma, a 13-year veteran of the German bank, is known as one of the most bullish of the economists who follow China.",2014-04-09T05:53:15+0000,https://dealbook.nytimes.com/2014/04/09/deutsche-bank-economist-to-join-chinas-central-bank/,2014-04-01 to 2014-06-30
Bank of America,Finance/Banking,What Awaits Banks After the Leverage Ratio,"The Basel Committee is considering rules that will affect banks’ business strategies significantly and continue to influence how they strengthen their auditing and compliance teams for years to come, writes Mayra Rodríguez Valladares in Another Vi...",2014-04-09T20:53:50+0000,https://dealbook.nytimes.com/2014/04/09/what-awaits-banks-after-the-leverage-ratio/,2014-04-01 to 2014-06-30
Bank of America,Finance/Banking,How Banks Fail,Two scholars explore the role of politics in the evolution of banking.,2014-04-11T14:14:30+0000,https://www.nytimes.com/2014/04/13/books/review/fragile-by-design-by-charles-w-calomiris-and-stephen-h-haber.html,2014-04-01 to 2014-06-30
Bank of America,Finance/Banking,French Officials Twist U.S. Arms in Bank Inquiry,"The French campaign has focused largely on the concern that BNP, unlike other big banks accused of doing business with Sudan and Iran, might be forced to suspend a core business operation in New York as a result of the guilty plea.",2014-06-03T02:00:23+0000,https://dealbook.nytimes.com/2014/06/02/french-officials-twist-u-s-arms-in-bank-inquiry/,2014-04-01 to 2014-06-30
Bank of America,Finance/Banking,Terror Suit Against Jordanian Bank Tests U.S. Diplomacy and Secrecy Laws,Relatives of Americans killed by terrorist attacks in Israel filed suit against Arab Bank and the case has provoked a split in the Obama administration that pits the State Department against the Treasury and Justice Departments.,2014-04-02T00:44:24+0000,https://www.nytimes.com/2014/04/02/us/terror-suit-against-jordanian-bank-tests-us-diplomacy-and-secrecy-laws.html,2014-04-01 to 2014-06-30
Bank of America,Finance/Banking,Bank of England Holds Key Rate at 0.5%,The central bank has not changed its benchmark rate since March 2009. It also left unchanged a stimulus program of holding 375 billion pounds in government bonds.,2014-04-10T11:18:12+0000,https://www.nytimes.com/2014/04/11/business/international/bank-of-england-holds-interest-rates-at-0-5.html,2014-04-01 to 2014-06-30
Bank of America,Finance/Banking,Deutsche Bank Vows to Remain a Top 5 Investment Bank,Executives’ pledges to make Deutsche Bank a winner in the sector were met with skepticism from shareholders at the company’s annual meeting. Some shareholders also objected to executive pay.,2014-05-22T10:57:13+0000,https://dealbook.nytimes.com/2014/05/22/deutsche-bank-vows-to-remain-a-top-5-investment-bank/,2014-04-01 to 2014-06-30
Bank of America,Finance/Banking,"Amid Split on Bank Case, U.S. Seeks a Middle Path",Solicitor General Donald Verrilli Jr. recently asked the Supreme Court not to intervene in a lawsuit in which American victims of terrorist attacks in Israel are accusing Jordan’s Arab Bank of providing services to terrorists.,2014-05-28T02:26:00+0000,https://www.nytimes.com/2014/05/28/us/amid-split-on-bank-case-us-seeks-a-middle-path.html,2014-04-01 to 2014-06-30
Bank of America,Finance/Banking,World Bank to Lift Lending to Developing Countries,"The institution announced that it would increase its capacity to lend to middle-income countries like China, India and Brazil from $15 billion to as much as $28 billion a year.",2014-04-01T12:30:33+0000,https://www.nytimes.com/2014/04/02/business/international/world-bank-to-expand-lending-to-developing-countries.html,2014-04-01 to 2014-06-30
Bank of America,Finance/Banking,Regulator Suggests End to Banks’ Self-Grading,"Daniel K. Tarullo, a Federal Reserve governor, said regulators should consider stopping the practice of banks’ using their own internal models to set capital requirements.",2014-05-09T01:22:54+0000,https://dealbook.nytimes.com/2014/05/08/regulator-suggests-end-to-banks-self-grading/,2014-04-01 to 2014-06-30
