company,sector,headline,snippet,pub_date,url,quarter
JPMorgan Chase,Finance/Banking,Goldman Sachs Near Deal to Settle 1MDB Inquiry,The Wall Street bank would pay a fine of as much as $2 billion and have a subsidiary plead guilty to settle an inquiry into the looting of a sovereign wealth fund in Malaysia.,2019-12-20T11:04:04+0000,https://www.nytimes.com/2019/12/20/business/dealbook/dealbook-goldman-sachs-near-deal-to-settle-1mdb-inquiry.html,2019-10-01 to 2019-12-31
JPMorgan Chase,Finance/Banking,DealBook: Watching for Christine Lagarde’s Stance as Head of E.C.B.,Analysts and investors will be listening for hints on where she stands on various issues when she gives her first news conference in the role.,2019-12-12T11:52:24+0000,https://www.nytimes.com/2019/12/12/business/dealbook/christine-lagarde-ecb.html,2019-10-01 to 2019-12-31
JPMorgan Chase,Finance/Banking,Democrats’ Plans to Tax Wealth Would Reshape U.S. Economy,Proposals from Elizabeth Warren and Bernie Sanders have raised concerns from economists and business leaders who fear the plans would sap economic growth.,2019-10-01T09:00:19+0000,https://www.nytimes.com/2019/10/01/us/politics/sanders-warren-wealth-tax.html,2019-10-01 to 2019-12-31
JPMorgan Chase,Finance/Banking,What to Expect When Boeing’s C.E.O. Faces Congress Today,Dennis Muilenburg will appear before Congress for the first time since the crashes of two 737 Max jets mired the company in crisis.,2019-10-29T10:16:35+0000,https://www.nytimes.com/2019/10/29/business/dealbook/boeing-737-hearing.html,2019-10-01 to 2019-12-31
JPMorgan Chase,Finance/Banking,The N.B.A.’s China Problem Is Getting Worse,Fallout from a tweet by a Houston Rockets executive about the Hong Kong protests has led to blowback by China’s state broadcaster and American lawmakers.,2019-10-08T10:49:37+0000,https://www.nytimes.com/2019/10/08/sports/basketball/nba-china.html,2019-10-01 to 2019-12-31
JPMorgan Chase,Finance/Banking,"As Warren Gains in Race, Wall Street Sounds the Alarm","With a populist message that promises to rein in corporate excess, Ms. Warren has been facing more hostility from the finance industry than any other candidate.",2019-11-04T08:00:12+0000,https://www.nytimes.com/2019/11/04/us/politics/elizabeth-warren-wall-street.html,2019-10-01 to 2019-12-31
JPMorgan Chase,Finance/Banking,Boeing May Suspend 737 Max Production,"The manufacturer could announce its plans today for the troubled plane, which has been out of service since two deadly crashes.",2019-12-16T11:56:49+0000,https://www.nytimes.com/2019/12/16/business/dealbook/amazon-cloud-computing-competition.html,2019-10-01 to 2019-12-31
JPMorgan Chase,Finance/Banking,George Soros Says Wall Street Won’t Decide the 2020 Election,"The billionaire philanthropist and former trader offered his views on next year’s elections, taxing the rich and putting Wall Street in its place.",2019-10-25T10:17:55+0000,https://www.nytimes.com/2019/10/25/business/dealbook/george-soros.html,2019-10-01 to 2019-12-31
JPMorgan Chase,Finance/Banking,An Activist Investor Tries to Oust a Trump Confidant,"Tom Barrack, the C.E.O. of Colony Capital and chairman of President Trump’s inaugural committee, is being pressed by an activist investor to resign.",2019-11-26T11:22:23+0000,https://www.nytimes.com/2019/11/26/business/dealbook/tom-barrack-colony-trump.html,2019-10-01 to 2019-12-31
JPMorgan Chase,Finance/Banking,Boeing’s Board Confronts Further 737 Max Scandal,Company directors are meeting today after the revelation that a top pilot had warned about a flight system now suspected of a role in two fatal crashes.,2019-10-21T10:08:05+0000,https://www.nytimes.com/2019/10/21/business/dealbook/boeing-737-max.html,2019-10-01 to 2019-12-31
JPMorgan Chase,Finance/Banking,"After School Shooting, Bill Focuses on Banks and Guns","A day after two students were killed at a school in Santa Clarita, Ca., a new bill will seek to have banks work with the government on financial activity related to firearms.",2019-11-15T11:20:26+0000,https://www.nytimes.com/2019/11/15/business/dealbook/banks-gun-crime.html,2019-10-01 to 2019-12-31
JPMorgan Chase,Finance/Banking,DealBook Briefing: Credit Suisse’s C.O.O. Quits Over a Spying Scandal,Pierre-Olivier Bouée has resigned after revelations that the Swiss bank had snooped on a former executive. But Credit Suisse’s C.E.O. was found not to be involved.,2019-10-01T10:52:25+0000,https://www.nytimes.com/2019/10/01/business/dealbook/credit-suisse-spying.html,2019-10-01 to 2019-12-31
JPMorgan Chase,Finance/Banking,WeWork’s Founder Allegedly Called Maternity Leave ‘Vacation’,"Adam Neumann, who was ousted as WeWork’s C.E.O. in September, is now accused of pregnancy discrimination.",2019-11-01T10:28:29+0000,https://www.nytimes.com/2019/11/01/business/dealbook/wework-adam-neumann-discrimination.html,2019-10-01 to 2019-12-31
JPMorgan Chase,Finance/Banking,Adam Neumann and the Art of Failing Up,WeWork’s chief risk-taker found a kindred spirit with an open checkbook: SoftBank’s Masayoshi Son. Now he’s walking away from the wreckage with more than $1 billion.,2019-11-02T09:00:15+0000,https://www.nytimes.com/2019/11/02/business/adam-neumann-wework-exit-package.html,2019-10-01 to 2019-12-31
JPMorgan Chase,Finance/Banking,"How Trump Reshaped the Presidency in Over 11,000 Tweets","The president’s tweeting was once a sideshow. But it transformed how he exerted power, leaving the White House and Twitter to grapple over whether, and how, to rein it in.",2019-11-02T11:21:48+0000,https://www.nytimes.com/interactive/2019/11/02/us/politics/trump-twitter-presidency.html,2019-10-01 to 2019-12-31
Goldman Sachs,Finance/Banking,Goldman Sachs Near Deal to Settle 1MDB Inquiry,The Wall Street bank would pay a fine of as much as $2 billion and have a subsidiary plead guilty to settle an inquiry into the looting of a sovereign wealth fund in Malaysia.,2019-12-20T11:04:04+0000,https://www.nytimes.com/2019/12/20/business/dealbook/dealbook-goldman-sachs-near-deal-to-settle-1mdb-inquiry.html,2019-10-01 to 2019-12-31
Goldman Sachs,Finance/Banking,Ex-Goldman Sachs Partner Barred by S.E.C. Over 1MDB Scandal,"Tim Leissner, the husband of Kimora Lee Simmons, will not have to pay anything beyond the $43.7 million he agreed to surrender as part of a guilty plea.",2019-12-16T22:34:09+0000,https://www.nytimes.com/2019/12/16/business/goldman-sachs-1mdb-tim-leissner.html,2019-10-01 to 2019-12-31
Goldman Sachs,Finance/Banking,Goldman Is in Talks to Settle Malaysia Fund Scandal,A settlement with federal prosecutors could be reached by the end of next month.,2019-12-19T14:45:14+0000,https://www.nytimes.com/2019/12/19/business/goldman-sachs-1mdb.html,2019-10-01 to 2019-12-31
Goldman Sachs,Finance/Banking,Apple Card Investigated After Gender Discrimination Complaints,A prominent software developer said on Twitter that the credit card was “sexist” against women applying for credit.,2019-11-10T19:06:42+0000,https://www.nytimes.com/2019/11/10/business/Apple-credit-card-investigation.html,2019-10-01 to 2019-12-31
Goldman Sachs,Finance/Banking,Jho Low Will Give Up as Much as $900 Million in Assets in 1MDB Scandal,The deal will not grant Mr. Low special treatment in the criminal case against him involving a looted Malaysian fund.,2019-10-30T16:59:15+0000,https://www.nytimes.com/2019/10/30/business/jho-low-1mdb-malaysia.html,2019-10-01 to 2019-12-31
Goldman Sachs,Finance/Banking,Big Banks Were the Loudest Optimists. They’re Getting Quieter.,The heads of the largest United States banks are expressing concern about President Trump’s trade war and its potential to drag down the global economy.,2019-10-15T17:28:05+0000,https://www.nytimes.com/2019/10/15/business/jpmorgan-goldman-sachs-citigroup-earnings.html,2019-10-01 to 2019-12-31
Goldman Sachs,Finance/Banking,"Lily Huang, Evan Chase",The couple met in 2011 while they were interns at the Zhong Lun Law Firm in Beijing.,2019-10-27T04:12:01+0000,https://www.nytimes.com/2019/10/27/fashion/weddings/lily-huang-evan-chase.html,2019-10-01 to 2019-12-31
Goldman Sachs,Finance/Banking,C.E.O.s Are Anxious About the Economy. That’s Bad for Stocks.,"Companies have binged on share buybacks in recent years, pumping up prices, but their appetite could wane as economic uncertainty rises.",2019-10-24T09:00:14+0000,https://www.nytimes.com/2019/10/24/business/ceo-confidence-buyback-drop.html,2019-10-01 to 2019-12-31
Goldman Sachs,Finance/Banking,"Meet the Man Loosening Bank Regulation, One Detail at a Time","Some say Randal Quarles is giving big banks a gift, little by little. Others call it needed fine-tuning. He pledges allegiance to efficiency.",2019-11-29T08:00:09+0000,https://www.nytimes.com/2019/11/29/business/economy/bank-regulations-fed.html,2019-10-01 to 2019-12-31
Goldman Sachs,Finance/Banking,Wall St. and Washington to Return to Saudi Investment Meeting,Treasury Secretary Steven Mnuchin will participate in the Riyadh conference a year after the U.S. shunned it in the wake of Jamal Khashoggi’s killing.,2019-10-22T17:05:20+0000,https://www.nytimes.com/2019/10/22/us/politics/mnuchin-saudia-arabia-conference.html,2019-10-01 to 2019-12-31
Goldman Sachs,Finance/Banking,"Jeffrey Katzenberg’s Mobile Start-Up, Quibi, Makes a Deal With ESPN","With $1 billion to work with, the veteran Hollywood executive finds more material for his short-form video platform.",2019-10-07T18:14:48+0000,https://www.nytimes.com/2019/10/07/business/media/quibi-espn-katzenberg.html,2019-10-01 to 2019-12-31
Goldman Sachs,Finance/Banking,Boeing Crisis Could Hit the Broader Economy,"A halt in production of the company’s 737 Max jet will affect hundreds of parts suppliers around the U.S., but will reduce losses for Boeing.",2019-12-17T11:19:33+0000,https://www.nytimes.com/2019/12/17/business/dealbook/boeing-737-max-production.html,2019-10-01 to 2019-12-31
Goldman Sachs,Finance/Banking,Are Algorithms Sexist?,"*looks around, clears throat* Probably, yes.",2019-11-15T17:56:27+0000,https://www.nytimes.com/2019/11/15/us/apple-card-goldman-sachs.html,2019-10-01 to 2019-12-31
Goldman Sachs,Finance/Banking,"Inside a Brazen Scheme to Woo China: Gifts, Golf and a $4,254 Wine",Confidential documents detail Deutsche Bank’s influence campaign and hiring practices in China. More than 100 relatives of top Communist Party officials got jobs.,2019-10-14T16:01:51+0000,https://www.nytimes.com/2019/10/14/business/deutsche-bank-china.html,2019-10-01 to 2019-12-31
Goldman Sachs,Finance/Banking,Elizabeth Warren Hits Back at Billionaires in New Ad for Wealth Tax,The ad is the latest volley in a back-and-forth with billionaires unhappy about her candidacy. Her campaign is embracing the fight.,2019-11-13T23:35:57+0000,https://www.nytimes.com/2019/11/13/us/politics/elizabeth-warren-ad-billionaires.html,2019-10-01 to 2019-12-31
Goldman Sachs,Finance/Banking,Investors Weigh 2020 Election: A Progressive Bet or a ‘Trump Wins’ Portfolio?,"With the United States presidential election a top concern, investors are trying to make money in the stock market based on who might prevail in November.",2019-12-26T21:14:57+0000,https://www.nytimes.com/2019/12/26/business/2020-election-investments.html,2019-10-01 to 2019-12-31
Goldman Sachs,Finance/Banking,Saudi Aramco Sets Its Market Value at Up to $1.7 Trillion,"The world’s largest oil company is providing more data for potential investors in its initial public offering, which is expected next month.",2019-11-17T09:57:08+0000,https://www.nytimes.com/2019/11/17/business/aramco-ipo.html,2019-10-01 to 2019-12-31
Goldman Sachs,Finance/Banking,WeWork Falls Furthest in a Year of Clipped Wings for Hot Startups,"Across Wall Street and in Silicon Valley, a reckoning is battering the companies that everyone was once so eager to buy.",2019-10-28T07:00:07+0000,https://www.nytimes.com/2019/10/28/business/dealbook/wework-writedown-unicorn.html,2019-10-01 to 2019-12-31
Goldman Sachs,Finance/Banking,"Google Makes a Bid for Banking, Where Tech Firms Go to Stumble",Attempts to create tech-focused alternatives to traditional banking have struggled to be more than a niche product.,2019-11-13T22:48:27+0000,https://www.nytimes.com/2019/11/13/business/google-banking-checking-account.html,2019-10-01 to 2019-12-31
Goldman Sachs,Finance/Banking,U.S. Bill Supporting Hong Kong Rights Heads to Trump’s Desk,"After winning House and Senate approval, the bill could complicate the administration’s already rocky talks with China to end the trade war.",2019-11-21T00:55:53+0000,https://www.nytimes.com/2019/11/20/business/hong-kong-human-rights-act.html,2019-10-01 to 2019-12-31
Goldman Sachs,Finance/Banking,Henry Paulson Sounds Alarm: U.S.-China Relations May Only Get Worse,"Whether or not a trade truce is reached, the two countries have been pushed further apart, the former Treasury secretary said.",2019-11-21T08:00:11+0000,https://www.nytimes.com/2019/11/21/business/dealbook/henry-paulson-china.html,2019-10-01 to 2019-12-31
Goldman Sachs,Finance/Banking,My Mom Obsesses Over Her Love Life. She Couldn’t Care Less About Mine.,Is this what happens when you start dating again for the first time in 40 years? Or is it personal?,2019-10-03T14:00:01+0000,https://www.nytimes.com/2019/10/03/style/mom-dating-again.html,2019-10-01 to 2019-12-31
Goldman Sachs,Finance/Banking,How Deutsche Bank Hired Its Way to the Top in China,Confidential documents reveal the troubled German bank’s brazen campaign to win business in China by charming and enriching the political elite. Here are six key takeaways.,2019-10-14T16:23:55+0000,https://www.nytimes.com/2019/10/14/business/deutsche-bank-china-hiring.html,2019-10-01 to 2019-12-31
Goldman Sachs,Finance/Banking,Beware of Automated Hiring,"It won’t end employment discrimination. In fact, it could make it worse.",2019-10-08T10:00:08+0000,https://www.nytimes.com/2019/10/08/opinion/ai-hiring-discrimination.html,2019-10-01 to 2019-12-31
Goldman Sachs,Finance/Banking,"As the Economy Slows, Which Investment Strategy Is Right for You?",The endowment model and the 60/40 split offer different risks and returns. Investors should examine the pros and cons before embracing either strategy.,2019-11-01T11:00:08+0000,https://www.nytimes.com/2019/11/01/your-money/investment-strategy-recession.html,2019-10-01 to 2019-12-31
Goldman Sachs,Finance/Banking,Mark Zuckerberg Tried to Charm Congress. He Got Slammed.,"The Facebook C.E.O. attempted to win lawmakers’ support for his cryptocurrency project. They seemed unimpressed, and also grilled him on a range of issues.",2019-10-24T10:22:28+0000,https://www.nytimes.com/2019/10/24/business/dealbook/mark-zuckerberg-facebook-libra.html,2019-10-01 to 2019-12-31
Goldman Sachs,Finance/Banking,DealBook: U.S. and China Could Roll Back Tariffs,It would be the first time the Trump administration has agreed to remove any of the tariffs it has placed on $360 billion worth of Chinese goods.,2019-11-08T11:00:50+0000,https://www.nytimes.com/2019/11/08/business/dealbook/trade-war-tariffs-us-china.html,2019-10-01 to 2019-12-31
Goldman Sachs,Finance/Banking,The Week in Tech: Facebook Fights Back,A remarkable leak from an internal meeting shows the company is gearing up to fight government intervention.,2019-10-04T13:00:10+0000,https://www.nytimes.com/2019/10/04/technology/the-week-in-tech-facebook-fights-back.html,2019-10-01 to 2019-12-31
Goldman Sachs,Finance/Banking,Here Are the Key Members to Watch on the House Intelligence Committee,These lawmakers are poised to take center stage in televised impeachment hearings that begin Wednesday.,2019-11-13T14:30:13+0000,https://www.nytimes.com/2019/11/13/us/politics/members-of-house-intelligence-committee.html,2019-10-01 to 2019-12-31
Goldman Sachs,Finance/Banking,A Preview of the December Fed Meeting,The central bank is expected to keep rates steady at its final meeting of 2019. Investors want to know how long the pause will last.,2019-12-11T10:00:28+0000,https://www.nytimes.com/2019/12/11/business/economy/fed-rates.html,2019-10-01 to 2019-12-31
Goldman Sachs,Finance/Banking,Smashing the Finance Patriarchy With Memes,Wall Street wants you to stay ignorant. @MrsDowJones is here to teach us financial literacy.,2019-12-24T16:58:34+0000,https://www.nytimes.com/2019/12/24/style/finance-memes.html,2019-10-01 to 2019-12-31
Goldman Sachs,Finance/Banking,The Week in Tech: Algorithmic Bias Is Bad. Uncovering It Is Good.,"We keep stumbling across examples of discrimination in algorithms, but that’s far better than their remaining hidden.",2019-11-15T14:00:06+0000,https://www.nytimes.com/2019/11/15/technology/algorithmic-ai-bias.html,2019-10-01 to 2019-12-31
Goldman Sachs,Finance/Banking,Aramco’s I.P.O. Will Be Less Gigantic Than Promised,The state-owned oil giant is expected to announce soon that it plans to go public. But the stock sale will fall short of Saudi Arabia’s ambitions.,2019-10-28T04:01:12+0000,https://www.nytimes.com/2019/10/28/business/dealbook/aramco-ipo-saudi-arabia.html,2019-10-01 to 2019-12-31
Goldman Sachs,Finance/Banking,You Too Can Play the Handbag Stock Market,Don’t think of those totes and saddle bags as just pretty accessories. They could also be an investment portfolio.,2019-10-24T09:00:16+0000,https://www.nytimes.com/2019/10/24/style/rebag-clair-handbag-stock-market.html,2019-10-01 to 2019-12-31
Goldman Sachs,Finance/Banking,Nets Owner Joe Tsai Didn’t Seem Political. Until Now.,"In response to an N.B.A. executive’s Twitter post, Tsai called pro-democracy protests in Hong Kong a “separatist movement,” further inflaming a geopolitical controversy.",2019-10-08T00:18:17+0000,https://www.nytimes.com/2019/10/07/sports/joe-tsai-nba-china.html,2019-10-01 to 2019-12-31
Goldman Sachs,Finance/Banking,"Impeachment Delay, Samoa’s Measles, ‘Star Wars’: Your Friday Briefing",Here’s what you need to know.,2019-12-19T23:15:53+0000,https://www.nytimes.com/2019/12/19/briefing/impeachment-delay-samoas-measles-star-wars.html,2019-10-01 to 2019-12-31
Goldman Sachs,Finance/Banking,"Impeachment Delay, Samoa’s Measles, ‘Star Wars’: Your Friday Briefing",Here’s what you need to know.,2019-12-19T20:54:29+0000,https://www.nytimes.com/2019/12/19/briefing/impeachment-samoa-star-wars.html,2019-10-01 to 2019-12-31
Goldman Sachs,Finance/Banking,"Navy SEALs, Bernie Sanders, Kazakhstan: Your Friday Briefing",Here’s what you need to know.,2019-12-27T10:20:32+0000,https://www.nytimes.com/2019/12/27/briefing/navy-seals-bernie-sanders-kazakhstan.html,2019-10-01 to 2019-12-31
Goldman Sachs,Finance/Banking,"With No End to Unrest in Sight, Hong Kong’s Economic Pain Deepens",An unmistakable sense of alarm is spreading among both small business owners and corporate executives who see no way out of the impasse.,2019-10-13T18:32:19+0000,https://www.nytimes.com/2019/10/13/world/asia/hong-kong-protest-economy.html,2019-10-01 to 2019-12-31
Goldman Sachs,Finance/Banking,"India’s Internet Crackdown, Swine Fever, The Vatican: Your Wednesday Briefing",Here’s what you need to know.,2019-12-17T19:47:55+0000,https://www.nytimes.com/2019/12/17/briefing/india-protests-swine-fever-china-impeachment.html,2019-10-01 to 2019-12-31
Goldman Sachs,Finance/Banking,"David Boies, a Star Lawyer, Faces Fresh Questions Over Ethics",David Boies’s association with hypothetical plans to extract money from wealthy men linked to the Jeffrey Epstein scandal has raised concerns.,2019-12-02T11:50:03+0000,https://www.nytimes.com/2019/12/02/business/dealbook/david-boies-jeffrey-epstein.html,2019-10-01 to 2019-12-31
Goldman Sachs,Finance/Banking,"After 15 Years, Dream Mall Finally Becomes a Reality","The $5 billion development in the Meadowlands, formerly known as Xanadu and now called American Dream, will open on Friday. Sort of.",2019-10-24T22:13:35+0000,https://www.nytimes.com/2019/10/24/business/american-dream-meadowlands-mall.html,2019-10-01 to 2019-12-31
Goldman Sachs,Finance/Banking,"Trump’s Trade War Could Put Swiss-Size Dent in Global Economy, I.M.F. Warns",The International Monetary Fund is the latest global organization to warn of growing economic fallout from President Trump’s trade war.,2019-10-08T16:55:44+0000,https://www.nytimes.com/2019/10/08/us/politics/trump-trade-war-imf.html,2019-10-01 to 2019-12-31
Goldman Sachs,Finance/Banking,Health Care and Billionaires Took Center Stage at Last Night’s Democratic Debate,Several candidates criticized Senator Elizabeth Warren’s health care proposal and backed proposals to impose big taxes on the wealthy.,2019-10-16T10:41:14+0000,https://www.nytimes.com/2019/10/16/business/dealbook/democratic-debate-health-care-billionaires.html,2019-10-01 to 2019-12-31
Goldman Sachs,Finance/Banking,Apple Gives Way to Pressure From Beijing,The tech giant removed an app after facing criticism from China’s state media that it was being used to target and ambush police officers in Hong Kong.,2019-10-10T10:29:53+0000,https://www.nytimes.com/2019/10/10/business/dealbook/apple-china-nba.html,2019-10-01 to 2019-12-31
Goldman Sachs,Finance/Banking,How Aramco’s Huge I.P.O. Fell Short of Saudi Prince’s Wish,"As investors balked, some bankers and Saudi officials still hoped to achieve the crown prince’s target price of $2 trillion. They wound up settling for less.",2019-12-06T18:59:15+0000,https://www.nytimes.com/2019/12/06/business/energy-environment/saudi-aramco-ipo.html,2019-10-01 to 2019-12-31
Goldman Sachs,Finance/Banking,What the U.K. Election Result Means for Global Business,"Prime Minister Boris Johnson said the government now had “a powerful new mandate to get Brexit done,” a stance that goes against decades of greater economic integration.",2019-12-13T11:42:50+0000,https://www.nytimes.com/2019/12/13/business/dealbook/britain-election-boris-johnson-brexit.html,2019-10-01 to 2019-12-31
Goldman Sachs,Finance/Banking,DealBook Briefing: Europe Deals a Big Blow to Facebook,"The E.U.’s top court ruled that an individual country can order the social network to take down content worldwide, adding new burden to global internet companies.",2019-10-03T10:19:32+0000,https://www.nytimes.com/2019/10/03/business/dealbook/europe-facebook-content.html,2019-10-01 to 2019-12-31
Goldman Sachs,Finance/Banking,Trump Expands the Trade Wars,The president threatened tariffs on French goods and on steel from Argentina and Brazil.,2019-12-03T11:27:38+0000,https://www.nytimes.com/2019/12/03/business/dealbook/trump-tariffs-trade-wars-france.html,2019-10-01 to 2019-12-31
Goldman Sachs,Finance/Banking,"As Warren Gains in Race, Wall Street Sounds the Alarm","With a populist message that promises to rein in corporate excess, Ms. Warren has been facing more hostility from the finance industry than any other candidate.",2019-11-04T08:00:12+0000,https://www.nytimes.com/2019/11/04/us/politics/elizabeth-warren-wall-street.html,2019-10-01 to 2019-12-31
Goldman Sachs,Finance/Banking,What to Expect When Boeing’s C.E.O. Faces Congress Today,Dennis Muilenburg will appear before Congress for the first time since the crashes of two 737 Max jets mired the company in crisis.,2019-10-29T10:16:35+0000,https://www.nytimes.com/2019/10/29/business/dealbook/boeing-737-hearing.html,2019-10-01 to 2019-12-31
Goldman Sachs,Finance/Banking,Inside Epstein’s Embellished Charitable Giving,"Jeffrey Epstein’s foundation looked like a charitable powerhouse. But it wasn’t officially a charity for much of its existence, allowing it to exaggerate its giving.",2019-11-27T11:09:11+0000,https://www.nytimes.com/2019/11/27/business/dealbook/jeffrey-epstein-charity.html,2019-10-01 to 2019-12-31
Goldman Sachs,Finance/Banking,"Business Leaders on Capitalism, Challenges and Their 8-Year-Old Selves","At the annual DealBook conference in New York, leaders at the “Groundbreakers Lunch” discussed the appropriate role of business in shaping policy and driving social change.",2019-11-11T21:54:30+0000,https://www.nytimes.com/2019/11/11/business/dealbook/dealbook-leaders-advice.html,2019-10-01 to 2019-12-31
Goldman Sachs,Finance/Banking,Mark Zuckerberg Sticks to His Guns on Political Speech,"The Facebook chief said that the social network will continue to let political ads tout false claims, in the name of free speech.",2019-10-18T10:11:14+0000,https://www.nytimes.com/2019/10/18/business/dealbook/zuckerberg-political-speech-facebook.html,2019-10-01 to 2019-12-31
Goldman Sachs,Finance/Banking,How Deutsche Bank Paid Millions to Get Ahead in China,Confidential documents show that the German lender doled out expensive gifts and jobs to win business in the country.,2019-10-15T10:19:51+0000,https://www.nytimes.com/2019/10/15/business/dealbook/deutsche-bank-china.html,2019-10-01 to 2019-12-31
Goldman Sachs,Finance/Banking,How a Tweet Put the NBA in Hot Water in China,"A quickly deleted post by a Houston Rockets executive opened the league, which has had huge success in China, up to blowback in a vital overseas market.",2019-10-07T10:28:27+0000,https://www.nytimes.com/2019/10/07/sports/basketball/nba-china.html,2019-10-01 to 2019-12-31
Goldman Sachs,Finance/Banking,"DealBook: Google’s Founders to Step Aside, Ending an Era","Larry Page and Sergey Brin will make way, with Sundar Pichai, who has run Google for several years, becoming C.E.O. of the parent company, Alphabet.",2019-12-04T11:53:10+0000,https://www.nytimes.com/2019/12/04/business/dealbook/google-alphabet-founders-ceo.html,2019-10-01 to 2019-12-31
Goldman Sachs,Finance/Banking,TikTok’s Bid to Regain Trust,"Having taken a beating over national security concerns, the company is now wondering how it can convince Washington that it’s safe.",2019-11-19T11:27:12+0000,https://www.nytimes.com/2019/11/19/business/dealbook/tiktok-trust.html,2019-10-01 to 2019-12-31
