company,sector,headline,snippet,pub_date,url,quarter
BlackRock,Finance/Banking,Want a Bigger Say on Corporate Behavior? Move Your Money,Millions of people have a stake in corporate America through mutual funds. But you may be surprised by how those funds are voting on your behalf.,2019-12-12T10:00:17+0000,https://www.nytimes.com/2019/12/12/business/corporate-behavior-move-your-money.html,2019-10-01 to 2019-12-31
BlackRock,Finance/Banking,Mission Critical: Alternative Investments in Modern Portfolios,People in finance often observe that “alternative” investments — so called because of the niche role they once played for investors — need a new name.,2019-12-06T22:41:02+0000,https://www.nytimes.com/paidpost/blackrock/alternative-investments-in-modern-portfolios.html,2019-10-01 to 2019-12-31
BlackRock,Finance/Banking,Want To Live Sustainably? Buy Ugly Produce,How one entrepreneur turned a passion for ending food waste into a successful start-up that's paving the way for a more sustainable future.,2019-11-15T18:33:14+0000,https://www.nytimes.com/paidpost/ishares-by-blackrock/want-to-live-sustainably-buy-ugly-produce.html,2019-10-01 to 2019-12-31
BlackRock,Finance/Banking,Saudi Aramco Sells $25.6 billion in Shares for I.P.O.,"Saudi Arabia’s state-owned oil company priced its offering at a level that would raise $25.6 billion, becoming the largest stock market debut on record.",2019-12-06T11:39:16+0000,https://www.nytimes.com/2019/12/06/business/dealbook/saudi-aramco-ipo.html,2019-10-01 to 2019-12-31
BlackRock,Finance/Banking,Wall St. and Washington to Return to Saudi Investment Meeting,Treasury Secretary Steven Mnuchin will participate in the Riyadh conference a year after the U.S. shunned it in the wake of Jamal Khashoggi’s killing.,2019-10-22T17:05:20+0000,https://www.nytimes.com/2019/10/22/us/politics/mnuchin-saudia-arabia-conference.html,2019-10-01 to 2019-12-31
BlackRock,Finance/Banking,"Beryl Sanders, Ari Khuner Haber",They met through the dating app Hinge a few weeks after their match expired on the dating app Bumble.,2019-11-10T05:15:00+0000,https://www.nytimes.com/2019/11/10/fashion/weddings/beryl-sanders-ari-khuner-haber.html,2019-10-01 to 2019-12-31
BlackRock,Finance/Banking,Short-Term Thinking Is Poisoning American Business,Free-market capitalism won’t survive unless it makes structural changes toward long-term investing.,2019-12-21T19:30:06+0000,https://www.nytimes.com/2019/12/21/opinion/sunday/capitalism-sanders-warren.html,2019-10-01 to 2019-12-31
BlackRock,Finance/Banking,Smith & Wesson’s Owner to Break Away From Gun Business,The move separates the broader company from the challenges the gun industry faces. It was announced shortly before another mass shooting.,2019-11-14T13:55:28+0000,https://www.nytimes.com/2019/11/14/business/smith-wesson-firearms-split.html,2019-10-01 to 2019-12-31
BlackRock,Finance/Banking,"E.T.F. Investors Are Going for Gold, Despite Many Drawbacks","Gold has often been viewed as a haven, but many experts say it isn’t needed to diversify a portfolio and adds unnecessary expense.",2019-10-11T11:00:05+0000,https://www.nytimes.com/2019/10/11/business/etf-investors-gold-drawbacks.html,2019-10-01 to 2019-12-31
BlackRock,Finance/Banking,"Working to Benefit Society, Not Just Companies",Andrew Kassoy and the other two co-founders of B Lab are encouraging businesses to focus on more than just profits.,2019-10-17T09:00:36+0000,https://www.nytimes.com/2019/10/17/business/certified-b-corps.html,2019-10-01 to 2019-12-31
BlackRock,Finance/Banking,California Companies Are Rushing to Find Female Board Members,A law mandating that every public company in the state should have a woman on the board by the end of the year has redefined the qualifications of a director.,2019-12-17T22:20:58+0000,https://www.nytimes.com/2019/12/17/us/california-boardroom-gender-quota.html,2019-10-01 to 2019-12-31
BlackRock,Finance/Banking,Stars Return to Saudi Investment Conference a Year After Khashoggi,"A year after boycotting after the killing of a dissident journalist, the big names of business and politics return to Riyadh.",2019-10-29T19:04:56+0000,https://www.nytimes.com/2019/10/29/us/politics/saudi-conference-khashoggi.html,2019-10-01 to 2019-12-31
BlackRock,Finance/Banking,Nestlé Says It Can Be Virtuous and Profitable. Is That Even Possible?,The world’s largest food company is trying to show it can be environmentally sustainable and still make money. Activists are skeptical.,2019-11-15T10:00:24+0000,https://www.nytimes.com/2019/11/15/business/nestle-environment-sustainability.html,2019-10-01 to 2019-12-31
BlackRock,Finance/Banking,"One Year On, Shadow of Khashoggi’s Killing Stalks Saudi Prince",Prince Mohammed bin Salman of Saudi Arabia is trying to regain his international footing after the killing of Jamal Khashoggi at the Saudi Consulate in Istanbul.,2019-10-02T13:44:43+0000,https://www.nytimes.com/2019/10/02/world/middleeast/khashoggi-killing-mbs-anniversary.html,2019-10-01 to 2019-12-31
BlackRock,Finance/Banking,Boeing May Suspend 737 Max Production,"The manufacturer could announce its plans today for the troubled plane, which has been out of service since two deadly crashes.",2019-12-16T11:56:49+0000,https://www.nytimes.com/2019/12/16/business/dealbook/amazon-cloud-computing-competition.html,2019-10-01 to 2019-12-31
BlackRock,Finance/Banking,How Aramco’s Huge I.P.O. Fell Short of Saudi Prince’s Wish,"As investors balked, some bankers and Saudi officials still hoped to achieve the crown prince’s target price of $2 trillion. They wound up settling for less.",2019-12-06T18:59:15+0000,https://www.nytimes.com/2019/12/06/business/energy-environment/saudi-aramco-ipo.html,2019-10-01 to 2019-12-31
BlackRock,Finance/Banking,DealBook Briefing: Europe Deals a Big Blow to Facebook,"The E.U.’s top court ruled that an individual country can order the social network to take down content worldwide, adding new burden to global internet companies.",2019-10-03T10:19:32+0000,https://www.nytimes.com/2019/10/03/business/dealbook/europe-facebook-content.html,2019-10-01 to 2019-12-31
BlackRock,Finance/Banking,China Is Now a Minefield for Western Companies,"It once was clear what American businesses needed to avoid to succeed in China’s huge market. As the N.B.A. has shown, that’s no longer the case.",2019-10-09T10:12:51+0000,https://www.nytimes.com/2019/10/09/business/dealbook/china-companies-nba.html,2019-10-01 to 2019-12-31
BlackRock,Finance/Banking,How the Superrich Took Over the Museum World,"The wealthy have always influenced the art scene. But in recent years, they’ve dominated it.",2019-12-14T19:30:12+0000,https://www.nytimes.com/2019/12/14/opinion/sunday/modern-art-museum.html,2019-10-01 to 2019-12-31
NVIDIA,AI/Chip Manufacturing,A Panorama of Design,"A look at design world events, products and people.",2019-11-20T10:00:46+0000,https://www.nytimes.com/2019/11/20/style/design-panorama.html,2019-10-01 to 2019-12-31
NVIDIA,AI/Chip Manufacturing,You Don’t Need to Spend a Ton on a Pricey Gaming Laptop,"Any gaming laptop that costs thousands of dollars should be able to play the newest, most taxing games smoothly and consistently on high graphics settings. But you don’t need to shell out more than $1,500 to get a great laptop capable of playing y...",2019-10-14T00:00:00+0000,https://www.nytimes.com/wirecutter/blog/you-dont-need-to-spend-a-lot-on-a-pricey-gaming-laptop/,2019-10-01 to 2019-12-31
NVIDIA,AI/Chip Manufacturing,"Pentagon, With an Eye on China, Pushes for Help From American Tech",Talks over how U.S. companies can ensure future supplies of advanced computer chips have taken on more urgency.,2019-10-25T09:00:22+0000,https://www.nytimes.com/2019/10/25/technology/pentagon-taiwan-tsmc-chipmaker.html,2019-10-01 to 2019-12-31
NVIDIA,AI/Chip Manufacturing,"DealBook: U.S. Companies, Ranked by What Americans Value","The American public values things like fair pay, ethical leadership and job creation. Which companies come out top when judged against those metrics?",2019-11-12T11:14:31+0000,https://www.nytimes.com/2019/11/12/business/dealbook/american-companies-values.html,2019-10-01 to 2019-12-31
Advanced Micro Devices,AI/Chip Manufacturing,Trump Is Winning the Online War,The technical superiority and sophistication of the president’s digital campaign is a hidden advantage of incumbency.,2019-10-16T10:00:07+0000,https://www.nytimes.com/2019/10/16/opinion/trump-digital-campaign.html,2019-10-01 to 2019-12-31
Intel,AI/Chip Manufacturing,Intel Fixes a Security Flaw It Said Was Repaired 6 Months Ago,"The chip maker patched several problems in May. Now it is issuing another fix, and researchers say the company hasn’t been straight about its issues.",2019-11-12T20:21:04+0000,https://www.nytimes.com/2019/11/12/technology/intel-chip-fix.html,2019-10-01 to 2019-12-31
Intel,AI/Chip Manufacturing,These Villages in Thailand Are Part of the Global Economy. Go to Ikea to Find Out.,A project employing women from poor hill tribes is transforming lives in northern Thailand.,2019-11-19T10:00:27+0000,https://www.nytimes.com/2019/11/19/business/thailand-doi-tung-women.html,2019-10-01 to 2019-12-31
Intel,AI/Chip Manufacturing,McDonald’s C.E.O. Fired Over a Relationship That’s Becoming Taboo,"Steve Easterbrook violated policy, the company said. He’s not the first chief executive to be ousted over a consensual relationship with an employee.",2019-11-05T00:26:18+0000,https://www.nytimes.com/2019/11/04/business/mcdonalds-ceo-fired.html,2019-10-01 to 2019-12-31
Intel,AI/Chip Manufacturing,"Pentagon, With an Eye on China, Pushes for Help From American Tech",Talks over how U.S. companies can ensure future supplies of advanced computer chips have taken on more urgency.,2019-10-25T09:00:22+0000,https://www.nytimes.com/2019/10/25/technology/pentagon-taiwan-tsmc-chipmaker.html,2019-10-01 to 2019-12-31
Intel,AI/Chip Manufacturing,Chuck Peddle Dies at 82; His $25 Chip Helped Start the PC Age,His invention brought digital technology to a new breed of consumer devices and powered early Apple and Commodore computers.,2019-12-24T19:52:47+0000,https://www.nytimes.com/2019/12/24/technology/chuck-peddle-dead.html,2019-10-01 to 2019-12-31
Intel,AI/Chip Manufacturing,"News Quiz: NATO, Tariffs, 2020 Race",Did you stay up-to-date this week?,2019-12-06T08:30:01+0000,https://www.nytimes.com/interactive/2019/12/06/briefing/nato-tariffs-2020-race-news-quiz.html,2019-10-01 to 2019-12-31
Intel,AI/Chip Manufacturing,Google Claims a Quantum Breakthrough That Could Change Computing,Scientists at a company lab said they had taken a big step toward creating a machine that would make today’s supercomputers look like toys.,2019-10-23T08:47:59+0000,https://www.nytimes.com/2019/10/23/technology/quantum-computing-google.html,2019-10-01 to 2019-12-31
Intel,AI/Chip Manufacturing,How to Gracefully Leverage an Outside Job Offer,Gather intel. Consult mentors. Make your case.,2019-11-27T03:00:03+0000,https://www.nytimes.com/2019/11/26/smarter-living/how-to-gracefully-leverage-an-outside-job-offer.html,2019-10-01 to 2019-12-31
Intel,AI/Chip Manufacturing,Secrets and Lies,"“Spies,” by Marc Favreau, introduces the danger, sacrifice and ingenuity of 20th-century espionage to a new generation of readers.",2019-11-07T22:20:47+0000,https://www.nytimes.com/2019/11/07/books/review/spies-marc-favreau.html,2019-10-01 to 2019-12-31
Intel,AI/Chip Manufacturing,Quantum Computing Explained (in Mere Minutes!),"Quantum computing is a national security priority, and a big focus of competition in the technology industry.",2019-10-23T16:15:50+0000,https://www.nytimes.com/2019/10/23/business/quantum-computing-google.html,2019-10-01 to 2019-12-31
Intel,AI/Chip Manufacturing,"41, 42 …",Trump’s catalog of misbehavior keeps growing.,2019-10-01T12:41:10+0000,https://www.nytimes.com/2019/10/01/opinion/trump-australia-barr-mueller.html,2019-10-01 to 2019-12-31
Intel,AI/Chip Manufacturing,Uber Settles Federal Investigation Into Workplace Culture,"The ride-hailing company “permitted a culture of sexual harassment and retaliation,” the Equal Employment Opportunity Commission found.",2019-12-18T22:45:36+0000,https://www.nytimes.com/2019/12/18/technology/uber-settles-eeoc-investigation-workplace-culture.html,2019-10-01 to 2019-12-31
Intel,AI/Chip Manufacturing,"With a Laser, Researchers Say They Can Hack Alexa, Google Home or Siri",Researchers in Japan and at the University of Michigan said they have found a way to take over the voice-controlled digital assistants.,2019-11-04T18:07:02+0000,https://www.nytimes.com/2019/11/04/technology/digital-assistant-laser-hack.html,2019-10-01 to 2019-12-31
Intel,AI/Chip Manufacturing,You Don’t Need to Spend a Ton on a Pricey Gaming Laptop,"Any gaming laptop that costs thousands of dollars should be able to play the newest, most taxing games smoothly and consistently on high graphics settings. But you don’t need to shell out more than $1,500 to get a great laptop capable of playing y...",2019-10-14T00:00:00+0000,https://www.nytimes.com/wirecutter/blog/you-dont-need-to-spend-a-lot-on-a-pricey-gaming-laptop/,2019-10-01 to 2019-12-31
Intel,AI/Chip Manufacturing,"Before ‘The Crown,’ Revelations About the Actual Crown",A new book on Queen Elizabeth II spills some even more surprising style secrets.,2019-11-14T10:00:13+0000,https://www.nytimes.com/2019/11/14/style/Queen-Elizabeth-II-fashion-royal-dresser.html,2019-10-01 to 2019-12-31
Intel,AI/Chip Manufacturing,"‘Mr. Robot’ Season 4, Episode 8 Recap: Prisoners","As Elliot grapples with last week’s big revelation, paralysis sets in.",2019-11-25T04:00:06+0000,https://www.nytimes.com/2019/11/24/arts/television/mr-robot-episode-8-recap.html,2019-10-01 to 2019-12-31
Intel,AI/Chip Manufacturing,Be Paranoid About Privacy,We need to take back our privacy from tech companies — even if that means sacrificing convenience.,2019-12-24T17:47:04+0000,https://www.nytimes.com/2019/12/24/opinion/location-privacy.html,2019-10-01 to 2019-12-31
Intel,AI/Chip Manufacturing,Natalie Portman Shoots for the Stars and Loses Her Mind,"The actor finally fulfills a childhood dream, sort of, by climbing into a spacesuit to play a tormented astronaut in “Lucy in the Sky.” And soon she’ll wield the hammer as female Thor.",2019-10-04T14:00:08+0000,https://www.nytimes.com/2019/10/04/movies/natalie-portman-lucy-in-the-sky.html,2019-10-01 to 2019-12-31
Intel,AI/Chip Manufacturing,"‘Mr. Robot’ Season 4, Episode 6 Recap: Hostage Situations",Elliott crossed a line this week that even Mr. Robot can’t go along with.,2019-11-11T02:00:02+0000,https://www.nytimes.com/2019/11/10/arts/television/mr-robot-episode-6-recap.html,2019-10-01 to 2019-12-31
Intel,AI/Chip Manufacturing,The Week in Tech: Algorithmic Bias Is Bad. Uncovering It Is Good.,"We keep stumbling across examples of discrimination in algorithms, but that’s far better than their remaining hidden.",2019-11-15T14:00:06+0000,https://www.nytimes.com/2019/11/15/technology/algorithmic-ai-bias.html,2019-10-01 to 2019-12-31
Intel,AI/Chip Manufacturing,PG&E Outage Darkens Northern California Amid Wildfire Threat,A deliberate power outage by the state’s largest utility sent residents scrambling — and debating whether it was worth it.,2019-10-10T00:20:15+0000,https://www.nytimes.com/2019/10/09/us/california-power-outage-PGE.html,2019-10-01 to 2019-12-31
Intel,AI/Chip Manufacturing,Laughing Through the Trump Era,The great drama of the Russia investigation has turned out to be a dark Coen brothers farce.,2019-12-17T11:00:09+0000,https://www.nytimes.com/2019/12/17/opinion/trump-coen-brothers.html,2019-10-01 to 2019-12-31
Intel,AI/Chip Manufacturing,Trump and Tehran Shake Up the Middle East,Iran’s airstrike on Saudi oil sites exposed vulnerabilities around the region.,2019-10-08T19:55:47+0000,https://www.nytimes.com/2019/10/08/opinion/iran-israel-saudi-arabia.html,2019-10-01 to 2019-12-31
Intel,AI/Chip Manufacturing,Al-Baghdadi Is Dead. The Story Doesn’t End Here.,President Trump boasts of defeating the Islamic State. He’s only showing how ignorant he is.,2019-10-27T19:40:12+0000,https://www.nytimes.com/2019/10/27/opinion/trump-al-baghdadi-dead.html,2019-10-01 to 2019-12-31
Intel,AI/Chip Manufacturing,"By Taking Aim at Chinese Tech Firms, Trump Signals a Strategy Shift","In blacklisting surveillance companies, the United States is the first major government to punish China for its crackdown on Muslims.",2019-10-08T15:53:32+0000,https://www.nytimes.com/2019/10/08/business/china-human-rights-technology-xinjiang.html,2019-10-01 to 2019-12-31
Intel,AI/Chip Manufacturing,How a Fringe Theory About Ukraine Took Root in the White House,A false tale about a cybersecurity firm called CrowdStrike and a Democratic conspiracy to undermine the 2016 election has formed the background of President Trump’s impeachment inquiry.,2019-10-03T18:29:52+0000,https://www.nytimes.com/2019/10/03/us/politics/trump-ukraine-conspiracy.html,2019-10-01 to 2019-12-31
Intel,AI/Chip Manufacturing,How SEALs and Veterans View the Trump-Navy Tussle Over Gallagher,Navy leaders’ efforts to punish a decorated SEAL at the center of a war crimes case and the president’s intervention on the SEAL’s behalf have prompted criticism on both sides and embarrassment over the public imbroglio.,2019-11-25T22:07:27+0000,https://www.nytimes.com/2019/11/25/us/navy-seals-gallagher-reaction.html,2019-10-01 to 2019-12-31
Intel,AI/Chip Manufacturing,The World-Shaking News That You’re Missing,The U.S.-China divide isn’t just about trade.,2019-11-27T00:28:17+0000,https://www.nytimes.com/2019/11/26/opinion/united-states-china.html,2019-10-01 to 2019-12-31
Intel,AI/Chip Manufacturing,Trump Impeachment Inquiry: Latest Updates,"President Trump attacked two House leaders after they threatened to subpoena the White House, and Mike Pompeo, the secretary of state, confirmed he listened in on the call with Ukraine’s president.",2019-10-02T15:57:03+0000,https://www.nytimes.com/2019/10/02/us/politics/trump-impeachment-inquiry.html,2019-10-01 to 2019-12-31
Intel,AI/Chip Manufacturing,Boeing Crisis Could Hit the Broader Economy,"A halt in production of the company’s 737 Max jet will affect hundreds of parts suppliers around the U.S., but will reduce losses for Boeing.",2019-12-17T11:19:33+0000,https://www.nytimes.com/2019/12/17/business/dealbook/boeing-737-max-production.html,2019-10-01 to 2019-12-31
Intel,AI/Chip Manufacturing,Inside Epstein’s Embellished Charitable Giving,"Jeffrey Epstein’s foundation looked like a charitable powerhouse. But it wasn’t officially a charity for much of its existence, allowing it to exaggerate its giving.",2019-11-27T11:09:11+0000,https://www.nytimes.com/2019/11/27/business/dealbook/jeffrey-epstein-charity.html,2019-10-01 to 2019-12-31
Intel,AI/Chip Manufacturing,DealBook: Trump Says Business Leaders ‘Have No Choice’ but to Vote for Him,"In a speech at the Economic Club of New York, the president defended his tariffs and argued that his policies could allow America’s prosperity to continue growing.",2019-11-13T11:34:52+0000,https://www.nytimes.com/2019/11/13/business/dealbook/trump-economic-club.html,2019-10-01 to 2019-12-31
Intel,AI/Chip Manufacturing,Saudi Aramco Shares Jump 10% in Record I.P.O.,Shares of the world’s largest oil company rose 10 percent during their market debut. The offering is expected to set a record.,2019-12-11T11:33:59+0000,https://www.nytimes.com/2019/12/11/business/dealbook/saudi-aramco-ipo.html,2019-10-01 to 2019-12-31
Intel,AI/Chip Manufacturing,"DealBook: U.S. Companies, Ranked by What Americans Value","The American public values things like fair pay, ethical leadership and job creation. Which companies come out top when judged against those metrics?",2019-11-12T11:14:31+0000,https://www.nytimes.com/2019/11/12/business/dealbook/american-companies-values.html,2019-10-01 to 2019-12-31
Intel,AI/Chip Manufacturing,Saudi Aramco Sells $25.6 billion in Shares for I.P.O.,"Saudi Arabia’s state-owned oil company priced its offering at a level that would raise $25.6 billion, becoming the largest stock market debut on record.",2019-12-06T11:39:16+0000,https://www.nytimes.com/2019/12/06/business/dealbook/saudi-aramco-ipo.html,2019-10-01 to 2019-12-31
Intel,AI/Chip Manufacturing,Trump’s Bizarre Apple Factory Visit,"President Trump didn’t rule out exempting Apple from tariffs, while the company’s C.E.O., Tim Cook, stood in silence as the president made inaccurate claims about the firm.",2019-11-21T11:27:32+0000,https://www.nytimes.com/2019/11/21/business/dealbook/trump-apple-tim-cook.html,2019-10-01 to 2019-12-31
Intel,AI/Chip Manufacturing,De Niro and Pacino Have Always Connected. Just Rarely Onscreen.,"“The Irishman” is officially only the third time they’ve collaborated, but over the years they often turned to one another. Who else could understand?",2019-10-24T09:00:17+0000,https://www.nytimes.com/2019/10/24/movies/robert-de-niro-al-pacino-the-irishman.html,2019-10-01 to 2019-12-31
Broadcom,AI/Chip Manufacturing,"Teenager Wins $25,000 for Science Project That Solves Blind Spots in Cars","Alaina Gassler, 14, got the idea for her science project after noticing how her mother didn’t like driving the family’s S.U.V.",2019-11-07T14:05:39+0000,https://www.nytimes.com/2019/11/07/us/blind-spots-science-project.html,2019-10-01 to 2019-12-31
Broadcom,AI/Chip Manufacturing,Europe’s Margrethe Vestager Takes a Rare Step Toward Big Tech,The E.U.’s top antitrust regulator ordered Broadcom to halt specific practices while the bloc investigates possible anticompetitive activity.,2019-10-16T12:49:18+0000,https://www.nytimes.com/2019/10/16/business/-big-tech-europe-antitrust.html,2019-10-01 to 2019-12-31
Broadcom,AI/Chip Manufacturing,Investors Get Excited Over the Brexit Deal,The British pound surged this morning after Britain and the E.U. reached an agreement on Brexit. But there are still serious hurdles to overcome.,2019-10-17T10:51:34+0000,https://www.nytimes.com/2019/10/17/business/dealbook/brexit-deal-investors.html,2019-10-01 to 2019-12-31
Broadcom,AI/Chip Manufacturing,TikTok Said to Be Under National Security Review,The review comes after lawmakers raised concerns about TikTok’s growing influence in the United States.,2019-11-01T19:07:59+0000,https://www.nytimes.com/2019/11/01/technology/tiktok-national-security-review.html,2019-10-01 to 2019-12-31
Broadcom,AI/Chip Manufacturing,House Impeachment Vote Is Unlikely to Sway Markets,"Investors don’t expect the Republican-controlled Senate to remove President Trump from office, according to a survey by RBC Capital Markets.",2019-12-19T11:38:02+0000,https://www.nytimes.com/2019/12/19/business/dealbook/trump-impeachment-markets.html,2019-10-01 to 2019-12-31
Broadcom,AI/Chip Manufacturing,How a Tweet Put the NBA in Hot Water in China,"A quickly deleted post by a Houston Rockets executive opened the league, which has had huge success in China, up to blowback in a vital overseas market.",2019-10-07T10:28:27+0000,https://www.nytimes.com/2019/10/07/sports/basketball/nba-china.html,2019-10-01 to 2019-12-31
Taiwan Semiconductor,AI/Chip Manufacturing,"Pentagon, With an Eye on China, Pushes for Help From American Tech",Talks over how U.S. companies can ensure future supplies of advanced computer chips have taken on more urgency.,2019-10-25T09:00:22+0000,https://www.nytimes.com/2019/10/25/technology/pentagon-taiwan-tsmc-chipmaker.html,2019-10-01 to 2019-12-31
Taiwan Semiconductor,AI/Chip Manufacturing,"Global Trade Is Deteriorating Fast, Sapping the Worlds Economy",Growth in global trade is slowing dramatically as the world economy weakens and as the United States and China escalate their trade war.,2019-12-14T10:00:14+0000,https://www.nytimes.com/2019/12/14/business/china-trade-hardliners.html,2019-10-01 to 2019-12-31
Taiwan Semiconductor,AI/Chip Manufacturing,Hong Kong Stock Market Retracts Offer to Buy London Exchange,"Regulatory concerns would have made a deal difficult. Still, both exchanges and their home cities face difficult questions about their future.",2019-12-14T10:00:14+0000,https://www.nytimes.com/2019/12/14/business/china-trade-hardliners.html,2019-10-01 to 2019-12-31
Taiwan Semiconductor,AI/Chip Manufacturing,Why Gamers Are Protesting BlizzCon for Hong Kong,"Blizzard, the video game company, sparked a backlash after punishing a player who supported demonstrators in Hong Kong. The companys convention in California faced a protest of its own.",2019-12-14T10:00:14+0000,https://www.nytimes.com/2019/12/14/business/china-trade-hardliners.html,2019-10-01 to 2019-12-31
Taiwan Semiconductor,AI/Chip Manufacturing,SoftBank and Line Corp. Seek to Create a Japanese Internet Giant,"Fresh off a multibillion-dollar loss on WeWork, SoftBank plans to shore up its domestic business with a big bet on Japans leading messaging app company.",2019-12-14T10:00:14+0000,https://www.nytimes.com/2019/12/14/business/china-trade-hardliners.html,2019-10-01 to 2019-12-31
Taiwan Semiconductor,AI/Chip Manufacturing,U.S. Bill Supporting Hong Kong Rights Heads to Trumps Desk,"After winning House and Senate approval, the bill could complicate the administrations already rocky talks with China to end the trade war.",2019-12-14T10:00:14+0000,https://www.nytimes.com/2019/12/14/business/china-trade-hardliners.html,2019-10-01 to 2019-12-31
Taiwan Semiconductor,AI/Chip Manufacturing,China’s Hard-Liners Win a Round in Trump’s Trade Deal,"A year and a half into the trade war, China seems to have a winning strategy: Stay tough and let the Trump administration negotiate with itself.",2019-12-14T10:00:14+0000,https://www.nytimes.com/2019/12/14/business/china-trade-hardliners.html,2019-10-01 to 2019-12-31
