company,sector,headline,snippet,pub_date,url,quarter
JPMorgan Chase,Finance/Banking,Some Banks Keep Customers’ Stimulus Checks if Accounts Are Overdrawn,Financial institutions can use the government deposits to make up for recipients’ negative balances.,2020-04-16T09:00:19+0000,https://www.nytimes.com/2020/04/16/business/stimulus-paychecks-garnish-banks.html,2020-04-01 to 2020-06-30
JPMorgan Chase,Finance/Banking,Trying to Correct Banking’s Racial Imbalance,Entrepreneurs are working on new business models to address income inequality and a resulting lack of access to the financial system for communities of color.,2020-06-30T09:00:30+0000,https://www.nytimes.com/2020/06/30/business/banking-race-black-inequality.html,2020-04-01 to 2020-06-30
JPMorgan Chase,Finance/Banking,Summer Internships Won’t Be the Same This Year,"With lockdowns in place for a while longer, thousands of graduates are fretting about the future of sought-after programs on Wall Street and beyond.",2020-04-20T10:52:08+0000,https://www.nytimes.com/2020/04/20/business/dealbook/summer-internship-coronavirus-virtual-remote.html,2020-04-01 to 2020-06-30
JPMorgan Chase,Finance/Banking,"Warren Buffett’s Optimistic? Pessimistic? No, Realistic",Between the lines of “You can bet on America” were warnings not to be overconfident in predicting what the future might hold.,2020-05-03T20:16:28+0000,https://www.nytimes.com/2020/05/03/business/dealbook/warren-buffett-berkshire-hathaway.html,2020-04-01 to 2020-06-30
JPMorgan Chase,Finance/Banking,Working From Home Feeds Market’s Woes in Little Ways That Add Up,"As traders scattered to their homes, sacrificing fast speeds, multiple screens and intricate setups, decisions took longer to communicate, slowing markets and adding uncertainty.",2020-04-12T20:13:22+0000,https://www.nytimes.com/2020/04/12/business/coronavirus-traders-work-from-home.html,2020-04-01 to 2020-06-30
JPMorgan Chase,Finance/Banking,Obama Says U.S. Lacks Leadership on Virus in Commencement Speeches,"The virus has “torn back the curtain on the idea that so many of the folks in charge know what they’re doing,” the former president said. “A lot of them aren’t even pretending to be in charge.”",2020-05-16T15:00:08+0000,https://www.nytimes.com/2020/05/16/us/barack-obama-2020-commencement-graduation-speech.html,2020-04-01 to 2020-06-30
JPMorgan Chase,Finance/Banking,I’m Not Ready to Go Back to Restaurants. Is Anyone?,"Restaurateurs have become de facto public-health officials as Covid-19 cases spike all over the country, and it’s a problem.",2020-06-30T15:30:40+0000,https://www.nytimes.com/2020/06/30/dining/restaurant-risks-coronavirus.html,2020-04-01 to 2020-06-30
JPMorgan Chase,Finance/Banking,Gaining Skills Virtually to Close the Inequality Gap,Successful job-training programs for low-income young people have long been held in person. Can a virtual ladder still be a path to the middle class?,2020-06-07T17:38:27+0000,https://www.nytimes.com/2020/06/07/technology/virtual-skills-inequality-gap-virus.html,2020-04-01 to 2020-06-30
JPMorgan Chase,Finance/Banking,Banks Warn of ‘Overwhelming’ Demand and Messy Start for Small Business Loans,"The government has promised to lend $349 billion to small businesses starting Friday, but banks and owners have no idea how it will play out.",2020-04-02T15:35:15+0000,https://www.nytimes.com/2020/04/02/business/small-business-coronavirus-stimulus.html,2020-04-01 to 2020-06-30
JPMorgan Chase,Finance/Banking,Trump’s ‘Opening Our Country Council’ Runs Into Its Own Opening Problems,"Instead of a formal council, the president created several industry groups, and joined four calls with them. But some participants had no notice they would be included, and others could not join in.",2020-04-16T00:02:28+0000,https://www.nytimes.com/2020/04/15/us/politics/trump-coronavirus-economy-panel.html,2020-04-01 to 2020-06-30
JPMorgan Chase,Finance/Banking,"Small-Business Loan Program, Chaotic From Start, Gets 2nd Round","The Paycheck Protection Program distributed $349 billion in less than two weeks, but lenders and borrowers confronted confusion at every step.",2020-04-26T22:09:12+0000,https://www.nytimes.com/2020/04/26/business/ppp-small-business-loans.html,2020-04-01 to 2020-06-30
JPMorgan Chase,Finance/Banking,Congress Steps Up Pressure as Trump Administration Evades Bailout Oversight,"As independent watchdogs sound an oversight alarm, House Democrats demand to know who got $500 billion in small-business loans.",2020-06-16T00:00:25+0000,https://www.nytimes.com/2020/06/15/us/politics/coronavirus-ppp-trump-congress.html,2020-04-01 to 2020-06-30
JPMorgan Chase,Finance/Banking,"As States Push to Reopen, Business Leaders Say Not So Fast","“Shutting down was hard, but opening up is going to be harder,” one C.E.O. said of balancing public health and a damaged economy.",2020-04-26T09:00:24+0000,https://www.nytimes.com/2020/04/26/business/coronavirus-states-businesses-reopen.html,2020-04-01 to 2020-06-30
JPMorgan Chase,Finance/Banking,Coronavirus Briefing: What Happened Today,Top U.S. health officials testified before Congress and warned that the country was a long way from containing the outbreak.,2020-05-12T23:36:47+0000,https://www.nytimes.com/2020/05/12/us/coronavirus-today.html,2020-04-01 to 2020-06-30
JPMorgan Chase,Finance/Banking,"A Big, Once-Reliable Source of Investor Cash Is Drying Up","The losses aren’t coming just from the drop in stock prices. The effect of the dividend cuts sweeping through the market will hurt, too.",2020-04-24T17:00:19+0000,https://www.nytimes.com/2020/04/24/business/coronavirus-stocks-investing-dividends.html,2020-04-01 to 2020-06-30
JPMorgan Chase,Finance/Banking,Here’s What Companies Are Promising to Do to Fight Racism,"Corporate America has pledged millions to social justice efforts since the killing of George Floyd. But some businesses have gone further, committing to concrete changes in their practices.",2020-06-19T13:13:55+0000,https://www.nytimes.com/article/companies-racism-george-floyd-protests.html,2020-04-01 to 2020-06-30
JPMorgan Chase,Finance/Banking,Policymakers and the Pandemic: Now What?,The Fed and Treasury chiefs both described the economy in gloomy terms at a congressional hearing. But they differed about how to fix it.,2020-05-20T11:01:34+0000,https://www.nytimes.com/2020/05/20/business/dealbook/coronavirus-stimulus-mnuchin-powell.html,2020-04-01 to 2020-06-30
JPMorgan Chase,Finance/Banking,A Decade of Jobs Destroyed in a Month,The number of people in America who lost their jobs in the past four weeks is expected to surpass all of the jobs created since the last recession.,2020-04-16T10:47:41+0000,https://www.nytimes.com/2020/04/16/business/dealbook/coronavirus-jobs-unemployment-claims.html,2020-04-01 to 2020-06-30
JPMorgan Chase,Finance/Banking,European Banks Prepared for a Crisis. But Not This One.,"The financial impact of the coronavirus surpasses the old worst-case scenarios, threatening a credit crunch or even a new financial crisis.",2020-04-06T07:00:10+0000,https://www.nytimes.com/2020/04/06/business/european-banks-coronavirus.html,2020-04-01 to 2020-06-30
JPMorgan Chase,Finance/Banking,Fed Limits Bank Payouts and Suspends Share Buybacks as Pandemic Grinds On,"About a quarter of banks would near minimum capital levels in a double dip recession, the Fed said, as it announced its stress-test results.",2020-06-25T20:30:47+0000,https://www.nytimes.com/2020/06/25/business/economy/fed-dividend-buyback-limits.html,2020-04-01 to 2020-06-30
JPMorgan Chase,Finance/Banking,"Fed Gives Banks a Break to Keep Markets Calm, Asking for Little in Return","The Federal Reserve is giving banks room to maneuver with regulatory tweaks. But it isn’t barring them from paying dividends, fueling concerns that it is ignoring the lessons of the last crisis.",2020-04-15T22:00:56+0000,https://www.nytimes.com/2020/04/15/business/economy/fed-banks-dividends-virus.html,2020-04-01 to 2020-06-30
JPMorgan Chase,Finance/Banking,"Cruise Industry, a Symbol of the Pandemic, Scrambles to Survive",Carnival and the other big companies have no revenue and face questions over whether customers will return once the threat of the coronavirus passes.,2020-04-07T07:03:23+0000,https://www.nytimes.com/2020/04/07/business/coronavirus-cruise-industry-carnival.html,2020-04-01 to 2020-06-30
JPMorgan Chase,Finance/Banking,The Business Leaders Trump Asks for Advice on the Coronavirus,"President Trump is taking advice on his administration’s coronavirus response from a wide range of people, but he trusts some more than others.",2020-04-03T10:54:56+0000,https://www.nytimes.com/2020/04/03/business/dealbook/trump-coronavirus-advisors.html,2020-04-01 to 2020-06-30
JPMorgan Chase,Finance/Banking,You Have to Pay to Give Oil Away,"The price of a barrel of oil dropped below zero, reflecting both short-term technical factors and long-term fundamentals. A recovery seems remote.",2020-04-21T10:51:38+0000,https://www.nytimes.com/2020/04/21/business/dealbook/oil-price-negative.html,2020-04-01 to 2020-06-30
JPMorgan Chase,Finance/Banking,Small-Business Aid Bill Faces Delay as Democrats Seek More Funds,Democrats say the $250 billion requested by the Trump administration for loans for the businesses will not pass unless money is included for hospitals and state and local governments.,2020-04-08T23:14:11+0000,https://www.nytimes.com/2020/04/08/us/politics/small-business-loans-coronavirus.html,2020-04-01 to 2020-06-30
JPMorgan Chase,Finance/Banking,A Wall Street Bank’s Hard-Driving Culture Pushes Traders Into the Office,Some employees at Bank of America’s New York headquarters say they fear pay cuts or job loss if they don’t show up and make money.,2020-04-09T18:50:51+0000,https://www.nytimes.com/2020/04/09/business/coronvirus-bank-of-america-workers.html,2020-04-01 to 2020-06-30
JPMorgan Chase,Finance/Banking,"New Yorkers Can Now Go Back to Offices, but Many Won’t","As the city entered Phase 2 of reopening, subway cars and sidewalks were relatively empty as many companies kept workers home.",2020-06-22T09:00:20+0000,https://www.nytimes.com/2020/06/22/nyregion/nyc-phase-2-reopening-coronavirus.html,2020-04-01 to 2020-06-30
JPMorgan Chase,Finance/Banking,"With Demand Soaring, Congress Weighs Adding $250 Billion in Small-Business Aid","Less than two weeks after enactment of a $2 trillion stimulus plan, the Trump administration is asking for a fresh infusion of funds to help businesses survive the economic damage of the coronavirus.",2020-04-07T22:24:35+0000,https://www.nytimes.com/2020/04/07/us/politics/coronavirus-congress-small-businesses.html,2020-04-01 to 2020-06-30
JPMorgan Chase,Finance/Banking,New Hope for White-Collar Job Seekers? It Depends on the Job,"The hiring trough seems to have passed, but most opportunities are with the industries least buffeted by the coronavirus shutdown.",2020-06-21T17:57:07+0000,https://www.nytimes.com/2020/06/21/business/economy/coronavirus-job-hunting.html,2020-04-01 to 2020-06-30
JPMorgan Chase,Finance/Banking,"The Tiny Bank That Got Pandemic Aid to 100,000 Small Businesses",Cross River has cranked out more loans under the federal Paycheck Protection Program than all but three of the country’s biggest lenders.,2020-06-23T15:55:53+0000,https://www.nytimes.com/2020/06/23/business/paycheck-protection-program-cross-river-bank.html,2020-04-01 to 2020-06-30
JPMorgan Chase,Finance/Banking,"Some Companies Seeking Bailouts Had Piles of Cash, Then Spent It","They poured the money into stock buybacks and dividends. Now, those hurting from the pandemic want government aid.",2020-04-24T09:00:17+0000,https://www.nytimes.com/2020/04/24/business/coronavirus-bailouts-buybacks-cash.html,2020-04-01 to 2020-06-30
JPMorgan Chase,Finance/Banking,Loan Money Runs Out While Small-Business Owners Wait in Line,"Frustrated with the process and banks, they have to figure out how to stay afloat while Congress tries to come up with more funding.",2020-04-16T22:51:08+0000,https://www.nytimes.com/2020/04/16/business/coronavirus-sba-loans-out-of-money.html,2020-04-01 to 2020-06-30
JPMorgan Chase,Finance/Banking,Trump and Biden Will Fight the Election With Charts,"In the campaign, selective quoting of statistics will paint sharply different — but equally valid — pictures of economic health during the pandemic.",2020-05-28T11:20:56+0000,https://www.nytimes.com/2020/05/28/business/dealbook/trump-biden-economics.html,2020-04-01 to 2020-06-30
JPMorgan Chase,Finance/Banking,Big Business Pledged Gentler Capitalism. It’s Not Happening in a Pandemic.,"C.E.O.s who signed a celebrated Business Roundtable document, promising to elevate worker interests, are now resorting to furloughs.",2020-04-13T09:00:23+0000,https://www.nytimes.com/2020/04/13/business/business-roundtable-coronavirus.html,2020-04-01 to 2020-06-30
JPMorgan Chase,Finance/Banking,"Frantic for Coronavirus Gear, Americans in Need Turn to China’s Elite",People and companies with vested interest in sustaining the U.S.-China relationship are stepping in as ties fray between the two countries.,2020-04-24T07:31:30+0000,https://www.nytimes.com/2020/04/24/business/us-china-coronavirus-donations.html,2020-04-01 to 2020-06-30
JPMorgan Chase,Finance/Banking,Paternity Leave Has Long-Lasting Benefits. So Why Don’t More American Men Take It?,"Men who take leave are less likely to get divorced, and have better relationships with their children, research shows.",2020-04-17T15:55:26+0000,https://www.nytimes.com/2020/04/17/parenting/paternity-leave.html,2020-04-01 to 2020-06-30
JPMorgan Chase,Finance/Banking,An L.G.B.T. Landmark,"In an unexpected ruling, the Supreme Court said that the Civil Rights Act protects workers if they’re fired “merely for being gay or transgender.”",2020-06-16T11:06:26+0000,https://www.nytimes.com/2020/06/16/business/dealbook/supreme-court-lgbt.html,2020-04-01 to 2020-06-30
JPMorgan Chase,Finance/Banking,"Coronavirus, California, Michael Flynn: Your Wednesday Briefing",Here’s what you need to know.,2020-05-13T10:35:12+0000,https://www.nytimes.com/2020/05/13/briefing/coronavirus-california-michael-flynn-your-wednesday-briefing.html,2020-04-01 to 2020-06-30
JPMorgan Chase,Finance/Banking,Black-Owned Businesses Could Face Hurdles in Federal Aid Program,"Minority business owners have always struggled to secure bank loans. Now, many banks want to deal only with existing customers when making loans through the government’s $349 billion aid package.",2020-04-10T20:35:52+0000,https://www.nytimes.com/2020/04/10/business/minority-business-coronavirus-loans.html,2020-04-01 to 2020-06-30
JPMorgan Chase,Finance/Banking,An Airline Bailout Is Taking Shape,The latest on stock market and business news during the coronavirus outbreak.,2020-04-14T04:08:57+0000,https://www.nytimes.com/2020/04/14/business/stock-market-covid-coronavirus.html,2020-04-01 to 2020-06-30
JPMorgan Chase,Finance/Banking,‘A Heartbreaking and Painful Week’,Business leaders are speaking out about nationwide protests against police brutality and discrimination.,2020-06-01T10:58:43+0000,https://www.nytimes.com/2020/06/01/business/dealbook/george-floyd-protests.html,2020-04-01 to 2020-06-30
JPMorgan Chase,Finance/Banking,Job or Health? Restarting the Economy Threatens to Worsen Economic Inequality,The coronavirus recession has exacerbated the racial and income divides in America. Lifting restrictions too soon will make them worse and leave workers with a bleak choice.,2020-04-27T20:51:12+0000,https://www.nytimes.com/2020/04/27/business/economy/coronavirus-economic-inequality.html,2020-04-01 to 2020-06-30
JPMorgan Chase,Finance/Banking,Classic Skyscrapers Define New York. Take a Virtual Tour.,"The epitome of the ‘Mad Men’ era, the sleek midcentury buildings of Park Avenue glimmer. Our critic strolls with the architect Annabelle Selldorf.",2020-04-22T09:00:44+0000,https://www.nytimes.com/2020/04/22/arts/design/nyc-skyscrapers-virtual-tour-virus.html,2020-04-01 to 2020-06-30
JPMorgan Chase,Finance/Banking,Stocks Slide as Texas Rolls Back Reopening,The latest on stock market and business news during the coronavirus outbreak.,2020-06-26T08:27:46+0000,https://www.nytimes.com/2020/06/26/business/stock-market-today-coronavirus.html,2020-04-01 to 2020-06-30
JPMorgan Chase,Finance/Banking,J.C. Penney Files for Bankruptcy Protection,The latest on stock market and business news during the coronavirus outbreak.,2020-05-15T04:03:07+0000,https://www.nytimes.com/2020/05/15/business/stock-market-today-coronavirus.html,2020-04-01 to 2020-06-30
JPMorgan Chase,Finance/Banking,The Next Gauge of the Economy Will Be Corporate Earnings,The latest on stock market and business news during the coronavirus outbreak.,2020-04-10T04:47:23+0000,https://www.nytimes.com/2020/04/10/business/stock-market-today-coronavirus.html,2020-04-01 to 2020-06-30
JPMorgan Chase,Finance/Banking,China’s G.D.P. Shrank in the First Quarter,The latest on stock market and business news during the coronavirus outbreak.,2020-04-16T04:12:45+0000,https://www.nytimes.com/2020/04/16/business/stock-market-live-coronavirus.html,2020-04-01 to 2020-06-30
JPMorgan Chase,Finance/Banking,Bleak Data Shows Extent of Economic Damage,The latest on stock market and business news during the coronavirus outbreak.,2020-04-15T04:09:00+0000,https://www.nytimes.com/2020/04/15/business/stock-market-today-coronavirus.html,2020-04-01 to 2020-06-30
JPMorgan Chase,Finance/Banking,More Than 4 Million Filed Unemployment Claims Last Week,The latest on stock market and business news during the coronavirus outbreak.,2020-04-23T04:04:01+0000,https://www.nytimes.com/2020/04/23/business/stock-market-coronavirus-live.html,2020-04-01 to 2020-06-30
JPMorgan Chase,Finance/Banking,Stocks Waver as China Tensions Climb,The latest on stock market and business news during the coronavirus outbreak.,2020-05-04T04:20:52+0000,https://www.nytimes.com/2020/05/04/business/live-stock-market-coronavirus.html,2020-04-01 to 2020-06-30
JPMorgan Chase,Finance/Banking,Airlines and Automakers Consider How to Reopen,The latest on stock market and business news during the coronavirus outbreak.,2020-04-22T04:35:53+0000,https://www.nytimes.com/2020/04/22/business/stock-market-tracker-live-coronavirus.html,2020-04-01 to 2020-06-30
JPMorgan Chase,Finance/Banking,When Manhattan Was Mannahatta: A Stroll Through the Centuries,"From lush forest to metropolis, the evolution of Lower Manhattan. Our critic walks with Eric W. Sanderson of the Wildlife Conservation Society.",2020-05-13T09:00:46+0000,https://www.nytimes.com/2020/05/13/arts/design/manhattan-virtual-tour-virus.html,2020-04-01 to 2020-06-30
JPMorgan Chase,Finance/Banking,‘Extraordinarily Uncertain’ Outlook From Powell,The latest on stock market and business news during the coronavirus outbreak.,2020-06-29T09:06:13+0000,https://www.nytimes.com/2020/06/29/business/stock-market-today-coronavirus.html,2020-04-01 to 2020-06-30
JPMorgan Chase,Finance/Banking,Stocks Rise as Oil Prices Plunge,The latest on stock market and business news during the coronavirus outbreak.,2020-04-27T04:14:27+0000,https://www.nytimes.com/2020/04/27/business/coronavirus-stock-market-tracker.html,2020-04-01 to 2020-06-30
JPMorgan Chase,Finance/Banking,Shooting in Seattle Raises Worries; Video Catches Calif. Sign Vandals,"Prison guards in Minnesota say only whites were allowed to guard Derek Chauvin, the officer who knelt on George Floyd’s neck, when he was first taken to jail.",2020-06-21T16:22:15+0000,https://www.nytimes.com/2020/06/21/us/black-lives-matter-protests.html,2020-04-01 to 2020-06-30
JPMorgan Chase,Finance/Banking,One Bar. Twelve Weeks. Seventeen Lives in Lockdown.,Following an Oakland tavern and its staff — from the tattooed bartender to the undocumented cleaner — as they weather the economic and emotional fallout of the coronavirus.,2020-06-11T09:00:48+0000,https://www.nytimes.com/2020/06/11/business/coronavirus-california-lockdown-small-business.html,2020-04-01 to 2020-06-30
JPMorgan Chase,Finance/Banking,"Testing Is Biggest Obstacle to Reopening States, Experts Say","Health, business and political leaders warn against a rush to lift restrictions. New Yorkers will have to wear face coverings in public, and California will extend aid to undocumented workers.",2020-04-15T09:00:46+0000,https://www.nytimes.com/2020/04/15/us/coronavirus-cases-update-live.html,2020-04-01 to 2020-06-30
JPMorgan Chase,Finance/Banking,Coronavirus Updates: Trump Halts U.S. Funding of World Health Organization,"New York deaths spike as the state releases a revised count, and California explores steps toward reopening. Trump announces his “opening the country” council.",2020-04-14T09:05:41+0000,https://www.nytimes.com/2020/04/14/us/coronavirus-updates.html,2020-04-01 to 2020-06-30
JPMorgan Chase,Finance/Banking,"C.D.C. Recommends Wearing Masks in Public; Trump Says, ‘I’m Choosing Not to Do It’","Alabama became the 41st state to issue a stay-at-home order, and the attorney general expanded the pool of prisoners eligible for early release from federal prisons.",2020-04-03T04:21:05+0000,https://www.nytimes.com/2020/04/03/world/coronavirus-news-updates.html,2020-04-01 to 2020-06-30
Goldman Sachs,Finance/Banking,Goldman Sachs Is Said to Try to Avoid Pleading Guilty in 1MDB Scandal,"The bank has asked the U.S. to review demands that any settlement include a guilty plea to a felony charge, according to people briefed on the matter.",2020-06-11T18:01:55+0000,https://www.nytimes.com/2020/06/11/business/goldman-sachs-1mdb-malaysia.html,2020-04-01 to 2020-06-30
Goldman Sachs,Finance/Banking,‘Very Harsh Indeed’,Bankers’ enthusiasm for the Fed’s relaxation of investing rules was tempered by new restrictions it imposed on buybacks and dividends.,2020-06-26T11:15:25+0000,https://www.nytimes.com/2020/06/26/business/dealbook/fed-stress-test-volcker-rule.html,2020-04-01 to 2020-06-30
Goldman Sachs,Finance/Banking,"Goldman Sachs Forecloses on 10,000 Homes for ‘Consumer Relief’","A federal settlement over the 2008 financial crisis required the bank to offer homeowners $1.8 billion in relief. In the process, it became a big buyer of distressed mortgages.",2020-05-22T07:00:07+0000,https://www.nytimes.com/2020/05/22/business/goldman-sachs-mortgage-foreclosure.html,2020-04-01 to 2020-06-30
Goldman Sachs,Finance/Banking,Boxed Lunches and Plexiglass Will Welcome Back Wall Street’s Workers,"The finance industry will return to its offices this month, but the landscape is likely to be altered for many months to come.",2020-06-08T18:03:09+0000,https://www.nytimes.com/2020/06/08/business/wall-street-virus-reopen.html,2020-04-01 to 2020-06-30
Goldman Sachs,Finance/Banking,"TPG in Talks to Acquire Goal, the Soccer Website, for $125 Million",DAZN Group is in final stage talks to sell the popular soccer website Goal.com to the investment firm TPG as it raises cash for its money-losing sports streaming platform.,2020-06-03T22:29:01+0000,https://www.nytimes.com/2020/06/03/sports/soccer/dazn-soccer-goal-tpg.html,2020-04-01 to 2020-06-30
Goldman Sachs,Finance/Banking,Jack Ma Quits SoftBank,"The Alibaba founder stepped down from SoftBank’s board on the day it posted a huge loss, dragged down by its once-vaunted technology investment fund.",2020-05-18T11:19:21+0000,https://www.nytimes.com/2020/05/18/business/dealbook/softbank-ma-vision-fund.html,2020-04-01 to 2020-06-30
Goldman Sachs,Finance/Banking,The Market Grapples With Fear and the Timing of a Recovery,"The health and economic effects of the pandemic are already immense, but investors need to assess how long they will last.",2020-04-17T09:00:19+0000,https://www.nytimes.com/2020/04/17/business/market-fear-timing-recovery.html,2020-04-01 to 2020-06-30
Goldman Sachs,Finance/Banking,Companies With High Debt Are Paying a Price,"For years, corporations bolstered their share prices by buying back stock with borrowed money. That practice may be catching up with some of them.",2020-04-16T16:00:09+0000,https://www.nytimes.com/2020/04/16/business/high-debt-companies-investing.html,2020-04-01 to 2020-06-30
Goldman Sachs,Finance/Banking,A Decade of Jobs Destroyed in a Month,The number of people in America who lost their jobs in the past four weeks is expected to surpass all of the jobs created since the last recession.,2020-04-16T10:47:41+0000,https://www.nytimes.com/2020/04/16/business/dealbook/coronavirus-jobs-unemployment-claims.html,2020-04-01 to 2020-06-30
Goldman Sachs,Finance/Banking,Big Banks Get Ready for Rough Days Ahead,"Bank of America, Goldman Sachs and Citigroup, all reporting quarterly earnings, said they had set aside billions of dollars in preparation for loan defaults.",2020-04-15T22:29:18+0000,https://www.nytimes.com/2020/04/15/business/banks-earnings-virus.html,2020-04-01 to 2020-06-30
Goldman Sachs,Finance/Banking,Warner Music Launches Its I.P.O.,"The recording company, which has musicians like Ed Sheeran on its books, tries to cash in on the streaming boom with a listing that would value it at up to $13.3 billion.",2020-05-26T13:47:50+0000,https://www.nytimes.com/2020/05/26/business/media/warner-music-ipo.html,2020-04-01 to 2020-06-30
Goldman Sachs,Finance/Banking,The Week in Business: The Second Wave Is Coming,How bad will it be?,2020-06-14T11:00:10+0000,https://www.nytimes.com/2020/06/14/business/coronavirus-second-wave.html,2020-04-01 to 2020-06-30
Goldman Sachs,Finance/Banking,"Jay Clayton, Low-Profile Regulator, Is Catapulted Into a Political Fight","Amid a muted tenure at the S.E.C., the corporate lawyer is now the Trump administration’s intended nominee to be the top prosecutor for the Southern District of New York.",2020-06-20T21:42:15+0000,https://www.nytimes.com/2020/06/20/business/jay-clayton-sdny-sec.html,2020-04-01 to 2020-06-30
