company,sector,headline,snippet,pub_date,url,quarter
Amazon,Technology,"Netflix vs. Amazon, and the New Economics of Television","To succeed today, you need to control either the content or the pipes.",2014-04-25T18:09:03+0000,https://www.nytimes.com/2014/04/27/upshot/netflix-vs-amazon-and-the-new-economics-of-television.html,2014-04-01 to 2014-06-30
Amazon,Technology,Amazon to Stream Original HBO Content,"In a deal believed to be worth at least $300 million, Amazon is forming an alliance with HBO.",2014-04-23T13:13:57+0000,https://www.nytimes.com/2014/04/24/business/amazon-to-offer-original-hbo-content.html,2014-04-01 to 2014-06-30
Amazon,Technology,"Amazon’s Revenue Grew 23 Percent in First Quarter, Nearing $20 Billion","The company had earnings per share of 23 cents, exactly hitting forecasts. Last quarter, analysts expected more than twice that amount.",2014-04-24T20:52:55+0000,https://www.nytimes.com/2014/04/25/technology/amazon-quarterly-earnings.html,2014-04-01 to 2014-06-30
Amazon,Technology,Losing Ground in the Amazon,"After years of progress in Brazil, deforestation and greenhouse gases are on the rise.",2014-04-15T11:10:08+0000,https://www.nytimes.com/2014/04/16/opinion/losing-ground-in-the-amazon.html,2014-04-01 to 2014-06-30
Amazon,Technology,Companies Back Initiative to Support OpenSSL and Other Open-Source Projects,The Heartlbleed bug that weakened the security of millions of web servers and Internet-connected devices also exposed a flaw in open-source software maintenance that many have promised to fix.,2014-04-24T12:00:28+0000,https://bits.blogs.nytimes.com/2014/04/24/companies-back-initiative-to-support-openssl-and-other-open-source-projects/,2014-04-01 to 2014-06-30
Amazon,Technology,Times Minute | Regulating E-Cigarettes,"On the Minute, the push to regulate e-cigarettes, Northwestern’s football players to vote on a union and Amazon to stream HBO series.",2014-04-24T04:04:57+0000,https://www.nytimes.com/news/minute/2014/04/24/times-minute-regulating-e-cigarettes/,2014-04-01 to 2014-06-30
Amazon,Technology,Times Minute | Regulating E-Cigarettes,"On the Minute, the push to regulate e-cigarettes, Northwestern’s football players to vote on a union and Amazon to stream HBO series.",2014-04-24T04:01:14+0000,https://www.nytimes.com/video/multimedia/100000002842850/times-minute-regulating-e-cigarettes.html,2014-04-01 to 2014-06-30
Amazon,Technology,Study Finds Less Green in the Congo Rain Forest,Scientists say that a long drought that has affected trees in Central Africa could help them understand how global warming may harm vegetation.,2014-04-23T18:54:40+0000,https://www.nytimes.com/2014/04/24/science/earth/study-finds-less-green-in-the-congo-rain-forest.html,2014-04-01 to 2014-06-30
Amazon,Technology,Amazon.com is learning the hard way that people care more about price than brand loyalty.,Surveys have shown that people will gladly leave a site for another that offers free shipping or a price that is even a few dollars lower.,2014-04-23T13:26:27+0000,https://www.nytimes.com/2014/04/24/upshot/amazoncom-is-learning-the-hard-way-that-people-care-more-about-price-than-brand-loyalty.html,2014-04-01 to 2014-06-30
Amazon,Technology,Times Minute | Tech Earnings Preview,"Apple, Microsoft and Amazon will issue quarterly reports this week. Also on the Minute, the effect of California’s water crisis and celebrating 100 years of Wrigley Field.",2014-04-21T16:12:48+0000,https://www.nytimes.com/video/multimedia/100000002836792/times-minute-tech-earnings-preview.html,2014-04-01 to 2014-06-30
Amazon,Technology,Times Minute | Tech Earnings Preview,"Apple, Microsoft and Amazon will issue quarterly reports this week. Also on the Minute, the effect of California’s water crisis and celebrating 100 years of Wrigley Field.",2014-04-21T16:14:15+0000,https://www.nytimes.com/news/minute/2014/04/21/times-minute-tech-earnings-preview/,2014-04-01 to 2014-06-30
Amazon,Technology,Pink Dolphins and Sunsets Along the Amazon,"Skiff excursions and jungle walks, hot showers and cold drinks are all part of a luxury river cruise.",2014-04-11T18:08:34+0000,https://www.nytimes.com/2014/04/13/travel/pink-dolphins-and-sunsets-along-the-amazon.html,2014-04-01 to 2014-06-30
Amazon,Technology,Amazon Buys ComiXology,"Zap! Pow! The acquisition of ComiXology fits nicely into Amazon’s entertainment strategy, which focuses on controlling the means of distribution.",2014-04-11T00:38:13+0000,https://bits.blogs.nytimes.com/2014/04/10/amazon-buys-comixology/,2014-04-01 to 2014-06-30
Amazon,Technology,Expressway to Amazon in a Box,"An entrant in the growing field of devices and services to stream media, the Fire TV is likable but falls short of some rivals, a reviewer says.",2014-04-07T00:48:34+0000,https://www.nytimes.com/2014/04/07/technology/personaltech/the-amazon-fire-tv-streaming-media-set-top-box.html,2014-04-01 to 2014-06-30
Amazon,Technology,Game of Drones,"It just might be the right time for a “Top Gun” sequel, considering we’re already on the highway to the danger zone.",2014-04-16T02:00:13+0000,https://www.nytimes.com/2014/04/16/opinion/game-of-drones.html,2014-04-01 to 2014-06-30
Amazon,Technology,Popular Demand,"Viewers watched on-demand television programming an average of 8.7 hours a month in 2013, according to Rentrak. Free broadcast and cable TV shows accounted for 6.4 of those hours. Most viewers, 66 percent, watched a show at least four days after i...",2014-04-14T03:44:08+0000,https://www.nytimes.com/interactive/2014/04/07/business/media/14most.html,2014-04-01 to 2014-06-30
Amazon,Technology,Amazon Channels a Cheaper Television Experience,"To make its set-top box viable, Amazon will have to spend a lot of money. That’s something it’s never been afraid of doing.",2014-04-04T13:00:28+0000,https://bits.blogs.nytimes.com/2014/04/04/amazon-channels-a-cheaper-television-experience/,2014-04-01 to 2014-06-30
Amazon,Technology,"With Fire TV, Amazon Seeks a Beachhead in the Living Room","The company’s new device, called Amazon Fire TV, will marry its video library with content from other providers.",2014-04-02T16:01:24+0000,https://www.nytimes.com/2014/04/03/technology/amazon-firetv-set-top-box.html,2014-04-01 to 2014-06-30
Amazon,Technology,"Bookstores in Seattle Soar, and Embrace an Old Nemesis: Amazon.com","Though many independent bookstores have blamed the giant online retailer for their struggles, there are signs of a thaw in tensions in Seattle, as many Amazon employees are buying books in brick-and-mortar shops.",2014-04-12T01:02:19+0000,https://www.nytimes.com/2014/04/12/us/bookstores-in-seattle-soar-and-embrace-an-old-nemesis-amazoncom.html,2014-04-01 to 2014-06-30
Amazon,Technology,Where the Amazon Fire TV Fits Into the Living Room,The just announced device will stream Internet video to your television. But so will Internet-connected TVs and a host of competing devices. Can it stand out from the crowd?,2014-04-02T20:07:43+0000,https://bits.blogs.nytimes.com/2014/04/02/where-the-amazon-fire-tv-fits-into-the-living-room/,2014-04-01 to 2014-06-30
Amazon,Technology,Daily Report: Amazon’s Fire TV Is a Bid to Take Over the Living Room,"With the Fire TV, Amazon is leveraging its position as a retailer to expand into new fields, something it has become very good at.",2014-04-03T11:03:23+0000,https://bits.blogs.nytimes.com/2014/04/03/daily-report-amazons-fire-tv-is-a-bid-to-take-over-the-living-room/,2014-04-01 to 2014-06-30
Amazon,Technology,Popular Demand,"Liberty Media, the investment company, said last week that it would sell most of its stake in Barnes & Noble, partly because the Nook tablet failed to meet long-term expectations. Meanwhile, Amazon’s Kindle is competing well with the iPad, and las...",2014-04-07T02:52:12+0000,https://www.nytimes.com/interactive/2014/04/07/business/media/07most.html,2014-04-01 to 2014-06-30
Amazon,Technology,"Jeff Bezos, Please Call Your Office","Amazon’s founder and chief executive was not on hand for the public announcement of the company’s Fire TV, its biggest move in hardware since 2011. Where was he?",2014-04-02T21:49:13+0000,https://bits.blogs.nytimes.com/2014/04/02/jeff-bezos-please-call-your-office/,2014-04-01 to 2014-06-30
Amazon,Technology,Scribd Adds Lonely Planet Guides to Its Roster,"Scribd, the e-book subscription service, will now include Lonely Planet guidebooks.",2014-04-01T21:03:39+0000,https://intransit.blogs.nytimes.com/2014/04/01/scribd-adds-lonely-planet-guides-to-its-roster/,2014-04-01 to 2014-06-30
Amazon,Technology,Tech Titans Are Vying to Be Your Pocketbook,"Companies like Google, Amazon, PayPal and Apple are looking for the route to dominance over future alternatives, both real-world and virtual, to cash and credit cards.",2014-04-01T14:26:20+0000,https://dealbook.nytimes.com/2014/04/01/tech-titans-are-vying-to-be-your-pocketbook/,2014-04-01 to 2014-06-30
Amazon,Technology,Book Fight: Amazon vs. Publishers,Readers discuss Amazon’s hardball actions and the publishing marketplace.,2014-06-05T23:34:04+0000,https://www.nytimes.com/2014/06/06/opinion/book-fight-amazon-vs-publishers.html,2014-04-01 to 2014-06-30
Amazon,Technology,Bookstores Will Survive,Robert Fader of Posman Books responds to a front-page article.,2014-05-28T22:03:28+0000,https://www.nytimes.com/2014/05/29/opinion/bookstores-will-survive.html,2014-04-01 to 2014-06-30
Amazon,Technology,Wiring the Amazon,This short documentary chronicles a remote Peruvian village’s four-year struggle to get Internet access.,2014-05-20T00:13:58+0000,https://www.nytimes.com/video/opinion/100000002890230/wiring-the-amazon.html,2014-04-01 to 2014-06-30
Amazon,Technology,‘Wiring the Amazon’,This short documentary chronicles a remote Peruvian village’s complicated path to getting connected to the outside world.,2014-05-20T00:16:03+0000,https://www.nytimes.com/2014/05/20/opinion/wiring-the-amazon.html,2014-04-01 to 2014-06-30
Amazon,Technology,Amazon takes on TV,"Amazon announced Wednesday that it was making a move into streaming video, a space that's already filled with fierce competition. But Amazon's foray into gaming could set it apart. Lily Jamali reports.",2014-04-02T23:53:02+0000,https://www.nytimes.com/video/multimedia/100000002803848/amazon-takes-on-tv.html,2014-04-01 to 2014-06-30
Amazon,Technology,Amazon Unveils Fire TV,"Amazon’s vice president for Kindle, Peter Larsen, announced the set-top device as part of its plans to merge shopping and entertainment.",2014-04-02T20:30:28+0000,https://www.nytimes.com/video/technology/100000002803084/amazon-unveils-fire-tv-.html,2014-04-01 to 2014-06-30
Amazon,Technology,Why Amazon is launching a smartphone,"Despite its late entry, Amazon could grow the smartphone market overseas and use the phone to spur more sales of its catalog of products, say analysts. Fred Katayama reports.",2014-06-18T15:06:34+0000,https://www.nytimes.com/video/multimedia/100000002947836/why-amazon-is-launching-a-smartphone.html,2014-04-01 to 2014-06-30
Amazon,Technology,Amazon to sell local services,"Amazon plans to launch a marketplace for local services later this year, competing against the likes of Yelp, Angie's List and Home Depot. Fred Katayama reports.",2014-06-11T14:59:23+0000,https://www.nytimes.com/video/multimedia/100000002933218/amazon-to-sell-local-services.html,2014-04-01 to 2014-06-30
Amazon,Technology,Amazon to stream music - report,"Amazon plans to launch a streaming music service, reports BuzzFeed. But it won't be a Pandora killer. Fred Katayama reports.",2014-05-30T15:19:41+0000,https://www.nytimes.com/video/multimedia/100000002910819/amazon-to-stream-music-report.html,2014-04-01 to 2014-06-30
Amazon,Technology,Exploring the Amazon in ‘Rio 2’,Images from “Rio 2” of sequences set in the Amazon rain forest.,2014-04-10T20:58:00+0000,https://www.nytimes.com/slideshow/2014/04/10/movies/rio-amazon-images.html,2014-04-01 to 2014-06-30
Amazon,Technology,France Gives Cold Shoulder to Amazon,"The French Senate has passed legislation, nicknamed the anti-Amazon law, designed to protect local bookstores.",2014-06-30T19:17:42+0000,https://artsbeat.blogs.nytimes.com/2014/06/30/france-gives-cold-shoulder-to-amazon/,2014-04-01 to 2014-06-30
Amazon,Technology,Alibaba teams up with Amazon rival,ShopRunner's deal with Alibaba will give American retailers a new way to enter the Chinese market. Fred Katayama reports.,2014-05-08T14:59:21+0000,https://www.nytimes.com/video/multimedia/100000002869291/alibaba-teams-up-with-amazon-rival.html,2014-04-01 to 2014-06-30
Amazon,Technology,Reading into the Amazon vs. Hachette battle,"The war between Amazon and publisher Hachette continues to escalate, with authors and consumers getting dragged into battle. Bobbi Rebell reports.",2014-05-28T23:37:44+0000,https://www.nytimes.com/video/multimedia/100000002907603/reading-into-the-amazon-vs-hachette-battle.html,2014-04-01 to 2014-06-30
Amazon,Technology,"Amazon, Microsoft beat low expectations",Amazon and Microsoft topped sales forecasts as both companies matched or exceeded low earnings predictions. Conway G. Gittens reports.,2014-04-25T00:34:24+0000,https://www.nytimes.com/video/multimedia/100000002845108/amazon-microsoft-beat-low-expectations.html,2014-04-01 to 2014-06-30
Amazon,Technology,James B. Stewart on Amazon Earnings,"James B. Stewart, columnist for The New York Times, weighs in on whether investors are finally getting impatient with Amazon’s notable lack of profits.",2014-04-25T16:32:21+0000,https://www.nytimes.com/video/business/100000002845995/james-b-stewart-on-amazon-earnings.html,2014-04-01 to 2014-06-30
Amazon,Technology,BlackBerry to Add Amazon App Store to Phones,"John S. Chen, BlackBerry’s chairman and chief executive, has repeatedly acknowledged that an absence of popular apps has hampered the BlackBerry 10 line of phones.",2014-06-18T17:58:10+0000,https://bits.blogs.nytimes.com/2014/06/18/blackberry-to-add-amazon-app-store-to-phones/,2014-04-01 to 2014-06-30
Amazon,Technology,"Amazon, Ukraine lead to Wall Street ruckus","A money-losing forecast by Amazon, weaker-than-expected results from Ford, and a backslide in progress between The West, Ukraine, and Russia punished the stock market on Friday.  Conway G. Gittens reports.",2014-04-25T23:00:43+0000,https://www.nytimes.com/video/multimedia/100000002847055/amazon-ukraine-lead-to-wall-street-ruckus.html,2014-04-01 to 2014-06-30
Amazon,Technology,Amazon tries to blaze different smartphone path,"Amazon is jumping into the crowded smartphone market with a 3D model it hopes will easily connect customers to its online marketplace, in another attempt to use devices to drive sales in its key e-commerce business.  Conway G. Gittens reports.",2014-06-18T23:36:33+0000,https://www.nytimes.com/video/multimedia/100000002949313/amazon-tries-to-blaze-different-smartphone-path.html,2014-04-01 to 2014-06-30
JPMorgan Chase,Finance/Banking,Mariano Rivera and JPMorgan’s James Lee Honored by Sports Charity,"The Bids for Kids Gala will honor the recently retired Yankees pitcher Mariano Rivera and James B. Lee Jr., vice chairman of JPMorgan Chase at an event expected to raise nearly $3 million.",2014-06-16T22:50:51+0000,https://dealbook.nytimes.com/2014/06/16/mariano-rivera-and-jpmorgans-james-lee-to-be-honored-for-charity/,2014-04-01 to 2014-06-30
JPMorgan Chase,Finance/Banking,"Bank Tool Is Expanding Unbanked Households, Regulators Say",New York’s attorney general is taking aim at databases that have been criticized for limiting access to banking services.,2014-06-16T01:00:13+0000,https://dealbook.nytimes.com/2014/06/15/bank-account-screening-tool-is-scrutinized-as-excessive/,2014-04-01 to 2014-06-30
JPMorgan Chase,Finance/Banking,Report Links Wen Family to Cambridge Professorship,"The daughter of the former Chinese prime minister Wen Jiabao is behind a charity that endowed a university post in Chinese development studies, according to a report in the British newspaper The Daily Telegraph.",2014-06-11T11:24:50+0000,https://sinosphere.blogs.nytimes.com/2014/06/11/report-links-wen-family-to-cambridge-professorship/,2014-04-01 to 2014-06-30
JPMorgan Chase,Finance/Banking,"In Tough Market, Investment Banks Seek Shelter or Get Out","Stricter regulations and low volatility are transforming the banking industry, driving banks to find additional, more stable sources of revenue or even to shift away from the business entirely, Steven M. Davidoff writes in the Deal Professor colum...",2014-06-11T01:18:06+0000,https://dealbook.nytimes.com/2014/06/10/in-tough-market-investment-banks-seek-shelter-or-get-out/,2014-04-01 to 2014-06-30
JPMorgan Chase,Finance/Banking,A Lift for One of London’s Financial Tech Start-Ups,"TransferWise, which uses peer-to-peer technology to swap currencies without large bank transfer fees, says it has raised $25 million from investors.",2014-06-09T23:02:41+0000,https://dealbook.nytimes.com/2014/06/09/boost-for-one-of-londons-bevy-of-financial-tech-start-ups/,2014-04-01 to 2014-06-30
JPMorgan Chase,Finance/Banking,"Summer Reads, Courtesy of JPMorgan","You won’t find any Faulkner on JPMorgan’s summer reading list, but titles by Arianna Huffington and the physicist Michio Kaku made the cut.",2014-06-06T15:32:59+0000,https://dealbook.nytimes.com/2014/06/06/summer-reads-courtesy-of-jpmorgan/,2014-04-01 to 2014-06-30
JPMorgan Chase,Finance/Banking,Henkel to Buy French Detergent Maker for $1.3 Billion,Henkel’s deal to acquire the Spotless Group from the European private equity firm BC Partners is expected to give a boost to the German company’s laundry and home care products unit.,2014-06-05T08:08:14+0000,https://dealbook.nytimes.com/2014/06/05/henkel-to-buy-french-detergent-maker-for-1-3-billion/,2014-04-01 to 2014-06-30
JPMorgan Chase,Finance/Banking,Corporate Rivalries and Strategies Extend to the Street,"In Corporate Challenge races, the main goal is camaraderie and team building, but in a region like New York full of people who do not like to lose, the team competition can be heated.",2014-06-04T01:40:46+0000,https://www.nytimes.com/2014/06/04/sports/jpmorgan-corporate-challenges-see-growth-in-popularity-and-gamesmanship.html,2014-04-01 to 2014-06-30
JPMorgan Chase,Finance/Banking,Former Top JPMorgan Banker in Britain Loses Appeal in Insider Case,"Ian Hannam, JPMorgan’s former global chairman of equity capital markets, was accused by British regulators of improperly sharing inside information about a client and fined £450,000 in 2012.",2014-05-28T15:05:27+0000,https://dealbook.nytimes.com/2014/05/28/former-top-jpmorgan-banker-in-britain-loses-appeal-in-insider-case/,2014-04-01 to 2014-06-30
JPMorgan Chase,Finance/Banking,Former Chief of JPMorgan’s China Unit Is Arrested,"Fang Fang, who was arrested by Hong Kong’s Independent Commission Against Corruption, has been released but is prohibited from leaving Hong Kong, according to a report in Caixin, a Chinese-language financial news outlet.",2014-05-21T06:23:40+0000,https://dealbook.nytimes.com/2014/05/21/former-top-china-jpmorgan-banker-said-to-be-arrested-in-hong-kong/,2014-04-01 to 2014-06-30
JPMorgan Chase,Finance/Banking,JPMorgan Committing $100 Million Over 5 Years to Aid Revitalization in Detroit,"Loans and grants, the latest outside help for a city trying to emerge from bankruptcy, will focus on housing, job training and economic development.",2014-05-20T23:49:27+0000,https://www.nytimes.com/2014/05/21/us/jpmorgan-committing-100-million-over-5-years-to-aid-revitalization-in-detroit.html,2014-04-01 to 2014-06-30
JPMorgan Chase,Finance/Banking,Commerzbank Suspends 2 Currency Traders,"The German lender Commerzbank said the traders were suspended for breaking internal rules, calling the incident “isolated” and stating that “the bank and the individuals concerned in no way profited.”",2014-05-21T10:31:35+0000,https://dealbook.nytimes.com/2014/05/21/commerzbank-suspends-two-currency-traders/,2014-04-01 to 2014-06-30
JPMorgan Chase,Finance/Banking,European Regulators Accuse 3 More Banks of Manipulating Interest Rates,"European Commission competition authorities on Tuesday accused JPMorgan Chase, HSBC and Crédit Agricole of having colluded to fix benchmark interest rates tied to the euro.",2014-05-20T11:24:49+0000,https://dealbook.nytimes.com/2014/05/20/european-regulators-accuse-three-more-banks-of-manipulating-interest-rates/,2014-04-01 to 2014-06-30
JPMorgan Chase,Finance/Banking,Analysts Have High Hopes for Big Economic Changes Under Modi,"What is driving much of the optimism is the Bharatiya Janata Party’s ability to pass legislation without the need for coalition partners, who could have potentially blocked policy changes that conflicted with their own interests.",2014-05-19T08:17:35+0000,https://india.blogs.nytimes.com/2014/05/19/analysts-have-high-hopes-for-big-economic-changes-under-modi/,2014-04-01 to 2014-06-30
JPMorgan Chase,Finance/Banking,"Derivatives Markets Growing Again, With Few New Protections","Even with new laws, derivatives remain mostly opaque, which means that the risks to governments and taxpayers are also opaque, Mayra Rodríguez Valladares writes in the Another View column.",2014-05-13T20:35:36+0000,https://dealbook.nytimes.com/2014/05/13/derivatives-markets-growing-again-with-few-new-protections/,2014-04-01 to 2014-06-30
JPMorgan Chase,Finance/Banking,"JPMorgan Backs an Online Broker, Motif Investing","The $35 million investment by JPMorgan Chase and other firms is a vote of confidence in Motif Investing, an upstart online broker that lets investors buy a basket of stocks centered on a theme.",2014-05-08T13:00:13+0000,https://dealbook.nytimes.com/2014/05/08/jpmorgan-backs-an-online-broker-motif-investing/,2014-04-01 to 2014-06-30
JPMorgan Chase,Finance/Banking,Twitter Insiders Sell After Lockup Expires,Three executives of the social network sold stock on Tuesday after restrictions were lifted on insider selling after Twitter’s initial offering of stock. A money manager that controlled 14.4 percent of Twitter’s stock also distributed its shares t...,2014-05-09T03:48:53+0000,https://bits.blogs.nytimes.com/2014/05/08/twitter-insiders-sell-after-lockup-expires/,2014-04-01 to 2014-06-30
JPMorgan Chase,Finance/Banking,The Six Banks Leading Alibaba’s Giant I.P.O.,"Six firms were listed as Alibaba’s lead underwriters, listed mostly in alphabetical order. The I.P.O. could end up raising more than $20 billion.",2014-05-07T00:39:20+0000,https://dealbook.nytimes.com/2014/05/06/the-six-banks-who-are-leading-alibabas-giant-i-p-o/,2014-04-01 to 2014-06-30
JPMorgan Chase,Finance/Banking,A Dinner Among Survivors of the Financial Crisis,"At a charity event on Wednesday, the chief of Goldman Sachs was overheard recounting a dinner with Jamie Dimon and Peter Sands, where they traded stories from the dark days of 2008.",2014-05-01T12:11:54+0000,https://dealbook.nytimes.com/2014/05/01/a-dinner-among-survivors-of-the-financial-crisis/,2014-04-01 to 2014-06-30
JPMorgan Chase,Finance/Banking,Doing the Math of a Bank of America Settlement,Bank of America was always expected to pay more than JPMorgan Chase’s $13 billion settlement. But how much more?,2014-04-28T12:18:31+0000,https://dealbook.nytimes.com/2014/04/28/doing-the-math-of-a-bank-of-america-settlement/,2014-04-01 to 2014-06-30
JPMorgan Chase,Finance/Banking,"Jimmy Elliott, a Senior JPMorgan Deal Adviser, to Retire","Mr. Elliott, who is the global chairman of investment banking, will leave in June to spend more time on his ranch in Texas, according to the memo from Jeff Urwin, a co-head of global banking at the firm.",2014-04-25T16:45:09+0000,https://dealbook.nytimes.com/2014/04/25/jimmy-elliott-a-senior-jpmorgan-deal-adviser-to-retire/,2014-04-01 to 2014-06-30
JPMorgan Chase,Finance/Banking,Justice Dept. Seeks Mortgage Deal With Bank of America,"The Justice Department made Bank of America an opening settlement offer of roughly $20 billion several weeks ago, according to people briefed on the matter.",2014-04-25T01:55:59+0000,https://dealbook.nytimes.com/2014/04/24/justice-dept-offers-bank-of-america-a-mortgage-deal/,2014-04-01 to 2014-06-30
JPMorgan Chase,Finance/Banking,"Daley, Former White House Chief of Staff, Joins Hedge Fund","The former JPMorgan Chase executive has been named a managing partner and the head of United States operations at Argentière Capital, a Swiss hedge fund founded less than a year ago.",2014-04-24T15:51:19+0000,https://dealbook.nytimes.com/2014/04/24/daley-former-white-house-chief-of-staff-joins-hedge-fund/,2014-04-01 to 2014-06-30
JPMorgan Chase,Finance/Banking,Numericable Raises $10.9 Billion in Junk Bond Offering,"The junk bond offering by Numericable, the French cable unit of Altice, is the largest in history and will help finance the acquisition of Vivendi’s mobile unit, SFR.",2014-04-23T09:18:27+0000,https://dealbook.nytimes.com/2014/04/23/numericable-set-to-price-largest-ever-junk-bond/,2014-04-01 to 2014-06-30
JPMorgan Chase,Finance/Banking,Barclays Said to Join Commodity Exodus,"Investment banks, which rushed into the new territory of physical commodities starting at the turn of the century, are now beating a retreat.",2014-04-21T12:59:05+0000,https://dealbook.nytimes.com/2014/04/21/barclays-poised-to-announce-exit-from-commodities/,2014-04-01 to 2014-06-30
JPMorgan Chase,Finance/Banking,Bank of America Not Alone in Reporting Anemic Results,"Bank of America’s $276 million loss provides some valuable perspective on the difficulties in running a big bank these days, Antony Currie of Reuters Breakingviews writes.",2014-04-16T18:34:58+0000,https://dealbook.nytimes.com/2014/04/16/bank-of-america-not-alone-in-reporting-anemic-results/,2014-04-01 to 2014-06-30
