company,sector,headline,snippet,pub_date,url,quarter
Netflix,Technology,"To Boost Profits, Disney Cracks Down on Password Sharing","The parent company of the streaming services Disney+, ESPN+ and Hulu announced the change in updated service agreements this week.",2024-02-01T18:22:47+0000,https://www.nytimes.com/2024/02/01/business/hulu-password-sharing-disney-plus.html,2024-01-01 to 2024-03-31
Netflix,Technology,‘Players’ Review: Running the Rom-Com Playbook,Gina Rodriguez stars in a Netflix movie that recalls the charms of the genre’s heyday.,2024-02-14T04:00:06+0000,https://www.nytimes.com/2024/02/13/movies/players-review.html,2024-01-01 to 2024-03-31
Netflix,Technology,Which TV Show or Movie Would You Want to Live?,Live interactive experiences inspired by popular shows like “Squid Game” and “Friends” are trending. Do they appeal to you?,2024-01-08T10:00:59+0000,https://www.nytimes.com/2024/01/08/learning/which-tv-show-or-movie-would-you-want-to-live.html,2024-01-01 to 2024-03-31
Netflix,Technology,Niecy Nash-Betts Honors Sandra Bland and Breonna Taylor in Her Emmy Speech,"The actress, who played a neighbor in Netflix’s “Dahmer,” won her first Emmy for best supporting actress in a limited series.",2024-01-16T02:17:13+0000,https://www.nytimes.com/2024/01/15/arts/television/niecy-nash-betts-emmys-speech.html,2024-01-01 to 2024-03-31
Netflix,Technology,Monday Briefing: Houthis Hold Firm After Strikes,"Also, Taiwan’s president-elect and India’s court case backlog.",2024-01-14T20:50:54+0000,https://www.nytimes.com/2024/01/14/world/asia/houthis-yemen-strikes-taiwan-president.html,2024-01-01 to 2024-03-31
Netflix,Technology,‘Irish Wish’ Review: Beware of Getting What You Want,Lindsay Lohan plays a book editor whose romantic dream comes true in this Netflix rom-com. But then Ed Speleers shows up in a red sports car.,2024-03-15T07:01:07+0000,https://www.nytimes.com/2024/03/15/movies/irish-wish-review.html,2024-01-01 to 2024-03-31
Netflix,Technology,‘The Kitchen’ Review: No Direction Home,"Directing their first feature, Kibwe Tavares and Daniel Kaluuya spin a warmly humane story of cross-generational connection.",2024-01-18T15:38:51+0000,https://www.nytimes.com/2024/01/18/movies/the-kitchen-review.html,2024-01-01 to 2024-03-31
Netflix,Technology,Where to Stream the 2024 Oscar Nominees,Many of the top contenders can be watched at home. Here’s a guide to help you get a jump on the field.,2024-01-23T18:41:42+0000,https://www.nytimes.com/2024/01/23/movies/oscar-nominated-movies-streaming.html,2024-01-01 to 2024-03-31
Netflix,Technology,Thursday Briefing: Where is Gaza’s Aid?,"Also, sweeping U.S. climate regulations and the “3 Body Problem” on Netflix.",2024-03-20T20:40:08+0000,https://www.nytimes.com/2024/03/20/world/asia/gaza-aid-evs-hong-kong-asia.html,2024-01-01 to 2024-03-31
Netflix,Technology,‘The Greatest Night in Pop’ Review: They Were the World,"This documentary shows the highlights of the recording session for the charity song “We Are the World,” which assembled a who’s who of pop celebrities.",2024-01-29T22:14:31+0000,https://www.nytimes.com/2024/01/29/movies/the-greatest-night-in-pop-review.html,2024-01-01 to 2024-03-31
Netflix,Technology,‘Society of the Snow’ Review: The Stranded and the Faithful,Another movie tackles the story of the Uruguayan rugby players who survived a plane crash and turned to cannibalism.,2024-01-04T12:00:08+0000,https://www.nytimes.com/2024/01/04/movies/society-of-the-snow-review.html,2024-01-01 to 2024-03-31
Netflix,Technology,"‘One Day’ Is Back. This Time, It’s Longer.","The hit novel became a movie, and now it’s a 14-episode Netflix series. More time let the screenwriter get deeper into the characters of Emma and Dexter.",2024-02-09T10:43:35+0000,https://www.nytimes.com/2024/02/09/arts/television/netflix-one-day.html,2024-01-01 to 2024-03-31
Netflix,Technology,All the Best Looks From the 2024 SAG Awards Red Carpet,"Lily Gladstone, Cillian Murphy and Margot Robbie led the celebrity fashion brigade.",2024-02-24T23:59:18+0000,https://www.nytimes.com/2024/02/24/style/sag-awards-red-carpet-photos.html,2024-01-01 to 2024-03-31
Netflix,Technology,"Meghan Debuts New Brand, American Riviera Orchard, Amid Royal Family Drama","The Duchess of Sussex released a mysterious 15-second video on Instagram, but what little is known about the brand has been gleaned from a trademark application.",2024-03-14T22:06:44+0000,https://www.nytimes.com/2024/03/14/style/meghan-markle-american-riviera-orchard.html,2024-01-01 to 2024-03-31
Netflix,Technology,30 Shows to Watch This Winter,"This season promises a deluge of big stars (Nicole Kidman, Kate Winslet), intriguing adaptations (“Avatar: The Last Airbender”), long-awaited returns (“True Detective”) and final goodbyes (“Curb Your Enthusiasm”).",2024-01-04T14:00:20+0000,https://www.nytimes.com/2024/01/04/arts/television/winter-tv-shows.html,2024-01-01 to 2024-03-31
Netflix,Technology,Five Action Movies to Stream Now,"This month’s picks include a French comedic swashbuckling adventure, Indian spy games and more.",2024-01-26T16:00:10+0000,https://www.nytimes.com/2024/01/26/movies/five-action-movies-to-stream-now.html,2024-01-01 to 2024-03-31
Netflix,Technology,‘Shirley’ Review: A Woman Who Contained Multitudes,"This staid biopic of Shirley Chisholm, the first Black woman elected to the U.S. Congress, is less interested in what she did than what she represented.",2024-03-21T09:03:11+0000,https://www.nytimes.com/2024/03/21/movies/shirley-review.html,2024-01-01 to 2024-03-31
Netflix,Technology,Late Night Finds Trump Incapable of Dealing With Facts,"A judge initially denied Trump the chance to speak at his criminal fraud trial, “but, as 27 women can tell you, Trump doesn’t take no for an answer,” Stephen Colbert said on Thursday.",2024-01-12T07:09:24+0000,https://www.nytimes.com/2024/01/12/arts/television/late-night-trump-trial.html,2024-01-01 to 2024-03-31
Netflix,Technology,A Broadway-Bound ‘Sunset Boulevard’ Leads Olivier Award Nominations,"The musical, starring Nicole Scherzinger, secured 11 nominations at Britain’s equivalent of the Tony Awards.",2024-03-12T13:43:36+0000,https://www.nytimes.com/2024/03/12/theater/olivier-award-nominations-sunset-boulevard.html,2024-01-01 to 2024-03-31
Netflix,Technology,"Congrats, and Goodbye, to Peak TV",The Emmys on Monday night felt in many ways like a bookend to one of the defining features of the streaming era: a never-ending supply of new programming.,2024-01-16T14:46:14+0000,https://www.nytimes.com/2024/01/16/business/media/emmys-tv-streaming.html,2024-01-01 to 2024-03-31
Netflix,Technology,"The Best of Late Night, at the Movies and Beyond","The new horror-thriller “Late Night With the Devil” isn’t the only time late-night hosts, shows and sets become fodder for on-screen moments in film and TV.",2024-03-26T15:02:26+0000,https://www.nytimes.com/2024/03/26/movies/late-night-tv-movies.html,2024-01-01 to 2024-03-31
Netflix,Technology,"Corrections: March 23, 2024","Corrections that appeared in print on Saturday, March 23, 2024.",2024-03-23T01:03:03+0000,https://www.nytimes.com/2024/03/22/pageoneplus/corrections-march-23-2024.html,2024-01-01 to 2024-03-31
Netflix,Technology,"‘Mister Organ,’ ‘Destroyer’ and More Streaming Gems",Con artists and ghost stories are among our recommendations from the subscription streaming services this month.,2024-02-21T10:02:34+0000,https://www.nytimes.com/2024/02/21/movies/mister-organ-destroyer-streaming-movies.html,2024-01-01 to 2024-03-31
Netflix,Technology,‘Spaceman’ Review: What Happened Here?,"Adam Sandler and Carey Mulligan star in a baffling Netflix misfire about a man in, well, space.",2024-02-29T10:03:30+0000,https://www.nytimes.com/2024/02/29/movies/spaceman-review.html,2024-01-01 to 2024-03-31
Netflix,Technology,"‘Mutt,’ ‘Unpregnant’ and More Streaming Gems",The complexities of 21st-century romantic entanglements are front and center in this month’s roundup of hidden gems on your subscription streaming services.,2024-01-26T12:00:02+0000,https://www.nytimes.com/2024/01/26/movies/mutt-unpregnant-streaming-movies.html,2024-01-01 to 2024-03-31
Netflix,Technology,Steven Yeun Wins His First Emmy,The actor captured the Emmy for best actor in a limited series for his role as Danny Cho in “Beef.”,2024-01-16T02:59:08+0000,https://www.nytimes.com/2024/01/15/arts/television/steven-yeun-emmys-beef.html,2024-01-01 to 2024-03-31
Netflix,Technology,‘Damsel’ Review: Yet Another Strong Female Lead,Millie Bobby Brown is a daring princess in a fairy tale that unspools its surprises far too soon.,2024-03-08T00:00:07+0000,https://www.nytimes.com/2024/03/07/movies/damsel-review.html,2024-01-01 to 2024-03-31
Netflix,Technology,Disgraced but Embraced: Pop Culture Pariahs Are Making Big Comebacks,"Shane Gillis hosted “S.N.L.,” the show that rebuffed him. Ye topped the Billboard chart after making antisemitic remarks. Has the mainstream given up on banishing bad actors?",2024-03-02T10:02:50+0000,https://www.nytimes.com/2024/03/02/arts/music/disgraced-but-embraced-shane-gillis-ye-canceled.html,2024-01-01 to 2024-03-31
Netflix,Technology,Christina Applegate Presents the First Emmy,"The “Dead to Me” actress makes a rare public appearance to present the first Emmy, for supporting actress in a comedy series.",2024-01-16T01:37:40+0000,https://www.nytimes.com/2024/01/15/arts/television/christina-applegate-emmys.html,2024-01-01 to 2024-03-31
Netflix,Technology,Ali Wong Makes History as a Best Actress Winner,"The “Beef” star took home a Golden Globe, as did Steven Yeun, who starred alongside her.",2024-01-08T01:27:55+0000,https://www.nytimes.com/2024/01/07/movies/ali-wong-golden-globes.html,2024-01-01 to 2024-03-31
Netflix,Technology,And the 2023 Oscar Nominees Should Be …,"Academy voters will do what they want, but if our chief critics had their way, these are the films and performers that would be up for Oscars this year.",2024-01-04T23:07:08+0000,https://www.nytimes.com/interactive/2024/01/04/movies/critics-oscar-nominees.html,2024-01-01 to 2024-03-31
Netflix,Technology,Pikachu Just Wants to Help You Relax These Days,"On Netflix’s “Pokémon Concierge,” the hyperactivity of the original gives way to soothing sights and tones that can help grown-up fans calm down.",2024-01-13T10:01:37+0000,https://www.nytimes.com/2024/01/13/arts/television/pokemon-concierge-netflix.html,2024-01-01 to 2024-03-31
Netflix,Technology,Super Bowl Broadcast Is a Crossroads for CBS Sports,"The storied network is facing a wave of change, including new leadership, the possible sale of its parent company and the continued challenge of streaming.",2024-02-09T10:03:31+0000,https://www.nytimes.com/2024/02/09/business/media/super-bowl-cbs-sports.html,2024-01-01 to 2024-03-31
Apple Inc,Technology,Garland Accuses Apple of Violating Federal Antitrust Law,Attorney General Merrick B. Garland said that Apple has employed a strategy that relies on exclusionary anti-competitive conduct that hurts both consumers and developers.,2024-03-21T16:57:58+0000,https://www.nytimes.com/video/us/100000009374404/apple-maintains-smart-phone-monopoly-power-by-violating-antitrust-law-us-general-attorney-says.html,2024-01-01 to 2024-03-31
Apple Inc,Technology,"Justice Dept. Sues Apple, Smartphones and Children with Jonathan Haidt and Reddit’s I.P.O.",“We’ll see you in court.”,2024-03-22T09:07:23+0000,https://www.nytimes.com/2024/03/22/podcasts/hard-fork-apple-lawsuit-reddit-ipo.html,2024-01-01 to 2024-03-31
Apple Inc,Technology,"U.S. to Push For Gaza Cease-Fire, Apple Gets Sued and More","Plus, don’t mess with Elvis.",2024-03-22T10:05:03+0000,https://www.nytimes.com/2024/03/22/podcasts/us-to-push-for-gaza-cease-fire-apple-gets-sued-and-more.html,2024-01-01 to 2024-03-31
Apple Inc,Technology,"E.U. Takes Aim at Alphabet, Apple and Meta in Wide-Ranging Investigations",The inquiries signal the bloc’s intention to tightly enforce sweeping new competition rules that took effect this month.,2024-03-25T11:44:47+0000,https://www.nytimes.com/2024/03/25/business/apple-facebook-google-eu-investigation.html,2024-01-01 to 2024-03-31
Apple Inc,Technology,The Trustbuster Who Has Apple and Google in His Sights,"Jonathan Kanter, the head of the Justice Department’s antitrust division, made his boldest move on Thursday by accusing Apple of antitrust violations.",2024-03-22T09:02:28+0000,https://www.nytimes.com/2024/03/22/technology/jonathan-kanter-apple-antitrust.html,2024-01-01 to 2024-03-31
Apple Inc,Technology,The Second Coming of the Microsoft Antitrust Battle?,Prosecutors compare their new fight against Apple to the seminal case against Windows in the 1990s.,2024-03-23T12:00:05+0000,https://www.nytimes.com/2024/03/23/business/dealbook/apple-microsoft-antitrust.html,2024-01-01 to 2024-03-31
Apple Inc,Technology,The United States vs. the iPhone,Washington’s crackdown on Big Tech is coming for Apple.,2024-03-26T10:00:13+0000,https://www.nytimes.com/2024/03/26/podcasts/the-daily/apple-lawsuit.html,2024-01-01 to 2024-03-31
Apple Inc,Technology,"U.S. Sues Apple, Accusing It of Maintaining an iPhone Monopoly","The lawsuit caps years of regulatory scrutiny of Apple’s wildly popular suite of devices and services, which have fueled its growth into a nearly $3 trillion public company.",2024-03-21T14:30:39+0000,https://www.nytimes.com/2024/03/21/technology/apple-doj-lawsuit-antitrust.html,2024-01-01 to 2024-03-31
Apple Inc,Technology,Read the Lawsuit Against Apple,The suit is the federal government’s most significant challenge to the reach and influence of the company.,2024-03-21T14:52:00+0000,https://www.nytimes.com/interactive/2024/03/21/technology/apple-lawsuit.html,2024-01-01 to 2024-03-31
Apple Inc,Technology,How the Fight Against Apple Could Redefine Antitrust Law,The Justice Department’s lawsuit against the iPhone maker pushes the boundaries of competition rules. Some experts say that may make winning more difficult.,2024-03-22T12:03:37+0000,https://www.nytimes.com/2024/03/22/business/dealbook/apple-justice-antitrust.html,2024-01-01 to 2024-03-31
Apple Inc,Technology,Apple’s Problems Around the Globe Are Piling Up,The Justice Department’s lawsuit against Apple is the latest in a series of regulatory actions that are hitting the tech giant at the same time.,2024-03-21T17:38:43+0000,https://www.nytimes.com/2024/03/21/technology/apple-regulators-world.html,2024-01-01 to 2024-03-31
Apple Inc,Technology,Apple and Google Are Discussing a Deal to Bring Generative A.I. to iPhones,A partnership would extend the long relationship between the companies that has helped deliver everything from maps to search on Apple’s devices.,2024-03-19T17:35:01+0000,https://www.nytimes.com/2024/03/19/technology/apple-google-ai-iphone.html,2024-01-01 to 2024-03-31
Apple Inc,Technology,Five U.S. Cases Targeting Big Tech ,"For years, Apple, Google, Meta and other tech giants operated unfettered. Now, regulators are taking steps to compel them to make major shifts to their products and businesses. ",2024-03-22T09:07:24+0000,https://www.nytimes.com/interactive/2024/03/22/business/5-us-cases-big-tech.html,2024-01-01 to 2024-03-31
Apple Inc,Technology,"Can Xerox’s PARC, a Silicon Valley Icon, Find New Life with SRI?",Two research labs known for some of the tech industry’s most important innovations have merged in hopes of recapturing their glory days.,2024-03-27T01:42:12+0000,https://www.nytimes.com/interactive/2024/03/26/business/silicon-valley-tech-xerox-parc-sri.html,2024-01-01 to 2024-03-31
Apple Inc,Technology,Apple Keeps Losing Patent Cases. Its Solution: Rewrite the Rules.,"After losing two complaints before the U.S. International Trade Commission, Apple has stepped up its lobbying to change the agency’s practices.",2024-03-19T17:48:47+0000,https://www.nytimes.com/2024/03/19/technology/apple-patents-lobbying.html,2024-01-01 to 2024-03-31
Apple Inc,Technology,"If Nvidia Keeps Rising Like This, It Will Be Bigger Than the Global Economy",A.I. fervor has rocketed the chip company’s share price upward. Our columnist asked A.I. chatbots how big Nvidia would become if it kept growing as fast as it had over the past year.,2024-03-15T13:00:08+0000,https://www.nytimes.com/2024/03/15/business/nvidia-stock-market-ai-bubble.html,2024-01-01 to 2024-03-31
Apple Inc,Technology,You Texted? I Hadn’t Noticed.,“Do Not Disturb” mode lets smartphone users silence notifications — and signals that they may take a while to respond.,2024-03-13T09:05:56+0000,https://www.nytimes.com/2024/03/13/style/do-not-disturb-phone-setting.html,2024-01-01 to 2024-03-31
Apple Inc,Technology,Apple Reverses Course and Allows Epic Games to Start Competing App Store,"After an inquiry by European regulators, Epic Games said Apple would allow it to access the software tools necessary to develop a game store.",2024-03-08T19:41:06+0000,https://www.nytimes.com/2024/03/08/technology/apple-epic-games-app-store.html,2024-01-01 to 2024-03-31
Apple Inc,Technology,"Musk vs. OpenAI, Europe’s Tech Crackdown and a Month With the Vision Pro","Just when we thought the feud was cooling off, OpenAI pulled out the receipts.",2024-03-08T10:04:19+0000,https://www.nytimes.com/2024/03/08/podcasts/musk-vs-openai-europes-tech-crackdown-and-a-month-with-the-vision-pro.html,2024-01-01 to 2024-03-31
Apple Inc,Technology,Apple Blocks Epic Games From Using iPhone Tools in Escalation of Feud,"The move tests the European Union’s new tech competition law, which was designed to allow competing app stores.",2024-03-06T17:46:28+0000,https://www.nytimes.com/2024/03/06/technology/apple-epic-games-feud.html,2024-01-01 to 2024-03-31
Apple Inc,Technology,Big American Tech Profits From Chinese Ad Spending Spree,"Temu, Shein, and streaming and gaming apps looking to break into the U.S. market are spending huge sums to get their wares in front of American consumers.",2024-03-07T00:15:48+0000,https://www.nytimes.com/2024/03/06/business/google-meta-temu-shein.html,2024-01-01 to 2024-03-31
Apple Inc,Technology,Apple Fined $2 Billion by E.U. for Using App Store to Thwart Competition,"Apple said it would appeal the penalty, the latest in a series of regulatory setbacks for the tech giant.",2024-03-04T12:13:58+0000,https://www.nytimes.com/2024/03/04/business/apple-eu-fine-app-store.html,2024-01-01 to 2024-03-31
Apple Inc,Technology,How Regulations Fractured Apple’s App Store,"As the App Store approaches its 16th anniversary, patchwork rules have turned what was a single store into different shops across many countries.",2024-03-04T05:00:08+0000,https://www.nytimes.com/2024/03/04/technology/app-store-europe-law.html,2024-01-01 to 2024-03-31
Apple Inc,Technology,Is China’s Era of High Growth Over?,"Beijing unveiled an annual economic target in line with last year’s, as it looks to refocus on strategically important sectors.",2024-03-05T13:27:33+0000,https://www.nytimes.com/2024/03/05/business/dealbook/china-era-high-growth-over.html,2024-01-01 to 2024-03-31
Apple Inc,Technology,Forced to Change: Tech Giants Bow to Global Onslaught of Rules,"For years, Apple, Google, Meta and others operated unfettered. But new laws and regulations have finally compelled them to make major shifts to their products and businesses.",2024-03-04T05:00:09+0000,https://www.nytimes.com/2024/03/04/technology/europe-apple-meta-google-microsoft.html,2024-01-01 to 2024-03-31
Apple Inc,Technology,An Analog Library of All the Lives I’ve Lived,What is lost when journaling moves into the cloud?,2024-03-02T13:12:05+0000,https://www.nytimes.com/2024/03/02/opinion/journaling-diary-iphone-app.html,2024-01-01 to 2024-03-31
Apple Inc,Technology,Behind Apple’s Doomed Car Project: False Starts and Wrong Turns,Internal disagreements over the direction of the Apple car led the effort to sputter for years before it was canceled this week.,2024-02-28T23:02:22+0000,https://www.nytimes.com/2024/02/28/technology/behind-the-apple-car-dead.html,2024-01-01 to 2024-03-31
Apple Inc,Technology,How Apple Used its Car Project to Drive Wider Innovation,"The tech giant has dropped its plans to develop an electric vehicle, but some of the development at the heart of the effort has helped power other products and services.",2024-02-28T13:06:19+0000,https://www.nytimes.com/2024/02/28/business/dealbook/apple-car-project-to-drive-wider-innovation.html,2024-01-01 to 2024-03-31
Apple Inc,Technology,Apple Kills Its Electric Car Project,"The car, which Apple spent billions of dollars researching, had been intended as a rival to Tesla’s E.V.s, which include autonomous driving features.",2024-02-27T20:47:02+0000,https://www.nytimes.com/2024/02/27/technology/apple-ends-electric-car-plan.html,2024-01-01 to 2024-03-31
Apple Inc,Technology,Can Fitness Trackers Really Make You Fitter?,Wearables can now track everything from heart rate variability to stride length. But access to so much data does not always mean better health.,2024-02-24T10:04:07+0000,https://www.nytimes.com/2024/02/24/well/move/fitness-watch-tracker-wearable-data.html,2024-01-01 to 2024-03-31
Apple Inc,Technology,"40 Years Ago, This Ad Changed the Super Bowl Forever","An oral history of Apple’s groundbreaking “1984” spot, which helped to establish the Super Bowl as TV’s biggest commercial showcase.",2024-02-09T16:53:45+0000,https://www.nytimes.com/2024/02/09/arts/television/super-bowl-apple-1984-ad.html,2024-01-01 to 2024-03-31
Apple Inc,Technology,Testing Apple’s Vision Pro,Our personal tech columnist tries Apple’s new Vision Pro and is less than impressed.,2024-02-07T13:41:19+0000,https://www.nytimes.com/video/technology/100000009300954/testing-apples-vision-pro.html,2024-01-01 to 2024-03-31
Apple Inc,Technology,Vision Pro Review: Apple’s First Headset Lacks Polish and Purpose,"Billed as the future of computing, the $3,500 goggles can’t replace a laptop for work. At times, wearing them also made our columnist feel nauseated.",2024-02-07T10:03:10+0000,https://www.nytimes.com/2024/02/07/technology/personaltech/apple-vision-pro-review.html,2024-01-01 to 2024-03-31
Apple Inc,Technology,"Republican Dysfunction, and Mom Convicted in School Shooting Case","Plus, the Apple Vision Pro hype.",2024-02-07T11:04:50+0000,https://www.nytimes.com/2024/02/07/podcasts/republican-apple-vision-pro.html,2024-01-01 to 2024-03-31
Apple Inc,Technology,"Stop Wearing Vision Pro Goggles While Driving Your Tesla, U.S. Says","Videos, many of them stunts or jokes, of people wearing Apple’s new virtual reality headset while driving Teslas in Autopilot mode prompted officials to issue warnings.",2024-02-06T22:07:26+0000,https://www.nytimes.com/2024/02/06/technology/personaltech/apple-vision-pro-tesla.html,2024-01-01 to 2024-03-31
Apple Inc,Technology,Why Is Big Tech Still Cutting Jobs?,Profits are up and the economy is strong. But the tech industry faces two challenges — dealing with a frenetic work force expansion in the pandemic and building A.I.,2024-02-05T10:03:06+0000,https://www.nytimes.com/2024/02/05/technology/why-is-big-tech-still-cutting-jobs.html,2024-01-01 to 2024-03-31
Apple Inc,Technology,We Tried the Apple Vision Pro + Can Congress Protect Kids Online? + Cruise’s Crash,Introducing DJ TaskRabbit.,2024-02-02T10:03:43+0000,https://www.nytimes.com/2024/02/02/podcasts/hard-fork-vision-pro-senate-hearing-cruise.html,2024-01-01 to 2024-03-31
Apple Inc,Technology,Apple Sees First Quarterly Revenue Increase in a Year,The iPhone maker’s share price dropped in after-hour trading even though sales and profit topped Wall Street expectations.,2024-02-01T22:05:44+0000,https://www.nytimes.com/2024/02/01/technology/apple-earnings-iphone.html,2024-01-01 to 2024-03-31
Apple Inc,Technology,Apple Has a New Plan for Its App Store. Many Developers Hate It.,"To comply with European regulations, Apple has proposed reducing its commission on app sales while adding new fees and hurdles.",2024-02-01T15:44:29+0000,https://www.nytimes.com/2024/02/01/technology/apple-app-store-europe.html,2024-01-01 to 2024-03-31
Apple Inc,Technology,A.I. Promises Give Tech Earnings a Jolt,Companies like Meta that could tout their work in the fast-growing field saw a benefit in their fourth-quarter results — and won praise from eager investors.,2024-02-02T13:11:37+0000,https://www.nytimes.com/2024/02/02/business/dealbook/meta-tech-earnings-ai.html,2024-01-01 to 2024-03-31
Apple Inc,Technology,India’s Quiet Push to Steal More of China’s iPhone Business,"The companies that make iPhones are bringing their factories to one corner of India, to graft them onto a network of manufacturers.",2024-02-02T05:01:29+0000,https://www.nytimes.com/2024/02/02/business/india-iphone-tech-manufacturing.html,2024-01-01 to 2024-03-31
Apple Inc,Technology,The Apple Vision Pro Is a Marvel. But Who Will Buy It?,"Parents, movie buffs and office workers might all succumb to the novelty of Apple’s new “spatial computing” device.",2024-01-31T16:33:37+0000,https://www.nytimes.com/2024/01/31/technology/roose-apple-vision-pro.html,2024-01-01 to 2024-03-31
Apple Inc,Technology,"The True Price of Apple’s $3,500 Vision Pro Is Closer to $4,600",The new headset teaches a valuable lesson about the cost of tech products: The upsells and add-ons will get you.,2024-01-31T16:33:27+0000,https://www.nytimes.com/2024/01/31/technology/personaltech/apple-vision-pro-headset-cost.html,2024-01-01 to 2024-03-31
Apple Inc,Technology,Apple Takes Messaging Crackdown to Customers’ Macs,"Beeper Mini customers were using their Mac computers to connect to iPhone messaging on their Android phones. Now, they say Apple has blocked the messaging service on their Macs.",2024-01-26T16:20:53+0000,https://www.nytimes.com/2024/01/26/technology/apple-messaging-crackdown-beeper.html,2024-01-01 to 2024-03-31
