company,sector,headline,snippet,pub_date,url,quarter
Pfizer,Healthcare,Trump Administration Selects Five Coronavirus Vaccine Candidates as Finalists,"The White House is eager to project progress, but the public-private partnership it has created still faces scientific hurdles, internal tensions and questions from Congress.",2020-06-03T16:58:08+0000,https://www.nytimes.com/2020/06/03/us/politics/coronavirus-vaccine-trump-moderna.html,2020-04-01 to 2020-06-30
Pfizer,Healthcare,Pfizer Begins Human Trials of Possible Coronavirus Vaccine,"The drug company, along with a German partner, is running tests in healthy volunteers. It’s one of several companies on an accelerated timetable to try to find a safe, effective vaccine.",2020-05-05T10:45:06+0000,https://www.nytimes.com/2020/05/05/health/pfizer-vaccine-coronavirus.html,2020-04-01 to 2020-06-30
Pfizer,Healthcare,"Eleanor Carol Leavell Barr, Wife of Kentucky Congressman, Dies at 39","The wife of Representative Andy Barr, Republican of Kentucky, died suddenly at home in Lexington, the congressman’s office said.",2020-06-17T13:27:47+0000,https://www.nytimes.com/2020/06/17/us/politics/carol-barr-dead.html,2020-04-01 to 2020-06-30
Pfizer,Healthcare,Moderna Gets OK to Start Larger Trial for a Coronavirus Vaccine,The company announced that the Food and Drug Administration had cleared its application to proceed to a clinical trial involving about 600 people.,2020-05-07T21:29:43+0000,https://www.nytimes.com/2020/05/07/health/coronavirus-vaccine-moderna.html,2020-04-01 to 2020-06-30
Pfizer,Healthcare,Sanofi Accelerates Its Timeline for Coronavirus Vaccine Development,The French drugmaker is testing two types of vaccines in a bid to catch up to competitors.,2020-06-23T20:47:42+0000,https://www.nytimes.com/2020/06/23/health/sanofi-coronavirus-vaccine.html,2020-04-01 to 2020-06-30
Pfizer,Healthcare,Different Approaches to a Coronavirus Vaccine,Scientists are using many techniques to develop coronavirus vaccines.,2020-05-20T18:47:04+0000,https://www.nytimes.com/interactive/2020/05/20/science/coronavirus-vaccine-development.html,2020-04-01 to 2020-06-30
Pfizer,Healthcare,"Task Force, Meat Shortage, Madagascar: Your Tuesday Evening Briefing",Here’s what you need to know at the end of the day.,2020-05-05T22:01:08+0000,https://www.nytimes.com/2020/05/05/briefing/task-force-meat-shortage-madagascar.html,2020-04-01 to 2020-06-30
Pfizer,Healthcare,There’s No Reason for an Architect to Design a Death Chamber,"As the country grapples with racial justice, architects should finally take a stand on the most barbaric aspects of a biased prison system.",2020-06-12T14:00:11+0000,https://www.nytimes.com/2020/06/12/arts/design/architects-prison-death-chamber.html,2020-04-01 to 2020-06-30
Pfizer,Healthcare,Trump’s ‘Opening Our Country Council’ Runs Into Its Own Opening Problems,"Instead of a formal council, the president created several industry groups, and joined four calls with them. But some participants had no notice they would be included, and others could not join in.",2020-04-16T00:02:28+0000,https://www.nytimes.com/2020/04/15/us/politics/trump-coronavirus-economy-panel.html,2020-04-01 to 2020-06-30
Pfizer,Healthcare,Coronavirus Briefing: What Happened Today,Some children are developing a mysterious illness that appears to be linked to the coronavirus.,2020-05-06T01:18:24+0000,https://www.nytimes.com/2020/05/05/us/coronavirus-today.html,2020-04-01 to 2020-06-30
Pfizer,Healthcare,Get Ready for the Global Fight Over Vaccines,"This isn’t just about saving lives. It’s also about power, profit and national prestige.",2020-04-30T19:00:09+0000,https://www.nytimes.com/2020/04/30/opinion/sunday/coronavirus-vaccine-supply.html,2020-04-01 to 2020-06-30
Pfizer,Healthcare,Could Trump Turn a Vaccine Into a Campaign Stunt?,"In a desperate search for a boost, he could release a coronavirus vaccine that has not been shown to be safe and effective as an October surprise.",2020-06-08T09:00:15+0000,https://www.nytimes.com/2020/06/08/opinion/trump-coronavirus-vaccine.html,2020-04-01 to 2020-06-30
Pfizer,Healthcare,"‘Just Sitting in Limbo.’ For Many Professionals, Careers Are on Hold.","Even for well-connected high earners, hiring has dried up, advancement has ceased, job searches have paused and new ventures are in jeopardy.",2020-05-27T20:47:01+0000,https://www.nytimes.com/2020/05/27/business/coronavirus-careers-on-hold.html,2020-04-01 to 2020-06-30
Pfizer,Healthcare,"India Repatriation, Duterte, France: Your Wednesday Briefing",Here’s what you need to know.,2020-05-05T19:36:44+0000,https://www.nytimes.com/2020/05/05/briefing/duterte-philippines-media-india-repatriation.html,2020-04-01 to 2020-06-30
Pfizer,Healthcare,"Covid-19 Changed How the World Does Science, Together","Never before, scientists say, have so many of the world’s researchers focused so urgently on a single topic. Nearly all other research has ground to a halt.",2020-04-01T09:00:28+0000,https://www.nytimes.com/2020/04/01/world/europe/coronavirus-science-research-cooperation.html,2020-04-01 to 2020-06-30
Pfizer,Healthcare,Coronavirus Briefing: What Happened Today,A vaccine produced by Moderna appeared to be safe and effective in its first human trial.,2020-05-19T00:10:54+0000,https://www.nytimes.com/2020/05/18/us/coronavirus-today.html,2020-04-01 to 2020-06-30
Pfizer,Healthcare,How Long Will a Vaccine Really Take?,Experts say at least 18 months. Here’s how to shorten the timeline.,2020-04-30T09:33:42+0000,https://www.nytimes.com/interactive/2020/04/30/opinion/coronavirus-covid-vaccine.html,2020-04-01 to 2020-06-30
Pfizer,Healthcare,"CVS, Dunkin’, Lego: The Brands Pulling Ads From Facebook Over Hate Speech",An effort to pressure Facebook to crack down on hate speech and misinformation has prompted dozens of advertisers to say they’ll stop spending on the platform. Here are some of the biggest companies involved.,2020-06-26T20:49:39+0000,https://www.nytimes.com/2020/06/26/business/media/Facebook-advertising-boycott.html,2020-04-01 to 2020-06-30
Pfizer,Healthcare,"Coronavirus, France, Duterte: Your Wednesday Briefing",Here’s what you need to know.,2020-05-06T03:19:35+0000,https://www.nytimes.com/2020/05/05/briefing/coronavirus-france-duterte.html,2020-04-01 to 2020-06-30
Pfizer,Healthcare,Advertiser Exodus Snowballs as Facebook Struggles to Ease Concerns,"The social network has tried striking a more conciliatory tone with its advertisers, who object to its handling of hate speech.",2020-06-30T21:46:11+0000,https://www.nytimes.com/2020/06/30/technology/facebook-advertising-boycott.html,2020-04-01 to 2020-06-30
Pfizer,Healthcare,"Vaccines, U.S. Reopenings, Flour Frenzy: Your Thursday Briefing",Here’s what you need to know.,2020-05-21T04:05:48+0000,https://www.nytimes.com/2020/05/21/briefing/vaccines-us-reopenings-flour-britain.html,2020-04-01 to 2020-06-30
Pfizer,Healthcare,Moderna Coronavirus Vaccine Trial Shows Promising Early Results,The company said a test in 8 healthy volunteers found its experimental vaccine was safe and provoked a strong immune response. It is on an accelerated timetable to begin larger human trials soon.,2020-05-18T12:14:45+0000,https://www.nytimes.com/2020/05/18/health/coronavirus-vaccine-moderna.html,2020-04-01 to 2020-06-30
Pfizer,Healthcare,More Coronavirus Vaccines and Treatments Move Toward Human Trials,"Just three months after the start of the coronavirus pandemic, several biotech companies are beginning trials of promising vaccines and treatments.",2020-04-08T20:35:01+0000,https://www.nytimes.com/2020/04/08/health/coronavirus-vaccines.html,2020-04-01 to 2020-06-30
Pfizer,Healthcare,"U.K.-Hong Kong, U.S. Protests, Travel: Your Thursday Briefing",Here’s what you need to know.,2020-06-04T04:59:25+0000,https://www.nytimes.com/2020/06/04/briefing/britain-hong-kong-america-protests-travel.html,2020-04-01 to 2020-06-30
Pfizer,Healthcare,The Loans and the Fury,"As the U.S. government’s small-business rescue fund reopens today, outrage remains about bigger companies that tapped the first round of loans.",2020-04-27T11:00:18+0000,https://www.nytimes.com/2020/04/27/business/dealbook/small-business-ppp-loans.html,2020-04-01 to 2020-06-30
Pfizer,Healthcare,Essential Drug Supplies for Virus Patients Are Running Low,"Medicines to alleviate breathing difficulty, relieve pain and sedate coronavirus patients are in very high demand, depleting stock around the country.",2020-04-02T20:05:57+0000,https://www.nytimes.com/2020/04/02/health/coronavirus-drug-shortages.html,2020-04-01 to 2020-06-30
Pfizer,Healthcare,A New Entry in the Race for a Coronavirus Vaccine: Hope,Scientists are increasingly optimistic that a vaccine can be produced in record time. But getting it manufactured and distributed will pose huge challenges.,2020-05-20T17:58:32+0000,https://www.nytimes.com/2020/05/20/health/coronavirus-vaccines.html,2020-04-01 to 2020-06-30
Pfizer,Healthcare,The End of College as We Knew It?,Restaurants get eulogies. Airlines get bailouts. Shakespeare gets kicked when he’s down.,2020-06-04T09:03:34+0000,https://www.nytimes.com/2020/06/04/opinion/sunday/coronavirus-college-humanities.html,2020-04-01 to 2020-06-30
Pfizer,Healthcare,Reopening Optimism Helps Wall Street,The latest on stock market and business news during the coronavirus outbreak.,2020-05-27T04:24:40+0000,https://www.nytimes.com/2020/05/27/business/stock-market-today-coronavirus.html,2020-04-01 to 2020-06-30
Pfizer,Healthcare,Trump Says Task Force Will Wind Down,"Jared Kushner tried to address a looming supply shortage with volunteers from the private sector. More than 1,000 people have died each day for over a month. Meat is growing scarcer.",2020-05-05T09:16:15+0000,https://www.nytimes.com/2020/05/05/us/coronavirus-live-news.html,2020-04-01 to 2020-06-30
Pfizer,Healthcare,U.K. to Quarantine All Incoming Air Travelers; a Chinese Coronavirus Vaccine Shows Promise,"Immunizations are falling because of pandemic disruptions, raising fears of surges in preventable disease. Lockdowns complicate the Muslim holiday Eid. China’s National People’s Congress offers a show of strength.",2020-05-22T04:09:01+0000,https://www.nytimes.com/2020/05/22/world/live-coronavirus-world-cases.html,2020-04-01 to 2020-06-30
Pfizer,Healthcare,How Scientists Could Stop the Next Pandemic Before It Starts,Researchers believe they could pre-emptively create vaccines and drugs to fight a wide range of viral threats — if they can get sufficient funding.,2020-04-21T09:00:02+0000,https://www.nytimes.com/2020/04/21/magazine/pandemic-vaccine.html,2020-04-01 to 2020-06-30
Pfizer,Healthcare,Xi Jinping Uses Pandemic to Strengthen His Rule in China,The Chinese leader hopes to rally national pride as his People’s Congress begins. Mexican officials will investigate why the official death toll is far smaller than the figures compiled in the capital.,2020-05-20T04:01:52+0000,https://www.nytimes.com/2020/05/20/world/coronavirus-world-tracker.html,2020-04-01 to 2020-06-30
Pfizer,Healthcare,"Lockdown Delays Led to at Least 36,000 More Deaths, Models Find","All 50 states have begun to reopen to some degree, but rules vary. Scientists say they see progress on the path to developing a vaccine by next year.",2020-05-20T09:32:10+0000,https://www.nytimes.com/2020/05/20/us/coronavirus-cases-deaths.html,2020-04-01 to 2020-06-30
Pfizer,Healthcare,Scientists Link Covid-19 Risk to Genetic Variations,"The Trump administration chose five companies as the most likely to produce a vaccine. The tally of new cases is rising in the U.S., partly because of expanded testing. Italy ends travel restrictions.",2020-06-03T09:23:44+0000,https://www.nytimes.com/2020/06/03/world/coronavirus-live.html,2020-04-01 to 2020-06-30
Pfizer,Healthcare,Economic Chaos Fuels Hunger and Strongmen,The E.U. accused Poland and Hungary of undermining democracy — and gave them billions in aid. Iran may be executing prisoners who feared infection.,2020-04-22T04:03:48+0000,https://www.nytimes.com/2020/04/22/world/coronavirus-cases-world.html,2020-04-01 to 2020-06-30
Pfizer,Healthcare,Top U.K. Scientist Resigns Over Coronavirus Distancing Violation,"French doctors found that a patient had the virus on Dec. 27, suggesting that it was circulating long before containment efforts began. A major Philippine broadcaster critical of Duterte has been forced off the air.",2020-05-05T04:00:51+0000,https://www.nytimes.com/2020/05/05/world/coronavirus-world-coverage.html,2020-04-01 to 2020-06-30
Pfizer,Healthcare,Can a Vaccine for Covid-19 Be Developed in Record Time?,A discussion moderated by Siddhartha Mukherjee.,2020-06-09T09:00:02+0000,https://www.nytimes.com/interactive/2020/06/09/magazine/covid-vaccine.html,2020-04-01 to 2020-06-30
Moderna,Healthcare,Coronavirus Vaccine Tracker,A look at all the vaccines that have reached trials in humans.,2020-06-10T09:01:01+0000,https://www.nytimes.com/interactive/2020/science/coronavirus-vaccine-tracker.html,2020-04-01 to 2020-06-30
Moderna,Healthcare,Trump Administration Selects Five Coronavirus Vaccine Candidates as Finalists,"The White House is eager to project progress, but the public-private partnership it has created still faces scientific hurdles, internal tensions and questions from Congress.",2020-06-03T16:58:08+0000,https://www.nytimes.com/2020/06/03/us/politics/coronavirus-vaccine-trump-moderna.html,2020-04-01 to 2020-06-30
Moderna,Healthcare,Tests for Coronavirus Vaccine Need This Ingredient: Horseshoe Crabs,Modern medicine still depends on this animal’s blood to test for bacteria in vaccines. And an alternative test requires further study.,2020-06-03T14:21:12+0000,https://www.nytimes.com/2020/06/03/science/coronavirus-vaccine-horseshoe-crabs.html,2020-04-01 to 2020-06-30
Moderna,Healthcare,Moderna Coronavirus Vaccine Trial Shows Promising Early Results,The company said a test in 8 healthy volunteers found its experimental vaccine was safe and provoked a strong immune response. It is on an accelerated timetable to begin larger human trials soon.,2020-05-18T12:14:45+0000,https://www.nytimes.com/2020/05/18/health/coronavirus-vaccine-moderna.html,2020-04-01 to 2020-06-30
Moderna,Healthcare,"How Upbeat Vaccine News Fueled a Stock Surge, and an Uproar","The desperate hunt for treatments and vaccines has changed how researchers, regulators, drug companies like Moderna, investors and journalists do their jobs.",2020-05-23T14:36:26+0000,https://www.nytimes.com/2020/05/23/health/coronavirus-vaccine-moderna.html,2020-04-01 to 2020-06-30
Moderna,Healthcare,"Trump’s Vaccine Chief Has Vast Ties to Drug Industry, Posing Possible Conflicts","Moncef Slaoui, a former pharmaceutical executive, is now overseeing the U.S. initiative to develop coronavirus treatments and vaccines. His financial interests and corporate roles have come under scrutiny.",2020-05-21T02:00:11+0000,https://www.nytimes.com/2020/05/20/health/coronavirus-vaccine-czar.html,2020-04-01 to 2020-06-30
Moderna,Healthcare,A New Entry in the Race for a Coronavirus Vaccine: Hope,Scientists are increasingly optimistic that a vaccine can be produced in record time. But getting it manufactured and distributed will pose huge challenges.,2020-05-20T17:58:32+0000,https://www.nytimes.com/2020/05/20/health/coronavirus-vaccines.html,2020-04-01 to 2020-06-30
Moderna,Healthcare,Policymakers and the Pandemic: Now What?,The Fed and Treasury chiefs both described the economy in gloomy terms at a congressional hearing. But they differed about how to fix it.,2020-05-20T11:01:34+0000,https://www.nytimes.com/2020/05/20/business/dealbook/coronavirus-stimulus-mnuchin-powell.html,2020-04-01 to 2020-06-30
Moderna,Healthcare,Moderna Gets OK to Start Larger Trial for a Coronavirus Vaccine,The company announced that the Food and Drug Administration had cleared its application to proceed to a clinical trial involving about 600 people.,2020-05-07T21:29:43+0000,https://www.nytimes.com/2020/05/07/health/coronavirus-vaccine-moderna.html,2020-04-01 to 2020-06-30
Moderna,Healthcare,On Politics: Hopeful Virus News (This Is Not a Drill),"Vaccine testing progresses, and Trump makes an admission: This is your morning tip sheet.",2020-05-19T10:58:49+0000,https://www.nytimes.com/2020/05/19/us/politics/coronavirus-vaccine.html,2020-04-01 to 2020-06-30
Moderna,Healthcare,"Profits and Pride at Stake, the Race for a Vaccine Intensifies","Governments, companies and academic labs are accelerating their efforts amid geopolitical crosscurrents, questions about safety and the challenges of producing enough doses for billions of people.",2020-05-02T16:47:31+0000,https://www.nytimes.com/2020/05/02/us/politics/vaccines-coronavirus-research.html,2020-04-01 to 2020-06-30
Moderna,Healthcare,"Trump Seeks Push to Speed Vaccine, Despite Safety Concerns","The president wants a coronavirus vaccine widely available by the end of the year, even though his public health experts say it will take at least a year to 18 months.",2020-04-29T23:45:05+0000,https://www.nytimes.com/2020/04/29/us/politics/trump-coronavirus-vaccine-operation-warp-speed.html,2020-04-01 to 2020-06-30
Moderna,Healthcare,More Coronavirus Vaccines and Treatments Move Toward Human Trials,"Just three months after the start of the coronavirus pandemic, several biotech companies are beginning trials of promising vaccines and treatments.",2020-04-08T20:35:01+0000,https://www.nytimes.com/2020/04/08/health/coronavirus-vaccines.html,2020-04-01 to 2020-06-30
Moderna,Healthcare,$1.2 Billion From U.S. to Drugmaker to Pursue Coronavirus Vaccine,"The Trump administration announced a grant to AstraZeneca, which has licensed a potential vaccine that is in trials by Oxford University.",2020-05-21T20:28:30+0000,https://www.nytimes.com/2020/05/21/health/coronavirus-vaccine-astrazeneca.html,2020-04-01 to 2020-06-30
Moderna,Healthcare,U.K. Lab to Sidestep Drug Industry to Sell Potential Virus Vaccine,Imperial College aims to develop a vaccine that is cheaper and easier to manufacture and is forming a partnership to sell it in low-income countries and Britain.,2020-06-07T06:00:09+0000,https://www.nytimes.com/2020/06/07/world/europe/imperial-college-uk-vaccine-coronavirus.html,2020-04-01 to 2020-06-30
Moderna,Healthcare,Coronavirus Briefing: What Happened Today,A vaccine produced by Moderna appeared to be safe and effective in its first human trial.,2020-05-19T00:10:54+0000,https://www.nytimes.com/2020/05/18/us/coronavirus-today.html,2020-04-01 to 2020-06-30
Moderna,Healthcare,"Trump Vows Vaccine by End of Year, and Mobilizes Military to Help","The president named Moncef Slaoui, a former pharmaceutical executive, to lead a crash development program that if successful would shatter speed records for vaccine development.",2020-05-15T14:00:53+0000,https://www.nytimes.com/2020/05/15/us/politics/coronavirus-vaccine-timeline.html,2020-04-01 to 2020-06-30
Moderna,Healthcare,Different Approaches to a Coronavirus Vaccine,Scientists are using many techniques to develop coronavirus vaccines.,2020-05-20T18:47:04+0000,https://www.nytimes.com/interactive/2020/05/20/science/coronavirus-vaccine-development.html,2020-04-01 to 2020-06-30
Moderna,Healthcare,"News Quiz: Coronavirus Vaccine, W.H.O., Johnson & Johnson",Did you follow the headlines this week?,2020-05-22T08:01:23+0000,https://www.nytimes.com/interactive/2020/05/22/briefing/coronavirus-vaccine-world-health-organization-johnson-and-johnson.html,2020-04-01 to 2020-06-30
Moderna,Healthcare,Powell and Mnuchin Give Lawmakers Stark Economic Outlook,Stock Market News During the Coronavirus Pandemic,2020-05-19T04:37:45+0000,https://www.nytimes.com/2020/05/19/business/coronavirus-stocks-economy.html,2020-04-01 to 2020-06-30
Moderna,Healthcare,China’s G.D.P. Shrank in the First Quarter,The latest on stock market and business news during the coronavirus outbreak.,2020-04-16T04:12:45+0000,https://www.nytimes.com/2020/04/16/business/stock-market-live-coronavirus.html,2020-04-01 to 2020-06-30
Moderna,Healthcare,"Vaccine, Hydroxychloroquine, W.H.O.: Your Monday Evening Briefing",Here’s what you need to know at the end of the day.,2020-05-18T22:35:13+0000,https://www.nytimes.com/2020/05/18/briefing/moderna-virus-trump-who-china.html,2020-04-01 to 2020-06-30
Moderna,Healthcare,How Long Will a Vaccine Really Take?,Experts say at least 18 months. Here’s how to shorten the timeline.,2020-04-30T09:33:42+0000,https://www.nytimes.com/interactive/2020/04/30/opinion/coronavirus-covid-vaccine.html,2020-04-01 to 2020-06-30
Moderna,Healthcare,Pfizer Begins Human Trials of Possible Coronavirus Vaccine,"The drug company, along with a German partner, is running tests in healthy volunteers. It’s one of several companies on an accelerated timetable to try to find a safe, effective vaccine.",2020-05-05T10:45:06+0000,https://www.nytimes.com/2020/05/05/health/pfizer-vaccine-coronavirus.html,2020-04-01 to 2020-06-30
Moderna,Healthcare,Coronavirus Vaccine Shows Promising Early Results in China,A trial with 108 participants suggests the vaccine is safe and may be moderately effective. But experts noted that the approach has failed in the past.,2020-05-22T19:58:37+0000,https://www.nytimes.com/2020/05/22/health/coronavirus-vaccine-china.html,2020-04-01 to 2020-06-30
Moderna,Healthcare,Sanofi Accelerates Its Timeline for Coronavirus Vaccine Development,The French drugmaker is testing two types of vaccines in a bid to catch up to competitors.,2020-06-23T20:47:42+0000,https://www.nytimes.com/2020/06/23/health/sanofi-coronavirus-vaccine.html,2020-04-01 to 2020-06-30
Moderna,Healthcare,"W.H.O., Xi Jinping, Germany: Your Tuesday Briefing",Here’s what you need to know.,2020-05-19T04:10:28+0000,https://www.nytimes.com/2020/05/19/briefing/who-xi-jinping-germany.html,2020-04-01 to 2020-06-30
Moderna,Healthcare,Trump Threatens to Leave W.H.O. and Permanently End Funding,The president said the organization had made missteps during the pandemic that “have been extremely costly for the world.” A claim he takes hydroxychloroquine was criticized by doctors.,2020-05-18T09:14:20+0000,https://www.nytimes.com/2020/05/18/us/coronavirus-updates.html,2020-04-01 to 2020-06-30
Moderna,Healthcare,Trump Picks Ex-Drug Company Executive to Lead Accelerated Coronavirus Vaccine Effort,The chief operating officer will be an Army general who specializes in logistics.,2020-05-14T00:00:58+0000,https://www.nytimes.com/2020/05/13/us/politics/coronavirus-trump-operation-warp-speed.html,2020-04-01 to 2020-06-30
Moderna,Healthcare,All 50 States Have Eased Coronavirus Restrictions,"More changes took effect on Wednesday, but vast discrepancies remain as states forge ahead after shutdowns. Treasury Secretary Steven Mnuchin warns of “permanent damage” to the economy.",2020-05-19T09:21:33+0000,https://www.nytimes.com/2020/05/19/us/coronavirus-usa-live.html,2020-04-01 to 2020-06-30
Moderna,Healthcare,Germany and France Propose $545 Billion Coronavirus Fund for Europe,"The U.S. sharply criticized the World Health Organization, while China pledged $2 billion to fight the pandemic. President Trump said he has been taking hydroxychloroquine, an unproven drug against Covid-19.",2020-05-18T04:01:29+0000,https://www.nytimes.com/2020/05/18/world/coronavirus-news.html,2020-04-01 to 2020-06-30
Moderna,Healthcare,Too Big to Fail: The Entire Private Sector,"Large parts of financial markets are now being managed by the government. Even if they don’t like it, investors must acknowledge it.",2020-05-19T13:45:08+0000,https://www.nytimes.com/2020/05/19/business/too-big-to-fail-wall-street-businesses.html,2020-04-01 to 2020-06-30
Moderna,Healthcare,Coronavirus Briefing: What Happened Today,Doctors and researchers are making headway on potential treatments for Covid-19.,2020-06-11T22:47:20+0000,https://www.nytimes.com/2020/06/11/us/coronavirus-today.html,2020-04-01 to 2020-06-30
Moderna,Healthcare,Get Ready for the Global Fight Over Vaccines,"This isn’t just about saving lives. It’s also about power, profit and national prestige.",2020-04-30T19:00:09+0000,https://www.nytimes.com/2020/04/30/opinion/sunday/coronavirus-vaccine-supply.html,2020-04-01 to 2020-06-30
Moderna,Healthcare,Coronavirus Briefing: What Happened Today,Flooding and a cyclone complicated efforts to keep people safe from the virus.,2020-05-21T00:12:20+0000,https://www.nytimes.com/2020/05/20/us/coronavirus-today.html,2020-04-01 to 2020-06-30
Moderna,Healthcare,"Vaccines, U.S. Reopenings, Flour Frenzy: Your Thursday Briefing",Here’s what you need to know.,2020-05-21T04:05:48+0000,https://www.nytimes.com/2020/05/21/briefing/vaccines-us-reopenings-flour-britain.html,2020-04-01 to 2020-06-30
Moderna,Healthcare,"Jesus, the Beatles and … Masa Son?",The SoftBank chief made some eye-opening arguments to justify his company’s poor investment performance.,2020-05-19T11:01:28+0000,https://www.nytimes.com/2020/05/19/business/dealbook/masa-son-softbank.html,2020-04-01 to 2020-06-30
Moderna,Healthcare,Fire Up Your Laptop: A Curated Guide to Theater Now Online,"Watch as the virtual curtains rise, from “Acquanetta” to the Wooster Group, with stops at Shakespeare and “Fun Home.”",2020-05-04T15:42:54+0000,https://www.nytimes.com/2020/05/04/theater/theater-streaming-coronavirus.html,2020-04-01 to 2020-06-30
Moderna,Healthcare,"Britain, Antibodies, Bundesliga: Your Friday Briefing",Here’s what you need to know.,2020-05-08T04:03:28+0000,https://www.nytimes.com/2020/05/08/briefing/britain-antibodies-bundesliga-your-friday-briefing.html,2020-04-01 to 2020-06-30
Moderna,Healthcare,Can a Vaccine for Covid-19 Be Developed in Record Time?,A discussion moderated by Siddhartha Mukherjee.,2020-06-09T09:00:02+0000,https://www.nytimes.com/interactive/2020/06/09/magazine/covid-vaccine.html,2020-04-01 to 2020-06-30
